#
# Beginning of grant.inc
#
GRANT ALL PRIVILEGES ON *.* TO user@localhost;
REVOKE FILE ON *.* FROM user@localhost;
SELECT user();
user()
user@localhost
CREATE TABLE t1 (a INT NOT NULL) ENGINE=CONNECT TABLE_TYPE=FIX;
Warnings:
Warning	1105	No file name. Table will use t1.fix
INSERT INTO t1 VALUES (10);
SELECT * FROM t1;
a
10
UPDATE t1 SET a=20;
SELECT * FROM t1;
a
20
DELETE FROM t1;
SELECT * FROM t1;
a
INSERT INTO t1 VALUES(10);
TRUNCATE TABLE t1;
SELECT * FROM t1;
a
CREATE VIEW v1 AS SELECT * FROM t1;
SELECT * FROM v1;
a
DROP VIEW v1;
DROP TABLE t1;
CREATE TABLE t1 (a INT NOT NULL) ENGINE=CONNECT TABLE_TYPE=FIX FILE_NAME='t1.EXT';
ERROR 28000: Access denied for user 'user'@'localhost' (using password: NO)
SELECT user();
user()
root@localhost
CREATE TABLE t1 (a INT NOT NULL) ENGINE=CONNECT TABLE_TYPE=FIX FILE_NAME='t1.EXT';
INSERT INTO t1 VALUES (10);
SELECT user();
user()
user@localhost
INSERT INTO t1 VALUES (10);
ERROR 28000: Access denied for user 'user'@'localhost' (using password: NO)
SELECT * FROM t1;
ERROR 28000: Access denied for user 'user'@'localhost' (using password: NO)
UPDATE t1 SET a=20;
ERROR 28000: Access denied for user 'user'@'localhost' (using password: NO)
DELETE FROM t1;
ERROR 28000: Access denied for user 'user'@'localhost' (using password: NO)
TRUNCATE TABLE t1;
ERROR 28000: Access denied for user 'user'@'localhost' (using password: NO)
ALTER TABLE t1 READONLY=1;
ERROR 28000: Access denied for user 'user'@'localhost' (using password: NO)
DROP TABLE t1;
ERROR 28000: Access denied for user 'user'@'localhost' (using password: NO)
CREATE VIEW v1 AS SELECT * FROM t1;
ERROR 28000: Access denied for user 'user'@'localhost' (using password: NO)
# Testing a VIEW created with FILE privileges but accessed with no FILE
SELECT user();
user()
root@localhost
CREATE VIEW v1 AS SELECT * FROM t1;
SELECT user();
user()
user@localhost
SELECT * FROM v1;
ERROR 28000: Access denied for user 'user'@'localhost' (using password: NO)
INSERT INTO v1 VALUES (2);
ERROR 28000: Access denied for user 'user'@'localhost' (using password: NO)
UPDATE v1 SET a=123;
ERROR 28000: Access denied for user 'user'@'localhost' (using password: NO)
DELETE FROM v1;
ERROR 28000: Access denied for user 'user'@'localhost' (using password: NO)
DROP VIEW v1;
DROP TABLE t1;
DROP USER user@localhost;
#
# End of grant.inc
#
#
# Testing errors
#
CREATE TABLE t1
(
ID INT NOT NULL
) Engine=CONNECT TABLE_TYPE=DOS FILE_NAME='nonexistent.txt';
SELECT * FROM t1;
ID
Warnings:
Warning	1105	Open(rb) error 2 on DATADIR/test/nonexistent.txt: No such file or directory
DROP TABLE t1;
#
# Testing READONLY tables
#
CREATE TABLE t1
(
id INT NOT NULL
) ENGINE=CONNECT TABLE_TYPE=FIX FILE_NAME='t1.txt';
INSERT INTO t1 VALUES (10);
SELECT * FROM t1;
id
10
ALTER TABLE t1 READONLY=1;
Warnings:
Warning	1105	The current version of CONNECT did not check what you changed in ALTER. Use at your own risk
SHOW CREATE TABLE t1;
Table	Create Table
t1	CREATE TABLE `t1` (
  `id` int(11) NOT NULL
) ENGINE=CONNECT DEFAULT CHARSET=latin1 `TABLE_TYPE`=FIX `FILE_NAME`='t1.txt' `READONLY`=1
INSERT INTO t1 VALUES (20);
ERROR HY000: Got error 174 'Cannot modify this read/only protected table' from CONNECT
UPDATE t1 SET id=20 WHERE id=10;
ERROR HY000: Got error 174 'Cannot modify this read/only protected table' from CONNECT
DELETE FROM t1 WHERE id=10;
ERROR HY000: Got error 174 'Cannot modify this read/only protected table' from CONNECT
TRUNCATE TABLE t1;
ERROR HY000: Got error 174 'Cannot modify this read/only protected table' from CONNECT
ALTER TABLE t1 READONLY=0;
Warnings:
Warning	1105	The current version of CONNECT did not check what you changed in ALTER. Use at your own risk
SHOW CREATE TABLE t1;
Table	Create Table
t1	CREATE TABLE `t1` (
  `id` int(11) NOT NULL
) ENGINE=CONNECT DEFAULT CHARSET=latin1 `TABLE_TYPE`=FIX `FILE_NAME`='t1.txt' `READONLY`=0
INSERT INTO t1 VALUES (20);
SELECT * FROM t1;
id
10
20
DROP TABLE t1;
#
# Testing manual examples
#
CREATE TABLE t1
(
number   CHAR(4) not null,
location CHAR(15) NOT NULL flag=5,
director CHAR(5) NOT NULL flag=20,
function CHAR(12) NOT NULL flag=26,
name     CHAR(22) NOT NULL flag=38
) ENGINE=CONNECT TABLE_TYPE=DOS FILE_NAME='dept.dat';
SELECT * FROM t1;
number	location	director	function	name
0318	KINGSTON	70012	SALES	Bank/Insurance
0021	ARMONK	87777	CHQ	Corporate headquarter
0319	HARRISON	40567	SALES	Federal Administration
2452	POUGHKEEPSIE	31416	DEVELOPMENT	Research & development
DROP TABLE t1;
CREATE TABLE t1
(
name char(12) not null,
city char(12) not null,
birth date not null date_format='DD/MM/YYYY',
hired date not null date_format='DD/MM/YYYY' flag=36
) ENGINE=CONNECT TABLE_TYPE=FIX FILE_NAME='boys.txt' ENDING=1;
SELECT * FROM t1;
name	city	birth	hired
John	Boston     2	1986-01-05	2010-06-02
Henry	Boston     0	1987-06-07	2008-04-01
George	San Jose   1	1981-08-01	2010-06-02
Sam	Chicago    2	1979-11-02	2007-10-10
James	Dallas     1	1992-05-03	2009-12-14
Bill	Boston     1	1986-09-01	2008-02-10
DROP TABLE t1;
CREATE TABLE t1
(
name char(12) not null,
city char(12) not null,
birth date not null date_format='DD/MM/YYYY',
hired date not null date_format='DD/MM/YYYY' flag=36
) ENGINE=CONNECT TABLE_TYPE=FIX FILE_NAME='boys.txt' LRECL=47 ENDING=1;
SELECT * FROM t1;
name	city	birth	hired
John	Boston     2	1986-01-05	2010-06-02
Henry	Boston     0	1987-06-07	2008-04-01
George	San Jose   1	1981-08-01	2010-06-02
Sam	Chicago    2	1979-11-02	2007-10-10
James	Dallas     1	1992-05-03	2009-12-14
Bill	Boston     1	1986-09-01	2008-02-10
DROP TABLE t1;
CREATE TABLE t1
(
name char(12) not null,
city char(12) not null,
birth date not null date_format='DD/MM/YYYY',
hired date not null date_format='DD/MM/YYYY' flag=36
) ENGINE=CONNECT TABLE_TYPE=FIX FILE_NAME='boyswin.txt' ENDING=2;
SELECT * FROM t1;
name	city	birth	hired
John	Boston     2	1986-01-05	2010-06-02
Henry	Boston     0	1987-06-07	2008-04-01
George	San Jose   1	1981-08-01	2010-06-02
Sam	Chicago    2	1979-11-02	2007-10-10
James	Dallas     1	1992-05-03	2009-12-14
Bill	Boston     1	1986-09-01	2008-02-10
DROP TABLE t1;
CREATE TABLE t1
(
name char(12) not null,
city char(12) not null,
birth date not null date_format='DD/MM/YYYY',
hired date not null date_format='DD/MM/YYYY' flag=36
) ENGINE=CONNECT TABLE_TYPE=FIX FILE_NAME='boyswin.txt' LRECL=47 ENDING=2;
SELECT * FROM t1;
name	city	birth	hired
John	Boston     2	1986-01-05	2010-06-02
Henry	Boston     0	1987-06-07	2008-04-01
George	San Jose   1	1981-08-01	2010-06-02
Sam	Chicago    2	1979-11-02	2007-10-10
James	Dallas     1	1992-05-03	2009-12-14
Bill	Boston     1	1986-09-01	2008-02-10
DROP TABLE t1;
