DROP TABLE IF EXISTS diaries;
CREATE TABLE diaries (
id INT PRIMARY KEY AUTO_INCREMENT,
title TEXT,
body TEXT,
FULLTEXT INDEX title_index (title),
FULLTEXT INDEX body_index (body)
) COMMENT = 'ENGINE "InnoDB"' DEFAULT CHARSET UTF8;
SHOW CREATE TABLE diaries;
Table	Create Table
diaries	CREATE TABLE `diaries` (
  `id` int(11) NOT NULL AUTO_INCREMENT,
  `title` text DEFAULT NULL,
  `body` text DEFAULT NULL,
  PRIMARY KEY (`id`),
  FULLTEXT KEY `title_index` (`title`),
  FULLTEXT KEY `body_index` (`body`)
) ENGINE=Mroonga DEFAULT CHARSET=utf8 COMMENT='ENGINE "InnoDB"'
INSERT INTO diaries (title, body) VALUES ("survey", "will start groonga!");
INSERT INTO diaries (title, body) VALUES ("groonga (1)", "starting groonga...");
INSERT INTO diaries (title, body) VALUES ("groonga (2)", "started groonga.");
SELECT * FROM diaries
WHERE MATCH(title) AGAINST("survey");
id	title	body
1	survey	will start groonga!
START TRANSACTION;
DELETE FROM diaries WHERE id = 1;
ROLLBACK;
SELECT * FROM diaries;
id	title	body
1	survey	will start groonga!
2	groonga (1)	starting groonga...
3	groonga (2)	started groonga.
SELECT * FROM diaries
WHERE MATCH(title) AGAINST("survey");
id	title	body
UPDATE diaries SET title = "survey day!" WHERE id = 1;
SELECT * FROM diaries;
id	title	body
1	survey day!	will start groonga!
2	groonga (1)	starting groonga...
3	groonga (2)	started groonga.
SELECT * FROM diaries
WHERE MATCH(title) AGAINST("survey");
id	title	body
1	survey day!	will start groonga!
DROP TABLE diaries;
