CREATE DATABASE IF NOT EXISTS `db1`;
USE `db1`;
DROP TABLE IF EXISTS `t1`;
Warnings:
Note	1051	Unknown table 'db1.t1'
CREATE TABLE `t1`(i BIGINT, t TEXT)ENGINE=xpand;
INSERT INTO `t1` (i, t) VALUES (42, 'один');
INSERT INTO `t1` (i, t) VALUES (42, 'ноль');
SELECT * FROM `t1` ORDER BY `i` DESC, `t` DESC;
i	t
42	один
42	ноль
UPDATE `t1` SET i=i+1,t='два' WHERE t='один';
SELECT * FROM `t1` ORDER BY `i` DESC, `t` DESC;
i	t
42	один
42	ноль
USE test;
UPDATE `db1`.`t1` SET i=i+1,t='три' WHERE t='два';
SELECT * FROM `db1`.`t1` ORDER BY `i` DESC, `t` DESC;
i	t
42	один
42	ноль
DROP TABLE `db1`.`t1`;
USE test;
DROP DATABASE `db1`;
