select * from information_schema.engines where engine="columnstore_cache";
ENGINE	SUPPORT	COMMENT	TRANSACTIONS	XA	SAVEPOINTS
Columnstore_cache	YES	Insert cache for ColumnStore	NO	NO	NO
create table t1 (a int, b varchar(10)) engine=columnstore_cache;
ERROR 42000: The storage engine for the table doesn't support nullable columns
create table t1 (a int not null, b varchar(15) not null) engine=columnstore_cache;
select * from t1;
a	b
insert into t1 values(1,"hello");
insert into t1 values(2,"world"),(3,"!");
select * from t1;
a	b
1	hello
2	world
3	!
insert into t1 values(4,"qqq"), (5,"to_be_deleted");
update t1 set b="updated" where a=4;
delete from t1 where a=5;
select * from t1;
a	b
4	updated
1	hello
2	world
3	!
drop table t1;
create table t1 (a int not null , b varchar(10) not null) engine=columnstore_cache;
create table t2 (a int not null , b varchar(10) not null) engine=columnstore_cache;
create table t3 (a int, b varchar(10)) engine=Aria;
insert into t1 values (1,"1"),(2,"2"),(3,"3");
insert into t2 values (10,"1"),(20,"2"),(30,"3");
insert into t3 values (100,"1"),(200,"2"),(300,"3");
insert into t1 select * from t2;
insert into t1 select * from t3;
select count(*), sum(a) from t1;
count(*)	sum(a)
9	666
insert into t1 select * from t1 as t4;
select count(*), sum(a) from t1;
count(*)	sum(a)
18	1332
drop table t1,t2,t3;
