call mtr.add_suppression("BINLOG_BASE64_EVENT: Master's version is earlier than");
call mtr.add_suppression("BINLOG_BASE64_EVENT: Column 1 of table 'test.char128_utf8' cannot be converted");
DROP TABLE IF EXISTS t1;
==== Test BUG#32407 ====
select * from t1;
a
1
1
==== Test BINLOG statement w/o FD event ====
BINLOG '
SVtYRxMBAAAAKQAAADQBAAAAABAAAAAAAAAABHRlc3QAAnQxAAEDAAE=
SVtYRxcBAAAAIgAAAFYBAAAQABAAAAAAAAEAAf/+AgAAAA==
';
ERROR HY000: The BINLOG statement of type Table_map was not preceded by a format description BINLOG statement
select * from t1;
a
1
1
==== Test BINLOG statement with FD event ====
BINLOG '
ODdYRw8BAAAAZgAAAGoAAAABAAQANS4xLjIzLXJjLWRlYnVnLWxvZwAAAAAAAAAAAAAAAAAAAAAA
AAAAAAAAAAAAAAAAAAA4N1hHEzgNAAgAEgAEBAQEEgAAUwAEGggAAAAICAgC
';
BINLOG '
TFtYRxMBAAAAKQAAAH8BAAAAABAAAAAAAAAABHRlc3QAAnQxAAEDAAE=
TFtYRxcBAAAAIgAAAKEBAAAQABAAAAAAAAEAAf/+AwAAAA==
';
select * from t1;
a
1
1
3
DELETE FROM t1 WHERE a=3;
BINLOG '
ODdYRw8BAAAAZgAAAGoAAAABAAQANS4xLjIzLXJjLWRlYnVnLWxvZwAAAAAAAAAAAAAAAAAAAAAA
AAAAAAAAAAAAAAAAAAA4N1hHEzgNAAgAEgAEBAQEEgAAUwAEGggAAAAICAgC
';
SET @binlog_fragment_0='
TFtYRxMBAAAAKQAAAH8BAAAAABAAAAAAAAAABHRlc3QAAnQxAAEDAAE=
TFtYRxcBAAAAIgAAAKEBAAAQABAAAAAAAAEAAf/+AwAAAA==
';
SET @binlog_fragment_1='';
BINLOG @binlog_fragment_0, @binlog_fragment_1;
select * from t1;
a
1
1
3
SELECT @binlog_fragment_0, @binlog_fragment_1 as 'NULL','NULL';
@binlog_fragment_0	NULL	NULL
NULL	NULL	NULL
==== Test --base64-output=never on a binlog with row events ====
/*!50530 SET @@SESSION.PSEUDO_SLAVE_MODE=1*/;
/*!40019 SET @@session.max_delayed_threads=0*/;
/*!50003 SET @OLD_COMPLETION_TYPE=@@COMPLETION_TYPE,COMPLETION_TYPE=0*/;
DELIMITER /*!*/;
<#>
ROLLBACK/*!*/;
<#>
use `test`/*!*/;
SET TIMESTAMP=1196959712/*!*/;
<#>SET @@session.foreign_key_checks=1, @@session.sql_auto_is_null=1, @@session.unique_checks=1, @@session.autocommit=1, @@session.check_constraint_checks=1, @@session.system_versioning_insert_history=0/*!*/;
SET @@session.sql_mode=0/*!*/;
SET @@session.auto_increment_increment=1, @@session.auto_increment_offset=1/*!*/;
/*!\C latin1 *//*!*/;
SET @@session.character_set_client=latin1,@@session.collation_connection=8,@@session.collation_server=8/*!*/;
SET @@session.lc_time_names=0/*!*/;
SET @@session.collation_database=DEFAULT/*!*/;
create table t1 (a int) engine= myisam
/*!*/;
<#>
<#>
<#>
<#>
<#>
DELIMITER ;
# End of log file
ROLLBACK /* added by mysqlbinlog */;
/*!50003 SET COMPLETION_TYPE=@OLD_COMPLETION_TYPE*/;
/*!50530 SET @@SESSION.PSEUDO_SLAVE_MODE=0*/;
==== Test non-matching FD event and Row event ====
BINLOG '
4CdYRw8BAAAAYgAAAGYAAAAAAAQANS4xLjE1LW5kYi02LjEuMjQtZGVidWctbG9nAAAAAAAAAAAA
AAAAAAAAAAAAAAAAAADgJ1hHEzgNAAgAEgAEBAQEEgAATwAEGggICAg=
';
BINLOG '
Dl1YRxMBAAAAKQAAADQBAAAAABAAAAAAAAAABHRlc3QAAnQxAAEDAAE=
Dl1YRxcBAAAAIgAAAFYBAAAQABAAAAAAAAEAAf/+BQAAAA==
';
ERROR 42000: You have an error in your SQL syntax; check the manual that corresponds to your MariaDB server version for the right syntax to use
select * from t1;
a
1
1
3
CREATE TABLE char128_utf8 ( 
i1 INT NOT NULL, 
c CHAR(128) CHARACTER SET utf8 NOT NULL, 
i2 INT NOT NULL);
CREATE TABLE char63_utf8 (
i1 INT NOT NULL,
c CHAR(63) CHARACTER SET utf8 NOT NULL,
i2 INT NOT NULL);
BINLOG '
MuNkSA8BAAAAZgAAAGoAAAAAAAQANS4xLjI1LXJjLWRlYnVnLWxvZwAAAAAAAAAAAAAAAAAAAAAA
AAAAAAAAAAAAAAAAAAAy42RIEzgNAAgAEgAEBAQEEgAAUwAEGggAAAAICAgC
';
BINLOG '
3u9kSBMBAAAANgAAAJYBAAAAABAAAAAAAAAABHRlc3QAC2NoYXI2M191dGY4AAMD/gMC/r0A
3u9kSBcBAAAAKgAAAMABAAAQABAAAAAAAAEAA//4AQAAAAMxMjMBAAAA
';
SELECT * FROM char63_utf8;
i1	c	i2
1	123	1
BINLOG '
iONkSBMBAAAANwAAAJkBAAAAABAAAAAAAAAABHRlc3QADGNoYXIxMjhfdXRmOAADA/4DAv6AAA==
iONkSBcBAAAAKwAAAMQBAAAQABAAAAAAAAEAA//4AQAAAAMAMTIzAQAAAA==
';
ERROR HY000: master may suffer from http://bugs.mysql.com/bug.php?id=37426 so slave stops; check error log on slave for more info
drop table t1, char63_utf8, char128_utf8;
call mtr.add_suppression("Slave SQL.*master suffers from this bug: http:..bugs.mysql.com.bug.php.id=37426.* error.* 1105");
call mtr.add_suppression("Slave SQL.*Table definition on master and slave does not match: Column 1 size mismatch.* error.* 1535");
call mtr.add_suppression("Slave SQL.*Column 1 of table .test.char128_utf8. cannot be converted.* error.* 1677");
#
# Bug #54393: crash and/or valgrind errors in 
# mysql_client_binlog_statement
#
BINLOG '';
ERROR 42000: You have an error in your SQL syntax; check the manual that corresponds to your MariaDB server version for the right syntax to use
BINLOG '123';
ERROR HY000: Decoding of base64 string failed
BINLOG '-2079193929';
ERROR HY000: Decoding of base64 string failed
BINLOG 'xç↓%~∙D╒ƒ╡';
ERROR HY000: Decoding of base64 string failed
#
# MDEV-39074 trans_rollback_stmt(THD *): Assertion `! thd->in_sub_stmt' failed.
#
create table t0 (a int);
create table t1 (a int);
create trigger trig_t0_insert after insert on t0 for each row binlog 'enabled';
insert into t0 set a= 0;
ERROR HY000: Decoding of base64 string failed
drop trigger trig_t0_insert;
## Case 1: Row event in trigger (works partially)
binlog 'ODdYRw8BAAAAZgAAAGoAAAABAAQANS4xLjIzLXJjLWRlYnVnLWxvZwAAAAAAAAAAAAAAAAAAAAAAAAAAAAAAAAAAAAAAAAA4N1hHEzgNAAgAEgAEBAQEEgAAUwAEGggAAAAICAgC';
create trigger trig_t0_insert after insert on t0 for each row
binlog 'TFtYRxMBAAAAKQAAAH8BAAAAABAAAAAAAAAABHRlc3QAAnQxAAEDAAE=TFtYRxcBAAAAIgAAAKEBAAAQABAAAAAAAAEAAf/+AwAAAA==';
create trigger trig_t1_insert after insert on t1 for each row
binlog 'TFtYRxMBAAAAKQAAAH8BAAAAABAAAAAAAAAABHRlc3QAAnQxAAEDAAE=TFtYRxcBAAAAIgAAAKEBAAAQABAAAAAAAAEAAf/+AwAAAA==';
insert into t0 set a= 1;
ERROR HY000: Table 't1' was not locked with LOCK TABLES
insert into t1 set a= 1;
select * from t1;
a
1
3
drop trigger trig_t0_insert;
drop trigger trig_t1_insert;
## Case 2: Statement event in trigger (disabled)
create trigger trig_t0_insert after insert on t0 for each row
binlog 'AAAAAAIBAAAAPwAAAAAAAAAAAAEAAAAAAAAABAAAAAB0ZXN0AGluc2VydCBpbnRvIHQxIHZhbHVlcyAoOTkp';
create trigger trig_t1_insert after insert on t1 for each row
binlog 'AAAAAAIBAAAAPwAAAAAAAAAAAAEAAAAAAAAABAAAAAB0ZXN0AGluc2VydCBpbnRvIHQxIHZhbHVlcyAoOTkp';
insert into t0 set a= 2;
ERROR 0A000: Statement-based BINLOG event is not allowed in stored procedures
insert into t1 set a= 2;
ERROR 0A000: Statement-based BINLOG event is not allowed in stored procedures
select * from t1;
a
1
3
2
drop trigger trig_t0_insert;
drop trigger trig_t1_insert;
## Case 3: Row event in SP (disabled)
create procedure proc_t1_insert()
begin
insert into t1 set a= 3;
binlog 'TFtYRxMBAAAAKQAAAH8BAAAAABAAAAAAAAAABHRlc3QAAnQxAAEDAAE=TFtYRxcBAAAAIgAAAKEBAAAQABAAAAAAAAEAAf/+AwAAAA==';
end|
call proc_t1_insert();
ERROR HY000: Table 't1' was not locked with LOCK TABLES
drop procedure proc_t1_insert;
## Case 4: Statement event in SP (disabled)
create procedure proc_t1_insert()
begin
insert into t1 set a= 4;
binlog 'AAAAAAIBAAAAPwAAAAAAAAAAAAEAAAAAAAAABAAAAAB0ZXN0AGluc2VydCBpbnRvIHQxIHZhbHVlcyAoOTkp';
end|
call proc_t1_insert();
ERROR 0A000: Statement-based BINLOG event is not allowed in stored procedures
drop procedure proc_t1_insert;
## Case 5: Row event in SF (works partially)
create function func_t0_insert() returns int
begin
insert into t0 set a= 5;
binlog 'TFtYRxMBAAAAKQAAAH8BAAAAABAAAAAAAAAABHRlc3QAAnQxAAEDAAE=TFtYRxcBAAAAIgAAAKEBAAAQABAAAAAAAAEAAf/+AwAAAA==';
return 0;
end|
create function func_t1_insert() returns int
begin
insert into t1 set a= 5;
binlog 'TFtYRxMBAAAAKQAAAH8BAAAAABAAAAAAAAAABHRlc3QAAnQxAAEDAAE=TFtYRxcBAAAAIgAAAKEBAAAQABAAAAAAAAEAAf/+AwAAAA==';
return 0;
end|
select func_t0_insert();
ERROR HY000: Table 't1' was not locked with LOCK TABLES
select func_t1_insert();
func_t1_insert()
0
select * from t1;
a
1
3
2
3
4
5
3
drop function func_t0_insert;
drop function func_t1_insert;
## Case 6: Statement event in SF (disabled)
create function func_t1_insert() returns int
begin
insert into t1 set a= 6;
binlog 'AAAAAAIBAAAAPwAAAAAAAAAAAAEAAAAAAAAABAAAAAB0ZXN0AGluc2VydCBpbnRvIHQxIHZhbHVlcyAoOTkp';
return 0;
end|
select func_t1_insert();
ERROR 0A000: Statement-based BINLOG event is not allowed in stored procedures
drop function func_t1_insert;
## Case 7: Row event in PS (works)
prepare stmt from "binlog 'TFtYRxMBAAAAKQAAAH8BAAAAABAAAAAAAAAABHRlc3QAAnQxAAEDAAE=TFtYRxcBAAAAIgAAAKEBAAAQABAAAAAAAAEAAf/+AwAAAA=='";
execute stmt;
execute stmt;
deallocate prepare stmt;
select * from t1;
a
1
3
2
3
4
5
3
6
3
3
## Case 8: Statement event in PS (works)
prepare stmt from "binlog 'AAAAAAIBAAAAPwAAAAAAAAAAAAEAAAAAAAAABAAAAAB0ZXN0AGluc2VydCBpbnRvIHQxIHZhbHVlcyAoOTkp'";
execute stmt;
execute stmt;
deallocate prepare stmt;
select * from t1;
a
1
3
2
3
4
5
3
6
3
3
99
99
drop table t0, t1;
# End of 10.11 tests
