#
# Preparatory cleanup.
#
DROP TABLE IF EXISTS t1;
#
# We need a fixed timestamp to avoid varying results.
#
SET timestamp=1000000000;
#
# Delete all existing binary logs.
#
RESET MASTER;
CREATE TABLE t1 (
c01 tinyint,
c02 smallint,
c03 mediumint,
c04 int,
c05 bigint,
c06 char(10),
c07 varchar(20),
c08 TEXT
) ENGINE=InnoDB;
#
# Insert data to t1
#
INSERT INTO t1 VALUES(0,0,0,0,0,'','','');
INSERT INTO t1 VALUES(1,2,3,4,5, "abc", "abcdefg", "abcedfghijklmnopqrstuvwxyz");
INSERT INTO t1 VALUES(127, 32767, 8388607, 2147483647, 9223372036854775807, repeat('a', 10), repeat('a', 20), repeat('a', 255));
#
# Update t1
#
UPDATE t1 SET c01=100 WHERE c02=0 OR c03=3;
#
# Clear t1
#
DELETE FROM t1;
FLUSH LOGS;
#
# Show mysqlbinlog result without -B
#
/*!50530 SET @@SESSION.PSEUDO_SLAVE_MODE=1*/;
/*!40019 SET @@session.max_insert_delayed_threads=0*/;
/*!50003 SET @OLD_COMPLETION_TYPE=@@COMPLETION_TYPE,COMPLETION_TYPE=0*/;
DELIMITER /*!*/;
# at #
#010909  9:46:40 server id 1  end_log_pos # CRC32 XXX 	Start: binlog v 4, server v #.##.## created 010909  9:46:40 at startup
ROLLBACK/*!*/;
# at #
#010909  9:46:40 server id 1  end_log_pos # CRC32 XXX 	Gtid list []
# at #
#010909  9:46:40 server id 1  end_log_pos # CRC32 XXX 	Binlog checkpoint master-bin.000001
# at #
#010909  9:46:40 server id 1  end_log_pos # CRC32 XXX 	GTID 0-1-1 ddl
/*!100101 SET @@session.skip_parallel_replication=0*//*!*/;
/*!100001 SET @@session.gtid_domain_id=0*//*!*/;
/*!100001 SET @@session.server_id=1*//*!*/;
/*!100001 SET @@session.gtid_seq_no=1*//*!*/;
# at #
#010909  9:46:40 server id 1  end_log_pos # CRC32 XXX 	Query	thread_id=#	exec_time=#	error_code=0
use `test`/*!*/;
SET TIMESTAMP=1000000000/*!*/;
SET @@session.pseudo_thread_id=#/*!*/;
SET @@session.foreign_key_checks=1, @@session.sql_auto_is_null=0, @@session.unique_checks=1, @@session.autocommit=1, @@session.check_constraint_checks=1/*!*/;
SET @@session.sql_mode=1411383296/*!*/;
SET @@session.auto_increment_increment=1, @@session.auto_increment_offset=1/*!*/;
/*!\C latin1 *//*!*/;
SET @@session.character_set_client=8,@@session.collation_connection=8,@@session.collation_server=8/*!*/;
SET @@session.lc_time_names=0/*!*/;
SET @@session.collation_database=DEFAULT/*!*/;
CREATE TABLE t1 (
c01 tinyint,
c02 smallint,
c03 mediumint,
c04 int,
c05 bigint,
c06 char(10),
c07 varchar(20),
c08 TEXT
) ENGINE=InnoDB
/*!*/;
# at #
#010909  9:46:40 server id 1  end_log_pos # CRC32 XXX 	GTID 0-1-2 trans
/*!100001 SET @@session.gtid_seq_no=2*//*!*/;
BEGIN
/*!*/;
# at #
# at #
#010909  9:46:40 server id 1  end_log_pos # CRC32 XXX 	Annotate_rows:
#Q> INSERT INTO t1 VALUES(0,0,0,0,0,'','','')
#010909  9:46:40 server id 1  end_log_pos # CRC32 XXX 	Table_map: `test`.`t1` mapped to number #
# at #
#010909  9:46:40 server id 1  end_log_pos # CRC32 XXX 	Write_rows: table id # flags: STMT_END_F
### INSERT INTO `test`.`t1`
### SET
###   @1=0 /* TINYINT meta=0 nullable=1 is_null=0 */
###   @2=0 /* SHORTINT meta=0 nullable=1 is_null=0 */
###   @3=0 /* MEDIUMINT meta=0 nullable=1 is_null=0 */
###   @4=0 /* INT meta=0 nullable=1 is_null=0 */
###   @5=0 /* LONGINT meta=0 nullable=1 is_null=0 */
###   @6='' /* STRING(10) meta=65034 nullable=1 is_null=0 */
###   @7='' /* VARSTRING(20) meta=20 nullable=1 is_null=0 */
###   @8='' /* BLOB/TEXT meta=2 nullable=1 is_null=0 */
# at #
#010909  9:46:40 server id 1  end_log_pos # CRC32 XXX 	Xid = #
COMMIT/*!*/;
# at #
#010909  9:46:40 server id 1  end_log_pos # CRC32 XXX 	GTID 0-1-3 trans
/*!100001 SET @@session.gtid_seq_no=3*//*!*/;
BEGIN
/*!*/;
# at #
# at #
#010909  9:46:40 server id 1  end_log_pos # CRC32 XXX 	Annotate_rows:
#Q> INSERT INTO t1 VALUES(1,2,3,4,5, "abc", "abcdefg", "abcedfghijklmnopqrstuvwxyz")
#010909  9:46:40 server id 1  end_log_pos # CRC32 XXX 	Table_map: `test`.`t1` mapped to number #
# at #
#010909  9:46:40 server id 1  end_log_pos # CRC32 XXX 	Write_rows: table id # flags: STMT_END_F
### INSERT INTO `test`.`t1`
### SET
###   @1=1 /* TINYINT meta=0 nullable=1 is_null=0 */
###   @2=2 /* SHORTINT meta=0 nullable=1 is_null=0 */
###   @3=3 /* MEDIUMINT meta=0 nullable=1 is_null=0 */
###   @4=4 /* INT meta=0 nullable=1 is_null=0 */
###   @5=5 /* LONGINT meta=0 nullable=1 is_null=0 */
###   @6='abc' /* STRING(10) meta=65034 nullable=1 is_null=0 */
###   @7='abcdefg' /* VARSTRING(20) meta=20 nullable=1 is_null=0 */
###   @8='abcedfghijklmnopqrstuvwxyz' /* BLOB/TEXT meta=2 nullable=1 is_null=0 */
# at #
#010909  9:46:40 server id 1  end_log_pos # CRC32 XXX 	Xid = #
COMMIT/*!*/;
# at #
#010909  9:46:40 server id 1  end_log_pos # CRC32 XXX 	GTID 0-1-4 trans
/*!100001 SET @@session.gtid_seq_no=4*//*!*/;
BEGIN
/*!*/;
# at #
# at #
#010909  9:46:40 server id 1  end_log_pos # CRC32 XXX 	Annotate_rows:
#Q> INSERT INTO t1 VALUES(127, 32767, 8388607, 2147483647, 9223372036854775807, repeat('a', 10), repeat('a', 20), repeat('a', 255))
#010909  9:46:40 server id 1  end_log_pos # CRC32 XXX 	Table_map: `test`.`t1` mapped to number #
# at #
#010909  9:46:40 server id 1  end_log_pos # CRC32 XXX 	Write_rows: table id # flags: STMT_END_F
### INSERT INTO `test`.`t1`
### SET
###   @1=127 /* TINYINT meta=0 nullable=1 is_null=0 */
###   @2=32767 /* SHORTINT meta=0 nullable=1 is_null=0 */
###   @3=8388607 /* MEDIUMINT meta=0 nullable=1 is_null=0 */
###   @4=2147483647 /* INT meta=0 nullable=1 is_null=0 */
###   @5=9223372036854775807 /* LONGINT meta=0 nullable=1 is_null=0 */
###   @6='aaaaaaaaaa' /* STRING(10) meta=65034 nullable=1 is_null=0 */
###   @7='aaaaaaaaaaaaaaaaaaaa' /* VARSTRING(20) meta=20 nullable=1 is_null=0 */
###   @8='aaaaaaaaaaaaaaaaaaaaaaaaaaaaaaaaaaaaaaaaaaaaaaaaaaaaaaaaaaaaaaaaaaaaaaaaaaaaaaaaaaaaaaaaaaaaaaaaaaaaaaaaaaaaaaaaaaaaaaaaaaaaaaaaaaaaaaaaaaaaaaaaaaaaaaaaaaaaaaaaaaaaaaaaaaaaaaaaaaaaaaaaaaaaaaaaaaaaaaaaaaaaaaaaaaaaaaaaaaaaaaaaaaaaaaaaaaaaaaaaaaaaaaaaaaaaaaa' /* BLOB/TEXT meta=2 nullable=1 is_null=0 */
# at #
#010909  9:46:40 server id 1  end_log_pos # CRC32 XXX 	Xid = #
COMMIT/*!*/;
# at #
#010909  9:46:40 server id 1  end_log_pos # CRC32 XXX 	GTID 0-1-5 trans
/*!100001 SET @@session.gtid_seq_no=5*//*!*/;
BEGIN
/*!*/;
# at #
# at #
#010909  9:46:40 server id 1  end_log_pos # CRC32 XXX 	Annotate_rows:
#Q> UPDATE t1 SET c01=100 WHERE c02=0 OR c03=3
#010909  9:46:40 server id 1  end_log_pos # CRC32 XXX 	Table_map: `test`.`t1` mapped to number #
# at #
#010909  9:46:40 server id 1  end_log_pos # CRC32 XXX 	Update_rows: table id # flags: STMT_END_F
### UPDATE `test`.`t1`
### WHERE
###   @1=0 /* TINYINT meta=0 nullable=1 is_null=0 */
###   @2=0 /* SHORTINT meta=0 nullable=1 is_null=0 */
###   @3=0 /* MEDIUMINT meta=0 nullable=1 is_null=0 */
###   @4=0 /* INT meta=0 nullable=1 is_null=0 */
###   @5=0 /* LONGINT meta=0 nullable=1 is_null=0 */
###   @6='' /* STRING(10) meta=65034 nullable=1 is_null=0 */
###   @7='' /* VARSTRING(20) meta=20 nullable=1 is_null=0 */
###   @8='' /* BLOB/TEXT meta=2 nullable=1 is_null=0 */
### SET
###   @1=100 /* TINYINT meta=0 nullable=1 is_null=0 */
###   @2=0 /* SHORTINT meta=0 nullable=1 is_null=0 */
###   @3=0 /* MEDIUMINT meta=0 nullable=1 is_null=0 */
###   @4=0 /* INT meta=0 nullable=1 is_null=0 */
###   @5=0 /* LONGINT meta=0 nullable=1 is_null=0 */
###   @6='' /* STRING(10) meta=65034 nullable=1 is_null=0 */
###   @7='' /* VARSTRING(20) meta=20 nullable=1 is_null=0 */
###   @8='' /* BLOB/TEXT meta=2 nullable=1 is_null=0 */
### UPDATE `test`.`t1`
### WHERE
###   @1=1 /* TINYINT meta=0 nullable=1 is_null=0 */
###   @2=2 /* SHORTINT meta=0 nullable=1 is_null=0 */
###   @3=3 /* MEDIUMINT meta=0 nullable=1 is_null=0 */
###   @4=4 /* INT meta=0 nullable=1 is_null=0 */
###   @5=5 /* LONGINT meta=0 nullable=1 is_null=0 */
###   @6='abc' /* STRING(10) meta=65034 nullable=1 is_null=0 */
###   @7='abcdefg' /* VARSTRING(20) meta=20 nullable=1 is_null=0 */
###   @8='abcedfghijklmnopqrstuvwxyz' /* BLOB/TEXT meta=2 nullable=1 is_null=0 */
### SET
###   @1=100 /* TINYINT meta=0 nullable=1 is_null=0 */
###   @2=2 /* SHORTINT meta=0 nullable=1 is_null=0 */
###   @3=3 /* MEDIUMINT meta=0 nullable=1 is_null=0 */
###   @4=4 /* INT meta=0 nullable=1 is_null=0 */
###   @5=5 /* LONGINT meta=0 nullable=1 is_null=0 */
###   @6='abc' /* STRING(10) meta=65034 nullable=1 is_null=0 */
###   @7='abcdefg' /* VARSTRING(20) meta=20 nullable=1 is_null=0 */
###   @8='abcedfghijklmnopqrstuvwxyz' /* BLOB/TEXT meta=2 nullable=1 is_null=0 */
# at #
#010909  9:46:40 server id 1  end_log_pos # CRC32 XXX 	Xid = #
COMMIT/*!*/;
# at #
#010909  9:46:40 server id 1  end_log_pos # CRC32 XXX 	GTID 0-1-6 trans
/*!100001 SET @@session.gtid_seq_no=6*//*!*/;
BEGIN
/*!*/;
# at #
# at #
#010909  9:46:40 server id 1  end_log_pos # CRC32 XXX 	Annotate_rows:
#Q> DELETE FROM t1
#010909  9:46:40 server id 1  end_log_pos # CRC32 XXX 	Table_map: `test`.`t1` mapped to number #
# at #
#010909  9:46:40 server id 1  end_log_pos # CRC32 XXX 	Delete_rows: table id # flags: STMT_END_F
### DELETE FROM `test`.`t1`
### WHERE
###   @1=100 /* TINYINT meta=0 nullable=1 is_null=0 */
###   @2=0 /* SHORTINT meta=0 nullable=1 is_null=0 */
###   @3=0 /* MEDIUMINT meta=0 nullable=1 is_null=0 */
###   @4=0 /* INT meta=0 nullable=1 is_null=0 */
###   @5=0 /* LONGINT meta=0 nullable=1 is_null=0 */
###   @6='' /* STRING(10) meta=65034 nullable=1 is_null=0 */
###   @7='' /* VARSTRING(20) meta=20 nullable=1 is_null=0 */
###   @8='' /* BLOB/TEXT meta=2 nullable=1 is_null=0 */
### DELETE FROM `test`.`t1`
### WHERE
###   @1=100 /* TINYINT meta=0 nullable=1 is_null=0 */
###   @2=2 /* SHORTINT meta=0 nullable=1 is_null=0 */
###   @3=3 /* MEDIUMINT meta=0 nullable=1 is_null=0 */
###   @4=4 /* INT meta=0 nullable=1 is_null=0 */
###   @5=5 /* LONGINT meta=0 nullable=1 is_null=0 */
###   @6='abc' /* STRING(10) meta=65034 nullable=1 is_null=0 */
###   @7='abcdefg' /* VARSTRING(20) meta=20 nullable=1 is_null=0 */
###   @8='abcedfghijklmnopqrstuvwxyz' /* BLOB/TEXT meta=2 nullable=1 is_null=0 */
### DELETE FROM `test`.`t1`
### WHERE
###   @1=127 /* TINYINT meta=0 nullable=1 is_null=0 */
###   @2=32767 /* SHORTINT meta=0 nullable=1 is_null=0 */
###   @3=8388607 /* MEDIUMINT meta=0 nullable=1 is_null=0 */
###   @4=2147483647 /* INT meta=0 nullable=1 is_null=0 */
###   @5=9223372036854775807 /* LONGINT meta=0 nullable=1 is_null=0 */
###   @6='aaaaaaaaaa' /* STRING(10) meta=65034 nullable=1 is_null=0 */
###   @7='aaaaaaaaaaaaaaaaaaaa' /* VARSTRING(20) meta=20 nullable=1 is_null=0 */
###   @8='aaaaaaaaaaaaaaaaaaaaaaaaaaaaaaaaaaaaaaaaaaaaaaaaaaaaaaaaaaaaaaaaaaaaaaaaaaaaaaaaaaaaaaaaaaaaaaaaaaaaaaaaaaaaaaaaaaaaaaaaaaaaaaaaaaaaaaaaaaaaaaaaaaaaaaaaaaaaaaaaaaaaaaaaaaaaaaaaaaaaaaaaaaaaaaaaaaaaaaaaaaaaaaaaaaaaaaaaaaaaaaaaaaaaaaaaaaaaaaaaaaaaaaaaaaaaaaa' /* BLOB/TEXT meta=2 nullable=1 is_null=0 */
# at #
#010909  9:46:40 server id 1  end_log_pos # CRC32 XXX 	Xid = #
COMMIT/*!*/;
# at #
#010909  9:46:40 server id 1  end_log_pos # CRC32 XXX 	Rotate to master-bin.000002  pos: 4
DELIMITER ;
# End of log file
ROLLBACK /* added by mysqlbinlog */;
/*!50003 SET COMPLETION_TYPE=@OLD_COMPLETION_TYPE*/;
/*!50530 SET @@SESSION.PSEUDO_SLAVE_MODE=0*/;
#
# Show mysqlbinlog result with -B
#
/*!50530 SET @@SESSION.PSEUDO_SLAVE_MODE=1*/;
/*!40019 SET @@session.max_insert_delayed_threads=0*/;
/*!50003 SET @OLD_COMPLETION_TYPE=@@COMPLETION_TYPE,COMPLETION_TYPE=0*/;
DELIMITER /*!*/;
#010909  9:46:40 server id 1  end_log_pos # CRC32 XXX 	Start: binlog v 4, server v #.##.## created 010909  9:46:40 at startup
ROLLBACK/*!*/;
#010909  9:46:40 server id 1  end_log_pos # CRC32 XXX 	Gtid list []
#010909  9:46:40 server id 1  end_log_pos # CRC32 XXX 	Binlog checkpoint master-bin.000001
#010909  9:46:40 server id 1  end_log_pos # CRC32 XXX 	Annotate_rows:
#Q> INSERT INTO t1 VALUES(0,0,0,0,0,'','','')
#010909  9:46:40 server id 1  end_log_pos # CRC32 XXX 	Table_map: `test`.`t1` mapped to number #
#010909  9:46:40 server id 1  end_log_pos # CRC32 XXX 	Annotate_rows:
#Q> INSERT INTO t1 VALUES(1,2,3,4,5, "abc", "abcdefg", "abcedfghijklmnopqrstuvwxyz")
#010909  9:46:40 server id 1  end_log_pos # CRC32 XXX 	Table_map: `test`.`t1` mapped to number #
#010909  9:46:40 server id 1  end_log_pos # CRC32 XXX 	Annotate_rows:
#Q> INSERT INTO t1 VALUES(127, 32767, 8388607, 2147483647, 9223372036854775807, repeat('a', 10), repeat('a', 20), repeat('a', 255))
#010909  9:46:40 server id 1  end_log_pos # CRC32 XXX 	Table_map: `test`.`t1` mapped to number #
#010909  9:46:40 server id 1  end_log_pos # CRC32 XXX 	Annotate_rows:
#Q> UPDATE t1 SET c01=100 WHERE c02=0 OR c03=3
#010909  9:46:40 server id 1  end_log_pos # CRC32 XXX 	Table_map: `test`.`t1` mapped to number #
#010909  9:46:40 server id 1  end_log_pos # CRC32 XXX 	Annotate_rows:
#Q> DELETE FROM t1
#010909  9:46:40 server id 1  end_log_pos # CRC32 XXX 	Table_map: `test`.`t1` mapped to number #
#010909  9:46:40 server id 1  end_log_pos # CRC32 XXX 	Rotate to master-bin.000002  pos: 4
#010909  9:46:40 server id 1  end_log_pos # CRC32 XXX 	Xid = #
BEGIN/*!*/;
#010909  9:46:40 server id 1  end_log_pos # CRC32 XXX 	Write_rows: table id # flags: STMT_END_F
### INSERT INTO `test`.`t1`
### SET
###   @1=127 /* TINYINT meta=0 nullable=1 is_null=0 */
###   @2=32767 /* SHORTINT meta=0 nullable=1 is_null=0 */
###   @3=8388607 /* MEDIUMINT meta=0 nullable=1 is_null=0 */
###   @4=2147483647 /* INT meta=0 nullable=1 is_null=0 */
###   @5=9223372036854775807 /* LONGINT meta=0 nullable=1 is_null=0 */
###   @6='aaaaaaaaaa' /* STRING(10) meta=65034 nullable=1 is_null=0 */
###   @7='aaaaaaaaaaaaaaaaaaaa' /* VARSTRING(20) meta=20 nullable=1 is_null=0 */
###   @8='aaaaaaaaaaaaaaaaaaaaaaaaaaaaaaaaaaaaaaaaaaaaaaaaaaaaaaaaaaaaaaaaaaaaaaaaaaaaaaaaaaaaaaaaaaaaaaaaaaaaaaaaaaaaaaaaaaaaaaaaaaaaaaaaaaaaaaaaaaaaaaaaaaaaaaaaaaaaaaaaaaaaaaaaaaaaaaaaaaaaaaaaaaaaaaaaaaaaaaaaaaaaaaaaaaaaaaaaaaaaaaaaaaaaaaaaaaaaaaaaaaaaaaaaaaaaaaa' /* BLOB/TEXT meta=2 nullable=1 is_null=0 */
### INSERT INTO `test`.`t1`
### SET
###   @1=100 /* TINYINT meta=0 nullable=1 is_null=0 */
###   @2=2 /* SHORTINT meta=0 nullable=1 is_null=0 */
###   @3=3 /* MEDIUMINT meta=0 nullable=1 is_null=0 */
###   @4=4 /* INT meta=0 nullable=1 is_null=0 */
###   @5=5 /* LONGINT meta=0 nullable=1 is_null=0 */
###   @6='abc' /* STRING(10) meta=65034 nullable=1 is_null=0 */
###   @7='abcdefg' /* VARSTRING(20) meta=20 nullable=1 is_null=0 */
###   @8='abcedfghijklmnopqrstuvwxyz' /* BLOB/TEXT meta=2 nullable=1 is_null=0 */
### INSERT INTO `test`.`t1`
### SET
###   @1=100 /* TINYINT meta=0 nullable=1 is_null=0 */
###   @2=0 /* SHORTINT meta=0 nullable=1 is_null=0 */
###   @3=0 /* MEDIUMINT meta=0 nullable=1 is_null=0 */
###   @4=0 /* INT meta=0 nullable=1 is_null=0 */
###   @5=0 /* LONGINT meta=0 nullable=1 is_null=0 */
###   @6='' /* STRING(10) meta=65034 nullable=1 is_null=0 */
###   @7='' /* VARSTRING(20) meta=20 nullable=1 is_null=0 */
###   @8='' /* BLOB/TEXT meta=2 nullable=1 is_null=0 */
COMMIT
/*!*/;
#010909  9:46:40 server id 1  end_log_pos # CRC32 XXX 	Xid = #
BEGIN/*!*/;
#010909  9:46:40 server id 1  end_log_pos # CRC32 XXX 	Update_rows: table id # flags: STMT_END_F
### UPDATE `test`.`t1`
### WHERE
###   @1=100 /* TINYINT meta=0 nullable=1 is_null=0 */
###   @2=2 /* SHORTINT meta=0 nullable=1 is_null=0 */
###   @3=3 /* MEDIUMINT meta=0 nullable=1 is_null=0 */
###   @4=4 /* INT meta=0 nullable=1 is_null=0 */
###   @5=5 /* LONGINT meta=0 nullable=1 is_null=0 */
###   @6='abc' /* STRING(10) meta=65034 nullable=1 is_null=0 */
###   @7='abcdefg' /* VARSTRING(20) meta=20 nullable=1 is_null=0 */
###   @8='abcedfghijklmnopqrstuvwxyz' /* BLOB/TEXT meta=2 nullable=1 is_null=0 */
### SET
###   @1=1 /* TINYINT meta=0 nullable=1 is_null=0 */
###   @2=2 /* SHORTINT meta=0 nullable=1 is_null=0 */
###   @3=3 /* MEDIUMINT meta=0 nullable=1 is_null=0 */
###   @4=4 /* INT meta=0 nullable=1 is_null=0 */
###   @5=5 /* LONGINT meta=0 nullable=1 is_null=0 */
###   @6='abc' /* STRING(10) meta=65034 nullable=1 is_null=0 */
###   @7='abcdefg' /* VARSTRING(20) meta=20 nullable=1 is_null=0 */
###   @8='abcedfghijklmnopqrstuvwxyz' /* BLOB/TEXT meta=2 nullable=1 is_null=0 */
### UPDATE `test`.`t1`
### WHERE
###   @1=100 /* TINYINT meta=0 nullable=1 is_null=0 */
###   @2=0 /* SHORTINT meta=0 nullable=1 is_null=0 */
###   @3=0 /* MEDIUMINT meta=0 nullable=1 is_null=0 */
###   @4=0 /* INT meta=0 nullable=1 is_null=0 */
###   @5=0 /* LONGINT meta=0 nullable=1 is_null=0 */
###   @6='' /* STRING(10) meta=65034 nullable=1 is_null=0 */
###   @7='' /* VARSTRING(20) meta=20 nullable=1 is_null=0 */
###   @8='' /* BLOB/TEXT meta=2 nullable=1 is_null=0 */
### SET
###   @1=0 /* TINYINT meta=0 nullable=1 is_null=0 */
###   @2=0 /* SHORTINT meta=0 nullable=1 is_null=0 */
###   @3=0 /* MEDIUMINT meta=0 nullable=1 is_null=0 */
###   @4=0 /* INT meta=0 nullable=1 is_null=0 */
###   @5=0 /* LONGINT meta=0 nullable=1 is_null=0 */
###   @6='' /* STRING(10) meta=65034 nullable=1 is_null=0 */
###   @7='' /* VARSTRING(20) meta=20 nullable=1 is_null=0 */
###   @8='' /* BLOB/TEXT meta=2 nullable=1 is_null=0 */
COMMIT
/*!*/;
#010909  9:46:40 server id 1  end_log_pos # CRC32 XXX 	Xid = #
BEGIN/*!*/;
#010909  9:46:40 server id 1  end_log_pos # CRC32 XXX 	Delete_rows: table id # flags: STMT_END_F
### DELETE FROM `test`.`t1`
### WHERE
###   @1=127 /* TINYINT meta=0 nullable=1 is_null=0 */
###   @2=32767 /* SHORTINT meta=0 nullable=1 is_null=0 */
###   @3=8388607 /* MEDIUMINT meta=0 nullable=1 is_null=0 */
###   @4=2147483647 /* INT meta=0 nullable=1 is_null=0 */
###   @5=9223372036854775807 /* LONGINT meta=0 nullable=1 is_null=0 */
###   @6='aaaaaaaaaa' /* STRING(10) meta=65034 nullable=1 is_null=0 */
###   @7='aaaaaaaaaaaaaaaaaaaa' /* VARSTRING(20) meta=20 nullable=1 is_null=0 */
###   @8='aaaaaaaaaaaaaaaaaaaaaaaaaaaaaaaaaaaaaaaaaaaaaaaaaaaaaaaaaaaaaaaaaaaaaaaaaaaaaaaaaaaaaaaaaaaaaaaaaaaaaaaaaaaaaaaaaaaaaaaaaaaaaaaaaaaaaaaaaaaaaaaaaaaaaaaaaaaaaaaaaaaaaaaaaaaaaaaaaaaaaaaaaaaaaaaaaaaaaaaaaaaaaaaaaaaaaaaaaaaaaaaaaaaaaaaaaaaaaaaaaaaaaaaaaaaaaaa' /* BLOB/TEXT meta=2 nullable=1 is_null=0 */
COMMIT
/*!*/;
#010909  9:46:40 server id 1  end_log_pos # CRC32 XXX 	Xid = #
BEGIN/*!*/;
#010909  9:46:40 server id 1  end_log_pos # CRC32 XXX 	Delete_rows: table id # flags: STMT_END_F
### DELETE FROM `test`.`t1`
### WHERE
###   @1=1 /* TINYINT meta=0 nullable=1 is_null=0 */
###   @2=2 /* SHORTINT meta=0 nullable=1 is_null=0 */
###   @3=3 /* MEDIUMINT meta=0 nullable=1 is_null=0 */
###   @4=4 /* INT meta=0 nullable=1 is_null=0 */
###   @5=5 /* LONGINT meta=0 nullable=1 is_null=0 */
###   @6='abc' /* STRING(10) meta=65034 nullable=1 is_null=0 */
###   @7='abcdefg' /* VARSTRING(20) meta=20 nullable=1 is_null=0 */
###   @8='abcedfghijklmnopqrstuvwxyz' /* BLOB/TEXT meta=2 nullable=1 is_null=0 */
COMMIT
/*!*/;
#010909  9:46:40 server id 1  end_log_pos # CRC32 XXX 	Xid = #
BEGIN/*!*/;
#010909  9:46:40 server id 1  end_log_pos # CRC32 XXX 	Delete_rows: table id # flags: STMT_END_F
### DELETE FROM `test`.`t1`
### WHERE
###   @1=0 /* TINYINT meta=0 nullable=1 is_null=0 */
###   @2=0 /* SHORTINT meta=0 nullable=1 is_null=0 */
###   @3=0 /* MEDIUMINT meta=0 nullable=1 is_null=0 */
###   @4=0 /* INT meta=0 nullable=1 is_null=0 */
###   @5=0 /* LONGINT meta=0 nullable=1 is_null=0 */
###   @6='' /* STRING(10) meta=65034 nullable=1 is_null=0 */
###   @7='' /* VARSTRING(20) meta=20 nullable=1 is_null=0 */
###   @8='' /* BLOB/TEXT meta=2 nullable=1 is_null=0 */
COMMIT
/*!*/;
#010909  9:46:40 server id 1  end_log_pos # CRC32 XXX 	Query	thread_id=#	exec_time=#	error_code=0
use `test`/*!*/;
SET TIMESTAMP=1000000000/*!*/;
SET @@session.pseudo_thread_id=#/*!*/;
SET @@session.foreign_key_checks=1, @@session.sql_auto_is_null=0, @@session.unique_checks=1, @@session.autocommit=1, @@session.check_constraint_checks=1/*!*/;
SET @@session.sql_mode=1411383296/*!*/;
SET @@session.auto_increment_increment=1, @@session.auto_increment_offset=1/*!*/;
/*!\C latin1 *//*!*/;
SET @@session.character_set_client=8,@@session.collation_connection=8,@@session.collation_server=8/*!*/;
SET @@session.lc_time_names=0/*!*/;
SET @@session.collation_database=DEFAULT/*!*/;
COMMIT
/*!*/;
DELIMITER ;
# End of log file
ROLLBACK /* added by mysqlbinlog */;
/*!50003 SET COMPLETION_TYPE=@OLD_COMPLETION_TYPE*/;
/*!50530 SET @@SESSION.PSEUDO_SLAVE_MODE=0*/;
#
# Insert data to t1
#
TRUNCATE TABLE t1;
INSERT INTO t1 VALUES(0,0,0,0,0,'','','');
INSERT INTO t1 VALUES(1,2,3,4,5, "abc", "abcdefg", "abcedfghijklmnopqrstuvwxyz");
INSERT INTO t1 VALUES(127, 32767, 8388607, 2147483647, 9223372036854775807, repeat('a', 10), repeat('a', 20), repeat('a', 60));
#
# Delete all existing binary logs.
#
RESET MASTER;
SELECT * FROM t1;
c01	c02	c03	c04	c05	c06	c07	c08
0	0	0	0	0			
1	2	3	4	5	abc	abcdefg	abcedfghijklmnopqrstuvwxyz
127	32767	8388607	2147483647	9223372036854775807	aaaaaaaaaa	aaaaaaaaaaaaaaaaaaaa	aaaaaaaaaaaaaaaaaaaaaaaaaaaaaaaaaaaaaaaaaaaaaaaaaaaaaaaaaaaa
#
# Operate some data
#
UPDATE t1 SET c01=20;
UPDATE t1 SET c02=200;
UPDATE t1 SET c03=2000;
DELETE FROM t1;
FLUSH LOGS;
#
# Flashback & Check the result
#
SELECT * FROM t1;
c01	c02	c03	c04	c05	c06	c07	c08
127	32767	8388607	2147483647	9223372036854775807	aaaaaaaaaa	aaaaaaaaaaaaaaaaaaaa	aaaaaaaaaaaaaaaaaaaaaaaaaaaaaaaaaaaaaaaaaaaaaaaaaaaaaaaaaaaa
1	2	3	4	5	abc	abcdefg	abcedfghijklmnopqrstuvwxyz
0	0	0	0	0			
RESET MASTER;
#
# UPDATE multi-rows in one event
#
BEGIN;
UPDATE t1 SET c01=10 WHERE c01=0;
UPDATE t1 SET c01=20 WHERE c01=10;
COMMIT;
FLUSH LOGS;
#
# Flashback & Check the result
#
SELECT * FROM t1;
c01	c02	c03	c04	c05	c06	c07	c08
127	32767	8388607	2147483647	9223372036854775807	aaaaaaaaaa	aaaaaaaaaaaaaaaaaaaa	aaaaaaaaaaaaaaaaaaaaaaaaaaaaaaaaaaaaaaaaaaaaaaaaaaaaaaaaaaaa
1	2	3	4	5	abc	abcdefg	abcedfghijklmnopqrstuvwxyz
0	0	0	0	0			
DROP TABLE t1;
#
# Self-referencing foreign keys
#
CREATE TABLE t1 (a INT PRIMARY KEY, b INT, FOREIGN KEY my_fk(b) REFERENCES t1(a)) ENGINE=InnoDB;
BEGIN;
INSERT INTO t1 VALUES (1, NULL);
INSERT INTO t1 VALUES (2, 1), (3, 2), (4, 3);
COMMIT;
SELECT * FROM t1;
a	b
1	NULL
2	1
3	2
4	3
RESET MASTER;
DELETE FROM t1 ORDER BY a DESC;
FLUSH LOGS;
#
# Flashback & Check the result
#
SELECT * FROM t1;
a	b
1	NULL
2	1
3	2
4	3
SET binlog_format=statement;
Warnings:
Warning	1105	MariaDB Galera and flashback do not support binlog format: STATEMENT
SET GLOBAL binlog_format=statement;
ERROR HY000: Flashback does not support binlog_format STATEMENT
DROP TABLE t1;
