use performance_schema;
set @start_read_only= @@global.read_only;
create user pfsuser@localhost;
grant SELECT, UPDATE on performance_schema.* to pfsuser@localhost;
flush privileges;
connect  con1, localhost, pfsuser, ,"*NO-ONE*";
connection default;
set global read_only=0;
connection con1;
select @@global.read_only;
@@global.read_only
OFF
show grants;
Grants for pfsuser@localhost
GRANT USAGE ON *.* TO `pfsuser`@`localhost`
GRANT SELECT, UPDATE ON `performance_schema`.* TO `pfsuser`@`localhost`
# Update on perf_schema is allowed in read_only mode.
select * from performance_schema.setup_instruments;
update performance_schema.setup_instruments set enabled='NO';
update performance_schema.setup_instruments set enabled='YES';
connection default;
set global read_only=1;
connection con1;
select @@global.read_only;
@@global.read_only
ON
show grants;
Grants for pfsuser@localhost
GRANT USAGE ON *.* TO `pfsuser`@`localhost`
GRANT SELECT, UPDATE ON `performance_schema`.* TO `pfsuser`@`localhost`
select * from performance_schema.setup_instruments;
update performance_schema.setup_instruments set enabled='NO';
ERROR HY000: The MariaDB server is running with the --read-only=ON option so it cannot execute this statement
update performance_schema.setup_instruments set enabled='YES';
ERROR HY000: The MariaDB server is running with the --read-only=ON option so it cannot execute this statement
connection default;
grant READ_ONLY ADMIN on *.* to pfsuser@localhost;
flush privileges;
disconnect con1;
connect  con1, localhost, pfsuser, ,"*NO-ONE*";
select @@global.read_only;
@@global.read_only
ON
show grants;
Grants for pfsuser@localhost
GRANT READ_ONLY ADMIN ON *.* TO `pfsuser`@`localhost`
GRANT SELECT, UPDATE ON `performance_schema`.* TO `pfsuser`@`localhost`
select * from performance_schema.setup_instruments;
update performance_schema.setup_instruments set enabled='NO';
update performance_schema.setup_instruments set enabled='YES';
disconnect con1;
connection default;
set global read_only= @start_read_only;
drop user pfsuser@localhost;
flush privileges;
