set @@session.time_zone='+00:00';
select ifnull(max(transaction_id), 0) into @start_trx_id from mysql.transaction_registry;
set @test_start=now(6);
create procedure if not exists verify_vtq()
begin
set @i= 0;
select
@i:= @i + 1 as No,
transaction_id > 0 as A,
commit_id > transaction_id as B,
begin_timestamp > @test_start as C,
commit_timestamp >= begin_timestamp as D
from mysql.transaction_registry
where transaction_id > @start_trx_id;
select ifnull(max(transaction_id), 0)
into @start_trx_id
from mysql.transaction_registry;
end~~
create function if not exists default_engine()
returns varchar(255)
deterministic
begin
declare e varchar(255);
select lower(engine) from information_schema.engines where support='DEFAULT' into e;
return e;
end~~
create function if not exists sys_datatype()
returns varchar(255)
deterministic
begin
if default_engine() = 'innodb' then
return 'bigint unsigned';
elseif default_engine() = 'myisam' then
return 'timestamp(6)';
end if;
return NULL;
end~~
create function if not exists sys_commit_ts(sys_field varchar(255))
returns varchar(255)
deterministic
begin
if default_engine() = 'innodb' then
return concat('vtq_commit_ts(', sys_field, ')');
elseif default_engine() = 'myisam' then
return sys_field;
end if;
return NULL;
end~~
create procedure if not exists innodb_verify_vtq(recs int)
begin
declare i int default 1;
if default_engine() = 'innodb' then
call verify_vtq;
elseif default_engine() = 'myisam' then
create temporary table tmp (No int, A bool, B bool, C bool, D bool);
while i <= recs do
insert into tmp values (i, 1, 1, 1, 1);
set i= i + 1;
end while;
select * from tmp;
drop table tmp;
end if;
end~~
create procedure concat_exec2(a varchar(255), b varchar(255))
begin
prepare stmt from concat(a, b);
execute stmt;
deallocate prepare stmt;
end~~
create procedure concat_exec3(a varchar(255), b varchar(255), c varchar(255))
begin
prepare stmt from concat(a, b, c);
execute stmt;
deallocate prepare stmt;
end~~
create or replace function moment()
returns timestamp(6)
not deterministic
begin
declare t timestamp(6);
declare i int;
set i= sleep(0.1);
set t= now(6);
set i= sleep(0.1);
return t;
end~~
create table emp
(
emp_id int,
name varchar(127),
mgr int
) with system versioning;
insert into emp values (1, 'bill', 0),
(2, 'bill', 1),
(3, 'kate', 1);
set @ts=moment();
delete from emp;
insert into emp values (4, 'john', 1);
with ancestors as (select * from emp) select * from ancestors;
emp_id	name	mgr
4	john	1
set @tmp= "with ancestors as (select * from emp) select * from ancestors";
prepare stmt from @tmp;
execute stmt;
emp_id	name	mgr
4	john	1
drop prepare stmt;
with ancestors as (select * from emp for system_time all) select * from ancestors;
emp_id	name	mgr
1	bill	0
2	bill	1
3	kate	1
4	john	1
set @tmp= "with ancestors as (select * from emp for system_time all) select * from ancestors";
prepare stmt from @tmp;
execute stmt;
emp_id	name	mgr
1	bill	0
2	bill	1
3	kate	1
4	john	1
drop prepare stmt;
with recursive ancestors as (select * from emp) select * from ancestors;
emp_id	name	mgr
4	john	1
set @tmp= "with recursive ancestors as (select * from emp) select * from ancestors";
prepare stmt from @tmp;
execute stmt;
emp_id	name	mgr
4	john	1
drop prepare stmt;
select emp_id from (select emp_id from emp where sys_trx_end>'2031-1-1') as tmp;
emp_id
4
set @tmp= "select emp_id from (select emp_id from emp where sys_trx_end>'2031-1-1') as tmp";
prepare stmt from @tmp;
execute stmt;
emp_id
4
drop prepare stmt;
with recursive
ancestors
as
(
select e.emp_id, e.name, e.mgr
from emp as e
where name = 'john'
  union
select ee.emp_id, ee.name, ee.mgr
from emp as ee, ancestors as a
where ee.mgr = a.emp_id
)
select * from ancestors;
emp_id	name	mgr
4	john	1
set @tmp= "
with recursive
ancestors
as
(
  select e.emp_id, e.name, e.mgr
  from emp as e
  where name = 'john'
  union
  select ee.emp_id, ee.name, ee.mgr
  from emp as ee, ancestors as a
  where ee.mgr = a.emp_id
)
select * from ancestors";
prepare stmt from @tmp;
execute stmt;
emp_id	name	mgr
4	john	1
drop prepare stmt;
with recursive
ancestors
as
(
select e.emp_id, e.name, e.mgr
from emp as e
where name = 'bill'
  system_time as of timestamp @ts
union
select ee.emp_id, ee.name, ee.mgr
from emp as ee, ancestors as a
where ee.mgr = a.emp_id
system_time as of timestamp @ts
)
select * from ancestors;
emp_id	name	mgr
1	bill	0
2	bill	1
3	kate	1
set @tmp= "
with recursive
ancestors
as
(
  select e.emp_id, e.name, e.mgr
  from emp as e
  where name = 'bill'
  system_time as of timestamp @ts
  union
  select ee.emp_id, ee.name, ee.mgr
  from emp as ee, ancestors as a
  where ee.mgr = a.emp_id
  system_time as of timestamp @ts
)
select * from ancestors";
prepare stmt from @tmp;
execute stmt;
emp_id	name	mgr
1	bill	0
2	bill	1
3	kate	1
drop prepare stmt;
drop table emp;
create or replace table t1 (x int) with system versioning;
create or replace table t2 (y int) with system versioning;
insert into t1 values (1);
set @t0= moment();
insert into t1 values (2);
delete from t1 where x = 1;
insert into t2 values (10);
select * from (select *, t1.sys_trx_end, t1.sys_trx_end as endo from t1) as s0;
ERROR HY000: Derived table is prohibited: multiple end system fields `t1.sys_trx_end`, `t1.sys_trx_end` in query!
select * from (select *, t1.sys_trx_end, t2.sys_trx_start from t1, t2) as s0;
ERROR HY000: Derived table is prohibited: system fields from multiple tables `t1`, `t2` in query!
select * from (select * from t1 for system_time as of timestamp @t0, t2) as s0;
x	y
1	10
with s1 as (select * from t1 for system_time as of timestamp @t0, t2) select * from s1;
x	y
1	10
select * from (select *, t1.sys_trx_end from t2, t1 for system_time as of timestamp @t0) as s2;
y	x
10	1
with s3 as (select *, t1.sys_trx_end from t2, t1 for system_time as of timestamp @t0) select * from s3;
y	x
10	1
select * from (select *, t1.sys_trx_start from t2 for system_time as of now, t1) as s4 system_time as of timestamp @t0;
y	x
10	1
with s5 as (select *, t1.sys_trx_start from t2 for system_time as of now, t1) select * from s5 for system_time as of timestamp @t0;
y	x
10	1
with s6 as (select *, t1.sys_trx_start from t2 for system_time as of now, t1) select * from s6 system_time as of timestamp @t0;
y	x
10	1
set @q= concat("create view vt1 as select * from t1 for system_time as of timestamp '", @t0, "'");
prepare q from @q;
execute q;
drop prepare q;
select * from vt1;
x
1
select * from (select * from vt1, t2) as s0;
x	y
1	10
select * from (select *, vt1.sys_trx_end from t2, vt1) as s0;
y	x
10	1
select * from (select *, vt1.sys_trx_start from t2 for system_time as of now, vt1) as s0 system_time as of timestamp @t0;
y	x
10	1
drop database test;
create database test;
