set @@session.time_zone='+00:00';
select ifnull(max(transaction_id), 0) into @start_trx_id from mysql.transaction_registry;
set @test_start=now(6);
create procedure if not exists verify_vtq()
begin
set @i= 0;
select
@i:= @i + 1 as No,
transaction_id > 0 as A,
commit_id > transaction_id as B,
begin_timestamp > @test_start as C,
commit_timestamp >= begin_timestamp as D
from mysql.transaction_registry
where transaction_id > @start_trx_id;
select ifnull(max(transaction_id), 0)
into @start_trx_id
from mysql.transaction_registry;
end~~
create function if not exists default_engine()
returns varchar(255)
deterministic
begin
declare e varchar(255);
select lower(engine) from information_schema.engines where support='DEFAULT' into e;
return e;
end~~
create function if not exists sys_datatype()
returns varchar(255)
deterministic
begin
if default_engine() = 'innodb' then
return 'bigint unsigned';
elseif default_engine() = 'myisam' then
return 'timestamp(6)';
end if;
return NULL;
end~~
create function if not exists sys_commit_ts(sys_field varchar(255))
returns varchar(255)
deterministic
begin
if default_engine() = 'innodb' then
return concat('vtq_commit_ts(', sys_field, ')');
elseif default_engine() = 'myisam' then
return sys_field;
end if;
return NULL;
end~~
create procedure if not exists innodb_verify_vtq(recs int)
begin
declare i int default 1;
if default_engine() = 'innodb' then
call verify_vtq;
elseif default_engine() = 'myisam' then
create temporary table tmp (No int, A bool, B bool, C bool, D bool);
while i <= recs do
insert into tmp values (i, 1, 1, 1, 1);
set i= i + 1;
end while;
select * from tmp;
drop table tmp;
end if;
end~~
create procedure concat_exec2(a varchar(255), b varchar(255))
begin
prepare stmt from concat(a, b);
execute stmt;
deallocate prepare stmt;
end~~
create procedure concat_exec3(a varchar(255), b varchar(255), c varchar(255))
begin
prepare stmt from concat(a, b, c);
execute stmt;
deallocate prepare stmt;
end~~
create or replace function moment()
returns timestamp(6)
not deterministic
begin
declare t timestamp(6);
declare i int;
set i= sleep(0.1);
set t= now(6);
set i= sleep(0.1);
return t;
end~~
create table parent(
id int unique key
) engine innodb;
create table child(
parent_id int,
foreign key(parent_id) references parent(id)
on delete restrict
on update restrict
) engine innodb with system versioning;
insert into parent values(1);
insert into child values(1);
delete from parent where id = 1;
ERROR 23000: Cannot delete or update a parent row: a foreign key constraint fails (`test`.`child`, CONSTRAINT `child_ibfk_1` FOREIGN KEY (`parent_id`) REFERENCES `parent` (`id`))
delete from child where parent_id = 1;
delete from parent where id = 1;
insert into parent values(1);
insert into child values(1);
update parent set id=id+1;
ERROR 23000: Cannot delete or update a parent row: a foreign key constraint fails (`test`.`child`, CONSTRAINT `child_ibfk_1` FOREIGN KEY (`parent_id`) REFERENCES `parent` (`id`))
delete from child;
update parent set id=id+1;
select * from child for system_time from timestamp '1-1-1' to timestamp moment();
parent_id
1
1
drop table child;
drop table parent;
create table parent(
id int(10) unsigned unique key
) engine innodb;
create table child(
parent_id int(10) unsigned primary key,
foreign key(parent_id) references parent(id)
) engine innodb with system versioning;
insert into parent values(1);
insert into child values(1);
delete from parent where id = 1;
ERROR 23000: Cannot delete or update a parent row: a foreign key constraint fails (`test`.`child`, CONSTRAINT `child_ibfk_1` FOREIGN KEY (`parent_id`) REFERENCES `parent` (`id`))
drop table child;
drop table parent;
create table parent(
id int unique key
) engine innodb;
create table child(
parent_id int,
foreign key(parent_id) references parent(id)
on delete cascade
on update cascade
) engine innodb with system versioning;
insert into parent values(1);
insert into child values(1);
delete from parent where id = 1;
select * from child;
parent_id
select * from child for system_time all;
parent_id
1
insert into parent values(1);
insert into child values(1);
update parent set id = id + 1;
select * from child;
parent_id
2
select * from child for system_time all;
parent_id
1
2
drop table child;
drop table parent;
create or replace table parent (
id int primary key
) with system versioning
engine innodb;
create or replace table child (
x int,
parent_id int not null,
constraint `parent-fk`
  foreign key (parent_id) references parent (id)
on delete cascade
on update restrict
)
engine innodb;
insert into parent (id) values (2);
insert into child (x, parent_id) values (2, 2);
delete from parent;
select * from child;
x	parent_id
drop table child;
drop table parent;
create or replace table parent (
id int primary key
)
engine innodb;
create or replace table child (
id int primary key,
parent_id int not null,
constraint `parent-fk`
  foreign key (parent_id) references parent (id)
on delete cascade
on update restrict
) with system versioning
engine innodb;
insert into parent (id) values (3);
insert into child (id, parent_id) values (3, 3);
delete from parent;
select * from child;
id	parent_id
select * from child for system_time all;
id	parent_id
3	3
drop table child;
drop table parent;
create table parent(
id int unique key
) engine innodb;
create table child(
parent_id int,
foreign key(parent_id) references parent(id)
on delete set null
on update set null
) engine innodb with system versioning;
insert into parent values(1);
insert into child values(1);
delete from child;
insert into child values(1);
delete from parent where id = 1;
select * from child;
parent_id
NULL
select * from child for system_time from timestamp '1-1-1' to timestamp moment();
parent_id
1
NULL
delete from child;
insert into parent values(1);
insert into child values(1);
update parent set id=id+1;
select * from child;
parent_id
NULL
select * from child for system_time from timestamp '1-1-1' to timestamp moment();
parent_id
1
NULL
NULL
drop table child;
drop table parent;
create or replace table parent(
id int unique key
) engine innodb with system versioning;
create or replace table child(
parent_id int,
foreign key(parent_id) references parent(id)
) engine innodb;
insert into parent values(1);
insert into child values(1);
delete from parent;
ERROR 23000: Cannot delete or update a parent row: a foreign key constraint fails (`test`.`child`, CONSTRAINT `child_ibfk_1` FOREIGN KEY (`parent_id`) REFERENCES `parent` (`id`))
update parent set id=2;
ERROR 23000: Cannot delete or update a parent row: a foreign key constraint fails (`test`.`child`, CONSTRAINT `child_ibfk_1` FOREIGN KEY (`parent_id`) REFERENCES `parent` (`id`))
delete from child;
delete from parent;
insert into child values(1);
ERROR 23000: Cannot add or update a child row: a foreign key constraint fails (`test`.`child`, CONSTRAINT `child_ibfk_1` FOREIGN KEY (`parent_id`) REFERENCES `parent` (`id`))
insert into parent values(1);
insert into child values(1);
delete from parent;
ERROR 23000: Cannot delete or update a parent row: a foreign key constraint fails (`test`.`child`, CONSTRAINT `child_ibfk_1` FOREIGN KEY (`parent_id`) REFERENCES `parent` (`id`))
update parent set id=2;
ERROR 23000: Cannot delete or update a parent row: a foreign key constraint fails (`test`.`child`, CONSTRAINT `child_ibfk_1` FOREIGN KEY (`parent_id`) REFERENCES `parent` (`id`))
drop database test;
create database test;
