#
# MDEV-25529 Auto-create: Pre-existing historical data is not partitioned as specified by ALTER
#
set @old_dbug= @@debug_dbug;
set debug_dbug= '+d,test_mdev-25529';
create or replace table t1 (x int) with system versioning
partition by system_time limit 1;
alter table t1 partition by system_time limit 1 auto;
create or replace table t1 (x int,
row_start timestamp(6) as row start invisible,
row_end timestamp(6) as row end invisible,
period for system_time (row_start, row_end),
index (row_end, row_start),
index (row_start),
index (row_end, x),
index (x, row_end),
index (row_end)) with system versioning
partition by system_time limit 1000 partitions 6;
show create table t1;
Table	Create Table
t1	CREATE TABLE `t1` (
  `x` int(11) DEFAULT NULL,
  `row_start` timestamp(6) GENERATED ALWAYS AS ROW START INVISIBLE,
  `row_end` timestamp(6) GENERATED ALWAYS AS ROW END INVISIBLE,
  KEY `row_end` (`row_end`,`row_start`),
  KEY `row_start` (`row_start`),
  KEY `row_end_2` (`row_end`,`x`),
  KEY `x` (`x`,`row_end`),
  KEY `row_end_3` (`row_end`),
  PERIOD FOR SYSTEM_TIME (`row_start`, `row_end`)
) ENGINE=MyISAM DEFAULT CHARSET=latin1 COLLATE=latin1_swedish_ci WITH SYSTEM VERSIONING
 PARTITION BY SYSTEM_TIME LIMIT 1000
PARTITIONS 6
set timestamp= unix_timestamp('2000-01-01 00:00:00');
insert t1 values (0);
set timestamp= unix_timestamp('2000-01-01 00:10:00.22');
update t1 set x= x + 1;
set timestamp= unix_timestamp('2000-01-01 01:00:00');
update t1 set x= x + 1;
set timestamp= unix_timestamp('2000-01-01 01:30:00');
update t1 set x= x + 1;
set timestamp= unix_timestamp('2000-01-01 02:00:00');
update t1 set x= x + 1;
select *, row_start, row_end from t1 partition (p0);
x	row_start	row_end
0	2000-01-01 00:00:00.000000	2000-01-01 00:10:00.220000
1	2000-01-01 00:10:00.220000	2000-01-01 01:00:00.000000
2	2000-01-01 01:00:00.000000	2000-01-01 01:30:00.000000
3	2000-01-01 01:30:00.000000	2000-01-01 02:00:00.000000
select *, row_start, row_end from t1 partition (p1);
x	row_start	row_end
select *, row_start, row_end from t1 partition (p2);
x	row_start	row_end
select *, row_start, row_end from t1 partition (p3);
x	row_start	row_end
select *, row_start, row_end from t1 partition (p4);
x	row_start	row_end
select *, row_start, row_end from t1 partition (pn);
x	row_start	row_end
4	2000-01-01 02:00:00.000000	2038-01-19 06:14:07.999999
set timestamp= default;
ALTER table t1 partition by system_time
interval 1 hour starts '2000-01-01 00:00:00';
select *, row_start, row_end from t1 partition (p0);
x	row_start	row_end
0	2000-01-01 00:00:00.000000	2000-01-01 00:10:00.220000
select *, row_start, row_end from t1 partition (p1);
x	row_start	row_end
1	2000-01-01 00:10:00.220000	2000-01-01 01:00:00.000000
2	2000-01-01 01:00:00.000000	2000-01-01 01:30:00.000000
select *, row_start, row_end from t1 partition (p2);
x	row_start	row_end
3	2000-01-01 01:30:00.000000	2000-01-01 02:00:00.000000
select *, row_start, row_end from t1 partition (p3);
x	row_start	row_end
select *, row_start, row_end from t1 partition (p4);
x	row_start	row_end
select *, row_start, row_end from t1 partition (pn);
x	row_start	row_end
4	2000-01-01 02:00:00.000000	2038-01-19 06:14:07.999999
alter TABLE t1 partition by system_time
interval 1 hour;
select *, row_start, row_end from t1 partition (p0);
x	row_start	row_end
0	2000-01-01 00:00:00.000000	2000-01-01 00:10:00.220000
select *, row_start, row_end from t1 partition (p1);
x	row_start	row_end
1	2000-01-01 00:10:00.220000	2000-01-01 01:00:00.000000
2	2000-01-01 01:00:00.000000	2000-01-01 01:30:00.000000
select *, row_start, row_end from t1 partition (p2);
x	row_start	row_end
3	2000-01-01 01:30:00.000000	2000-01-01 02:00:00.000000
select *, row_start, row_end from t1 partition (p3);
x	row_start	row_end
select *, row_start, row_end from t1 partition (p4);
x	row_start	row_end
select *, row_start, row_end from t1 partition (pn);
x	row_start	row_end
4	2000-01-01 02:00:00.000000	2038-01-19 06:14:07.999999
set @@system_versioning_alter_history= keep;
alter table t1 remove partitioning;
select *, row_start, row_end from t1 for system_time all;
x	row_start	row_end
0	2000-01-01 00:00:00.000000	2000-01-01 00:10:00.220000
1	2000-01-01 00:10:00.220000	2000-01-01 01:00:00.000000
2	2000-01-01 01:00:00.000000	2000-01-01 01:30:00.000000
3	2000-01-01 01:30:00.000000	2000-01-01 02:00:00.000000
4	2000-01-01 02:00:00.000000	2038-01-19 06:14:07.999999
alter table t1 PARTITION by system_time interval 1 hour auto;
show create table t1;
Table	Create Table
t1	CREATE TABLE `t1` (
  `x` int(11) DEFAULT NULL,
  `row_start` timestamp(6) GENERATED ALWAYS AS ROW START INVISIBLE,
  `row_end` timestamp(6) GENERATED ALWAYS AS ROW END INVISIBLE,
  KEY `row_end` (`row_end`,`row_start`),
  KEY `row_start` (`row_start`),
  KEY `row_end_2` (`row_end`,`x`),
  KEY `x` (`x`,`row_end`),
  KEY `row_end_3` (`row_end`),
  PERIOD FOR SYSTEM_TIME (`row_start`, `row_end`)
) ENGINE=MyISAM DEFAULT CHARSET=latin1 COLLATE=latin1_swedish_ci WITH SYSTEM VERSIONING
 PARTITION BY SYSTEM_TIME INTERVAL 1 HOUR STARTS TIMESTAMP'2000-01-01 00:00:00' AUTO
PARTITIONS 3
select *, row_start, row_end from t1 partition (p0);
x	row_start	row_end
0	2000-01-01 00:00:00.000000	2000-01-01 00:10:00.220000
select *, row_start, row_end from t1 partition (p1);
x	row_start	row_end
1	2000-01-01 00:10:00.220000	2000-01-01 01:00:00.000000
2	2000-01-01 01:00:00.000000	2000-01-01 01:30:00.000000
3	2000-01-01 01:30:00.000000	2000-01-01 02:00:00.000000
select *, row_start, row_end from t1 partition (pn);
x	row_start	row_end
4	2000-01-01 02:00:00.000000	2038-01-19 06:14:07.999999
alter table t1 remove partitioning;
alter table t1 partition by SYSTEM_TIME interval 1 hour starts '2000-01-01 00:00:00' auto;
show create table t1;
Table	Create Table
t1	CREATE TABLE `t1` (
  `x` int(11) DEFAULT NULL,
  `row_start` timestamp(6) GENERATED ALWAYS AS ROW START INVISIBLE,
  `row_end` timestamp(6) GENERATED ALWAYS AS ROW END INVISIBLE,
  KEY `row_end` (`row_end`,`row_start`),
  KEY `row_start` (`row_start`),
  KEY `row_end_2` (`row_end`,`x`),
  KEY `x` (`x`,`row_end`),
  KEY `row_end_3` (`row_end`),
  PERIOD FOR SYSTEM_TIME (`row_start`, `row_end`)
) ENGINE=MyISAM DEFAULT CHARSET=latin1 COLLATE=latin1_swedish_ci WITH SYSTEM VERSIONING
 PARTITION BY SYSTEM_TIME INTERVAL 1 HOUR STARTS TIMESTAMP'2000-01-01 00:00:00' AUTO
PARTITIONS 3
select *, row_start, row_end from t1 partition (p0);
x	row_start	row_end
0	2000-01-01 00:00:00.000000	2000-01-01 00:10:00.220000
select *, row_start, row_end from t1 partition (p1);
x	row_start	row_end
1	2000-01-01 00:10:00.220000	2000-01-01 01:00:00.000000
2	2000-01-01 01:00:00.000000	2000-01-01 01:30:00.000000
3	2000-01-01 01:30:00.000000	2000-01-01 02:00:00.000000
select *, row_start, row_end from t1 partition (pn);
x	row_start	row_end
4	2000-01-01 02:00:00.000000	2038-01-19 06:14:07.999999
set timestamp= unix_timestamp('2000-01-02 03:01:23.456');
delete from t1;
alter table t1 remove partitioning;
alter table t1 partition by SYSTEM_TIME interval 1 hour auto;
show create table t1;
Table	Create Table
t1	CREATE TABLE `t1` (
  `x` int(11) DEFAULT NULL,
  `row_start` timestamp(6) GENERATED ALWAYS AS ROW START INVISIBLE,
  `row_end` timestamp(6) GENERATED ALWAYS AS ROW END INVISIBLE,
  KEY `row_end` (`row_end`,`row_start`),
  KEY `row_start` (`row_start`),
  KEY `row_end_2` (`row_end`,`x`),
  KEY `x` (`x`,`row_end`),
  KEY `row_end_3` (`row_end`),
  PERIOD FOR SYSTEM_TIME (`row_start`, `row_end`)
) ENGINE=MyISAM DEFAULT CHARSET=latin1 COLLATE=latin1_swedish_ci WITH SYSTEM VERSIONING
 PARTITION BY SYSTEM_TIME INTERVAL 1 HOUR STARTS TIMESTAMP'2000-01-01 00:00:00' AUTO
PARTITIONS 29
select *, row_start, row_end from t1 partition (p0);
x	row_start	row_end
0	2000-01-01 00:00:00.000000	2000-01-01 00:10:00.220000
select *, row_start, row_end from t1 partition (p1);
x	row_start	row_end
1	2000-01-01 00:10:00.220000	2000-01-01 01:00:00.000000
2	2000-01-01 01:00:00.000000	2000-01-01 01:30:00.000000
select *, row_start, row_end from t1 partition (p2);
x	row_start	row_end
3	2000-01-01 01:30:00.000000	2000-01-01 02:00:00.000000
select *, row_start, row_end from t1 partition (p27);
x	row_start	row_end
4	2000-01-01 02:00:00.000000	2000-01-02 03:01:23.456000
select *, row_start, row_end from t1 partition (pn);
x	row_start	row_end
set timestamp= unix_timestamp('2000-01-02 03:01:23.456');
delete from t1;
alter table t1 partition by system_time INTERVAL 20 minute auto force;
show create table t1;
Table	Create Table
t1	CREATE TABLE `t1` (
  `x` int(11) DEFAULT NULL,
  `row_start` timestamp(6) GENERATED ALWAYS AS ROW START INVISIBLE,
  `row_end` timestamp(6) GENERATED ALWAYS AS ROW END INVISIBLE,
  KEY `row_end` (`row_end`,`row_start`),
  KEY `row_start` (`row_start`),
  KEY `row_end_2` (`row_end`,`x`),
  KEY `x` (`x`,`row_end`),
  KEY `row_end_3` (`row_end`),
  PERIOD FOR SYSTEM_TIME (`row_start`, `row_end`)
) ENGINE=MyISAM DEFAULT CHARSET=latin1 COLLATE=latin1_swedish_ci WITH SYSTEM VERSIONING
 PARTITION BY SYSTEM_TIME INTERVAL 20 MINUTE STARTS TIMESTAMP'2000-01-01 00:10:00' AUTO
PARTITIONS 82
select *, row_start, row_end from t1 partition (p0);
x	row_start	row_end
0	2000-01-01 00:00:00.000000	2000-01-01 00:10:00.220000
select *, row_start, row_end from t1 partition (p2);
x	row_start	row_end
1	2000-01-01 00:10:00.220000	2000-01-01 01:00:00.000000
select *, row_start, row_end from t1 partition (p5);
x	row_start	row_end
3	2000-01-01 01:30:00.000000	2000-01-01 02:00:00.000000
select *, row_start, row_end from t1 partition (pn);
x	row_start	row_end
alter table t1 remove partitioning;
alter table t1 partition by system_time interval 1 hour
starts '2002-01-01 00:00:00' auto;
Warnings:
Warning	4164	`t1`: STARTS timestamp 2002-01-01 00:00:00 is later than query timestamp 2000-01-02 03:01:23, first history partition may exceed INTERVAL value
Warning	4193	`t1`: STARTS timestamp 2002-01-01 00:00:00 is above earliest history date 2000-01-01 00:10:00 and was set to 2000-01-01 00:00:00
# STARTS changed and WARN_VERS_WRONG_STARTS is here
alter table t1 force partition by system_time interval 1 hour
starts '2003-01-01 00:00:00' auto;
Warnings:
Warning	4193	`t1`: STARTS timestamp 2003-01-01 00:00:00 is above earliest history date 2000-01-01 00:10:00 and was set to 2000-01-01 00:00:00
show create table t1;
Table	Create Table
t1	CREATE TABLE `t1` (
  `x` int(11) DEFAULT NULL,
  `row_start` timestamp(6) GENERATED ALWAYS AS ROW START INVISIBLE,
  `row_end` timestamp(6) GENERATED ALWAYS AS ROW END INVISIBLE,
  KEY `row_end` (`row_end`,`row_start`),
  KEY `row_start` (`row_start`),
  KEY `row_end_2` (`row_end`,`x`),
  KEY `x` (`x`,`row_end`),
  KEY `row_end_3` (`row_end`),
  PERIOD FOR SYSTEM_TIME (`row_start`, `row_end`)
) ENGINE=MyISAM DEFAULT CHARSET=latin1 COLLATE=latin1_swedish_ci WITH SYSTEM VERSIONING
 PARTITION BY SYSTEM_TIME INTERVAL 1 HOUR STARTS TIMESTAMP'2000-01-01 00:00:00' AUTO
PARTITIONS 29
alter table t1 partition by system_time interval 1 hour
starts '2004-01-01 00:00:00' auto force;
Warnings:
Warning	4164	`t1`: STARTS timestamp 2004-01-01 00:00:00 is later than query timestamp 2000-01-02 03:01:23, first history partition may exceed INTERVAL value
Warning	4193	`t1`: STARTS timestamp 2004-01-01 00:00:00 is above earliest history date 2000-01-01 00:10:00 and was set to 2000-01-01 00:00:00
show create table t1;
Table	Create Table
t1	CREATE TABLE `t1` (
  `x` int(11) DEFAULT NULL,
  `row_start` timestamp(6) GENERATED ALWAYS AS ROW START INVISIBLE,
  `row_end` timestamp(6) GENERATED ALWAYS AS ROW END INVISIBLE,
  KEY `row_end` (`row_end`,`row_start`),
  KEY `row_start` (`row_start`),
  KEY `row_end_2` (`row_end`,`x`),
  KEY `x` (`x`,`row_end`),
  KEY `row_end_3` (`row_end`),
  PERIOD FOR SYSTEM_TIME (`row_start`, `row_end`)
) ENGINE=MyISAM DEFAULT CHARSET=latin1 COLLATE=latin1_swedish_ci WITH SYSTEM VERSIONING
 PARTITION BY SYSTEM_TIME INTERVAL 1 HOUR STARTS TIMESTAMP'2000-01-01 00:00:00' AUTO
PARTITIONS 29
# STARTS doesn't change without FORCE
alter table t1 partition by system_time interval 1 hour
starts '2005-01-01 00:00:00' auto;
Warnings:
Warning	4164	`t1`: STARTS timestamp 2005-01-01 00:00:00 is later than query timestamp 2000-01-02 03:01:23, first history partition may exceed INTERVAL value
show create table t1;
Table	Create Table
t1	CREATE TABLE `t1` (
  `x` int(11) DEFAULT NULL,
  `row_start` timestamp(6) GENERATED ALWAYS AS ROW START INVISIBLE,
  `row_end` timestamp(6) GENERATED ALWAYS AS ROW END INVISIBLE,
  KEY `row_end` (`row_end`,`row_start`),
  KEY `row_start` (`row_start`),
  KEY `row_end_2` (`row_end`,`x`),
  KEY `x` (`x`,`row_end`),
  KEY `row_end_3` (`row_end`),
  PERIOD FOR SYSTEM_TIME (`row_start`, `row_end`)
) ENGINE=MyISAM DEFAULT CHARSET=latin1 COLLATE=latin1_swedish_ci WITH SYSTEM VERSIONING
 PARTITION BY SYSTEM_TIME INTERVAL 1 HOUR STARTS TIMESTAMP'2005-01-01 00:00:00' AUTO
PARTITIONS 29
# min_ts == max_ts case, partitions decrease
delete history from t1;
set timestamp= unix_timestamp('2000-01-01 00:00:00');
insert t1 values (77);
delete from t1;
alter table t1 partition by system_time interval 7 hour auto force;
show create table t1;
Table	Create Table
t1	CREATE TABLE `t1` (
  `x` int(11) DEFAULT NULL,
  `row_start` timestamp(6) GENERATED ALWAYS AS ROW START INVISIBLE,
  `row_end` timestamp(6) GENERATED ALWAYS AS ROW END INVISIBLE,
  KEY `row_end` (`row_end`,`row_start`),
  KEY `row_start` (`row_start`),
  KEY `row_end_2` (`row_end`,`x`),
  KEY `x` (`x`,`row_end`),
  KEY `row_end_3` (`row_end`),
  PERIOD FOR SYSTEM_TIME (`row_start`, `row_end`)
) ENGINE=MyISAM DEFAULT CHARSET=latin1 COLLATE=latin1_swedish_ci WITH SYSTEM VERSIONING
 PARTITION BY SYSTEM_TIME INTERVAL 7 HOUR STARTS TIMESTAMP'2000-01-01 00:00:00' AUTO
PARTITIONS 2
# Explicit partition list ignores AUTO FORCE
set timestamp= unix_timestamp('2000-01-03 00:00:00');
insert t1 values (88);
delete from t1;
alter table t1 partition by system_time interval 8 hour auto force;
show create table t1;
Table	Create Table
t1	CREATE TABLE `t1` (
  `x` int(11) DEFAULT NULL,
  `row_start` timestamp(6) GENERATED ALWAYS AS ROW START INVISIBLE,
  `row_end` timestamp(6) GENERATED ALWAYS AS ROW END INVISIBLE,
  KEY `row_end` (`row_end`,`row_start`),
  KEY `row_start` (`row_start`),
  KEY `row_end_2` (`row_end`,`x`),
  KEY `x` (`x`,`row_end`),
  KEY `row_end_3` (`row_end`),
  PERIOD FOR SYSTEM_TIME (`row_start`, `row_end`)
) ENGINE=MyISAM DEFAULT CHARSET=latin1 COLLATE=latin1_swedish_ci WITH SYSTEM VERSIONING
 PARTITION BY SYSTEM_TIME INTERVAL 8 HOUR STARTS TIMESTAMP'2000-01-01 00:00:00' AUTO
PARTITIONS 7
alter table t1 partition by system_time interval 8 hour auto (
partition p0 history,
partition p1 history,
partition pn current) force;
show create table t1;
Table	Create Table
t1	CREATE TABLE `t1` (
  `x` int(11) DEFAULT NULL,
  `row_start` timestamp(6) GENERATED ALWAYS AS ROW START INVISIBLE,
  `row_end` timestamp(6) GENERATED ALWAYS AS ROW END INVISIBLE,
  KEY `row_end` (`row_end`,`row_start`),
  KEY `row_start` (`row_start`),
  KEY `row_end_2` (`row_end`,`x`),
  KEY `x` (`x`,`row_end`),
  KEY `row_end_3` (`row_end`),
  PERIOD FOR SYSTEM_TIME (`row_start`, `row_end`)
) ENGINE=MyISAM DEFAULT CHARSET=latin1 COLLATE=latin1_swedish_ci WITH SYSTEM VERSIONING
 PARTITION BY SYSTEM_TIME INTERVAL 8 HOUR STARTS TIMESTAMP'2000-01-03 00:00:00' AUTO
(PARTITION `p0` HISTORY ENGINE = MyISAM,
 PARTITION `p1` HISTORY ENGINE = MyISAM,
 PARTITION `pn` CURRENT ENGINE = MyISAM)
# Switch system_time -> hash
alter table t1 partition by hash(x) partitions 3;
show create table t1;
Table	Create Table
t1	CREATE TABLE `t1` (
  `x` int(11) DEFAULT NULL,
  `row_start` timestamp(6) GENERATED ALWAYS AS ROW START INVISIBLE,
  `row_end` timestamp(6) GENERATED ALWAYS AS ROW END INVISIBLE,
  KEY `row_end` (`row_end`,`row_start`),
  KEY `row_start` (`row_start`),
  KEY `row_end_2` (`row_end`,`x`),
  KEY `x` (`x`,`row_end`),
  KEY `row_end_3` (`row_end`),
  PERIOD FOR SYSTEM_TIME (`row_start`, `row_end`)
) ENGINE=MyISAM DEFAULT CHARSET=latin1 COLLATE=latin1_swedish_ci WITH SYSTEM VERSIONING
 PARTITION BY HASH (`x`)
PARTITIONS 3
# Switch hash -> system_time
alter table t1 partition by system_time interval 9 hour
starts '2001-01-01 00:00:00' auto force;
Warnings:
Warning	4164	`t1`: STARTS timestamp 2001-01-01 00:00:00 is later than query timestamp 2000-01-03 00:00:00, first history partition may exceed INTERVAL value
Warning	4193	`t1`: STARTS timestamp 2001-01-01 00:00:00 is above earliest history date 2000-01-01 00:00:00 and was set to 2000-01-01 00:00:00
show create table t1;
Table	Create Table
t1	CREATE TABLE `t1` (
  `x` int(11) DEFAULT NULL,
  `row_start` timestamp(6) GENERATED ALWAYS AS ROW START INVISIBLE,
  `row_end` timestamp(6) GENERATED ALWAYS AS ROW END INVISIBLE,
  KEY `row_end` (`row_end`,`row_start`),
  KEY `row_start` (`row_start`),
  KEY `row_end_2` (`row_end`,`x`),
  KEY `x` (`x`,`row_end`),
  KEY `row_end_3` (`row_end`),
  PERIOD FOR SYSTEM_TIME (`row_start`, `row_end`)
) ENGINE=MyISAM DEFAULT CHARSET=latin1 COLLATE=latin1_swedish_ci WITH SYSTEM VERSIONING
 PARTITION BY SYSTEM_TIME INTERVAL 9 HOUR STARTS TIMESTAMP'2000-01-01 00:00:00' AUTO
PARTITIONS 7
# Slow scan warning
create or replace table t1 (x int,
row_start timestamp(6) as row start invisible,
row_end timestamp(6) as row end invisible,
period for system_time (row_start, row_end),
index (x, row_end, row_start),
index (row_start, row_end),
index (x, row_end)) with system versioning;
set timestamp= unix_timestamp('2000-01-01 00:00:00');
insert t1 values (77);
delete from t1;
set timestamp= unix_timestamp('2000-01-03 00:00:00');
insert t1 values (88);
delete from t1;
alter table t1 partition by system_time interval 10 hour auto;
Warnings:
Warning	4194	`t1`: ROW END index not found, using slow scan
show create table t1;
Table	Create Table
t1	CREATE TABLE `t1` (
  `x` int(11) DEFAULT NULL,
  `row_start` timestamp(6) GENERATED ALWAYS AS ROW START INVISIBLE,
  `row_end` timestamp(6) GENERATED ALWAYS AS ROW END INVISIBLE,
  KEY `x` (`x`,`row_end`,`row_start`),
  KEY `row_start` (`row_start`,`row_end`),
  KEY `x_2` (`x`,`row_end`),
  PERIOD FOR SYSTEM_TIME (`row_start`, `row_end`)
) ENGINE=MyISAM DEFAULT CHARSET=latin1 COLLATE=latin1_swedish_ci WITH SYSTEM VERSIONING
 PARTITION BY SYSTEM_TIME INTERVAL 10 HOUR STARTS TIMESTAMP'2000-01-01 00:00:00' AUTO
PARTITIONS 6
# TRX_ID versioning
create or replace table t1 (x int,
row_start bigint(20) unsigned as row start invisible,
row_end bigint(20) unsigned as row end invisible,
period for system_time (row_start, row_end),
index (row_end)) with system versioning engine innodb;
set timestamp= unix_timestamp('2000-01-01 00:00:00');
insert t1 values (77);
delete from t1;
set timestamp= unix_timestamp('2000-01-03 00:00:00');
insert t1 values (88);
delete from t1;
# Partitioning is not allowed for TRX_ID versioning
alter table t1 partition by system_time interval 11 hour auto;
ERROR HY000: `row_start` must be of type TIMESTAMP(6) for system-versioned table `t1`
drop table t1;
set debug_dbug= @old_dbug;
