#
# Checking FILE privileges
#
GRANT ALL PRIVILEGES ON *.* TO user@localhost;
REVOKE FILE ON *.* FROM user@localhost;
SELECT user();
user()
user@localhost
CREATE TABLE t1 (sec CHAR(10) NOT NULL FLAG=1, val CHAR(10) NOT NULL) ENGINE=CONNECT TABLE_TYPE=INI;
Warnings:
Warning	1105	No file name. Table will use t1.ini
INSERT INTO t1 VALUES ('sec1','val1');
SELECT * FROM t1;
sec	val
sec1	val1
UPDATE t1 SET val='val11';
SELECT * FROM t1;
sec	val
sec1	val11
DELETE FROM t1;
SELECT * FROM t1;
sec	val
INSERT INTO t1 VALUES('sec2','val2');
TRUNCATE TABLE t1;
SELECT * FROM t1;
sec	val
CREATE VIEW v1 AS SELECT * FROM t1;
SELECT * FROM v1;
sec	val
DROP VIEW v1;
DROP TABLE t1;
CREATE TABLE t1 (sec CHAR(10) NOT NULL FLAG=1, val CHAR(10) NOT NULL) ENGINE=CONNECT TABLE_TYPE=INI FILE_NAME='t1.EXT';
ERROR 28000: Access denied for user 'user'@'localhost' (using password: NO)
SELECT user();
user()
root@localhost
CREATE TABLE t1 (sec CHAR(10) NOT NULL FLAG=1, val CHAR(10) NOT NULL) ENGINE=CONNECT TABLE_TYPE=INI FILE_NAME='t1.EXT';
INSERT INTO t1 VALUES ('sec1','val1');
SELECT user();
user()
user@localhost
INSERT INTO t1 VALUES ('sec2','val2');
ERROR 28000: Access denied for user 'user'@'localhost' (using password: NO)
SELECT * FROM t1;
ERROR 28000: Access denied for user 'user'@'localhost' (using password: NO)
UPDATE t1 SET val='val11';
ERROR 28000: Access denied for user 'user'@'localhost' (using password: NO)
DELETE FROM t1;
ERROR 28000: Access denied for user 'user'@'localhost' (using password: NO)
TRUNCATE TABLE t1;
ERROR 28000: Access denied for user 'user'@'localhost' (using password: NO)
ALTER TABLE t1 READONLY=1;
ERROR 28000: Access denied for user 'user'@'localhost' (using password: NO)
DROP TABLE t1;
ERROR 28000: Access denied for user 'user'@'localhost' (using password: NO)
CREATE VIEW v1 AS SELECT * FROM t1;
ERROR 28000: Access denied for user 'user'@'localhost' (using password: NO)
# Testing a VIEW created with FILE privileges but accessed with no FILE
SELECT user();
user()
root@localhost
CREATE VIEW v1 AS SELECT * FROM t1;
SELECT user();
user()
user@localhost
SELECT * FROM v1;
ERROR 28000: Access denied for user 'user'@'localhost' (using password: NO)
INSERT INTO v1 VALUES ('sec3','val3');
ERROR 28000: Access denied for user 'user'@'localhost' (using password: NO)
UPDATE v1 SET val='val11';
ERROR 28000: Access denied for user 'user'@'localhost' (using password: NO)
DELETE FROM v1;
ERROR 28000: Access denied for user 'user'@'localhost' (using password: NO)
DROP VIEW v1;
DROP TABLE t1;
DROP USER user@localhost;
#
# Checking FILE privileges: done
#
