#
# Cross-engine RYOW: the same external table referenced more than once.
#
# The external table registry is keyed by table name, so two references
# to one table would collapse onto a single TABLE/handler and produce two
# concurrent scans over one cursor.  Such queries must not be pushed
# down; the server executes them itself and the results must still show
# the uncommitted writes of the current transaction.
#
DROP DATABASE IF EXISTS cross_engine_ryow_dup;
CREATE DATABASE cross_engine_ryow_dup CHARACTER SET utf8mb4;
USE cross_engine_ryow_dup;
SET @old_max_threads= @@global.duckdb_max_threads;
SET GLOBAL duckdb_max_threads= 4;
CREATE TABLE t_duck (id INT PRIMARY KEY, val VARCHAR(50)) ENGINE=DuckDB;
CREATE TABLE t_inno (id INT PRIMARY KEY, score INT) ENGINE=InnoDB;
INSERT INTO t_duck VALUES (1,'alpha'),(2,'beta'),(3,'gamma');
INSERT INTO t_inno VALUES (1,10),(2,20),(3,30);
SET SESSION duckdb_cross_engine_ryow=1;

# (1) Self-join of the external table under two aliases

BEGIN;
UPDATE t_inno SET score=999 WHERE id=2;
SELECT d.id, a.score AS a_score, b.score AS b_score
FROM t_duck d
JOIN t_inno a ON d.id = a.id
JOIN t_inno b ON a.id = b.id;
id	a_score	b_score
1	10	10
2	999	999
3	30	30
ROLLBACK;

# (2) The external table used both in the join and in a subquery

BEGIN;
UPDATE t_inno SET score=999 WHERE id=3;
SELECT d.id, i.score
FROM t_duck d JOIN t_inno i ON d.id = i.id
WHERE i.score = (SELECT MAX(score) FROM t_inno);
id	score
3	999
ROLLBACK;

# (3) The external table twice in a UNION

BEGIN;
UPDATE t_inno SET score=999 WHERE id=1;
SELECT d.id, i.score FROM t_duck d JOIN t_inno i ON d.id = i.id WHERE i.id = 1
UNION ALL
SELECT d.id, i.score FROM t_duck d JOIN t_inno i ON d.id = i.id WHERE i.id = 2;
id	score
1	999
2	20
ROLLBACK;

# (4) A single reference is still pushed down and still sees own writes

BEGIN;
UPDATE t_inno SET score=555 WHERE id=2;
SELECT d.id, i.score FROM t_duck d JOIN t_inno i ON d.id = i.id;
id	score
1	10
2	555
3	30
ROLLBACK;

# (5) Committed state is intact

SELECT d.id, i.score FROM t_duck d JOIN t_inno i ON d.id = i.id;
id	score
1	10
2	20
3	30

# Cleanup

SET SESSION duckdb_cross_engine_ryow=DEFAULT;
SET GLOBAL duckdb_max_threads= @old_max_threads;
DROP TABLE t_duck;
DROP TABLE t_inno;
DROP DATABASE cross_engine_ryow_dup;
