CREATE DATABASE db_ident_esc;
USE db_ident_esc;
#
# 1) Column names containing a double quote (CREATE/INSERT/SELECT)
#
CREATE TABLE t1 (`a"b` INT PRIMARY KEY, `c"d` INT) ENGINE=DuckDB;
INSERT INTO t1 VALUES (1, 10), (2, 20);
SELECT * FROM t1 ORDER BY `a"b`;
a"b	c"d
1	10
2	20
SELECT /* user's ' column */ * FROM t1 ORDER BY `a"b`;
a"b	c"d
1	10
2	20
SELECT * -- user's ' columns
FROM t1 ORDER BY `a"b`;
a"b	c"d
1	10
2	20
#
# 2) UPDATE/DELETE route the quoted names through the WHERE/SET builders
#
UPDATE t1 SET `c"d` = 99 WHERE `a"b` = 1;
SELECT * FROM t1 ORDER BY `a"b`;
a"b	c"d
1	99
2	20
DELETE FROM t1 WHERE `a"b` = 2;
SELECT * FROM t1 ORDER BY `a"b`;
a"b	c"d
1	99
#
# 3) ALTER RENAME/ADD/DROP COLUMN with quoted names
#
ALTER TABLE t1 RENAME COLUMN `c"d` TO `e""f`;
SHOW CREATE TABLE t1;
Table	Create Table
t1	CREATE TABLE `t1` (
  `a"b` int(11) NOT NULL,
  `e""f` int(11) DEFAULT NULL,
  PRIMARY KEY (`a"b`)
) ENGINE=DUCKDB DEFAULT CHARSET=utf8mb4 COLLATE=utf8mb4_uca1400_ai_ci
SELECT `e""f` FROM t1;
e""f
99
ALTER TABLE t1 ADD COLUMN `g"h` INT;
SELECT * FROM t1;
a"b	e""f	g"h
1	99	NULL
ALTER TABLE t1 DROP COLUMN `g"h`;
#
# 4) Table name containing a double quote
#
CREATE TABLE `x"y` (`id` INT PRIMARY KEY) ENGINE=DuckDB;
INSERT INTO `x"y` VALUES (1), (2);
SELECT * FROM `x"y` ORDER BY `id`;
id
1
2
TRUNCATE TABLE `x"y`;
SELECT COUNT(*) FROM `x"y`;
COUNT(*)
0
DROP TABLE `x"y`;
#
# 5) Backslash quote-boundary mismatches disable raw SQL forwarding
#
CREATE TABLE lexical_guard (id INT PRIMARY KEY, v VARCHAR(100)) ENGINE=DuckDB;
INSERT INTO lexical_guard VALUES (1, 'safe');
SELECT COUNT(*) FROM lexical_guard
WHERE v = 'missing\' OR true -- ';
COUNT(*)
0
UPDATE lexical_guard SET v = 'changed\' WHERE true -- ' WHERE id = 999;
ERROR HY000: Got error 168 'Unsafe MariaDB backslash quote escape in forwarded SQL' from DuckDB
SELECT * FROM lexical_guard;
id	v
1	safe
DELETE FROM lexical_guard WHERE v = 'missing\' OR true -- ';
ERROR HY000: Got error 168 'Unsafe MariaDB backslash quote escape in forwarded SQL' from DuckDB
SELECT COUNT(*) FROM lexical_guard;
COUNT(*)
1
UPDATE lexical_guard SET v = 'safe\'';
ERROR HY000: Got error 168 'Unsafe MariaDB backslash quote escape in forwarded SQL' from DuckDB
SELECT * FROM lexical_guard;
id	v
1	safe
UPDATE /* user's \' comment */ lexical_guard SET v = 'unchanged' WHERE id = 999;
UPDATE lexical_guard SET v = 'unchanged\n' WHERE id = 999;
UPDATE lexical_guard SET v = "changed\" WHERE true -- " WHERE id = 999;
ERROR HY000: Got error 168 'Unsafe MariaDB backslash quote escape in forwarded SQL' from DuckDB
SELECT * FROM lexical_guard;
id	v
1	safe
DROP TABLE lexical_guard;
#
# 6) Cleanup
#
DROP TABLE t1;
DROP DATABASE db_ident_esc;
