#
# 1) PREPARE
#
CREATE DATABASE `my-db`;
USE `my-db`;
CREATE TABLE `my-table` (
`id` int(11) NOT NULL,
`name` varchar(255) NOT NULL,
PRIMARY KEY (`id`)
) ENGINE = InnoDB;
INSERT INTO `my-table` (`id`, `name`) VALUES (1, 'John'), (2, 'Jane'), (3, 'Jim');
#
# 2) ALTER TO DUCKDB
#
ALTER TABLE `my-table` ENGINE = DuckDB;
include/assert.inc [CHECKSUM is the same]
ALTER TABLE `my-table` RENAME TO `my-table-renamed`;
RENAME TABLE `my-table-renamed` TO `my-table`;
ALTER TABLE `my-table` ADD COLUMN `col1` INT;
ALTER TABLE `my-table` ADD COLUMN `col2` INT, ALGORITHM = COPY;
SELECT COUNT(*) FROM `my-table`;
COUNT(*)
3
INSERT INTO `my-table` (`id`, `name`) VALUES (4, 'Joe');
UPDATE `my-table` SET `name` = 'Jack' WHERE `id` = 4;
DELETE FROM `my-table` WHERE `id` = 4;
SELECT run_in_duckdb("SELECT table_schema, table_name FROM information_schema.tables WHERE table_schema = 'my-db'");
run_in_duckdb("SELECT table_schema, table_name FROM information_schema.tables WHERE table_schema = 'my-db'")
table_schema	table_name	
VARCHAR	VARCHAR	
[ Rows: 1]
my-db	my-table


SELECT run_in_duckdb("DESC `my-db`.`my-table`");
run_in_duckdb("DESC `my-db`.`my-table`")
column_name	column_type	null	key	default	extra	
VARCHAR	VARCHAR	VARCHAR	VARCHAR	VARCHAR	VARCHAR	
[ Rows: 4]
id	INTEGER	NO	NULL	NULL	NULL
name	VARCHAR	NO	NULL	NULL	NULL
col1	INTEGER	YES	NULL	NULL	NULL
col2	INTEGER	YES	NULL	NULL	NULL


#
# 3) ALTER TO INNODB
#
ALTER TABLE `my-table` ENGINE = InnoDB;
SELECT run_in_duckdb("SELECT COUNT(*) FROM information_schema.tables WHERE table_schema = 'my-db'");
run_in_duckdb("SELECT COUNT(*) FROM information_schema.tables WHERE table_schema = 'my-db'")
count_star()	
BIGINT	
[ Rows: 1]
0


include/assert.inc [CHECKSUM is the same]
#
# 4) CLEANUP
#
DROP DATABASE `my-db`;
SELECT run_in_duckdb("SELECT COUNT(*) FROM information_schema.schemata WHERE schema_name = 'my-db'");
run_in_duckdb("SELECT COUNT(*) FROM information_schema.schemata WHERE schema_name = 'my-db'")
count_star()	
BIGINT	
[ Rows: 1]
0


