include/master-slave.inc
[connection master]
# MIXED: UUID()/NOW() switch the statements to row events
connection master;
CREATE DATABASE mdev_40957_rpl CHARACTER SET utf8mb4;
USE mdev_40957_rpl;
SELECT @@binlog_format;
@@binlog_format
MIXED
CREATE TABLE invoice (
id UUID DEFAULT UUID() PRIMARY KEY,
product VARCHAR(64),
amount DECIMAL(12,2),
sold_at TIMESTAMP
) ENGINE=DuckDB DEFAULT CHARSET utf8mb4;
INSERT INTO invoice (product, amount, sold_at) VALUES
('MariaDB mug', 12.00, NOW()),
('DuckDB sticker', 2.50, NOW()),
('Sea lion plush', 25.00, NOW()),
('DuckDB sticker', 2.50, NOW());
connection slave;
USE mdev_40957_rpl;
SELECT COUNT(*) FROM invoice;
COUNT(*)
4
connection master;
DELETE FROM invoice;
SELECT COUNT(*) FROM invoice;
COUNT(*)
0
connection slave;
SELECT COUNT(*) FROM invoice;
COUNT(*)
0
# ROW: replicated UPDATE (including a PK change) and DELETE
connection master;
SET SESSION binlog_format=ROW;
CREATE TABLE t_upd (
id INT PRIMARY KEY,
v VARCHAR(16),
untouched VARCHAR(16)
) ENGINE=DuckDB;
INSERT INTO t_upd VALUES
(1, 'one', 'keep-1'),
(2, 'two', 'keep-2'),
(3, 'three', 'keep-3'),
(4, 'four', 'keep-4'),
(6, 'six', 'keep-6'),
(7, 'seven', 'keep-7'),
(8, 'eight', 'keep-8');
UPDATE t_upd SET v = 'TWO' WHERE id = 2;
UPDATE t_upd SET id = 30, v = 'moved' WHERE id = 3;
DELETE FROM t_upd WHERE id = 1;
UPDATE t_upd FORCE INDEX(PRIMARY) SET v = 'FOUR' WHERE id = 4;
UPDATE t_upd SET v = 'SIX' WHERE v = 'six';
UPDATE t_upd SET id = 70, v = 'moved-non-pk' WHERE v = 'seven';
DELETE FROM t_upd WHERE v = 'eight';
SELECT * FROM t_upd ORDER BY id;
id	v	untouched
2	TWO	keep-2
4	FOUR	keep-4
6	SIX	keep-6
30	moved	keep-3
70	moved-non-pk	keep-7
connection slave;
SELECT * FROM t_upd ORDER BY id;
id	v	untouched
2	TWO	keep-2
4	FOUR	keep-4
6	SIX	keep-6
30	moved	keep-3
70	moved-non-pk	keep-7
connection master;
DELETE FROM t_upd;
connection slave;
SELECT COUNT(*) FROM t_upd;
COUNT(*)
0
# MINIMAL row image: replicated UPDATE preserves unchanged columns
connection master;
SET GLOBAL duckdb_dml_in_batch=OFF;
SET SESSION binlog_row_image=MINIMAL;
INSERT INTO t_upd VALUES
(1, 'one', 'must-survive'),
(2, 'other', 'must-not-leak');
UPDATE t_upd SET v = 'ONE' WHERE v = 'one';
connection slave;
SELECT * FROM t_upd WHERE id = 1;
id	v	untouched
1	ONE	must-survive
connection master;
UPDATE t_upd SET id = 20 WHERE v = 'other';
connection slave;
SELECT * FROM t_upd ORDER BY id;
id	v	untouched
1	ONE	must-survive
20	other	must-not-leak
UPDATE t_upd SET v = 'corrupt', untouched = 'corrupt' WHERE v = 'other';
SELECT * FROM t_upd ORDER BY id;
id	v	untouched
1	ONE	must-survive
20	corrupt	corrupt
include/stop_slave.inc
CHANGE MASTER TO MASTER_LOG_FILE='REPLAY_FILE', MASTER_LOG_POS=REPLAY_POS, MASTER_USE_GTID=NO;
include/start_slave.inc
connection master;
connection slave;
SELECT * FROM t_upd ORDER BY id;
id	v	untouched
1	ONE	must-survive
20	other	must-not-leak
connection master;
SET GLOBAL duckdb_dml_in_batch=ON;
SET SESSION binlog_row_image=FULL;
SET SESSION binlog_format=MIXED;
DROP DATABASE mdev_40957_rpl;
connection slave;
include/rpl_end.inc
