SET @start_value= @@global.max_sort_length;
** creating tables **
CREATE TABLE t (id INT AUTO_INCREMENT PRIMARY KEY, c TEXT) CHARSET=latin1;
CREATE TABLE t1 (id INT AUTO_INCREMENT PRIMARY KEY, c BLOB) CHARSET=latin1;
CREATE TABLE t2 (id INT AUTO_INCREMENT PRIMARY KEY, c TEXT) CHARSET=latin1;
'#--------------------FN_DYNVARS_098_01-------------------------#'
connect  test_con1,localhost,root,,;
** Setting value to 70 and inserting data **
SET @@global.max_sort_length = 70;
SELECT @@global.max_sort_length;
@@global.max_sort_length
70
INSERT INTO t set c = repeat('x',69);
INSERT INTO t set c = concat(repeat('x',68),'r','x');
INSERT INTO t set c = concat(repeat('x',68),'s','y');
INSERT INTO t set c = concat(repeat('x',68),'g','w');
SELECT c from t ORDER BY c, id;
c
xxxxxxxxxxxxxxxxxxxxxxxxxxxxxxxxxxxxxxxxxxxxxxxxxxxxxxxxxxxxxxxxxxxxgw
xxxxxxxxxxxxxxxxxxxxxxxxxxxxxxxxxxxxxxxxxxxxxxxxxxxxxxxxxxxxxxxxxxxxrx
xxxxxxxxxxxxxxxxxxxxxxxxxxxxxxxxxxxxxxxxxxxxxxxxxxxxxxxxxxxxxxxxxxxxsy
xxxxxxxxxxxxxxxxxxxxxxxxxxxxxxxxxxxxxxxxxxxxxxxxxxxxxxxxxxxxxxxxxxxxx
** Results should be sorted **
SET @@session.max_sort_length = 69;
SELECT @@session.max_sort_length;
@@session.max_sort_length
69
INSERT INTO t set c = repeat('x',69);
INSERT INTO t set c = concat(repeat('x',68),'r','x');
INSERT INTO t set c = concat(repeat('x',68),'s','y');
INSERT INTO t set c = concat(repeat('x',68),'g','w');
SELECT c from t ORDER BY c, id;
c
xxxxxxxxxxxxxxxxxxxxxxxxxxxxxxxxxxxxxxxxxxxxxxxxxxxxxxxxxxxxxxxxxxxxgw
xxxxxxxxxxxxxxxxxxxxxxxxxxxxxxxxxxxxxxxxxxxxxxxxxxxxxxxxxxxxxxxxxxxxgw
xxxxxxxxxxxxxxxxxxxxxxxxxxxxxxxxxxxxxxxxxxxxxxxxxxxxxxxxxxxxxxxxxxxxrx
xxxxxxxxxxxxxxxxxxxxxxxxxxxxxxxxxxxxxxxxxxxxxxxxxxxxxxxxxxxxxxxxxxxxrx
xxxxxxxxxxxxxxxxxxxxxxxxxxxxxxxxxxxxxxxxxxxxxxxxxxxxxxxxxxxxxxxxxxxxsy
xxxxxxxxxxxxxxxxxxxxxxxxxxxxxxxxxxxxxxxxxxxxxxxxxxxxxxxxxxxxxxxxxxxxsy
xxxxxxxxxxxxxxxxxxxxxxxxxxxxxxxxxxxxxxxxxxxxxxxxxxxxxxxxxxxxxxxxxxxxx
xxxxxxxxxxxxxxxxxxxxxxxxxxxxxxxxxxxxxxxxxxxxxxxxxxxxxxxxxxxxxxxxxxxxx
Warnings:
Warning	4202	6 values were longer than max_sort_length. Sorting used only the first 69 bytes
** Results should be sorted **
'#--------------------FN_DYNVARS_098_02-------------------------#'
connect  test_con2,localhost,root,,;
SET @@global.max_sort_length = 70;
SELECT @@global.max_sort_length;
@@global.max_sort_length
70
INSERT INTO t set c = repeat('x',69);
INSERT INTO t set c = concat(repeat('x',68),'r','x');
INSERT INTO t set c = concat(repeat('x',68),'s','y');
INSERT INTO t set c = concat(repeat('x',68),'g','w');
SELECT c from t ORDER BY c, id;
c
xxxxxxxxxxxxxxxxxxxxxxxxxxxxxxxxxxxxxxxxxxxxxxxxxxxxxxxxxxxxxxxxxxxxgw
xxxxxxxxxxxxxxxxxxxxxxxxxxxxxxxxxxxxxxxxxxxxxxxxxxxxxxxxxxxxxxxxxxxxgw
xxxxxxxxxxxxxxxxxxxxxxxxxxxxxxxxxxxxxxxxxxxxxxxxxxxxxxxxxxxxxxxxxxxxgw
xxxxxxxxxxxxxxxxxxxxxxxxxxxxxxxxxxxxxxxxxxxxxxxxxxxxxxxxxxxxxxxxxxxxrx
xxxxxxxxxxxxxxxxxxxxxxxxxxxxxxxxxxxxxxxxxxxxxxxxxxxxxxxxxxxxxxxxxxxxrx
xxxxxxxxxxxxxxxxxxxxxxxxxxxxxxxxxxxxxxxxxxxxxxxxxxxxxxxxxxxxxxxxxxxxrx
xxxxxxxxxxxxxxxxxxxxxxxxxxxxxxxxxxxxxxxxxxxxxxxxxxxxxxxxxxxxxxxxxxxxsy
xxxxxxxxxxxxxxxxxxxxxxxxxxxxxxxxxxxxxxxxxxxxxxxxxxxxxxxxxxxxxxxxxxxxsy
xxxxxxxxxxxxxxxxxxxxxxxxxxxxxxxxxxxxxxxxxxxxxxxxxxxxxxxxxxxxxxxxxxxxsy
xxxxxxxxxxxxxxxxxxxxxxxxxxxxxxxxxxxxxxxxxxxxxxxxxxxxxxxxxxxxxxxxxxxxx
xxxxxxxxxxxxxxxxxxxxxxxxxxxxxxxxxxxxxxxxxxxxxxxxxxxxxxxxxxxxxxxxxxxxx
xxxxxxxxxxxxxxxxxxxxxxxxxxxxxxxxxxxxxxxxxxxxxxxxxxxxxxxxxxxxxxxxxxxxx
** Results should be sorted **
SET @@session.max_sort_length = 64;
SELECT @@session.max_sort_length;
@@session.max_sort_length
64
INSERT INTO t set c = repeat('x',69);
INSERT INTO t set c = concat(repeat('x',68),'r','x');
INSERT INTO t set c = concat(repeat('x',68),'s','y');
INSERT INTO t set c = concat(repeat('x',68),'g','w');
SELECT c from t ORDER BY c, id;
c
xxxxxxxxxxxxxxxxxxxxxxxxxxxxxxxxxxxxxxxxxxxxxxxxxxxxxxxxxxxxxxxxxxxxx
xxxxxxxxxxxxxxxxxxxxxxxxxxxxxxxxxxxxxxxxxxxxxxxxxxxxxxxxxxxxxxxxxxxxrx
xxxxxxxxxxxxxxxxxxxxxxxxxxxxxxxxxxxxxxxxxxxxxxxxxxxxxxxxxxxxxxxxxxxxsy
xxxxxxxxxxxxxxxxxxxxxxxxxxxxxxxxxxxxxxxxxxxxxxxxxxxxxxxxxxxxxxxxxxxxgw
xxxxxxxxxxxxxxxxxxxxxxxxxxxxxxxxxxxxxxxxxxxxxxxxxxxxxxxxxxxxxxxxxxxxx
xxxxxxxxxxxxxxxxxxxxxxxxxxxxxxxxxxxxxxxxxxxxxxxxxxxxxxxxxxxxxxxxxxxxrx
xxxxxxxxxxxxxxxxxxxxxxxxxxxxxxxxxxxxxxxxxxxxxxxxxxxxxxxxxxxxxxxxxxxxsy
xxxxxxxxxxxxxxxxxxxxxxxxxxxxxxxxxxxxxxxxxxxxxxxxxxxxxxxxxxxxxxxxxxxxgw
xxxxxxxxxxxxxxxxxxxxxxxxxxxxxxxxxxxxxxxxxxxxxxxxxxxxxxxxxxxxxxxxxxxxx
xxxxxxxxxxxxxxxxxxxxxxxxxxxxxxxxxxxxxxxxxxxxxxxxxxxxxxxxxxxxxxxxxxxxrx
xxxxxxxxxxxxxxxxxxxxxxxxxxxxxxxxxxxxxxxxxxxxxxxxxxxxxxxxxxxxxxxxxxxxsy
xxxxxxxxxxxxxxxxxxxxxxxxxxxxxxxxxxxxxxxxxxxxxxxxxxxxxxxxxxxxxxxxxxxxgw
xxxxxxxxxxxxxxxxxxxxxxxxxxxxxxxxxxxxxxxxxxxxxxxxxxxxxxxxxxxxxxxxxxxxx
xxxxxxxxxxxxxxxxxxxxxxxxxxxxxxxxxxxxxxxxxxxxxxxxxxxxxxxxxxxxxxxxxxxxrx
xxxxxxxxxxxxxxxxxxxxxxxxxxxxxxxxxxxxxxxxxxxxxxxxxxxxxxxxxxxxxxxxxxxxsy
xxxxxxxxxxxxxxxxxxxxxxxxxxxxxxxxxxxxxxxxxxxxxxxxxxxxxxxxxxxxxxxxxxxxgw
Warnings:
Warning	4202	16 values were longer than max_sort_length. Sorting used only the first 64 bytes
** Results should not be sorted **
'#--------------------FN_DYNVARS_098_03-------------------------#'
SET max_sort_length=64;
INSERT INTO t set c = repeat('x',69);
INSERT INTO t set c = concat(repeat('x',68),'r','x');
INSERT INTO t set c = concat(repeat('x',68),'s','y');
INSERT INTO t set c = concat(repeat('x',68),'g','w');
SELECT c from t ORDER BY c, id;
c
xxxxxxxxxxxxxxxxxxxxxxxxxxxxxxxxxxxxxxxxxxxxxxxxxxxxxxxxxxxxxxxxxxxxx
xxxxxxxxxxxxxxxxxxxxxxxxxxxxxxxxxxxxxxxxxxxxxxxxxxxxxxxxxxxxxxxxxxxxrx
xxxxxxxxxxxxxxxxxxxxxxxxxxxxxxxxxxxxxxxxxxxxxxxxxxxxxxxxxxxxxxxxxxxxsy
xxxxxxxxxxxxxxxxxxxxxxxxxxxxxxxxxxxxxxxxxxxxxxxxxxxxxxxxxxxxxxxxxxxxgw
xxxxxxxxxxxxxxxxxxxxxxxxxxxxxxxxxxxxxxxxxxxxxxxxxxxxxxxxxxxxxxxxxxxxx
xxxxxxxxxxxxxxxxxxxxxxxxxxxxxxxxxxxxxxxxxxxxxxxxxxxxxxxxxxxxxxxxxxxxrx
xxxxxxxxxxxxxxxxxxxxxxxxxxxxxxxxxxxxxxxxxxxxxxxxxxxxxxxxxxxxxxxxxxxxsy
xxxxxxxxxxxxxxxxxxxxxxxxxxxxxxxxxxxxxxxxxxxxxxxxxxxxxxxxxxxxxxxxxxxxgw
xxxxxxxxxxxxxxxxxxxxxxxxxxxxxxxxxxxxxxxxxxxxxxxxxxxxxxxxxxxxxxxxxxxxx
xxxxxxxxxxxxxxxxxxxxxxxxxxxxxxxxxxxxxxxxxxxxxxxxxxxxxxxxxxxxxxxxxxxxrx
xxxxxxxxxxxxxxxxxxxxxxxxxxxxxxxxxxxxxxxxxxxxxxxxxxxxxxxxxxxxxxxxxxxxsy
xxxxxxxxxxxxxxxxxxxxxxxxxxxxxxxxxxxxxxxxxxxxxxxxxxxxxxxxxxxxxxxxxxxxgw
xxxxxxxxxxxxxxxxxxxxxxxxxxxxxxxxxxxxxxxxxxxxxxxxxxxxxxxxxxxxxxxxxxxxx
xxxxxxxxxxxxxxxxxxxxxxxxxxxxxxxxxxxxxxxxxxxxxxxxxxxxxxxxxxxxxxxxxxxxrx
xxxxxxxxxxxxxxxxxxxxxxxxxxxxxxxxxxxxxxxxxxxxxxxxxxxxxxxxxxxxxxxxxxxxsy
xxxxxxxxxxxxxxxxxxxxxxxxxxxxxxxxxxxxxxxxxxxxxxxxxxxxxxxxxxxxxxxxxxxxgw
xxxxxxxxxxxxxxxxxxxxxxxxxxxxxxxxxxxxxxxxxxxxxxxxxxxxxxxxxxxxxxxxxxxxx
xxxxxxxxxxxxxxxxxxxxxxxxxxxxxxxxxxxxxxxxxxxxxxxxxxxxxxxxxxxxxxxxxxxxrx
xxxxxxxxxxxxxxxxxxxxxxxxxxxxxxxxxxxxxxxxxxxxxxxxxxxxxxxxxxxxxxxxxxxxsy
xxxxxxxxxxxxxxxxxxxxxxxxxxxxxxxxxxxxxxxxxxxxxxxxxxxxxxxxxxxxxxxxxxxxgw
Warnings:
Warning	4202	20 values were longer than max_sort_length. Sorting used only the first 64 bytes
** Results should not be sorted **
RESET QUERY CACHE;
'#--------------------FN_DYNVARS_098_04-------------------------#'
SET max_sort_length=69;
SELECT c from t ORDER BY c, id;
c
xxxxxxxxxxxxxxxxxxxxxxxxxxxxxxxxxxxxxxxxxxxxxxxxxxxxxxxxxxxxxxxxxxxxgw
xxxxxxxxxxxxxxxxxxxxxxxxxxxxxxxxxxxxxxxxxxxxxxxxxxxxxxxxxxxxxxxxxxxxgw
xxxxxxxxxxxxxxxxxxxxxxxxxxxxxxxxxxxxxxxxxxxxxxxxxxxxxxxxxxxxxxxxxxxxgw
xxxxxxxxxxxxxxxxxxxxxxxxxxxxxxxxxxxxxxxxxxxxxxxxxxxxxxxxxxxxxxxxxxxxgw
xxxxxxxxxxxxxxxxxxxxxxxxxxxxxxxxxxxxxxxxxxxxxxxxxxxxxxxxxxxxxxxxxxxxgw
xxxxxxxxxxxxxxxxxxxxxxxxxxxxxxxxxxxxxxxxxxxxxxxxxxxxxxxxxxxxxxxxxxxxrx
xxxxxxxxxxxxxxxxxxxxxxxxxxxxxxxxxxxxxxxxxxxxxxxxxxxxxxxxxxxxxxxxxxxxrx
xxxxxxxxxxxxxxxxxxxxxxxxxxxxxxxxxxxxxxxxxxxxxxxxxxxxxxxxxxxxxxxxxxxxrx
xxxxxxxxxxxxxxxxxxxxxxxxxxxxxxxxxxxxxxxxxxxxxxxxxxxxxxxxxxxxxxxxxxxxrx
xxxxxxxxxxxxxxxxxxxxxxxxxxxxxxxxxxxxxxxxxxxxxxxxxxxxxxxxxxxxxxxxxxxxrx
xxxxxxxxxxxxxxxxxxxxxxxxxxxxxxxxxxxxxxxxxxxxxxxxxxxxxxxxxxxxxxxxxxxxsy
xxxxxxxxxxxxxxxxxxxxxxxxxxxxxxxxxxxxxxxxxxxxxxxxxxxxxxxxxxxxxxxxxxxxsy
xxxxxxxxxxxxxxxxxxxxxxxxxxxxxxxxxxxxxxxxxxxxxxxxxxxxxxxxxxxxxxxxxxxxsy
xxxxxxxxxxxxxxxxxxxxxxxxxxxxxxxxxxxxxxxxxxxxxxxxxxxxxxxxxxxxxxxxxxxxsy
xxxxxxxxxxxxxxxxxxxxxxxxxxxxxxxxxxxxxxxxxxxxxxxxxxxxxxxxxxxxxxxxxxxxsy
xxxxxxxxxxxxxxxxxxxxxxxxxxxxxxxxxxxxxxxxxxxxxxxxxxxxxxxxxxxxxxxxxxxxx
xxxxxxxxxxxxxxxxxxxxxxxxxxxxxxxxxxxxxxxxxxxxxxxxxxxxxxxxxxxxxxxxxxxxx
xxxxxxxxxxxxxxxxxxxxxxxxxxxxxxxxxxxxxxxxxxxxxxxxxxxxxxxxxxxxxxxxxxxxx
xxxxxxxxxxxxxxxxxxxxxxxxxxxxxxxxxxxxxxxxxxxxxxxxxxxxxxxxxxxxxxxxxxxxx
xxxxxxxxxxxxxxxxxxxxxxxxxxxxxxxxxxxxxxxxxxxxxxxxxxxxxxxxxxxxxxxxxxxxx
Warnings:
Warning	4202	15 values were longer than max_sort_length. Sorting used only the first 69 bytes
** Results should be sorted **
'#--------------------FN_DYNVARS_098_05-------------------------#'
SET max_sort_length=70;
SELECT c from t ORDER BY c, id;
c
xxxxxxxxxxxxxxxxxxxxxxxxxxxxxxxxxxxxxxxxxxxxxxxxxxxxxxxxxxxxxxxxxxxxgw
xxxxxxxxxxxxxxxxxxxxxxxxxxxxxxxxxxxxxxxxxxxxxxxxxxxxxxxxxxxxxxxxxxxxgw
xxxxxxxxxxxxxxxxxxxxxxxxxxxxxxxxxxxxxxxxxxxxxxxxxxxxxxxxxxxxxxxxxxxxgw
xxxxxxxxxxxxxxxxxxxxxxxxxxxxxxxxxxxxxxxxxxxxxxxxxxxxxxxxxxxxxxxxxxxxgw
xxxxxxxxxxxxxxxxxxxxxxxxxxxxxxxxxxxxxxxxxxxxxxxxxxxxxxxxxxxxxxxxxxxxgw
xxxxxxxxxxxxxxxxxxxxxxxxxxxxxxxxxxxxxxxxxxxxxxxxxxxxxxxxxxxxxxxxxxxxrx
xxxxxxxxxxxxxxxxxxxxxxxxxxxxxxxxxxxxxxxxxxxxxxxxxxxxxxxxxxxxxxxxxxxxrx
xxxxxxxxxxxxxxxxxxxxxxxxxxxxxxxxxxxxxxxxxxxxxxxxxxxxxxxxxxxxxxxxxxxxrx
xxxxxxxxxxxxxxxxxxxxxxxxxxxxxxxxxxxxxxxxxxxxxxxxxxxxxxxxxxxxxxxxxxxxrx
xxxxxxxxxxxxxxxxxxxxxxxxxxxxxxxxxxxxxxxxxxxxxxxxxxxxxxxxxxxxxxxxxxxxrx
xxxxxxxxxxxxxxxxxxxxxxxxxxxxxxxxxxxxxxxxxxxxxxxxxxxxxxxxxxxxxxxxxxxxsy
xxxxxxxxxxxxxxxxxxxxxxxxxxxxxxxxxxxxxxxxxxxxxxxxxxxxxxxxxxxxxxxxxxxxsy
xxxxxxxxxxxxxxxxxxxxxxxxxxxxxxxxxxxxxxxxxxxxxxxxxxxxxxxxxxxxxxxxxxxxsy
xxxxxxxxxxxxxxxxxxxxxxxxxxxxxxxxxxxxxxxxxxxxxxxxxxxxxxxxxxxxxxxxxxxxsy
xxxxxxxxxxxxxxxxxxxxxxxxxxxxxxxxxxxxxxxxxxxxxxxxxxxxxxxxxxxxxxxxxxxxsy
xxxxxxxxxxxxxxxxxxxxxxxxxxxxxxxxxxxxxxxxxxxxxxxxxxxxxxxxxxxxxxxxxxxxx
xxxxxxxxxxxxxxxxxxxxxxxxxxxxxxxxxxxxxxxxxxxxxxxxxxxxxxxxxxxxxxxxxxxxx
xxxxxxxxxxxxxxxxxxxxxxxxxxxxxxxxxxxxxxxxxxxxxxxxxxxxxxxxxxxxxxxxxxxxx
xxxxxxxxxxxxxxxxxxxxxxxxxxxxxxxxxxxxxxxxxxxxxxxxxxxxxxxxxxxxxxxxxxxxx
xxxxxxxxxxxxxxxxxxxxxxxxxxxxxxxxxxxxxxxxxxxxxxxxxxxxxxxxxxxxxxxxxxxxx
** Results should be sorted **
'#--------------------FN_DYNVARS_098_06-------------------------#'
SET max_sort_length=default;
SELECT @@max_sort_length;
@@max_sort_length
70
SELECT c from t ORDER BY c, id;
c
xxxxxxxxxxxxxxxxxxxxxxxxxxxxxxxxxxxxxxxxxxxxxxxxxxxxxxxxxxxxxxxxxxxxgw
xxxxxxxxxxxxxxxxxxxxxxxxxxxxxxxxxxxxxxxxxxxxxxxxxxxxxxxxxxxxxxxxxxxxgw
xxxxxxxxxxxxxxxxxxxxxxxxxxxxxxxxxxxxxxxxxxxxxxxxxxxxxxxxxxxxxxxxxxxxgw
xxxxxxxxxxxxxxxxxxxxxxxxxxxxxxxxxxxxxxxxxxxxxxxxxxxxxxxxxxxxxxxxxxxxgw
xxxxxxxxxxxxxxxxxxxxxxxxxxxxxxxxxxxxxxxxxxxxxxxxxxxxxxxxxxxxxxxxxxxxgw
xxxxxxxxxxxxxxxxxxxxxxxxxxxxxxxxxxxxxxxxxxxxxxxxxxxxxxxxxxxxxxxxxxxxrx
xxxxxxxxxxxxxxxxxxxxxxxxxxxxxxxxxxxxxxxxxxxxxxxxxxxxxxxxxxxxxxxxxxxxrx
xxxxxxxxxxxxxxxxxxxxxxxxxxxxxxxxxxxxxxxxxxxxxxxxxxxxxxxxxxxxxxxxxxxxrx
xxxxxxxxxxxxxxxxxxxxxxxxxxxxxxxxxxxxxxxxxxxxxxxxxxxxxxxxxxxxxxxxxxxxrx
xxxxxxxxxxxxxxxxxxxxxxxxxxxxxxxxxxxxxxxxxxxxxxxxxxxxxxxxxxxxxxxxxxxxrx
xxxxxxxxxxxxxxxxxxxxxxxxxxxxxxxxxxxxxxxxxxxxxxxxxxxxxxxxxxxxxxxxxxxxsy
xxxxxxxxxxxxxxxxxxxxxxxxxxxxxxxxxxxxxxxxxxxxxxxxxxxxxxxxxxxxxxxxxxxxsy
xxxxxxxxxxxxxxxxxxxxxxxxxxxxxxxxxxxxxxxxxxxxxxxxxxxxxxxxxxxxxxxxxxxxsy
xxxxxxxxxxxxxxxxxxxxxxxxxxxxxxxxxxxxxxxxxxxxxxxxxxxxxxxxxxxxxxxxxxxxsy
xxxxxxxxxxxxxxxxxxxxxxxxxxxxxxxxxxxxxxxxxxxxxxxxxxxxxxxxxxxxxxxxxxxxsy
xxxxxxxxxxxxxxxxxxxxxxxxxxxxxxxxxxxxxxxxxxxxxxxxxxxxxxxxxxxxxxxxxxxxx
xxxxxxxxxxxxxxxxxxxxxxxxxxxxxxxxxxxxxxxxxxxxxxxxxxxxxxxxxxxxxxxxxxxxx
xxxxxxxxxxxxxxxxxxxxxxxxxxxxxxxxxxxxxxxxxxxxxxxxxxxxxxxxxxxxxxxxxxxxx
xxxxxxxxxxxxxxxxxxxxxxxxxxxxxxxxxxxxxxxxxxxxxxxxxxxxxxxxxxxxxxxxxxxxx
xxxxxxxxxxxxxxxxxxxxxxxxxxxxxxxxxxxxxxxxxxxxxxxxxxxxxxxxxxxxxxxxxxxxx
** Results should be sorted **
'#--------------------FN_DYNVARS_098_07-------------------------#'
Testing type BLOB
SET @@max_sort_length = 70;
SELECT @@max_sort_length;
@@max_sort_length
70
INSERT INTO t1 set c = repeat('x',69);
INSERT INTO t1 set c = concat(repeat('x',68),'r','x');
INSERT INTO t1 set c = concat(repeat('x',68),'s','y');
INSERT INTO t1 set c = concat(repeat('x',68),'g','w');
SELECT c from t1 ORDER BY c, id DESC;
c
xxxxxxxxxxxxxxxxxxxxxxxxxxxxxxxxxxxxxxxxxxxxxxxxxxxxxxxxxxxxxxxxxxxxx
xxxxxxxxxxxxxxxxxxxxxxxxxxxxxxxxxxxxxxxxxxxxxxxxxxxxxxxxxxxxxxxxxxxxgw
xxxxxxxxxxxxxxxxxxxxxxxxxxxxxxxxxxxxxxxxxxxxxxxxxxxxxxxxxxxxxxxxxxxxsy
xxxxxxxxxxxxxxxxxxxxxxxxxxxxxxxxxxxxxxxxxxxxxxxxxxxxxxxxxxxxxxxxxxxxrx
Warnings:
Warning	4202	4 values were longer than max_sort_length. Sorting used only the first 70 bytes
** Results should be sorted **
SET @@session.max_sort_length = 64;
SELECT @@session.max_sort_length;
@@session.max_sort_length
64
INSERT INTO t1 set c = repeat('x',69);
INSERT INTO t1 set c = concat(repeat('x',68),'r','x');
INSERT INTO t1 set c = concat(repeat('x',68),'s','y');
INSERT INTO t1 set c = concat(repeat('x',68),'g','w');
SELECT c from t1 ORDER BY c, id;
c
xxxxxxxxxxxxxxxxxxxxxxxxxxxxxxxxxxxxxxxxxxxxxxxxxxxxxxxxxxxxxxxxxxxxx
xxxxxxxxxxxxxxxxxxxxxxxxxxxxxxxxxxxxxxxxxxxxxxxxxxxxxxxxxxxxxxxxxxxxx
xxxxxxxxxxxxxxxxxxxxxxxxxxxxxxxxxxxxxxxxxxxxxxxxxxxxxxxxxxxxxxxxxxxxrx
xxxxxxxxxxxxxxxxxxxxxxxxxxxxxxxxxxxxxxxxxxxxxxxxxxxxxxxxxxxxxxxxxxxxsy
xxxxxxxxxxxxxxxxxxxxxxxxxxxxxxxxxxxxxxxxxxxxxxxxxxxxxxxxxxxxxxxxxxxxgw
xxxxxxxxxxxxxxxxxxxxxxxxxxxxxxxxxxxxxxxxxxxxxxxxxxxxxxxxxxxxxxxxxxxxrx
xxxxxxxxxxxxxxxxxxxxxxxxxxxxxxxxxxxxxxxxxxxxxxxxxxxxxxxxxxxxxxxxxxxxsy
xxxxxxxxxxxxxxxxxxxxxxxxxxxxxxxxxxxxxxxxxxxxxxxxxxxxxxxxxxxxxxxxxxxxgw
Warnings:
Warning	4202	8 values were longer than max_sort_length. Sorting used only the first 64 bytes
** Results should not be sorted **
'#--------------------FN_DYNVARS_098_08-------------------------#'
Testing type CHAR
SET @@global.max_sort_length = 70;
SELECT @@global.max_sort_length;
@@global.max_sort_length
70
INSERT INTO t2 set c = repeat('x',69);
INSERT INTO t2 set c = concat(repeat('x',68),'r','x');
INSERT INTO t2 set c = concat(repeat('x',68),'s','y');
INSERT INTO t2 set c = concat(repeat('x',68),'g','w');
SELECT c from t2 ORDER BY c, id;
c
xxxxxxxxxxxxxxxxxxxxxxxxxxxxxxxxxxxxxxxxxxxxxxxxxxxxxxxxxxxxxxxxxxxxx
xxxxxxxxxxxxxxxxxxxxxxxxxxxxxxxxxxxxxxxxxxxxxxxxxxxxxxxxxxxxxxxxxxxxrx
xxxxxxxxxxxxxxxxxxxxxxxxxxxxxxxxxxxxxxxxxxxxxxxxxxxxxxxxxxxxxxxxxxxxsy
xxxxxxxxxxxxxxxxxxxxxxxxxxxxxxxxxxxxxxxxxxxxxxxxxxxxxxxxxxxxxxxxxxxxgw
Warnings:
Warning	4202	4 values were longer than max_sort_length. Sorting used only the first 64 bytes
** Results should not be sorted **
SET @@session.max_sort_length = 64;
SELECT @@session.max_sort_length;
@@session.max_sort_length
64
INSERT INTO t2 set c = repeat('x',69);
INSERT INTO t2 set c = concat(repeat('x',68),'r','x');
INSERT INTO t2 set c = concat(repeat('x',68),'s','y');
INSERT INTO t2 set c = concat(repeat('x',68),'g','w');
SELECT c from t2 ORDER BY c, id;
c
xxxxxxxxxxxxxxxxxxxxxxxxxxxxxxxxxxxxxxxxxxxxxxxxxxxxxxxxxxxxxxxxxxxxx
xxxxxxxxxxxxxxxxxxxxxxxxxxxxxxxxxxxxxxxxxxxxxxxxxxxxxxxxxxxxxxxxxxxxrx
xxxxxxxxxxxxxxxxxxxxxxxxxxxxxxxxxxxxxxxxxxxxxxxxxxxxxxxxxxxxxxxxxxxxsy
xxxxxxxxxxxxxxxxxxxxxxxxxxxxxxxxxxxxxxxxxxxxxxxxxxxxxxxxxxxxxxxxxxxxgw
xxxxxxxxxxxxxxxxxxxxxxxxxxxxxxxxxxxxxxxxxxxxxxxxxxxxxxxxxxxxxxxxxxxxx
xxxxxxxxxxxxxxxxxxxxxxxxxxxxxxxxxxxxxxxxxxxxxxxxxxxxxxxxxxxxxxxxxxxxrx
xxxxxxxxxxxxxxxxxxxxxxxxxxxxxxxxxxxxxxxxxxxxxxxxxxxxxxxxxxxxxxxxxxxxsy
xxxxxxxxxxxxxxxxxxxxxxxxxxxxxxxxxxxxxxxxxxxxxxxxxxxxxxxxxxxxxxxxxxxxgw
Warnings:
Warning	4202	8 values were longer than max_sort_length. Sorting used only the first 64 bytes
** Results should not be sorted **
DROP TABLE t, t1, t2;
#
# MDEV-27277 Add a warning when max_sort_length is reached
#
set max_sort_length = 70;
# Table having a fixed-length string field
create table t1(a char(100));
insert into t1 values
('ShortStr1'), ('ShortStr2'),
(concat(repeat('Str', 25), 'zzz')), (concat(repeat('Str', 25), 'yyy')),
(concat(repeat('Str', 25), 'xxx'));
# Strings are not sorted properly due to max_sort_length limitation
select a from t1 order by a;
a
ShortStr1
ShortStr2
StrStrStrStrStrStrStrStrStrStrStrStrStrStrStrStrStrStrStrStrStrStrStrStrStrzzz
StrStrStrStrStrStrStrStrStrStrStrStrStrStrStrStrStrStrStrStrStrStrStrStrStryyy
StrStrStrStrStrStrStrStrStrStrStrStrStrStrStrStrStrStrStrStrStrStrStrStrStrxxx
Warnings:
Warning	4202	3 values were longer than max_sort_length. Sorting used only the first 70 bytes
# Make sure there are warnings when a string function is used:
select a from t1 order by coalesce(a);
a
ShortStr1
ShortStr2
StrStrStrStrStrStrStrStrStrStrStrStrStrStrStrStrStrStrStrStrStrStrStrStrStrzzz
StrStrStrStrStrStrStrStrStrStrStrStrStrStrStrStrStrStrStrStrStrStrStrStrStryyy
StrStrStrStrStrStrStrStrStrStrStrStrStrStrStrStrStrStrStrStrStrStrStrStrStrxxx
Warnings:
Warning	4202	3 values were longer than max_sort_length. Sorting used only the first 70 bytes
select a from t1 order by concat(a, '1');
a
ShortStr1
ShortStr2
StrStrStrStrStrStrStrStrStrStrStrStrStrStrStrStrStrStrStrStrStrStrStrStrStrzzz
StrStrStrStrStrStrStrStrStrStrStrStrStrStrStrStrStrStrStrStrStrStrStrStrStryyy
StrStrStrStrStrStrStrStrStrStrStrStrStrStrStrStrStrStrStrStrStrStrStrStrStrxxx
Warnings:
Warning	4202	3 values were longer than max_sort_length. Sorting used only the first 70 bytes
select a from t1 order by binary(a);
a
ShortStr1
ShortStr2
StrStrStrStrStrStrStrStrStrStrStrStrStrStrStrStrStrStrStrStrStrStrStrStrStrzzz
StrStrStrStrStrStrStrStrStrStrStrStrStrStrStrStrStrStrStrStrStrStrStrStrStryyy
StrStrStrStrStrStrStrStrStrStrStrStrStrStrStrStrStrStrStrStrStrStrStrStrStrxxx
Warnings:
Warning	4202	3 values were longer than max_sort_length. Sorting used only the first 70 bytes
# Table having a variable-length string field and UTF16 encoding (2 bytes per char):
create table t2(a varchar(100)) character set 'utf16';
insert into t2 values
(concat(repeat('Str', 15), 'zzz')), (concat(repeat('Str', 15), 'yyy')),
(concat(repeat('Str', 15), 'xxx')),
('shortString89'),
('shortString51');
set max_sort_length = 64;
select * from t2 order by a;
a
shortString51
shortString89
StrStrStrStrStrStrStrStrStrStrStrStrStrStrStrzzz
StrStrStrStrStrStrStrStrStrStrStrStrStrStrStryyy
StrStrStrStrStrStrStrStrStrStrStrStrStrStrStrxxx
Warnings:
Warning	4202	3 values were longer than max_sort_length. Sorting used only the first 64 bytes
# Table having text blobs
create table t3(a text, b mediumtext, c longtext) character set 'utf16';
insert into t3 values
(concat(repeat('Text', 20), '999'), concat(repeat('Medium', 15), '99'), concat(repeat('Long', 20), '99')),
(concat(repeat('Text', 20), '888'), concat(repeat('Medium', 15), '88'), concat(repeat('Long', 20), '88')),
(concat(repeat('Text', 20), '777'), concat(repeat('Medium', 15), '77'), concat(repeat('Long', 20), '77')),
('shortString89', 'short123', 'short456'),
('shortString51', 'short777', 'short897');
select * from t3 order by a;
a	b	c
shortString51	short777	short897
shortString89	short123	short456
TextTextTextTextTextTextTextTextTextTextTextTextTextTextTextTextTextTextTextText999	MediumMediumMediumMediumMediumMediumMediumMediumMediumMediumMediumMediumMediumMediumMedium99	LongLongLongLongLongLongLongLongLongLongLongLongLongLongLongLongLongLongLongLong99
TextTextTextTextTextTextTextTextTextTextTextTextTextTextTextTextTextTextTextText888	MediumMediumMediumMediumMediumMediumMediumMediumMediumMediumMediumMediumMediumMediumMedium88	LongLongLongLongLongLongLongLongLongLongLongLongLongLongLongLongLongLongLongLong88
TextTextTextTextTextTextTextTextTextTextTextTextTextTextTextTextTextTextTextText777	MediumMediumMediumMediumMediumMediumMediumMediumMediumMediumMediumMediumMediumMediumMedium77	LongLongLongLongLongLongLongLongLongLongLongLongLongLongLongLongLongLongLongLong77
Warnings:
Warning	4202	3 values were longer than max_sort_length. Sorting used only the first 64 bytes
select * from t3 order by b desc;
a	b	c
shortString51	short777	short897
shortString89	short123	short456
TextTextTextTextTextTextTextTextTextTextTextTextTextTextTextTextTextTextTextText999	MediumMediumMediumMediumMediumMediumMediumMediumMediumMediumMediumMediumMediumMediumMedium99	LongLongLongLongLongLongLongLongLongLongLongLongLongLongLongLongLongLongLongLong99
TextTextTextTextTextTextTextTextTextTextTextTextTextTextTextTextTextTextTextText888	MediumMediumMediumMediumMediumMediumMediumMediumMediumMediumMediumMediumMediumMediumMedium88	LongLongLongLongLongLongLongLongLongLongLongLongLongLongLongLongLongLongLongLong88
TextTextTextTextTextTextTextTextTextTextTextTextTextTextTextTextTextTextTextText777	MediumMediumMediumMediumMediumMediumMediumMediumMediumMediumMediumMediumMediumMediumMedium77	LongLongLongLongLongLongLongLongLongLongLongLongLongLongLongLongLongLongLongLong77
Warnings:
Warning	4202	3 values were longer than max_sort_length. Sorting used only the first 64 bytes
select * from t3 order by coalesce(b) desc;
a	b	c
shortString51	short777	short897
shortString89	short123	short456
TextTextTextTextTextTextTextTextTextTextTextTextTextTextTextTextTextTextTextText999	MediumMediumMediumMediumMediumMediumMediumMediumMediumMediumMediumMediumMediumMediumMedium99	LongLongLongLongLongLongLongLongLongLongLongLongLongLongLongLongLongLongLongLong99
TextTextTextTextTextTextTextTextTextTextTextTextTextTextTextTextTextTextTextText888	MediumMediumMediumMediumMediumMediumMediumMediumMediumMediumMediumMediumMediumMediumMedium88	LongLongLongLongLongLongLongLongLongLongLongLongLongLongLongLongLongLongLongLong88
TextTextTextTextTextTextTextTextTextTextTextTextTextTextTextTextTextTextTextText777	MediumMediumMediumMediumMediumMediumMediumMediumMediumMediumMediumMediumMediumMediumMedium77	LongLongLongLongLongLongLongLongLongLongLongLongLongLongLongLongLongLongLongLong77
Warnings:
Warning	4202	3 values were longer than max_sort_length. Sorting used only the first 64 bytes
select * from t3 order by c;
a	b	c
TextTextTextTextTextTextTextTextTextTextTextTextTextTextTextTextTextTextTextText999	MediumMediumMediumMediumMediumMediumMediumMediumMediumMediumMediumMediumMediumMediumMedium99	LongLongLongLongLongLongLongLongLongLongLongLongLongLongLongLongLongLongLongLong99
TextTextTextTextTextTextTextTextTextTextTextTextTextTextTextTextTextTextTextText888	MediumMediumMediumMediumMediumMediumMediumMediumMediumMediumMediumMediumMediumMediumMedium88	LongLongLongLongLongLongLongLongLongLongLongLongLongLongLongLongLongLongLongLong88
TextTextTextTextTextTextTextTextTextTextTextTextTextTextTextTextTextTextTextText777	MediumMediumMediumMediumMediumMediumMediumMediumMediumMediumMediumMediumMediumMediumMedium77	LongLongLongLongLongLongLongLongLongLongLongLongLongLongLongLongLongLongLongLong77
shortString89	short123	short456
shortString51	short777	short897
Warnings:
Warning	4202	3 values were longer than max_sort_length. Sorting used only the first 64 bytes
select * from t3 order by c, a desc;
a	b	c
TextTextTextTextTextTextTextTextTextTextTextTextTextTextTextTextTextTextTextText999	MediumMediumMediumMediumMediumMediumMediumMediumMediumMediumMediumMediumMediumMediumMedium99	LongLongLongLongLongLongLongLongLongLongLongLongLongLongLongLongLongLongLongLong99
TextTextTextTextTextTextTextTextTextTextTextTextTextTextTextTextTextTextTextText888	MediumMediumMediumMediumMediumMediumMediumMediumMediumMediumMediumMediumMediumMediumMedium88	LongLongLongLongLongLongLongLongLongLongLongLongLongLongLongLongLongLongLongLong88
TextTextTextTextTextTextTextTextTextTextTextTextTextTextTextTextTextTextTextText777	MediumMediumMediumMediumMediumMediumMediumMediumMediumMediumMediumMediumMediumMediumMedium77	LongLongLongLongLongLongLongLongLongLongLongLongLongLongLongLongLongLongLongLong77
shortString89	short123	short456
shortString51	short777	short897
Warnings:
Warning	4202	6 values were longer than max_sort_length. Sorting used only the first 64 bytes
# Packing of sort keys will be applied here:
select * from t3 order by a, c, b;
a	b	c
shortString51	short777	short897
shortString89	short123	short456
TextTextTextTextTextTextTextTextTextTextTextTextTextTextTextTextTextTextTextText999	MediumMediumMediumMediumMediumMediumMediumMediumMediumMediumMediumMediumMediumMediumMedium99	LongLongLongLongLongLongLongLongLongLongLongLongLongLongLongLongLongLongLongLong99
TextTextTextTextTextTextTextTextTextTextTextTextTextTextTextTextTextTextTextText888	MediumMediumMediumMediumMediumMediumMediumMediumMediumMediumMediumMediumMediumMediumMedium88	LongLongLongLongLongLongLongLongLongLongLongLongLongLongLongLongLongLongLongLong88
TextTextTextTextTextTextTextTextTextTextTextTextTextTextTextTextTextTextTextText777	MediumMediumMediumMediumMediumMediumMediumMediumMediumMediumMediumMediumMediumMediumMedium77	LongLongLongLongLongLongLongLongLongLongLongLongLongLongLongLongLongLongLongLong77
Warnings:
Warning	4202	9 values were longer than max_sort_length. Sorting used only the first 64 bytes
select * from t3 order by a;
a	b	c
shortString51	short777	short897
shortString89	short123	short456
TextTextTextTextTextTextTextTextTextTextTextTextTextTextTextTextTextTextTextText999	MediumMediumMediumMediumMediumMediumMediumMediumMediumMediumMediumMediumMediumMediumMedium99	LongLongLongLongLongLongLongLongLongLongLongLongLongLongLongLongLongLongLongLong99
TextTextTextTextTextTextTextTextTextTextTextTextTextTextTextTextTextTextTextText888	MediumMediumMediumMediumMediumMediumMediumMediumMediumMediumMediumMediumMediumMediumMedium88	LongLongLongLongLongLongLongLongLongLongLongLongLongLongLongLongLongLongLongLong88
TextTextTextTextTextTextTextTextTextTextTextTextTextTextTextTextTextTextTextText777	MediumMediumMediumMediumMediumMediumMediumMediumMediumMediumMediumMediumMediumMediumMedium77	LongLongLongLongLongLongLongLongLongLongLongLongLongLongLongLongLongLongLongLong77
Warnings:
Warning	4202	3 values were longer than max_sort_length. Sorting used only the first 64 bytes
# Test a prepared statement re-execution (expecting warnings at both executions)
prepare stmt from "select * from t2 order by a";
execute stmt;
a
shortString51
shortString89
StrStrStrStrStrStrStrStrStrStrStrStrStrStrStrzzz
StrStrStrStrStrStrStrStrStrStrStrStrStrStrStryyy
StrStrStrStrStrStrStrStrStrStrStrStrStrStrStrxxx
Warnings:
Warning	4202	3 values were longer than max_sort_length. Sorting used only the first 64 bytes
execute stmt;
a
shortString51
shortString89
StrStrStrStrStrStrStrStrStrStrStrStrStrStrStrzzz
StrStrStrStrStrStrStrStrStrStrStrStrStrStrStryyy
StrStrStrStrStrStrStrStrStrStrStrStrStrStrStrxxx
Warnings:
Warning	4202	3 values were longer than max_sort_length. Sorting used only the first 64 bytes
# Test a stored procedure
create procedure p1() select * from t2 order by a;
call p1();
a
shortString51
shortString89
StrStrStrStrStrStrStrStrStrStrStrStrStrStrStrzzz
StrStrStrStrStrStrStrStrStrStrStrStrStrStrStryyy
StrStrStrStrStrStrStrStrStrStrStrStrStrStrStrxxx
Warnings:
Warning	4202	3 values were longer than max_sort_length. Sorting used only the first 64 bytes
call p1();
a
shortString51
shortString89
StrStrStrStrStrStrStrStrStrStrStrStrStrStrStrzzz
StrStrStrStrStrStrStrStrStrStrStrStrStrStrStryyy
StrStrStrStrStrStrStrStrStrStrStrStrStrStrStrxxx
Warnings:
Warning	4202	3 values were longer than max_sort_length. Sorting used only the first 64 bytes
drop procedure p1;
# Test a stored function
create function f1 () returns char(100) return (select a from t1 order by a limit 1);
select f1() as f1_res from t1 order by f1_res;
f1_res
ShortStr1
ShortStr1
ShortStr1
ShortStr1
ShortStr1
Warnings:
Warning	4202	15 values were longer than max_sort_length. Sorting used only the first 64 bytes
# Test a view
create view v1 as select f1() as f1_res from t1 order by f1_res;
select * from v1;
f1_res
ShortStr1
ShortStr1
ShortStr1
ShortStr1
ShortStr1
Warnings:
Warning	4202	30 values were longer than max_sort_length. Sorting used only the first 64 bytes
drop function f1;
drop view v1;
drop table t1, t2, t3;
set max_sort_length = default;
#
# MDEV-35275 Unexpected WARN_SORTING_ON_TRUNCATED_LENGTH or assertion
#            failure in diagnostics area
#
create table t1 (a int, b varchar(1024));
insert into t1 values (1,repeat('x',513)), (2,repeat('y',650));
insert into t1 select * from t1 order by b limit 1;
Warnings:
Warning	4202	2 values were longer than max_sort_length. Sorting used only the first 70 bytes
update t1 set a = 3 order by b limit 1;
Warnings:
Warning	4202	3 values were longer than max_sort_length. Sorting used only the first 70 bytes
delete from t1 where a < 3 order by b;
Warnings:
Warning	4202	2 values were longer than max_sort_length. Sorting used only the first 70 bytes
# Make sure warnings from previous statements do not overflow to next ones
select a from t1;
a
3
drop table t1;
#
# MDEV-35307 Unexpected WARN_SORTING_ON_TRUNCATED_LENGTH or assertion
#            failure in diagnostics area #2
#
create table t1 (a varchar(1024)) engine=innodb;
insert into t1 values (repeat('a',1000)),(repeat('b',1000));
insert into t1 (a) select a from t1 order by a;
Warnings:
Warning	4202	2 values were longer than max_sort_length. Sorting used only the first 70 bytes
drop table t1;
connection default;
disconnect test_con1;
disconnect test_con2;
SET @@global.max_sort_length= @start_value;
