#
# ============================================
# TEST 1: READ COMMITTED - sees committed data
# ============================================
#
CREATE TABLE t_iso (
id  INT NOT NULL PRIMARY KEY,
val INT
) ENGINE=TIDESDB;
INSERT INTO t_iso VALUES (1, 10);
connect  con1, localhost, root,,;
connection con1;
SET TRANSACTION ISOLATION LEVEL READ COMMITTED;
BEGIN;
SELECT * FROM t_iso ORDER BY id;
id	val
1	10
connection default;
INSERT INTO t_iso VALUES (2, 20);
# con1 at READ COMMITTED should see newly committed row
connection con1;
SELECT * FROM t_iso ORDER BY id;
id	val
1	10
2	20
COMMIT;
disconnect con1;
connection default;
#
# ============================================
# TEST 2: REPEATABLE READ - snapshot isolation
# ============================================
#
connect  con2, localhost, root,,;
connection con2;
SET TRANSACTION ISOLATION LEVEL REPEATABLE READ;
BEGIN;
SELECT * FROM t_iso ORDER BY id;
id	val
1	10
2	20
connection default;
INSERT INTO t_iso VALUES (3, 30);
# con2 at REPEATABLE READ should NOT see row 3
connection con2;
SELECT * FROM t_iso ORDER BY id;
id	val
1	10
2	20
COMMIT;
# After COMMIT, new transaction should see row 3
SELECT * FROM t_iso ORDER BY id;
id	val
1	10
2	20
3	30
disconnect con2;
connection default;
#
# ============================================
# TEST 3: Basic DML at each isolation level
#   (verifies the mapping doesn't crash)
# ============================================
#
SET SESSION TRANSACTION ISOLATION LEVEL READ UNCOMMITTED;
INSERT INTO t_iso VALUES (4, 40);
SELECT * FROM t_iso WHERE id = 4;
id	val
4	40
SET SESSION TRANSACTION ISOLATION LEVEL READ COMMITTED;
UPDATE t_iso SET val = 41 WHERE id = 4;
SELECT * FROM t_iso WHERE id = 4;
id	val
4	41
SET SESSION TRANSACTION ISOLATION LEVEL REPEATABLE READ;
UPDATE t_iso SET val = 42 WHERE id = 4;
SELECT * FROM t_iso WHERE id = 4;
id	val
4	42
SET SESSION TRANSACTION ISOLATION LEVEL SERIALIZABLE;
DELETE FROM t_iso WHERE id = 4;
SELECT * FROM t_iso ORDER BY id;
id	val
1	10
2	20
3	30
# Reset to default
SET SESSION TRANSACTION ISOLATION LEVEL REPEATABLE READ;
DROP TABLE t_iso;
#
# ============================================
# TEST 4: SNAPSHOT isolation via table option
#   (table uses ISOLATION_LEVEL=SNAPSHOT, session
#   at REPEATABLE READ should activate SNAPSHOT)
# ============================================
#
CREATE TABLE t_snap (
id  INT NOT NULL PRIMARY KEY,
val INT
) ENGINE=TIDESDB ISOLATION_LEVEL='SNAPSHOT';
INSERT INTO t_snap VALUES (1, 100);
SET SESSION TRANSACTION ISOLATION LEVEL REPEATABLE READ;
BEGIN;
SELECT * FROM t_snap ORDER BY id;
id	val
1	100
INSERT INTO t_snap VALUES (2, 200);
SELECT * FROM t_snap ORDER BY id;
id	val
1	100
2	200
COMMIT;
DROP TABLE t_snap;
#
# Done.
