connection node_2;
connection node_1;
connection node_1;
connection node_2;
connection node_3;
connection node_1;
# gtid_strict_mode must be enabled on all nodes
SELECT @@global.gtid_strict_mode AS gtid_strict_mode;
gtid_strict_mode
1
connection node_2;
connection node_3;
connect node_1_load, 127.0.0.1, root, , test, $NODE_MYPORT_1;
connect node_2_load, 127.0.0.1, root, , test, $NODE_MYPORT_2;
connection node_1_load;
CALL p_load();
connection node_2_load;
CALL p_load();
connection node_1;
connection node_2;
connection node_3;
connection node_1;
UPDATE ctrl SET stop = 1 WHERE id = 1;
connection node_1_load;
connection node_2_load;
connection node_1;
SET SESSION wsrep_sync_wait = 15;
SELECT VARIABLE_VALUE AS wsrep_cluster_size FROM INFORMATION_SCHEMA.GLOBAL_STATUS WHERE VARIABLE_NAME = 'wsrep_cluster_size';
wsrep_cluster_size
3
connection node_2;
SET SESSION wsrep_sync_wait = 15;
count_match	checksum_match	gtid_match
1	1	1
connection node_3;
SET SESSION wsrep_sync_wait = 15;
count_match	checksum_match	gtid_match
1	1	1
connection node_1;
connection node_2;
connection node_3;
disconnect node_2;
disconnect node_1;
