CREATE TABLE t(a INT PRIMARY KEY, b CHAR(255) DEFAULT '' NOT NULL, INDEX(b))
ENGINE=INNODB;
INSERT INTO t SET a=1;
CREATE TABLE at1(i INTEGER) ENGINE=Aria TRANSACTIONAL=1;
INSERT INTO at1 VALUES (1);
CREATE TABLE at0 (i INTEGER) ENGINE=Aria TRANSACTIONAL=0;
INSERT INTO at0 VALUES (0);
CREATE DATABASE `$$$$$$$$$$$$`;
CREATE TABLE `$$$$$$$$$$$$`.`$$$$$$$$$$$$`(a SERIAL) ENGINE=InnoDB
SELECT 1;
BEGIN;
DELETE FROM t;
connect backup,localhost,root;
BACKUP SERVER WITH 2 CONCURRENT 'cat';
connection default;
INSERT INTO t(a) SELECT * FROM seq_1_to_30000;
connection backup;
disconnect backup;
connection default;
ROLLBACK;
SELECT * FROM t;
a	b
1	
DELETE FROM t;
DROP TABLE at0, at1;
DROP DATABASE `$$$$$$$$$$$$`;
# restart: --defaults-file=MYSQLTEST_VARDIR/backup_stream/backup.cnf --datadir=MYSQLTEST_VARDIR/backup_stream
SELECT * FROM at0;
i
0
SELECT * FROM at1;
i
1
SELECT * FROM t;
a	b
1	
SELECT * FROM `$$$$$$$$$$$$`.`$$$$$$$$$$$$`;
a	1
1	1
DELETE FROM t;
ERROR HY000: Table 't' is read only
DELETE FROM `$$$$$$$$$$$$`.`$$$$$$$$$$$$`;
ERROR HY000: Table '$$$$$$$$$$$$' is read only
# restart
SELECT * FROM t;
a	b
DROP TABLE t;
DELETE FROM `$$$$$$$$$$$$`.`$$$$$$$$$$$$`;
ERROR 42S02: Table '$$$$$$$$$$$$.$$$$$$$$$$$$' doesn't exist
