#
# alter ignore cannot be done online
#
create table t (a int);
alter ignore table t add primary key (a), algorithm=copy, lock=none;
ERROR 0A000: LOCK=NONE is not supported. Reason: COPY algorithm requires a lock. Try LOCK=SHARED
drop table t;
#
# MDEV-28771 Assertion `table->in_use&&tdc->flushed' failed after ALTER
#
create table t (a char(1));
insert into t values ('a'),('b');
select * from t join t as t2 join t as t3;
a	a	a
a	a	a
b	a	a
a	b	a
b	b	a
a	a	b
b	a	b
a	b	b
b	b	b
alter table t modify a int;
ERROR 22007: Truncated incorrect INTEGER value: 'a'
select * from t;
a
a
b
drop table t;
create table t (c double precision key,c2 char,c3 year);
insert into t values (7,3,1);
select a from t where a=all (select a from t where b=2 union select a from t where b=2);
ERROR 42S22: Unknown column 'a' in 'field list'
insert into t values (3,1,1);
alter table t change c c date,add key(c);
ERROR 22007: Incorrect date value: '7' for column `test`.`t`.`c` at row 1
select * from t;
c	c2	c3
7	3	2001
3	1	2001
drop table t;
set sql_mode='';
create table t (c char unique,c2 int,stamp timestamp);
insert into t values (1,1,1),(2,2,2),(3,3,3),(4,4,4),(5,5,5);
Warnings:
Warning	1265	Data truncated for column 'stamp' at row 1
Warning	1265	Data truncated for column 'stamp' at row 2
Warning	1265	Data truncated for column 'stamp' at row 3
Warning	1265	Data truncated for column 'stamp' at row 4
Warning	1265	Data truncated for column 'stamp' at row 5
update t set c=(select * from t) where c in (select * from t);
ERROR 21000: Operand should contain 1 column(s)
alter table t modify c date;
ERROR 23000: Duplicate entry '0000-00-00' for key 'c'
select * from t;
c	c2	stamp
1	1	0000-00-00 00:00:00
2	2	0000-00-00 00:00:00
3	3	0000-00-00 00:00:00
4	4	0000-00-00 00:00:00
5	5	0000-00-00 00:00:00
drop table t;
set sql_mode=default;
#
# MDEV-28944 XA assertions failing in binlog_rollback and binlog_commit
#
CREATE TABLE t (a INT) ENGINE=MyISAM;
INSERT INTO t VALUES (1);
connect  con1,localhost,root,,test;
XA START 'xid';
SELECT * FROM t;
a
1
connection default;
ALTER TABLE t NOWAIT ADD KEY (a);
ERROR HY000: Lock wait timeout exceeded; try restarting transaction
connection con1;
UPDATE t SET a = 2;
XA END 'xid';
XA COMMIT 'xid' ONE PHASE;
DROP TABLE t;
disconnect con1;
connection default;
#
# MDEV-29068 Cascade foreign key updates do not apply in online alter
#
create table t1 (a int primary key) engine=InnoDB;
insert into t1 values (1),(2),(3);
create table t2 (b int, foreign key (b)
references t1 (a)
on update cascade) engine=InnoDB;
insert into t2 values (1),(2),(3);
alter table t2 add c int, algorithm=copy, lock=none;
ERROR 0A000: LOCK=NONE is not supported. Reason: COPY algorithm requires a lock. Try LOCK=SHARED
alter table t2 add c int, algorithm=inplace, lock=none;
create or replace table t2 (b int, foreign key (b)
references t1 (a)
on delete set null) engine=InnoDB;
alter table t2 add c int, algorithm=copy, lock=none;
ERROR 0A000: LOCK=NONE is not supported. Reason: COPY algorithm requires a lock. Try LOCK=SHARED
alter table t2 add c int, algorithm=inplace, lock=none;
create or replace table t2 (b int, foreign key (b)
references t1 (a)
on delete no action) engine=InnoDB;
insert into t2 values (1),(2),(3);
alter table t2 add c int, algorithm=copy, lock=none;
create or replace table t2 (b int, foreign key (b)
references t1 (a)
on update restrict) engine=InnoDB;
insert into t2 values (1),(2),(3);
alter table t2 add c int, algorithm=copy, lock=none;
drop table t2, t1;
create table t1 (a int primary key, b int unique) engine=InnoDB;
insert into t1 values (1, 1),(2, 2),(3, 3);
create table t2 (a int references t1 (a),
b int references t1 (b) on update cascade) engine=InnoDB;
insert into t2 values (1, 1),(2, 2);
alter table t2 add c int, algorithm=copy, lock=none;
ERROR 0A000: LOCK=NONE is not supported. Reason: COPY algorithm requires a lock. Try LOCK=SHARED
alter table t2 add c int, algorithm=copy;
alter table t2 add d int, algorithm=inplace;
drop table t2, t1;
#
# MDEV-30891 Assertion `!table->versioned(VERS_TRX_ID)' failed
# in Write_rows_log_event::binlog_row_logging_function
#
set system_versioning_alter_history= keep;
create table t1 (id int,
row_start bigint unsigned generated always as row start,
row_end bigint unsigned generated always as row end,
period for system_time (row_start, row_end))
engine=innodb with system versioning;
alter table t1 add c int, algorithm=copy, lock=none;
ERROR 0A000: LOCK=NONE is not supported. Reason: COPY algorithm requires a lock. Try LOCK=SHARED
alter table t1 add c int, algorithm=inplace;
alter table t1 add d int, lock=none;
set system_versioning_alter_history= default;
drop table t1;
