set default_storage_engine= innodb;
connect  con2, localhost, root,,;
connection default;
#
# Test insert
#
# Insert and add column
create or replace table t1 (a int);
insert t1 values (5);
connection con2;
set debug_sync= 'now WAIT_FOR ended';
connection default;
set debug_sync= 'alter_table_copy_end SIGNAL ended WAIT_FOR end';
alter table t1 add b int NULL, algorithm= copy, lock= none;
connection con2;
insert into t1 values (123), (456), (789);
set debug_sync= 'now SIGNAL end';
connection default;
select * from t1;
a	b
5	NULL
123	NULL
456	NULL
789	NULL
# Insert, error
create or replace table t1 (a int);
insert t1 values (5), (5);
connection con2;
set debug_sync= 'now WAIT_FOR ended';
connection default;
set debug_sync= 'alter_table_copy_end SIGNAL ended WAIT_FOR end';
alter table t1 nowait add unique (a), algorithm= copy, lock= none;
connection con2;
start transaction;
insert into t1 values (123), (456), (789);
set debug_sync= 'now SIGNAL end';
connection default;
ERROR 23000: Duplicate entry '5' for key 'a'
connection con2;
commit;
connection default;
select variable_value into @otd from information_schema.session_status where variable_name='Opened_table_definitions';
select * from t1;
a
5
5
123
456
789
select variable_value-@otd from information_schema.session_status where variable_name='Opened_table_definitions';
variable_value-@otd
1
# long transaction and add column
create or replace table t1 (a int);
insert t1 values (5);
connection con2;
set debug_sync= 'now WAIT_FOR ended';
connection default;
set debug_sync= 'alter_table_copy_end SIGNAL ended WAIT_FOR end';
alter table t1 nowait add b int NULL, algorithm= copy, lock= none;
connection con2;
start transaction;
insert into t1 values (123), (456), (789);
set debug_sync= 'now SIGNAL end';
connection default;
ERROR HY000: Lock wait timeout exceeded; try restarting transaction
select * from t1;
a
5
connection con2;
rollback;
connection default;
# Insert and add NOT NULL column without default value
create or replace table t1 (a int);
insert t1 values (5);
connection con2;
set debug_sync= 'now WAIT_FOR ended';
connection default;
set debug_sync= 'alter_table_copy_end SIGNAL ended WAIT_FOR end';
alter table t1 add b int NOT NULL, algorithm= copy, lock= none;
connection con2;
insert into t1 values (123), (456), (789);
set debug_sync= 'now SIGNAL end';
connection default;
select * from t1;
a	b
5	0
123	0
456	0
789	0
# Insert and add a column with a default value
create or replace table t1 (a int);
insert t1 values (5);
connection con2;
set debug_sync= 'now WAIT_FOR ended';
connection default;
set debug_sync= 'alter_table_copy_end SIGNAL ended WAIT_FOR end';
alter table t1 add b int NOT NULL default (222), algorithm= copy, lock= none;
connection con2;
insert into t1 values (123), (456), (789);
set debug_sync= 'now SIGNAL end';
connection default;
select * from t1;
a	b
5	222
123	222
456	222
789	222
#
# Test update
#
# Update and add a column
create or replace table t1 (a int primary key, b int);
insert t1 values (1, 22);
insert t1 values (3, 44);
connection con2;
set debug_sync= 'now WAIT_FOR ended';
connection default;
set debug_sync= 'alter_table_copy_end SIGNAL ended WAIT_FOR end';
alter table t1 add c int default(1),
algorithm= copy, lock= none;
connection con2;
update t1 set b= 55 where a = 1;
set debug_sync= 'now SIGNAL end';
connection default;
select * from t1;
a	b	c
1	55	1
3	44	1
# Update and add a column in the middle
create or replace table t1 (a int primary key, b int);
insert t1 values (1, 22);
insert t1 values (3, 44);
connection con2;
set debug_sync= 'now WAIT_FOR ended';
connection default;
set debug_sync= 'alter_table_copy_end SIGNAL ended WAIT_FOR end';
alter table t1 add c int default(1) after a,
algorithm= copy, lock= none;
connection con2;
update t1 set b= 55 where a = 1;
set debug_sync= 'now SIGNAL end';
connection default;
select * from t1;
a	c	b
1	1	55
3	1	44
#
# Test primary key change
#
# Drop key, add key
create or replace table t1 (a int primary key, b int);
insert t1 values (1, 22);
insert t1 values (3, 44);
connection con2;
set debug_sync= 'now WAIT_FOR ended';
connection default;
set debug_sync= 'alter_table_copy_end SIGNAL ended WAIT_FOR end';
alter table t1 drop primary key, add primary key(b),
algorithm= copy, lock= none;
connection con2;
update t1 set b= 55 where a = 1;
set debug_sync= 'now SIGNAL end';
connection default;
select * from t1;
a	b
3	44
1	55
# Drop key, add key. Two updates
create or replace table t1 (a int primary key, b int);
insert t1 values (1, 11);
insert t1 values (2, 22);
connection con2;
set debug_sync= 'now WAIT_FOR ended';
connection default;
set debug_sync= 'alter_table_copy_end SIGNAL ended WAIT_FOR end';
alter table t1 drop primary key, add primary key(b),
algorithm= copy, lock= none;
connection con2;
update t1 set b= 33 where a = 1;
update t1 set b= 44 where a = 2;
set debug_sync= 'now SIGNAL end';
connection default;
select * from t1;
a	b
1	33
2	44
#
# Various tests, see below
#
create or replace table t1 (a int primary key, b int);
insert t1 values (1, 11);
insert t1 values (2, 22);
insert t1 values (3, 33);
insert t1 values (4, 44);
insert t1 values (5, 55);
insert t1 values (6, 66);
insert t1 values (7, 77);
insert t1 values (8, 88);
insert t1 values (9, 99);
connection con2;
set debug_sync= 'now WAIT_FOR ended';
connection default;
set debug_sync= 'alter_table_copy_end SIGNAL ended WAIT_FOR end';
alter table t1 drop primary key, add primary key(b),
algorithm= copy, lock= none;
connection con2;
# Two updates
update t1 set b= 1001 where a = 1;
update t1 set b= 2002 where a = 2;
# Two updates in transaction
set autocommit = 0;
start transaction;
update t1 set b= 3003 where a = 3;
update t1 set b= 4004 where a = 4;
commit;
set autocommit = 1;
# Second update is rolled back
update t1 set b= 5005 where a = 5;
set autocommit = 0;
start transaction;
update t1 set b= 6006 where a = 6;
rollback;
set autocommit = 1;
# Second execution in transaction fails
set autocommit = 0;
start transaction;
update t1 set b= 7007 where a = 7;
update t1 set a= 8, b= 8008 where a = 8 or a = 9 order by a;
ERROR 23000: Duplicate entry '8' for key 'PRIMARY'
commit;
set autocommit = 1;
select * from t1;
a	b
1	1001
2	2002
3	3003
4	4004
5	5005
6	66
7	7007
8	88
9	99
set debug_sync= 'now SIGNAL end';
connection default;
select * from t1;
a	b
1	1001
2	2002
3	3003
4	4004
5	5005
6	66
7	7007
8	88
9	99
#
# MYISAM. Only Inserts can be tested.
# (everything else is a table lock disallowing concurrent reads)
#
create or replace table t1 (a int) engine=myisam;
insert t1 values (5);
connection con2;
set debug_sync= 'now WAIT_FOR ended';
connection default;
set debug_sync= 'alter_table_copy_end SIGNAL ended WAIT_FOR end';
alter table t1 add b int NULL, algorithm= copy, lock= none;
connection con2;
insert into t1 values (123), (456), (789);
set debug_sync= 'now SIGNAL end';
connection default;
select * from t1;
a	b
5	NULL
123	NULL
456	NULL
789	NULL
# MYISAM + error
create or replace table t1 (a int primary key) engine=myisam;
insert t1 values (5);
connection con2;
set debug_sync= 'now WAIT_FOR ended';
connection default;
set debug_sync= 'alter_table_copy_end SIGNAL ended WAIT_FOR end';
alter table t1 add b int NULL, algorithm= copy, lock= none;
connection con2;
insert into t1 values (1),(2),(3),(4),(5),(6);
ERROR 23000: Duplicate entry '5' for key 'PRIMARY'
select * from t1;
a
1
2
3
4
5
set debug_sync= 'now SIGNAL end';
connection default;
select * from t1;
a	b
5	NULL
1	NULL
2	NULL
3	NULL
4	NULL
# Aria + error
set @@binlog_format=row;
create or replace table t1 (a int primary key) engine=aria;
insert t1 values (5);
connection con2;
set debug_sync= 'now WAIT_FOR ended';
connection default;
set debug_sync= 'alter_table_copy_end SIGNAL ended WAIT_FOR end';
alter table t1 add b int NULL, algorithm= copy, lock= none;
connection con2;
insert into t1 values (1),(2),(3),(4),(5),(6);
ERROR 23000: Duplicate entry '5' for key 'PRIMARY'
select * from t1;
a
1
2
3
4
5
set debug_sync= 'now SIGNAL end';
connection default;
select * from t1;
a	b
5	NULL
1	NULL
2	NULL
3	NULL
4	NULL
set @@binlog_format=default;
# Test incompatible changes
create or replace table t1 (a int primary key, b int);
insert t1 values (1, 22);
insert t1 values (3, 44);
connection con2;
set debug_sync= 'now WAIT_FOR ended';
connection default;
set debug_sync= 'alter_table_copy_end SIGNAL ended WAIT_FOR end';
alter table t1 drop primary key, add primary key(b),
algorithm= copy, lock= none;
connection con2;
update t1 set b= 44 where a = 1;
set debug_sync= 'now SIGNAL end';
connection default;
ERROR 23000: Duplicate entry '44' for key 'PRIMARY'
select * from t1;
a	b
1	44
3	44
# Test log read after EXCLUSIVE lock
# Transaction is started before ALTER, and UPDATE is made.
# Then more UPDATEs.
create or replace table t1 (a int primary key, b int);
insert t1 values (1, 11);
insert t1 values (2, 22);
insert t1 values (3, 33);
insert t1 values (4, 44);
insert t1 values (5, 55);
set debug_sync= 'alter_table_online_before_lock SIGNAL locking WAIT_FOR end';
set debug_sync= 'alter_table_online_downgraded SIGNAL downgraded';
alter table t1 drop primary key, add primary key(b),
algorithm= copy, lock= none;
connection con2;
begin;
set debug_sync= 'now WAIT_FOR downgraded';
update t1 set b= 111 where a = 1;
set debug_sync= 'now WAIT_FOR locking';
set debug_sync= 'now SIGNAL end';
update t1 set b= 222 where a = 2;
update t1 set b= 333 where a = 3;
update t1 set b= 444 where a = 4;
commit;
update t1 set b= 555 where a = 5;
connection default;
select * from t1;
a	b
1	111
2	222
3	333
4	444
5	555
#
# Test progress report.
#
create or replace table t1 (a int primary key, b int);
insert t1 values (1, 11);
insert t1 values (2, 22);
insert t1 values (3, 33);
insert t1 values (4, 44);
set debug_sync= 'alter_table_online_before_lock SIGNAL locking WAIT_FOR end';
set debug_sync= 'alter_table_online_downgraded SIGNAL downgraded'
                                             ' WAIT_FOR start_replication';
set debug_sync= 'alter_table_online_progress SIGNAL applied WAIT_FOR proceed'
                                           ' EXECUTE 9';
alter table t1 drop primary key, add primary key(b),
algorithm= copy, lock= none;
connection con2;
set debug_sync= 'now WAIT_FOR downgraded';
update t1 set b= 111 where a = 1;
insert t1 values (5, 55);
update t1 set b= 555 where a = 5;
insert t1 values (6, 66);
update t1 set b= 666 where a = 6;
set debug_sync= 'now SIGNAL start_replication';
# First signal is for log description event.
set debug_sync= 'now WAIT_FOR applied';
select stage, progress from INFORMATION_SCHEMA.PROCESSLIST where id = @con;
stage	progress
3	51.220
set debug_sync= 'now SIGNAL proceed WAIT_FOR applied';
select stage, progress from INFORMATION_SCHEMA.PROCESSLIST where id = @con;
stage	progress
3	61.789
set debug_sync= 'now SIGNAL proceed WAIT_FOR applied';
select stage, progress from INFORMATION_SCHEMA.PROCESSLIST where id = @con;
stage	progress
3	70.325
set debug_sync= 'now SIGNAL proceed WAIT_FOR applied';
select stage, progress from INFORMATION_SCHEMA.PROCESSLIST where id = @con;
stage	progress
3	80.894
set debug_sync= 'now SIGNAL proceed WAIT_FOR applied';
select stage, progress from INFORMATION_SCHEMA.PROCESSLIST where id = @con;
stage	progress
3	89.431
set debug_sync= 'now SIGNAL proceed WAIT_FOR applied';
select stage, progress from INFORMATION_SCHEMA.PROCESSLIST where id = @con;
stage	progress
3	100.000
set debug_sync= 'now SIGNAL proceed WAIT_FOR locking';
begin;
update t1 set b= 222 where a = 2;
update t1 set b= 333 where a = 3;
update t1 set b= 444 where a = 4;
commit;
set debug_sync= 'now SIGNAL end WAIT_FOR applied';
select stage, progress from INFORMATION_SCHEMA.PROCESSLIST where id = @con;
stage	progress
4	33.333
set debug_sync= 'now SIGNAL proceed WAIT_FOR applied';
select stage, progress from INFORMATION_SCHEMA.PROCESSLIST where id = @con;
stage	progress
4	66.667
set debug_sync= 'now SIGNAL proceed WAIT_FOR applied';
select stage, progress from INFORMATION_SCHEMA.PROCESSLIST where id = @con;
stage	progress
4	100.000
set debug_sync= 'now SIGNAL proceed';
connection default;
select * from t1;
a	b
1	111
2	222
3	333
4	444
5	555
6	666
#
# Test system versioning
#
create or replace table t1 (a int primary key, b int);
insert t1 values (1, 22);
insert t1 values (3, 44);
connection con2;
set debug_sync= 'now WAIT_FOR ended';
connection default;
set debug_sync= 'alter_table_copy_end SIGNAL ended WAIT_FOR end';
set timestamp = 1;
alter table t1 add system versioning,
algorithm= copy, lock= none;
connection con2;
set timestamp = 2;
update t1 set b= 55 where a = 1;
set timestamp = 3;
insert into t1 values (6, 77);
set debug_sync= 'now SIGNAL end';
connection default;
show create table t1;
Table	Create Table
t1	CREATE TABLE `t1` (
  `a` int(11) NOT NULL,
  `b` int(11) DEFAULT NULL,
  PRIMARY KEY (`a`)
) ENGINE=InnoDB DEFAULT CHARSET=latin1 WITH SYSTEM VERSIONING
select *, UNIX_TIMESTAMP(row_start), UNIX_TIMESTAMP(row_end) from t1 for system_time all;
a	b	UNIX_TIMESTAMP(row_start)	UNIX_TIMESTAMP(row_end)
1	55	1.000000	2147483647.999999
3	44	1.000000	2147483647.999999
6	77	1.000000	2147483647.999999
alter table t1 drop system versioning, algorithm= copy, lock= none;
ERROR 0A000: LOCK=NONE is not supported. Reason: COPY algorithm requires a lock. Try LOCK=SHARED
#
# Test ROLLBACK TO SAVEPOINT
#
create or replace table t1 (a int);
insert t1 values (1), (2);
create or replace table t2 (a int);
insert t2 values (1), (2);
connection con2;
begin;
update t2 set a= 222 where a = 2;
savepoint savie;
update t2 set a= 111 where a = 1;
set debug_sync= 'now WAIT_FOR ended';
connection default;
set debug_sync= 'alter_table_copy_end SIGNAL ended WAIT_FOR end';
alter table t1 add b int NULL, algorithm= copy, lock= none;
connection con2;
update t1 set a= 123 where a = 1;
savepoint whoopsie;
rollback to savepoint savie;
commit;
set debug_sync= 'now SIGNAL end';
connection default;
select * from t1;
a	b
1	NULL
2	NULL
select * from t2;
a
1
222
create or replace table t1 (a int);
insert t1 values (1), (2);
create or replace table t2 (a int);
insert t2 values (1), (2);
create or replace table t3 (a int) engine=myisam;
insert t3 values (1);
connection con2;
begin;
update t2 set a= 222 where a = 2;
savepoint savie;
update t2 set a= 111 where a = 1;
set debug_sync= 'now WAIT_FOR ended';
connection default;
set debug_sync= 'alter_table_copy_end SIGNAL ended WAIT_FOR end';
alter table t1 add b int NULL, algorithm= copy, lock= none;
connection con2;
update t1 set a= 222 where a = 2;
savepoint whoopsie;
update t1 set a= 123 where a = 1;
insert t3 values (2);
select * from t1;
a
123
222
rollback to savepoint whoopsie;
Warnings:
Warning	1196	Some non-transactional changed tables couldn't be rolled back
select * from t1;
a
1
222
select * from t3;
a
1
2
commit;
set debug_sync= 'now SIGNAL end';
connection default;
select * from t1;
a	b
1	NULL
222	NULL
select * from t2;
a
111
222
select * from t3;
a
1
2
# Cleanup
set debug_sync= 'reset';
drop table t1;
drop table t2;
drop table t3;
create table t1 (a char(6), b int) engine=innodb;
insert t1 values ('abcde1',1),('abcde2',2);
set debug_sync= 'now wait_for downgraded';
connection con2;
set sql_mode='';
set debug_sync= 'alter_table_online_downgraded signal downgraded wait_for goforit';
alter table t1 modify a char(4), algorithm=copy, lock=none;
connection default;
update t1 set b=b+10 where a='abcde2';
select * from t1;
a	b
abcde1	1
abcde2	12
set debug_sync= 'now signal goforit';
connection con2;
Warnings:
Warning	1265	Data truncated for column 'a' at row 1
Warning	1265	Data truncated for column 'a' at row 2
Warning	1265	Data truncated for column 'a' at row 3
set sql_mode=default;
connection default;
show create table t1;
Table	Create Table
t1	CREATE TABLE `t1` (
  `a` char(4) DEFAULT NULL,
  `b` int(11) DEFAULT NULL
) ENGINE=InnoDB DEFAULT CHARSET=latin1
select * from t1;
a	b
abcd	1
abcd	12
drop table t1;
set debug_sync= 'reset';
#
# MDEV-28930 ALTER TABLE Deadlocks with parallel TL_WRITE
#
create table t1(a int) engine=myisam select 1;
set debug_sync='alter_table_online_before_lock SIGNAL ready WAIT_FOR go_for_locking';
alter table t1 force;
connection con2;
set debug_sync='now WAIT_FOR ready';
set debug_sync='thr_multi_lock_before_thr_lock SIGNAL go_for_locking';
update t1 set a=2;
connection default;
set debug_sync='alter_table_online_before_lock SIGNAL ready WAIT_FOR go_for_locking';
alter table mysql.global_priv force;
connection con2;
set debug_sync='now WAIT_FOR ready';
set debug_sync='thr_multi_lock_before_thr_lock SIGNAL go_for_locking';
create user user1@localhost;
connection default;
set debug_sync=reset;
drop user user1@localhost;
drop table t1;
#
# MDEV-28959 Online alter ignores strict table mode
#
create table t1 (a int);
insert into t1 values (1),(2),(3);
set debug_sync= 'now wait_for downgraded';
connection con2;
set sql_mode='STRICT_TRANS_TABLES,STRICT_ALL_TABLES';
set debug_sync= 'alter_table_online_downgraded signal downgraded wait_for goforit';
alter table t1 modify a int not null, algorithm=copy, lock=none;
connection default;
insert into t1 values (null),(null);
set debug_sync= 'now signal goforit';
connection con2;
ERROR 01000: Data truncated for column 'a' at row 4
show create table t1;
Table	Create Table
t1	CREATE TABLE `t1` (
  `a` int(11) DEFAULT NULL
) ENGINE=InnoDB DEFAULT CHARSET=latin1
select * from t1;
a
1
2
3
NULL
NULL
set sql_mode=default;
connection default;
drop table t1;
set debug_sync= reset;
#
# MDEV-28967 Assertion `marked_for_write_or_computed()' failed in Field_new_decimal::store_value / online_alter_read_from_binlog`
#
create  table t1 (a decimal(8,2), b varchar(8));
insert into t1 (b) values ('x');
set debug_sync= 'now wait_for downgraded';
connection con2;
set debug_sync= 'alter_table_online_downgraded signal downgraded wait_for goforit';
alter table t1 force, algorithm=copy, lock=none;
connection default;
insert t1 (b) values ('k');
insert t1 (b) values ('m');
set debug_sync= 'now signal goforit';
connection con2;
connection default;
drop table t1;
set debug_sync= reset;
#
# MDEV-29021 ALTER TABLE fails when a stored virtual column is dropped and added
#
create table t1 (a char(9), b char(9) as (a) stored);
insert into t1(a) values ('foobar');
set debug_sync= 'now wait_for downgraded';
connection con2;
set sql_mode='';
set debug_sync= 'alter_table_online_downgraded signal downgraded wait_for goforit';
alter table t1 drop b, add b char(3) as (a) stored, algorithm=copy, lock=none;
connection default;
update t1 set a = 'foobarqux';
set debug_sync= 'now signal goforit';
connection con2;
Warnings:
Warning	1265	Data truncated for column 'b' at row 1
Warning	1265	Data truncated for column 'b' at row 2
set sql_mode=default;
connection default;
drop table t1;
set debug_sync= reset;
# (duplicate) MDEV-29007 Assertion `marked_for_write_or_computed()'
# failed upon online ADD COLUMN .. FIRST
create table t (a int);
insert into t values (1),(2);
set debug_sync= 'now wait_for downgraded';
connection con2;
set debug_sync= 'alter_table_online_downgraded signal downgraded wait_for goforit';
alter table t add c int first, algorithm=copy, lock=none;
connection default;
insert into t values (3);
set debug_sync= 'now signal goforit';
connection con2;
connection default;
drop table t;
set debug_sync= reset;
# UNIQUE blob duplicates are not ignored.
create table t1 (b blob);
insert into t1 values ('foo'),('bar');
set debug_sync= 'now wait_for downgraded';
connection con2;
set debug_sync= 'alter_table_online_downgraded signal downgraded wait_for goforit';
alter table t1 add unique(b), algorithm=copy, lock=none;
connection default;
insert into t1 values ('qux'),('foo');
set debug_sync= 'now signal goforit';
connection con2;
ERROR 23000: Duplicate entry 'foo' for key 'b'
select * from t1;
b
foo
bar
qux
foo
show create table t1;
Table	Create Table
t1	CREATE TABLE `t1` (
  `b` blob DEFAULT NULL
) ENGINE=InnoDB DEFAULT CHARSET=latin1
connection default;
drop table t1;
set debug_sync= reset;
#
# DELETE with added virtual column
#
CREATE TABLE t1 (a CHAR(3), b CHAR(3) AS (a));
INSERT INTO t1 (a) VALUES ('foo'),('bar');
set debug_sync= 'now wait_for downgraded';
connection con2;
set debug_sync= 'alter_table_online_downgraded signal downgraded wait_for goforit';
ALTER TABLE t1 ADD c INT, ALGORITHM=COPY, LOCK=NONE;
connection default;
DELETE FROM t1;
set debug_sync= 'now signal goforit';
connection con2;
select * from t1;
a	b	c
connection default;
DROP TABLE t1;
set debug_sync= reset;
#
# Do not ignore sql_mode when replicating
#
create table t1 (a int);
insert into t1 values (1);
set debug_sync= 'now wait_for downgraded';
connection con2;
set sql_mode='STRICT_ALL_TABLES,ERROR_FOR_DIVISION_BY_ZERO';
set debug_sync= 'alter_table_online_downgraded signal downgraded wait_for goforit';
alter table t1 add b int as (1/a) stored, algorithm=copy, lock=none;
connection default;
update t1 set a= 0 where a=1;
set debug_sync= 'now signal goforit';
connection con2;
ERROR 22012: Division by 0
set sql_mode= default;
connection default;
drop table t1;
set debug_sync= reset;
#
# MDEV-29067 Online alter ignores check constraint violation
#
## CHECK, INSERT
create table t1 (a int);
insert t1 values (1),(2);
set debug_sync= 'now wait_for downgraded';
connection con2;
set debug_sync= 'alter_table_online_downgraded signal downgraded wait_for goforit';
alter table t1 add check (a<10), algorithm=copy, lock=none;
connection default;
insert t1 values (11),(12);
set debug_sync= 'now signal goforit';
connection con2;
ERROR 23000: CONSTRAINT `CONSTRAINT_1` failed for `test`.`t1`
connection default;
show create table t1;
Table	Create Table
t1	CREATE TABLE `t1` (
  `a` int(11) DEFAULT NULL
) ENGINE=InnoDB DEFAULT CHARSET=latin1
select * from t1;
a
1
2
11
12
drop table t1;
## DEFAULT, INSERT
create table t1 (a int);
insert t1 values (1),(2);
set debug_sync= 'now wait_for downgraded';
connection con2;
set debug_sync= 'alter_table_online_downgraded signal downgraded wait_for goforit';
alter table t1 add b int default(a+10), algorithm=copy, lock=none;
connection default;
insert t1 values (11),(12);
set debug_sync= 'now signal goforit';
connection con2;
connection default;
show create table t1;
Table	Create Table
t1	CREATE TABLE `t1` (
  `a` int(11) DEFAULT NULL,
  `b` int(11) DEFAULT (`a` + 10)
) ENGINE=InnoDB DEFAULT CHARSET=latin1
select * from t1;
a	b
1	11
2	12
11	21
12	22
drop table t1;
set debug_sync= 'reset';
## CHECK, UPDATE
create table t1 (a int) engine=innodb;
insert t1 values (1),(2),(3),(4);
set debug_sync= 'now wait_for downgraded';
connection con2;
set debug_sync= 'alter_table_online_downgraded signal downgraded wait_for goforit';
alter table t1 add check (a<10), algorithm=copy, lock=none;
connection default;
update t1 set a=a+10 where a > 2;
set debug_sync= 'now signal goforit';
connection con2;
ERROR 23000: CONSTRAINT `CONSTRAINT_1` failed for `test`.`t1`
connection default;
show create table t1;
Table	Create Table
t1	CREATE TABLE `t1` (
  `a` int(11) DEFAULT NULL
) ENGINE=InnoDB DEFAULT CHARSET=latin1
select * from t1;
a
1
2
13
14
drop table t1;
## DEFAULT, UPDATE
create table t1 (a int) engine=innodb;
insert t1 values (1),(2),(3),(4);
set debug_sync= 'now wait_for downgraded';
connection con2;
set debug_sync= 'alter_table_online_downgraded signal downgraded wait_for goforit';
alter table t1 add b int default(a+10), algorithm=copy, lock=none;
connection default;
update t1 set a=a+10 where a > 2;
set debug_sync= 'now signal goforit';
connection con2;
connection default;
show create table t1;
Table	Create Table
t1	CREATE TABLE `t1` (
  `a` int(11) DEFAULT NULL,
  `b` int(11) DEFAULT (`a` + 10)
) ENGINE=InnoDB DEFAULT CHARSET=latin1
select * from t1;
a	b
1	11
2	12
13	23
14	24
drop table t1;
set debug_sync= 'reset';
#
# MDEV-29013 ER_KEY_NOT_FOUND/lock timeout upon online alter
# with long unique indexes
#
create table t1 (b text not null, unique(b));
insert into t1 values ('foo'),('bar');
set debug_sync= 'now wait_for downgraded';
connection con2;
set debug_sync= 'alter_table_online_downgraded signal downgraded wait_for goforit';
alter table t1 add c int, algorithm=copy, lock=none;
connection default;
delete from t1;
set debug_sync= 'now signal goforit';
connection con2;
connection default;
drop table t1;
set debug_sync= reset;
###
create table t1 (a text, unique(a)) engine=innodb;
create table t2 (b text, unique(b)) engine=innodb;
insert into t2 values (null),(null);
set debug_sync= 'now wait_for downgraded';
connection con2;
set debug_sync= 'alter_table_online_downgraded signal downgraded wait_for goforit';
alter table t2 add column c int, algorithm=copy, lock=none;
connection default;
delete from t2;
set debug_sync= 'now signal goforit';
connection con2;
connection default;
alter table t2 force;
alter table t1 force;
drop table t1, t2;
set debug_sync= reset;
#
# MDEV-29069 ER_KEY_NOT_FOUND upon online autoinc addition and
# concurrent DELETE
#
set @old_dbug=@@debug_dbug;
set debug_dbug="+d,rpl_report_chosen_key";
create table t (a int);
insert into t values (10),(20),(30);
set debug_sync= 'alter_table_online_downgraded signal downgraded wait_for goforit';
alter table t add pk int auto_increment primary key, algorithm=copy, lock=none;
connection con2;
set debug_sync= 'now wait_for downgraded';
delete from t where a = 20;
update t set a = a + 1 where a = 10;
set debug_sync= 'now signal goforit';
connection default;
Warnings:
Note	1105	Key chosen: -1
Note	1105	Key chosen: -1
select * from t;
a	pk
11	1
30	3
#
# Add clumsy DEFAULT
#
create or replace table t (a int);
insert into t values (10),(20),(30);
set debug_sync= 'alter_table_online_downgraded signal downgraded wait_for goforit';
alter table t add b int default(RAND() * 20), add key(b),
algorithm=copy, lock=none;
connection con2;
set debug_sync= 'now wait_for downgraded';
delete from t where a = 20;
update t set a = a + 1 where a = 10;
set debug_sync= 'now signal goforit';
connection default;
Warnings:
Note	1105	Key chosen: -1
Note	1105	Key chosen: -1
select a from t;
a
11
30
# CURRENT_TIMESTAMP
create or replace table t (a int);
insert into t values (10),(20),(30);
set debug_sync= 'alter_table_online_downgraded signal downgraded wait_for goforit';
alter table t add b timestamp default CURRENT_TIMESTAMP, add key(b),
algorithm=copy, lock=none;
connection con2;
set debug_sync= 'now wait_for downgraded';
delete from t where a = 20;
update t set a = a + 1 where a = 10;
set debug_sync= 'now signal goforit';
connection default;
Warnings:
Note	1105	Key chosen: -1
Note	1105	Key chosen: -1
select a from t;
a
11
30
# CURRENT_TIMESTAMP, mixed key
create or replace table t (a int);
insert into t values (10),(20),(30);
set debug_sync= 'alter_table_online_downgraded signal downgraded wait_for goforit';
alter table t add b timestamp default CURRENT_TIMESTAMP, add key(a, b),
algorithm=copy, lock=none;
connection con2;
set debug_sync= 'now wait_for downgraded';
delete from t where a = 20;
update t set a = a + 1 where a = 10;
set debug_sync= 'now signal goforit';
connection default;
Warnings:
Note	1105	Key chosen: -1
Note	1105	Key chosen: -1
select a from t;
a
11
30
# Mixed primary key
create or replace table t (a int);
insert into t values (10),(20),(30);
set debug_sync= 'alter_table_online_downgraded signal downgraded wait_for goforit';
alter table t add b int default (a+1), add primary key(b, a),
algorithm=copy, lock=none;
connection con2;
set debug_sync= 'now wait_for downgraded';
delete from t where a = 20;
update t set a = a + 1 where a = 10;
set debug_sync= 'now signal goforit';
connection default;
Warnings:
Note	1105	Key chosen: -1
Note	1105	Key chosen: -1
select a from t;
a
11
30
#
# Normal row, could be used as a key
#
create or replace table t (a int);
insert into t values (10),(20),(30);
set debug_sync= 'alter_table_online_downgraded signal downgraded wait_for goforit';
alter table t add b int as (a * 10) unique, algorithm=copy, lock=none;
connection con2;
set debug_sync= 'now wait_for downgraded';
delete from t where a = 20;
update t set a = a + 1 where a = 10;
set debug_sync= 'now signal goforit';
connection default;
Warnings:
Note	1105	Key chosen: -1
Note	1105	Key chosen: -1
#
# Add key for old row
#
create or replace table t (a int);
insert into t values (10),(20),(30);
set debug_sync= 'alter_table_online_downgraded signal downgraded wait_for goforit';
alter table t add unique(a), algorithm=copy, lock=none;
connection con2;
set debug_sync= 'now wait_for downgraded';
delete from t where a = 20;
update t set a = a + 1 where a = 10;
set debug_sync= 'now signal goforit';
connection default;
Warnings:
Note	1105	Key chosen: 0
Note	1105	Key chosen: 0
drop table t;
set debug_sync= reset;
set debug_dbug= @old_debug;
connection default;
#
# End of 10.10 tests
#
