# Tests for delete with INNODB
#
# MDEV-22187: SIGSEGV in ha_innobase::cmp_ref on DELETE
#
SET @save_sort_buffer_size= @@sort_buffer_size;
SET sort_buffer_size=1024;
CREATE TABLE t1(c1 CHAR(255) PRIMARY KEY) ENGINE=InnoDB;
INSERT INTO t1 VALUES (0), ('a'), ('b');
ANALYZE TABLE t1 PERSISTENT FOR ALL;
Table	Op	Msg_type	Msg_text
test.t1	analyze	status	Engine-independent statistics collected
test.t1	analyze	status	OK
SELECT * FROM t1;
c1
0
a
b
EXPLAIN DELETE b FROM t1 AS a JOIN t1 AS b;
id	select_type	table	type	possible_keys	key	key_len	ref	rows	Extra
1	SIMPLE	a	ALL	NULL	NULL	NULL	NULL	3	
1	SIMPLE	b	ALL	NULL	NULL	NULL	NULL	3	
DELETE b FROM t1 AS a JOIN t1 AS b;
SELECT * FROM t1;
c1
SET sort_buffer_size=@save_sort_buffer_size;
DROP TABLE t1;
#
# MDEV-32212 DELETE with ORDER BY and semijoin optimization causing crash
#
CREATE TABLE t1 (c1 INT) ENGINE=InnoDB;
CREATE TABLE t2 (c2 INT) ENGINE=InnoDB;
INSERT INTO t1 values (1),(2),(3),(4),(5),(6);
INSERT INTO t2 values (2);
DELETE FROM t1 WHERE c1 IN (select c2 from t2);
select * from t1;
c1
1
3
4
5
6
truncate t1;
truncate t2;
INSERT INTO t1 values (1),(2),(3),(4),(5),(6);
INSERT INTO t2 values (2);
check sj optimization with order-by
analyze DELETE FROM t1 WHERE c1 IN (select c2 from t2) ORDER BY c1;
id	select_type	table	type	possible_keys	key	key_len	ref	rows	r_rows	filtered	r_filtered	Extra
1	PRIMARY	t1	ALL	NULL	NULL	NULL	NULL	6	6.00	100.00	100.00	Using filesort
1	PRIMARY	t2	ALL	NULL	NULL	NULL	NULL	1	1.00	100.00	16.67	Using where; FirstMatch(t1)
select * from t1;
c1
1
3
4
5
6
truncate t2;
INSERT INTO t2 values (3);
disallows sj optimization
analyze DELETE FROM t1 WHERE c1 IN (select c2 from t2) ORDER BY c1 limit 1;
id	select_type	table	type	possible_keys	key	key_len	ref	rows	r_rows	filtered	r_filtered	Extra
1	PRIMARY	t1	ALL	NULL	NULL	NULL	NULL	5	1.00	100.00	100.00	Using where; Using filesort
2	DEPENDENT SUBQUERY	t2	ALL	NULL	NULL	NULL	NULL	1	1.00	100.00	20.00	Using where
select * from t1;
c1
1
4
5
6
DROP TABLE t1, t2;
End of 11.1 tests
