#
# What a JSON function reads back out of a temporary table the server
# built for itself.
#
# Such a table is written, read and thrown away inside one query, and
# no statement can name it, so what goes into a column of one is
# decided once, when the column is made.  A column whose one producer
# always gives back a document therefore holds documents, and a
# reader of it can be spared finding that out again.
#
# A column of a table anybody can name says nothing of the sort: a row
# can hold bytes no check ever saw, and nothing in one records where
# they came from.  The answers below are the same either way - the
# reading that is left out could only have found out what was already
# known - so this file is here to say that they stay the same.
#
SET NAMES utf8mb4;
SET optimizer_switch='derived_merge=off';
CREATE TABLE t1 (id INT, j VARCHAR(64) CHECK (JSON_VALID(j))) CHARSET utf8mb4;
INSERT INTO t1 VALUES (1, '{"a":1}'), (2, '[1,2]');
#
# 1. A document out of a temporary table, spliced into a new one.
#
SELECT id, JSON_ARRAY(x) AS spliced FROM
(SELECT id, JSON_SET(j, '$.c', id) AS x FROM t1) d ORDER BY id;
id	spliced
1	[{"a": 1, "c": 1}]
2	[[1, 2]]
SELECT id, JSON_OBJECT('k', x) AS spliced FROM
(SELECT id, JSON_EXTRACT(j, '$') AS x FROM t1) d ORDER BY id;
id	spliced
1	{"k": {"a": 1}}
2	{"k": [1, 2]}
#
# 2. The same, edited rather than spliced.
#
SELECT id, JSON_SET(x, '$.d', 4) AS edited FROM
(SELECT id, JSON_SET(j, '$.c', id) AS x FROM t1) d ORDER BY id;
id	edited
1	{"a": 1, "c": 1, "d": 4}
2	[1, 2]
SELECT id, JSON_MERGE_PATCH(x, '{"e":5}') AS merged FROM
(SELECT id, JSON_EXTRACT(j, '$') AS x FROM t1) d ORDER BY id;
id	merged
1	{"a": 1, "e": 5}
2	{"e": 5}
#
# 3. Asked about, rather than read.
#
SELECT id, JSON_VALID(x) AS valid, JSON_TYPE(x) AS what, JSON_DEPTH(x) AS deep
FROM (SELECT id, JSON_SET(j, '$.c', id) AS x FROM t1) d ORDER BY id;
id	valid	what	deep
1	1	OBJECT	2
2	1	ARRAY	2
#
# 4. Through a GROUP BY, a DISTINCT and an ORDER BY, each of which
# writes a temporary table of its own.
#
SELECT JSON_ARRAY(x) AS grouped FROM
(SELECT id, JSON_SET(j, '$.c', id) AS x FROM t1 GROUP BY id, j) d
ORDER BY x;
grouped
[[1, 2]]
[{"a": 1, "c": 1}]
SELECT DISTINCT JSON_ARRAY(x) AS distincted FROM
(SELECT JSON_SET(j, '$.c', 1) AS x FROM t1) d ORDER BY 1;
distincted
[[1, 2]]
[{"a": 1, "c": 1}]
#
# 5. Through a UNION, whose column has one producer per branch and
# answers what all of them answer - the branches being where they
# are all in reach.  One that does not answer is the whole column
# not answering, there being no telling afterwards which branch a
# row came out of.
#
SELECT JSON_ARRAY(x) AS unioned FROM
(SELECT JSON_SET(j, '$.c', 1) AS x FROM t1
UNION ALL
SELECT j FROM t1) d ORDER BY 1;
unioned
[[1, 2]]
[[1,2]]
[{"a": 1, "c": 1}]
[{"a":1}]
SELECT JSON_ARRAY(x) AS unioned FROM
(SELECT JSON_SET(j, '$.c', 1) AS x FROM t1
UNION ALL
SELECT JSON_EXTRACT(j, '$') FROM t1) d ORDER BY 1;
unioned
[[1, 2]]
[[1, 2]]
[{"a": 1, "c": 1}]
[{"a": 1}]
SELECT JSON_ARRAY(x) AS unioned FROM
(SELECT JSON_EXTRACT(j, '$') AS x FROM t1
UNION
SELECT JSON_QUERY(j, '$') FROM t1) d ORDER BY 1;
unioned
[[1, 2]]
[[1,2]]
[{"a": 1}]
[{"a":1}]
SELECT JSON_ARRAY(x) AS unioned FROM
(SELECT JSON_EXTRACT(j, '$') AS x FROM t1
EXCEPT
SELECT JSON_EXTRACT(j, '$') FROM t1 WHERE id = 9) d ORDER BY 1;
unioned
[[1, 2]]
[{"a": 1}]
#
# The same column written one list of values at a time.
#
WITH d(x) AS
(VALUES (JSON_EXTRACT('{"a":1}', '$')), (JSON_QUERY('[1,2]', '$')))
SELECT JSON_ARRAY(x) AS unioned FROM d ORDER BY 1;
unioned
[[1,2]]
[{"a": 1}]
WITH d(x) AS
(VALUES (JSON_EXTRACT('{"a":1}', '$')), (JSON_OBJECT('b', 2)))
SELECT JSON_ARRAY(x) AS unioned FROM d ORDER BY 1;
unioned
[{"a": 1}]
[{"b": 2}]
#
# A column of a recursive CTE is built once the parts that do not go
# round have agreed on a type, the parts that DO go round not being
# reached at all.  So a value can arrive there from a producer
# nothing asked, and here one arrives that is no document: a column
# typed JSON holds whatever was put in it while its check was off.
#
CREATE TABLE t5 (good JSON, bad JSON);
SET @old_check= @@SESSION.check_constraint_checks;
SET SESSION check_constraint_checks= OFF;
INSERT INTO t5 VALUES ('{"a":1}', 'not a document');
SET SESSION check_constraint_checks= @old_check;
WITH RECURSIVE r AS (
SELECT 1 AS n, JSON_EXTRACT(good, '$') AS x FROM t5
UNION ALL
SELECT n + 1, t5.bad FROM r, t5 WHERE n < 2)
SELECT n, JSON_ARRAY(x) AS unioned FROM r ORDER BY n;
n	unioned
1	[{"a": 1}]
2	[not a document]
Warnings:
Note	4038	Syntax error in JSON text in argument 1 to function 'json_array' at position 1
DROP TABLE t5;
#
# Branches written in different character sets.  The column takes
# one set for all of them, and a branch whose own set is not that
# one is stored into it converting.  A store into the binary set
# converts nothing: it keeps every byte and calls them by the other
# set's name, so a document written in a wide set arrives as bytes
# that nothing reads as a document, and it arrives at exactly the
# length it was written at.  A byte count is therefore the one
# measure that cannot tell this apart, and each branch is asked
# about its characters as well as its length.
#
CREATE TABLE t6 (j VARCHAR(64) CHECK (JSON_VALID(j))) CHARSET ucs2;
INSERT INTO t6 VALUES ('{"a":1}'), ('[1,2]');
CREATE TABLE t7 (b BLOB);
INSERT INTO t7 VALUES ('{"b":2}'), ('[3,4]');
SELECT HEX(JSON_ARRAY(x)) AS packed, JSON_VALID(x) AS still_a_document,
HEX(x) AS bytes FROM
(SELECT JSON_QUERY(j, '$') AS x FROM t6
UNION ALL
SELECT JSON_QUERY(b, '$') FROM t7) d ORDER BY bytes;
packed	still_a_document	bytes
5B005B0031002C0032005D5D	0	005B0031002C0032005D
5B007B002200610022003A0031007D5D	0	007B002200610022003A0031007D
5B5B332C345D5D	1	5B332C345D
5B7B2262223A327D5D	1	7B2262223A327D
Warnings:
Note	4036	Character disallowed in JSON in argument 1 to function 'json_array' at position 1
Note	4036	Character disallowed in JSON in argument 1 to function 'json_valid' at position 1
Note	4036	Character disallowed in JSON in argument 1 to function 'json_array' at position 1
Note	4036	Character disallowed in JSON in argument 1 to function 'json_valid' at position 1
#
# The same two branches with the wide one on the right, so that it
# is the second producer rather than the first that has to move.
#
SELECT HEX(JSON_ARRAY(x)) AS packed, JSON_VALID(x) AS still_a_document,
HEX(x) AS bytes FROM
(SELECT JSON_QUERY(b, '$') AS x FROM t7
UNION ALL
SELECT JSON_QUERY(j, '$') FROM t6) d ORDER BY bytes;
packed	still_a_document	bytes
5B005B0031002C0032005D5D	0	005B0031002C0032005D
5B007B002200610022003A0031007D5D	0	007B002200610022003A0031007D
5B5B332C345D5D	1	5B332C345D
5B7B2262223A327D5D	1	7B2262223A327D
Warnings:
Note	4036	Character disallowed in JSON in argument 1 to function 'json_array' at position 1
Note	4036	Character disallowed in JSON in argument 1 to function 'json_valid' at position 1
Note	4036	Character disallowed in JSON in argument 1 to function 'json_array' at position 1
Note	4036	Character disallowed in JSON in argument 1 to function 'json_valid' at position 1
#
# And both branches in the wide set, where the column takes that
# same set and every character comes across as the one written.
#
SELECT JSON_ARRAY(x) AS unioned, JSON_VALID(x) AS still_a_document FROM
(SELECT JSON_QUERY(j, '$') AS x FROM t6
UNION ALL
SELECT JSON_QUERY(j, '$') FROM t6 WHERE j <> '[1,2]') d ORDER BY 1;
unioned	still_a_document
[[1,2]]	1
[{"a":1}]	1
[{"a":1}]	1
DROP TABLE t6, t7;
#
# 6. A producer that is a document only some of the time keeps its
# column untrusted.  JSON_OBJECT answers per evaluation, not for the
# class, so a column fed by one is read like any other.
#
SELECT JSON_ARRAY(x) AS spliced FROM
(SELECT JSON_OBJECT('a', id) AS x FROM t1) d ORDER BY 1;
spliced
[{"a": 1}]
[{"a": 2}]
#
# 7. A function that returns more than it was given.  JSON_REMOVE
# writes a space after every separator it copies, so taking one
# element out of a dense array returns more than there was to begin
# with, and the column it goes into has to have been asked for wide
# enough to hold it.
#
CREATE TABLE t7 (j VARCHAR(64) CHECK (JSON_VALID(j))) CHARSET utf8mb4;
INSERT INTO t7 VALUES
('[1,1,1,1,1,1,1,1,1,1,1,1,1,1,1,1,1,1,1,1,1,1,1,1,1,1,1,1,1,1]'),
('[2,2,2,2,2,2,2,2,2,2,2,2,2,2,2,2,2,2,2,2,2,2,2,2,2,2,2,2,2,2]');
SELECT LENGTH(j) AS given, LENGTH(JSON_REMOVE(j, '$[0]')) AS produced
FROM t7 ORDER BY 1, 2;
given	produced
61	87
61	87
SELECT LENGTH(x) AS kept, JSON_VALID(x) AS still_a_document FROM
(SELECT JSON_REMOVE(j, '$[0]') AS x FROM t7) d ORDER BY 1;
kept	still_a_document
87	1
87	1
DROP TABLE t7;
#
# The same function on a document that leaves room to spare.
#
SELECT JSON_ARRAY(x) AS spliced FROM
(SELECT JSON_REMOVE(j, '$.a') AS x FROM t1 WHERE id = 1) d;
spliced
[{}]
#
# 8. A table the user asked for is not the server's own, whatever is
# written into it and whatever check it carries.
#
CREATE TEMPORARY TABLE tt (x VARCHAR(64) CHECK (JSON_VALID(x))) CHARSET utf8mb4;
INSERT INTO tt SELECT JSON_SET(j, '$.c', id) FROM t1;
SELECT JSON_ARRAY(x) AS spliced FROM tt ORDER BY 1;
spliced
[[1, 2]]
[{"a": 1, "c": 1}]
DROP TEMPORARY TABLE tt;
#
# 9. A materialized subquery.
#
SELECT id FROM t1 WHERE JSON_ARRAY(j) IN
(SELECT JSON_ARRAY(x) FROM (SELECT j AS x FROM t1) d) ORDER BY id;
id
1
2
#
# 10. Two temporary tables one after the other.  The second was
# built before a row of the first existed, so what it was given
# then is only as much as the first can still say later, and it
# asks again for every row put across.
#
SELECT JSON_ARRAY(y) AS spliced FROM
(SELECT x AS y FROM
(SELECT JSON_SET(j, '$.c', id) AS x FROM t1) d1) d2 ORDER BY 1;
spliced
[[1, 2]]
[{"a": 1, "c": 1}]
#
# The same three deep, and with a grouping in the middle so the row
# crosses by more than one route.
#
SELECT JSON_ARRAY(z) AS spliced FROM
(SELECT y AS z FROM
(SELECT x AS y FROM
(SELECT JSON_SET(j, '$.c', id) AS x FROM t1) d1) d2) d3 ORDER BY 1;
spliced
[[1, 2]]
[{"a": 1, "c": 1}]
SELECT JSON_ARRAY(y) AS spliced FROM
(SELECT x AS y FROM
(SELECT JSON_EXTRACT(j, '$') AS x FROM t1) d1 GROUP BY x) d2 ORDER BY 1;
spliced
[[1, 2]]
[{"a": 1}]
#
# 11. A NULL, which is not a document and is not read as one.
#
SELECT JSON_ARRAY(x) AS spliced FROM
(SELECT JSON_SET(NULL, '$.c', 1) AS x FROM t1) d ORDER BY 1;
spliced
[null]
[null]
#
# 12. A document written in one character set and read in another.
#
SELECT JSON_ARRAY(x) AS spliced FROM
(SELECT CONVERT(JSON_SET(j, '$.c', 1) USING latin1) AS x FROM t1) d
ORDER BY 1;
spliced
[[1, 2]]
[{"a": 1, "c": 1}]
SELECT JSON_ARRAY(x) AS spliced FROM
(SELECT JSON_SET(CONVERT(j USING latin1), '$.c', 1) AS x FROM t1) d
ORDER BY 1;
spliced
[[1, 2]]
[{"a": 1, "c": 1}]
DROP TABLE t1;
#
# 13. A window function's temporary table.
#
CREATE TABLE t2 (id INT, g INT, j VARCHAR(64) CHECK (JSON_VALID(j)))
CHARSET utf8mb4;
INSERT INTO t2 VALUES (1, 1, '{"a":1}'), (2, 1, '{"b":2}'), (3, 2, '[3]');
SELECT id, JSON_ARRAY(x) AS spliced FROM
(SELECT id, JSON_SET(j, '$.n',
ROW_NUMBER() OVER (PARTITION BY g ORDER BY id)) AS x
FROM t2) d ORDER BY id;
id	spliced
1	[{"a": 1, "n": 1}]
2	[{"b": 2, "n": 2}]
3	[[3]]
#
# 14. An aggregate, which gathers its elements in a table of its own
# and reads them back out of a record.
#
SELECT JSON_ARRAYAGG(JSON_EXTRACT(j, '$')) AS gathered FROM t2;
gathered
[{"a": 1},{"b": 2},[3]]
SELECT JSON_ARRAYAGG(JSON_OBJECT('a', id)) AS gathered FROM t2;
gathered
[{"a": 1},{"a": 2},{"a": 3}]
SELECT g, JSON_OBJECTAGG(id, JSON_EXTRACT(j, '$')) AS gathered FROM t2
GROUP BY g ORDER BY g;
g	gathered
1	{"1":{"a": 1}, "2":{"b": 2}}
2	{"3":[3]}
#
# 15. The same, with the arguments buffered before the group can be
# built.  Each group gathers the same row more than once, so what is
# gathered reads the same whichever order the rows arrive in - an
# order a grouping does not fix and this file must not depend on.
#
CREATE TABLE t15m (g INT);
INSERT INTO t15m VALUES (1), (1), (2), (2);
SELECT JSON_OBJECTAGG(a.id, JSON_EXTRACT(a.j, '$')) AS gathered
FROM t2 a, t15m b WHERE a.g = b.g AND a.id IN (1, 3)
GROUP BY a.g ORDER BY a.g DESC;
gathered
{"3":[3], "3":[3]}
{"1":{"a": 1}, "1":{"a": 1}}
SELECT JSON_ARRAYAGG(JSON_EXTRACT(a.j, '$')) AS gathered
FROM t2 a, t15m b WHERE a.g = b.g AND a.id IN (1, 3)
GROUP BY a.g ORDER BY a.g DESC;
gathered
[[3],[3]]
[{"a": 1},{"a": 1}]
DROP TABLE t15m;
#
# 16. A value the aggregate cannot carry as a document.
#
SELECT JSON_ARRAYAGG(j) AS gathered FROM t2;
gathered
[{"a":1},{"b":2},[3]]
#
# 17. A grouping that writes no temporary table holds its values in
# buffers instead, and a HAVING or an ORDER BY reads them back out
# of those rather than out of a record.
#
SELECT MAX(id) AS m, JSON_SET(j, '$.c', 1) AS x FROM t2
HAVING JSON_ARRAY(x) <> '[]';
m	x
3	{"a": 1, "c": 1}
SELECT MAX(id) AS m, JSON_EXTRACT(j, '$') AS x FROM t2
ORDER BY JSON_ARRAY(x);
m	x
3	{"a": 1}
SELECT MAX(id) AS m, JSON_OBJECT('a', id) AS x FROM t2
HAVING JSON_ARRAY(x) <> '[]';
m	x
3	{"a": 1}
#
# The same where the buffer is filled from a column rather than
# from an item, which is the route a value wide enough to be kept
# apart from its row takes.
#
CREATE TABLE t17 (id INT, j JSON) CHARSET utf8mb4;
INSERT INTO t17 VALUES (1, '{"a":1}'), (2, '[1,2]');
SELECT MAX(d.id) AS m, d.x AS y FROM
(SELECT id, JSON_SET(j, '$.c', 1) AS x FROM t17) d
HAVING JSON_ARRAY(y) <> '[]';
m	y
2	{"a": 1, "c": 1}
SELECT MAX(d.id) AS m, d.j AS y FROM t17 d
HAVING JSON_ARRAY(y) <> '[]';
m	y
2	{"a":1}
DROP TABLE t17;
#
# A NULL, and a character set conversion around the producer -
# which carries the value through while the type stops at it, so the
# buffer attests to nothing and the value is quoted, not spliced.
#
SELECT MAX(id) AS m, JSON_SET(NULL, '$.c', 1) AS x FROM t2
HAVING JSON_ARRAY(x) IS NULL;
m	x
SELECT MAX(id) AS m, CONVERT(JSON_EXTRACT(j, '$') USING latin1) AS x FROM t2
ORDER BY JSON_ARRAY(x);
m	x
3	{"a": 1}
#
# Quoted rather than spliced is the whole of what the buffer was
# asked, and a buffer is read from a HAVING or an ORDER BY and never
# from the select list - so what went into the document is only to
# be had through a comparison.  Asking what its first element IS
# tells the two apart, and the row comes back for whichever
# happened.
#
SELECT MAX(id) AS m, JSON_EXTRACT(j, '$') AS x FROM t2
HAVING JSON_TYPE(JSON_EXTRACT(JSON_ARRAY(x), '$[0]')) = 'OBJECT';
m	x
3	{"a": 1}
SELECT MAX(id) AS m, CONVERT(JSON_EXTRACT(j, '$') USING latin1) AS x FROM t2
HAVING JSON_TYPE(JSON_EXTRACT(JSON_ARRAY(x), '$[0]')) = 'OBJECT';
m	x
SELECT MAX(id) AS m, CONVERT(JSON_EXTRACT(j, '$') USING latin1) AS x FROM t2
HAVING JSON_TYPE(JSON_EXTRACT(JSON_ARRAY(x), '$[0]')) = 'STRING';
m	x
3	{"a": 1}
#
# And the same conversion with no buffer in the way IS looked
# through, which is what makes the two above a fact about the buffer
# rather than about the conversion.
#
SELECT id, JSON_ARRAY(CONVERT(JSON_EXTRACT(j, '$') USING latin1)) AS r
FROM t2 ORDER BY id;
id	r
1	[{"a": 1}]
2	[{"b": 2}]
3	[[3]]
#
# 18. How a value is FORMATTED, which is a second thing such a column
# can attest to and is come by differently.  Being a document is
# promised by the producer before a row exists; the formatting is
# settled one value at a time, so it is granted along with the first
# answer and spent by whatever gets written afterwards.
#
CREATE TABLE t18 (id INT, j JSON) CHARSET utf8mb4;
INSERT INTO t18 VALUES (1, '{"a":1}'), (2, '[1,2]');
#
# Edited out of a column whose producer writes the loose way, out of
# one that copies a sub-document in whatever way it found it, and out
# of one that writes a form of its own.
#
SELECT id, JSON_SET(x, '$.c', 1) AS r FROM
(SELECT id, JSON_EXTRACT(j, '$') AS x FROM t18) d ORDER BY id;
id	r
1	{"a": 1, "c": 1}
2	[1, 2]
SELECT id, JSON_SET(x, '$.c', 1) AS r FROM
(SELECT id, JSON_QUERY(j, '$') AS x FROM t18) d ORDER BY id;
id	r
1	{"a": 1, "c": 1}
2	[1, 2]
SELECT id, JSON_SET(x, '$.c', 1) AS r FROM
(SELECT id, JSON_NORMALIZE(j) AS x FROM t18) d ORDER BY id;
id	r
1	{"a": 1.0E0, "c": 1}
2	[1.0E0, 2.0E0]
#
# Carried from one such table into the next, and taken back there
# where what the first holds was written some other way.
#
SELECT id, JSON_SET(y, '$.c', 1) AS r FROM
(SELECT id, x AS y FROM
(SELECT id, JSON_EXTRACT(j, '$') AS x FROM t18) d1) d2 ORDER BY id;
id	r
1	{"a": 1, "c": 1}
2	[1, 2]
SELECT id, JSON_SET(y, '$.c', 1) AS r FROM
(SELECT id, x AS y FROM
(SELECT id, JSON_QUERY(j, '$') AS x FROM t18) d1) d2 ORDER BY id;
id	r
1	{"a": 1, "c": 1}
2	[1, 2]
#
# The same across the copier that fills a grouping's table.
#
SELECT id, JSON_SET(y, '$.c', 1) AS r FROM
(SELECT id, x AS y FROM
(SELECT id, JSON_EXTRACT(j, '$') AS x FROM t18) d1 GROUP BY id, x) d2
ORDER BY id;
id	r
1	{"a": 1, "c": 1}
2	[1, 2]
SELECT id, JSON_SET(y, '$.c', 1) AS r FROM
(SELECT id, x AS y FROM
(SELECT id, JSON_QUERY(j, '$') AS x FROM t18) d1 GROUP BY id, x) d2
ORDER BY id;
id	r
1	{"a": 1, "c": 1}
2	[1, 2]
#
# An aggregate reads its elements out of a record, the column being
# the only thing left there to ask - so what it says about their
# formatting is what the gathered document can say about its own.
#
SELECT JSON_ARRAY(JSON_ARRAYAGG(x)) AS r FROM
(SELECT id, JSON_EXTRACT(j, '$') AS x FROM t18) d;
r
[[{"a": 1},[1, 2]]]
SELECT JSON_ARRAY(JSON_ARRAYAGG(x)) AS r FROM
(SELECT id, JSON_QUERY(j, '$') AS x FROM t18) d;
r
[[{"a":1},[1,2]]]
DROP TABLE t18;
#
# 19. How deep the values went, which is a figure rather than a yes.
#
# What a column keeps is the deepest of the rows written into it so
# far, not the depth of the row being read - more than that row
# needs and never less.  More is the direction this one is allowed
# to be wrong in: a figure too large costs a reading that could have
# been skipped, while one too small would admit a document that
# nothing can read back.  Nothing acts on the figure except to skip
# a reading, so the answers below are the ones the server has always
# given.
#
SET @k30= CONCAT(REPEAT(CONCAT('{"', REPEAT('k', 10), '":'), 30),
'1', REPEAT('}', 30));
SET @k31= CONCAT(REPEAT(CONCAT('{"', REPEAT('k', 10), '":'), 31),
'1', REPEAT('}', 31));
CREATE TABLE t19 (id INT, j LONGTEXT) CHARSET utf8mb4;
INSERT INTO t19 VALUES (1, @k30), (2, '{"a":1}');
#
# One row at the limit and a shallow one beside it, put one level
# in.  The column answers 30 for both, which is exact for the first
# and too large for the second, and each still ends up where it
# belongs.
#
SELECT id, JSON_DEPTH(JSON_ARRAY(x)) AS d FROM
(SELECT id, JSON_EXTRACT(j, '$') AS x FROM t19) d ORDER BY id;
id	d
1	32
2	3
#
# A byte past it, where the same shape is refused - and the shallow
# row in the same column is not, the figure being about the column
# and the limit about each document that comes out of it.
#
UPDATE t19 SET j= @k31 WHERE id= 1;
SELECT id, JSON_DEPTH(JSON_ARRAY(x)) AS d FROM
(SELECT id, JSON_EXTRACT(j, '$') AS x FROM t19) d ORDER BY id;
id	d
1	NULL
2	3
Warnings:
Note	4040	Limit of 32 on JSON nested structures depth is reached in argument 1 to function 'json_array' at position 497
Warning	4040	Limit of 32 on JSON nested structures depth is reached in argument 1 to function 'json_depth' at position 452
#
# Each level of these is fourteen characters, so half the length is
# seven times the limit and the length can tell neither of them from
# the other.  Only the figure the column kept can.
#
SELECT JSON_DEPTH(JSON_ARRAY(y)) AS d FROM
(SELECT id, x AS y FROM
(SELECT id, JSON_EXTRACT(j, '$') AS x FROM t19) d1 WHERE id= 2) d2;
d
3
DROP TABLE t19;
DROP TABLE t2;
