#
# What a check constraint has to read for itself, whatever wrote the
# value.
#
# A value that arrived from something that attested to it is only
# the value the check will read if TWO things hold: the store put
# those same characters in the row and nothing has written over them
# since.  Every case below is one where one of the two fails, and
# the check has to read the row for itself.
#
# These answers are what a released server gives.  A value getting
# in here that reads back as not a document is a value that got past
# the constraint declaring it must be one.
#
SET NAMES utf8mb4;
#
# 1. Stores that do not put down the characters they were given.
#
# BINARY pads with NUL, and the padding is part of what is stored
CREATE TABLE t1 (b BINARY(20) CHECK (JSON_VALID(b)));
INSERT INTO t1 VALUES (JSON_OBJECT('a', 1));
ERROR 23000: CONSTRAINT `t1.b` failed for `test`.`t1`
INSERT INTO t1 VALUES (JSON_ARRAY(1, 2));
ERROR 23000: CONSTRAINT `t1.b` failed for `test`.`t1`
SELECT COUNT(*) AS rows_that_got_in FROM t1;
rows_that_got_in
0
DROP TABLE t1;
# CHAR pads too, with spaces, which are not read back
CREATE TABLE t1 (c CHAR(20) CHECK (JSON_VALID(c)));
INSERT INTO t1 VALUES (JSON_OBJECT('a', 1));
INSERT INTO t1 VALUES ('not a document');
ERROR 23000: CONSTRAINT `t1.c` failed for `test`.`t1`
SELECT c, JSON_VALID(c) AS reads_as_a_document FROM t1;
c	reads_as_a_document
{"a": 1}	1
DROP TABLE t1;
# ENUM keeps the member it matched, not the text it was given
CREATE TABLE t1 (e ENUM('True','banana') CHECK (JSON_VALID(e)));
INSERT INTO t1 VALUES (JSON_COMPACT('true'));
ERROR 23000: CONSTRAINT `t1.e` failed for `test`.`t1`
INSERT INTO t1 VALUES (JSON_COMPACT('2'));
ERROR 23000: CONSTRAINT `t1.e` failed for `test`.`t1`
SELECT COUNT(*) AS rows_that_got_in FROM t1;
rows_that_got_in
0
DROP TABLE t1;
# SET the same
CREATE TABLE t1 (s SET('True','1') CHECK (JSON_VALID(s)));
INSERT INTO t1 VALUES (JSON_COMPACT('true'));
ERROR 23000: CONSTRAINT `t1.s` failed for `test`.`t1`
SELECT COUNT(*) AS rows_that_got_in FROM t1;
rows_that_got_in
0
DROP TABLE t1;
# a column that DOES put down what it was given takes the document
CREATE TABLE t1 (v VARCHAR(64) CHECK (JSON_VALID(v)),
t LONGTEXT CHECK (JSON_VALID(t)));
INSERT INTO t1 VALUES (JSON_OBJECT('a', 1), JSON_ARRAY(1, 2));
SELECT v, t FROM t1;
v	t
{"a": 1}	[1, 2]
DROP TABLE t1;
#
# 2. A stored generated column is written twice: once from what was
# given, and again from its own expression, which is what stays.
#
SET @sql_mode_saved = @@sql_mode;
SET @@sql_mode = '';
CREATE TABLE t1 (a VARCHAR(20), j LONGTEXT AS (a) STORED CHECK (JSON_VALID(j)));
INSERT INTO t1 (a, j) VALUES ('not a document', JSON_OBJECT('k', 1));
ERROR 23000: CONSTRAINT `t1.j` failed for `test`.`t1`
SELECT COUNT(*) AS rows_that_got_in FROM t1;
rows_that_got_in
0
# and the value the expression does produce is taken
INSERT INTO t1 (a, j) VALUES ('{"k":1}', JSON_OBJECT('k', 1));
Warnings:
Warning	1906	The value specified for generated column 'j' in table 't1' has been ignored
SELECT a, j FROM t1;
a	j
{"k":1}	{"k":1}
# the same on update
UPDATE t1 SET a = 'not a document';
ERROR 23000: CONSTRAINT `t1.j` failed for `test`.`t1`
SELECT a, j FROM t1;
a	j
{"k":1}	{"k":1}
DROP TABLE t1;
SET @@sql_mode = @sql_mode_saved;
#
# 3. A row whose writing ends before the check is reached leaves
# nothing behind for the NEXT row to be read with.
#
# an update where one row comes out exactly as it went in
CREATE TABLE t1 (id INT PRIMARY KEY, b INT, j VARCHAR(64) CHECK (JSON_VALID(j)));
INSERT INTO t1 VALUES (1, 1, JSON_OBJECT('k', 1));
SET @@check_constraint_checks = OFF;
INSERT INTO t1 VALUES (2, 0, 'not a document');
SET @@check_constraint_checks = ON;
CREATE TRIGGER t1t BEFORE UPDATE ON t1 FOR EACH ROW
BEGIN
IF OLD.id = 1 THEN SET NEW.j = JSON_OBJECT('k', 1); END IF;
END|
UPDATE t1 SET b = b + (id = 2);
ERROR 23000: CONSTRAINT `t1.j` failed for `test`.`t1`
SELECT id, b, j FROM t1 ORDER BY id;
id	b	j
1	1	{"k": 1}
2	0	not a document
DROP TABLE t1;
# an insert through a view whose own check refuses the row first
CREATE TABLE t1 (id INT PRIMARY KEY, b INT,
j VARCHAR(64) DEFAULT 'not a document'
                   CHECK (JSON_VALID(j)));
CREATE VIEW v1 AS SELECT id, b, j FROM t1 WHERE b > 0 WITH CHECK OPTION;
CREATE TRIGGER t1t BEFORE INSERT ON t1 FOR EACH ROW
BEGIN
IF NEW.id = 1 THEN SET NEW.j = JSON_OBJECT('k', 1); END IF;
END|
INSERT IGNORE INTO v1 (id, b) VALUES (1, 0), (2, 1);
Warnings:
Warning	1369	CHECK OPTION failed `test`.`v1`
Note	4038	Syntax error in JSON text in argument 1 to function 'json_valid' at position 1
Warning	4025	CONSTRAINT `t1.j` failed for `test`.`t1`
SELECT id, b, j FROM t1 ORDER BY id;
id	b	j
DROP VIEW v1;
DROP TABLE t1;
#
# 4. A row written twice over, where the SECOND writing does not
# touch the column at all.
#
# The first writing puts a document there and attests to it; the
# old row's bytes are then put back, and the update clause leaves
# the column alone.  What the check reads is the old bytes, which
# nothing has attested.
#
CREATE TABLE t1 (id INT PRIMARY KEY, a INT, j VARCHAR(64) CHECK (JSON_VALID(j)));
SET @@check_constraint_checks = OFF;
INSERT INTO t1 VALUES (1, 0, 'not a document');
SET @@check_constraint_checks = ON;
INSERT INTO t1 VALUES (1, 1, JSON_OBJECT('x', 1))
ON DUPLICATE KEY UPDATE a = 1;
ERROR 23000: CONSTRAINT `t1.j` failed for `test`.`t1`
SELECT id, a, j FROM t1 ORDER BY id;
id	a	j
1	0	not a document
# and where the update clause DOES write the column, it is read the
# ordinary way
INSERT INTO t1 VALUES (1, 2, JSON_OBJECT('x', 1))
ON DUPLICATE KEY UPDATE j = JSON_OBJECT('y', 2);
SELECT id, a, j FROM t1 ORDER BY id;
id	a	j
1	0	{"y": 2}
DROP TABLE t1;
#
# 5. Stores that put down every byte they were given and call them
# by another name.
#
# A binary column takes the bytes of a document written in some
# other character set exactly as they stand, and a column in some
# other set takes the bytes of a binary one the same way.  Neither
# writes the characters again, so what the row holds is not the
# characters that were attested, and the check has to read it.
#
# a document written in a wide set, into a binary column
CREATE TABLE t1 (j BLOB CHECK (JSON_VALID(j)));
INSERT INTO t1 VALUES (CONVERT(JSON_OBJECT('a', 1) USING ucs2));
ERROR 23000: CONSTRAINT `t1.j` failed for `test`.`t1`
INSERT INTO t1 VALUES (CONVERT(JSON_ARRAY(1, 2) USING utf16));
ERROR 23000: CONSTRAINT `t1.j` failed for `test`.`t1`
SELECT COUNT(*) AS rows_that_got_in FROM t1;
rows_that_got_in
0
# the same documents in a set the column can take go in
INSERT INTO t1 VALUES (JSON_OBJECT('a', 1)), (JSON_ARRAY(1, 2));
SELECT j FROM t1;
j
{"a": 1}
[1, 2]
DROP TABLE t1;
# a binary document, into a column written in a wide set
CREATE TABLE t1 (j TEXT CHARACTER SET ucs2 CHECK (JSON_VALID(j)));
INSERT INTO t1 VALUES (JSON_ARRAY(_binary'ab'));
ERROR 23000: CONSTRAINT `t1.j` failed for `test`.`t1`
INSERT INTO t1 VALUES (JSON_OBJECT(_binary'k', 1));
ERROR 23000: CONSTRAINT `t1.j` failed for `test`.`t1`
SELECT COUNT(*) AS rows_that_got_in FROM t1;
rows_that_got_in
0
DROP TABLE t1;
# a store that does write the characters again, in the column's
# own set, keeps the document
CREATE TABLE t1 (j TEXT CHARACTER SET latin1 CHECK (JSON_VALID(j)));
INSERT INTO t1 VALUES (JSON_OBJECT('a', 1)), (JSON_ARRAY(1, 2));
SELECT j FROM t1;
j
{"a": 1}
[1, 2]
DROP TABLE t1;
#
# 6. A row split in two by an update over part of its period.  Such
# an update writes the pieces of the old row that the period does
# not cover as new rows, and it writes them by putting the saved
# copy of the row back into the buffer the checks read.  Anything
# said about what stood there before is about the value the update
# wrote, not the one just restored, so it goes with the row it was
# about.
#
# A trigger is what makes the difference visible: it writes the
# document column while the piece is being made, so the check has
# something to catch.
#
CREATE TABLE t1 (id INT,
j VARCHAR(64) CHECK (JSON_VALID(j)),
s DATE, e DATE, PERIOD FOR apptime(s,e)) CHARSET utf8mb4;
INSERT INTO t1 (id, j, s, e)
VALUES (1, '{"a":1}', '1999-01-01', '2018-12-12'),
(2, '[1,2]',   '1999-01-01', '2018-12-12');
UPDATE t1 FOR PORTION OF apptime FROM '2000-01-01' TO '2018-01-01'
       SET id= id + 5;
SELECT id, j, JSON_TYPE(j) AS ty, s, e FROM t1;
id	j	ty	s	e
1	{"a":1}	OBJECT	1999-01-01	2000-01-01
1	{"a":1}	OBJECT	2018-01-01	2018-12-12
2	[1,2]	ARRAY	1999-01-01	2000-01-01
2	[1,2]	ARRAY	2018-01-01	2018-12-12
6	{"a":1}	OBJECT	2000-01-01	2018-01-01
7	[1,2]	ARRAY	2000-01-01	2018-01-01
# the same split with the pieces given documents of their own
CREATE TABLE t2 (id INT,
j VARCHAR(64) CHECK (JSON_VALID(j)),
s DATE, e DATE, PERIOD FOR apptime(s,e)) CHARSET utf8mb4;
CREATE TRIGGER t2_bi BEFORE INSERT ON t2 FOR EACH ROW
SET NEW.j = JSON_INSERT(NEW.j, '$.piece', NEW.id);
INSERT INTO t2 (id, j, s, e)
VALUES (1, '{"a":1}', '1999-01-01', '2018-12-12'),
(2, '{"b":2}', '1999-01-01', '2018-12-12');
UPDATE t2 FOR PORTION OF apptime FROM '2000-01-01' TO '2018-01-01'
       SET id= id + 5;
SELECT id, j, JSON_TYPE(j) AS ty, s, e FROM t2;
id	j	ty	s	e
1	{"a": 1, "piece": 1}	OBJECT	1999-01-01	2000-01-01
1	{"a": 1, "piece": 1}	OBJECT	2018-01-01	2018-12-12
2	{"b": 2, "piece": 2}	OBJECT	1999-01-01	2000-01-01
2	{"b": 2, "piece": 2}	OBJECT	2018-01-01	2018-12-12
6	{"a": 1, "piece": 1}	OBJECT	2000-01-01	2018-01-01
7	{"b": 2, "piece": 2}	OBJECT	2000-01-01	2018-01-01
# the row the update itself writes is checked as any other row is,
# and it is written after the pieces have been, so what the pieces
# left behind must not be believed of it: a portion set to
# something that is not a document is refused
CREATE TABLE t3 (id INT,
j VARCHAR(64) CHECK (JSON_VALID(j)),
s DATE, e DATE, PERIOD FOR apptime(s,e)) CHARSET utf8mb4;
CREATE TRIGGER t3_bi BEFORE INSERT ON t3 FOR EACH ROW
SET NEW.j = JSON_INSERT(NEW.j, '$.piece', NEW.id);
INSERT INTO t3 (id, j, s, e)
VALUES (1, '{"a":1}', '1999-01-01', '2018-12-12'),
(2, '{"b":2}', '1999-01-01', '2018-12-12');
UPDATE t3 FOR PORTION OF apptime FROM '2000-01-01' TO '2018-01-01'
       SET j= 'not a document';
ERROR 23000: CONSTRAINT `t3.j` failed for `test`.`t3`
SELECT id, j, s, e FROM t3;
id	j	s	e
1	{"a": 1, "piece": 1}	1999-01-01	2018-12-12
2	{"b": 2, "piece": 2}	1999-01-01	2018-12-12
# and one set to a document goes in
UPDATE t3 FOR PORTION OF apptime FROM '2000-01-01' TO '2018-01-01'
       SET j= JSON_OBJECT('portion', id);
SELECT id, j, JSON_TYPE(j) AS ty, s, e FROM t3;
id	j	ty	s	e
1	{"a": 1, "piece": 1}	OBJECT	1999-01-01	2000-01-01
1	{"a": 1, "piece": 1}	OBJECT	2018-01-01	2018-12-12
1	{"portion": 1}	OBJECT	2000-01-01	2018-01-01
2	{"b": 2, "piece": 2}	OBJECT	1999-01-01	2000-01-01
2	{"b": 2, "piece": 2}	OBJECT	2018-01-01	2018-12-12
2	{"portion": 2}	OBJECT	2000-01-01	2018-01-01
DROP TABLE t3, t2, t1;
#
# 7. A value that came out SQL NULL, put into a column that cannot
# hold one.
#
# A column of a temporary table is attested to once, when the
# table is built out of something that attests to every value it
# will make.  That answer is about the column and stands over
# every row of it, a row whose value came out NULL among them.
# What such a row puts in the destination is not the NULL but
# whatever the destination takes in place of one, and nothing has
# attested that.
#
CREATE TABLE src (d LONGTEXT) CHARSET utf8mb4;
INSERT INTO src VALUES ('{"a":1}'), ('{"b":2}');
# grouping builds the temporary table, and the path finds nothing
CREATE TABLE t1 (j LONGTEXT NOT NULL CHECK (JSON_VALID(j))) CHARSET utf8mb4;
SET @save_sql_mode= @@sql_mode;
SET SESSION sql_mode= '';
INSERT INTO t1 (j) SELECT JSON_EXTRACT(d, '$.nosuch') FROM src GROUP BY d;
ERROR 23000: CONSTRAINT `t1.j` failed for `test`.`t1`
SET SESSION sql_mode= @save_sql_mode;
SELECT COUNT(*) FROM t1;
COUNT(*)
0
# the same insert told to carry on past what it cannot store
INSERT IGNORE INTO t1 (j) SELECT JSON_EXTRACT(d, '$.nosuch')
FROM src GROUP BY d;
Warnings:
Warning	1048	Column 'j' cannot be null
Note	4037	Unexpected end of JSON text in argument 1 to function 'json_valid'
Warning	4025	CONSTRAINT `t1.j` failed for `test`.`t1`
Warning	1048	Column 'j' cannot be null
Note	4037	Unexpected end of JSON text in argument 1 to function 'json_valid'
Warning	4025	CONSTRAINT `t1.j` failed for `test`.`t1`
SELECT COUNT(*) FROM t1;
COUNT(*)
0
# a union builds one too, and the rows where the path does find a
# value go in while the ones where it does not are refused
CREATE TABLE t2 (j LONGTEXT NOT NULL CHECK (JSON_VALID(j))) CHARSET utf8mb4;
INSERT IGNORE INTO t2 (j)
SELECT JSON_EXTRACT(d, '$.nosuch') FROM src UNION ALL
SELECT JSON_EXTRACT(d, '$.a') FROM src;
Warnings:
Warning	1048	Column 'j' cannot be null
Note	4037	Unexpected end of JSON text in argument 1 to function 'json_valid'
Warning	4025	CONSTRAINT `t2.j` failed for `test`.`t2`
Warning	1048	Column 'j' cannot be null
Note	4037	Unexpected end of JSON text in argument 1 to function 'json_valid'
Warning	4025	CONSTRAINT `t2.j` failed for `test`.`t2`
Warning	1048	Column 'j' cannot be null
Note	4037	Unexpected end of JSON text in argument 1 to function 'json_valid'
Warning	4025	CONSTRAINT `t2.j` failed for `test`.`t2`
SELECT j, JSON_TYPE(j) AS ty FROM t2;
j	ty
1	INTEGER
# a column that CAN hold a NULL holds the NULL itself, which is
# not a document and is not asked to be one
CREATE TABLE t3 (j LONGTEXT CHECK (JSON_VALID(j))) CHARSET utf8mb4;
INSERT INTO t3 (j) SELECT JSON_EXTRACT(d, '$.a') FROM src GROUP BY d;
SELECT j, j IS NULL AS was_null FROM t3;
j	was_null
1	0
NULL	1
DROP TABLE t3, t2, t1, src;
