#
# MDEV-37365: Crash when ALTER TABLE on parent runs concurrently
# with INSERT on FK child
#
#
# Test 1: Verify MDL_SHARED_READ is acquired on FK parent
# during INSERT into child
#
CREATE TABLE parent(a INT PRIMARY KEY) ENGINE=InnoDB;
CREATE TABLE child(a INT PRIMARY KEY,
FOREIGN KEY(a) REFERENCES parent(a)) ENGINE=InnoDB;
INSERT INTO parent VALUES (1),(2),(3);
connect con1,localhost,root,,test;
# No metadata locks are held by con1 before the transaction
SELECT LOCK_MODE, TABLE_SCHEMA, TABLE_NAME
FROM information_schema.metadata_lock_info
WHERE THREAD_ID=$con1_id AND TABLE_SCHEMA='test'
    AND LOCK_TYPE='Table metadata lock'
  ORDER BY TABLE_NAME, LOCK_MODE;
LOCK_MODE	TABLE_SCHEMA	TABLE_NAME
BEGIN;
INSERT INTO child VALUES (1);
connection default;
# Expect MDL_SHARED_READ on parent from FK prelocking
SELECT LOCK_MODE, TABLE_SCHEMA, TABLE_NAME
FROM information_schema.metadata_lock_info
WHERE THREAD_ID=$con1_id AND TABLE_SCHEMA='test'
    AND LOCK_TYPE='Table metadata lock'
  ORDER BY TABLE_NAME, LOCK_MODE;
LOCK_MODE	TABLE_SCHEMA	TABLE_NAME
MDL_SHARED_WRITE	test	child
MDL_SHARED_READ	test	parent
connection con1;
COMMIT;
#
# Test 2: Verify MDL_SHARED_READ on parent for UPDATE of FK column
#
connection default;
# No metadata locks are held by con1 before the transaction
SELECT LOCK_MODE, TABLE_SCHEMA, TABLE_NAME
FROM information_schema.metadata_lock_info
WHERE THREAD_ID=$con1_id AND TABLE_SCHEMA='test'
    AND LOCK_TYPE='Table metadata lock'
  ORDER BY TABLE_NAME, LOCK_MODE;
LOCK_MODE	TABLE_SCHEMA	TABLE_NAME
connection con1;
BEGIN;
UPDATE child SET a=2 WHERE a=1;
connection default;
SELECT LOCK_MODE, TABLE_SCHEMA, TABLE_NAME
FROM information_schema.metadata_lock_info
WHERE THREAD_ID=$con1_id AND TABLE_SCHEMA='test'
    AND LOCK_TYPE='Table metadata lock'
  ORDER BY TABLE_NAME, LOCK_MODE;
LOCK_MODE	TABLE_SCHEMA	TABLE_NAME
MDL_SHARED_WRITE	test	child
MDL_SHARED_READ	test	parent
connection con1;
COMMIT;
connection default;
DROP TABLE child, parent;
#
# Test 3: Multi-level FK chain -- only direct parents are prelocked
#
CREATE TABLE grandparent(a INT PRIMARY KEY) ENGINE=InnoDB;
CREATE TABLE parent(a INT PRIMARY KEY,
FOREIGN KEY(a) REFERENCES grandparent(a)) ENGINE=InnoDB;
CREATE TABLE child(a INT PRIMARY KEY,
FOREIGN KEY(a) REFERENCES parent(a)) ENGINE=InnoDB;
INSERT INTO grandparent VALUES (1),(2);
INSERT INTO parent VALUES (1),(2);
connection con1;
BEGIN;
INSERT INTO child VALUES (1);
connection default;
# Expect MDL_SHARED_READ on parent only, NOT on grandparent
SELECT LOCK_MODE, TABLE_SCHEMA, TABLE_NAME
FROM information_schema.metadata_lock_info
WHERE THREAD_ID=$con1_id AND TABLE_SCHEMA='test'
    AND LOCK_TYPE='Table metadata lock'
  ORDER BY TABLE_NAME, LOCK_MODE;
LOCK_MODE	TABLE_SCHEMA	TABLE_NAME
MDL_SHARED_WRITE	test	child
MDL_SHARED_READ	test	parent
connection con1;
COMMIT;
connection default;
DROP TABLE child, parent, grandparent;
#
# Test 4: Self-referencing FK -- no extra lock needed
#
CREATE TABLE self_ref(a INT PRIMARY KEY, parent_a INT,
FOREIGN KEY(parent_a) REFERENCES self_ref(a)) ENGINE=InnoDB;
INSERT INTO self_ref VALUES (1, NULL);
connection con1;
BEGIN;
INSERT INTO self_ref VALUES (2, 1);
connection default;
# Self-referencing FK: only one MDL on the table (SHARED_WRITE from DML)
SELECT LOCK_MODE, TABLE_SCHEMA, TABLE_NAME
FROM information_schema.metadata_lock_info
WHERE THREAD_ID=$con1_id AND TABLE_SCHEMA='test'
    AND LOCK_TYPE='Table metadata lock'
  ORDER BY TABLE_NAME, LOCK_MODE;
LOCK_MODE	TABLE_SCHEMA	TABLE_NAME
MDL_SHARED_WRITE	test	self_ref
connection con1;
COMMIT;
connection default;
DROP TABLE self_ref;
#
# Test 5: ALTER TABLE parent waits for a child transaction
# (deterministic version of the MDEV-37365 crash scenario)
#
CREATE TABLE parent(a INT PRIMARY KEY, b INT, c INT AS(b) VIRTUAL)
ENGINE=InnoDB;
CREATE TABLE child(a INT PRIMARY KEY REFERENCES parent(a)) ENGINE=InnoDB;
INSERT INTO parent(a,b) VALUES (1,1),(2,2);
connection con1;
BEGIN;
INSERT INTO child VALUES (1);
connection default;
# ALTER on parent must wait for the child transaction's
# MDL_SHARED_READ on parent
ALTER TABLE parent ADD INDEX(c);
connection con1;
# ALTER is waiting for MDL on parent as expected
COMMIT;
connection default;
DROP TABLE child, parent;
#
# Test 6: INSERT into child is blocked by EXCLUSIVE MDL on parent
#
CREATE TABLE parent(a INT PRIMARY KEY) ENGINE=InnoDB;
CREATE TABLE child(a INT PRIMARY KEY,
FOREIGN KEY(a) REFERENCES parent(a)) ENGINE=InnoDB;
INSERT INTO parent VALUES (1),(2);
# LOCK TABLE WRITE acquires SHARED_NO_READ_WRITE, which blocks
# MDL_SHARED_READ. The INSERT should wait.
LOCK TABLE parent WRITE;
connection con1;
INSERT INTO child VALUES (1);
connection default;
# INSERT is waiting for MDL on parent as expected
UNLOCK TABLES;
connection con1;
#
# Test 7: MDL on parent is acquired regardless of
# @@foreign_key_checks
#
connection con1;
SET foreign_key_checks=0;
BEGIN;
INSERT INTO child VALUES (42);
connection default;
# Expect MDL_SHARED_READ on parent even with foreign_key_checks=0
SELECT LOCK_MODE, TABLE_SCHEMA, TABLE_NAME
FROM information_schema.metadata_lock_info
WHERE THREAD_ID=$con1_id AND TABLE_SCHEMA='test'
    AND LOCK_TYPE='Table metadata lock'
  ORDER BY TABLE_NAME, LOCK_MODE;
LOCK_MODE	TABLE_SCHEMA	TABLE_NAME
MDL_SHARED_WRITE	test	child
MDL_SHARED_READ	test	parent
connection con1;
# Re-enabling foreign_key_checks mid-transaction: the FK check of
# the next statement runs under the same MDL on parent
SET foreign_key_checks=1;
INSERT INTO child VALUES (43);
ERROR 23000: Cannot add or update a child row: a foreign key constraint fails (`test`.`child`, CONSTRAINT `1` FOREIGN KEY (`a`) REFERENCES `parent` (`a`))
ROLLBACK;
connection default;
DROP TABLE child, parent;
disconnect con1;
