create table t1 (a int, b int, c int, d int, e int);
insert into t1 () values
(),(),(),(),(),(),(),(),(),(),(),(),(),(),(),(),(),(),(),(),(),(),(),(),
(),(),(),(),(),(),(),(),(),(),(),(),(),(),(),(),(),(),(),(),(),(),(),(),
(),(),(),(),(),(),(),(),(),(),(),(),(),(),(),(),(),(),(),(),(),(),(),(),
(),(),(),(),(),(),(),(),(),(),(),(),(),(),(),(),(),(),(),(),(),(),(),(),
(),(),(),();
select * into outfile 'load.data' from t1;
create temporary table tmp (a varchar(1024), b int, c int, d int, e linestring, unique (e));
load data infile 'load.data' into table tmp;
delete from tmp;
drop table t1;
create table t1 (b blob) engine=innodb;
alter table t1 add unique (b);
alter table t1 force;
show create table t1;
Table	Create Table
t1	CREATE TABLE `t1` (
  `b` blob DEFAULT NULL,
  UNIQUE KEY `b` (`b`) USING HASH
) ENGINE=InnoDB DEFAULT CHARSET=latin1
drop table t1;
create table t1 (pk int, b blob, primary key(pk), unique(b)) engine=myisam;
insert into t1 values (1,'foo');
replace into t1 (pk) values (1);
alter table t1 force;
replace into t1 (pk) values (1);
drop table t1;
create table t1 (t time, unique(t)) engine=innodb;
insert into t1 values (null),(null);
alter ignore table t1 modify t text not null default '';
Warnings:
Warning	1265	Data truncated for column 't' at row 1
Warning	1265	Data truncated for column 't' at row 2
drop table t1;
create table t1 ( pk int, f text, primary key (pk), unique(f)) with system versioning;
insert into t1 values (1,'foo');
update t1 set f = 'bar';
select * from t1;
pk	f
1	bar
update t1 set f = 'foo';
select * from t1;
pk	f
1	foo
select pk, f, row_end > DATE'2030-01-01' from t1 for system_time all;
pk	f	row_end > DATE'2030-01-01'
1	foo	1
1	foo	0
1	bar	0
drop table t1;
create temporary table t1 (f blob, unique(f)) engine=innodb;
insert into t1 values (1);
replace into t1 values (1);
drop table t1;
create table t (b blob, unique(b)) engine=myisam;
insert into t values ('foo');
replace into t values ('foo');
drop table t;
CREATE TABLE t1 (f INT, x BLOB, UNIQUE (x));
INSERT INTO t1 VALUES (1,'foo');
ALTER TABLE t1 DROP x, ALGORITHM=INPLACE;
ERROR 0A000: ALGORITHM=INPLACE is not supported for this operation. Try ALGORITHM=COPY
UPDATE t1 SET x = 'bar';
DROP TABLE t1;
create table t1(a blob unique , b blob);
insert into t1 values(1,1),(2,1);
alter table t1 add unique(b);
ERROR 23000: Duplicate entry '1' for key 'b'
show keys from t1;;
Table	t1
Non_unique	0
Key_name	a
Seq_in_index	1
Column_name	a
Collation	A
Cardinality	NULL
Sub_part	NULL
Packed	NULL
Null	YES
Index_type	HASH
Comment	
Index_comment	
insert into t1 values(1,1);
ERROR 23000: Duplicate entry '1' for key 'a'
DROP TABLE t1;
CREATE TABLE t1 (a TEXT, b INT, UNIQUE(a)) ENGINE=MyISAM;
ALTER TABLE t1 DROP x;
ERROR 42000: Can't DROP COLUMN `x`; check that it exists
UPDATE t1 SET b = 0 WHERE a = 'foo';
DROP TABLE t1;
CREATE TABLE t1 (a TEXT, b INT, UNIQUE(a)) ENGINE=InnoDB;
ALTER TABLE t1 DROP x;
ERROR 42000: Can't DROP COLUMN `x`; check that it exists
UPDATE t1 SET b = 0 WHERE a = 'foo';
DROP TABLE t1;
CREATE TEMPORARY TABLE t1 (f BLOB, UNIQUE(f)) ENGINE=InnoDB ROW_FORMAT=COMPACT;
ALTER TABLE t1 ADD KEY (f);
ERROR HY000: Index column size too large. The maximum column size is 767 bytes
TRUNCATE TABLE t1;
SELECT * FROM t1 WHERE f LIKE 'foo';
f
DROP TABLE t1;
CREATE TABLE t1 (a INT, UNIQUE ind USING HASH (a)) ENGINE=InnoDB;
ALTER TABLE t1 CHANGE COLUMN IF EXISTS b a INT;
Warnings:
Note	1054	Unknown column 'b' in 't1'
DROP TABLE t1;
CREATE TABLE t1 (f VARCHAR(4096), UNIQUE(f)) ENGINE=InnoDB;
ALTER TABLE t1 DROP x;
ERROR 42000: Can't DROP COLUMN `x`; check that it exists
SELECT * FROM t1 WHERE f LIKE 'foo';
f
DROP TABLE t1;
CREATE TABLE t1 (pk INT, PRIMARY KEY USING HASH (pk)) ENGINE=InnoDB;
show keys from t1;;
Table	t1
Non_unique	0
Key_name	PRIMARY
Seq_in_index	1
Column_name	pk
Collation	A
Cardinality	0
Sub_part	NULL
Packed	NULL
Null	
Index_type	BTREE
Comment	
Index_comment	
ALTER TABLE t1 ADD INDEX (pk);
DROP TABLE t1;
CREATE TABLE t1 (b int, a  varchar(4000));
INSERT INTO t1 VALUES (1, 2),(2,3),(3,4);
ALTER TABLE t1 ADD UNIQUE INDEX (a);
SELECT * FROM t1;
b	a
1	2
2	3
3	4
SELECT a FROM t1;
a
2
3
4
drop table t1;
CREATE TABLE t1 (f VARCHAR(4096), UNIQUE(f)) ENGINE=InnoDB;
ALTER TABLE t1 DROP KEY f, ADD INDEX idx1(f), ALGORITHM=INSTANT;
ERROR 0A000: ALGORITHM=INSTANT is not supported. Reason: ADD INDEX. Try ALGORITHM=NOCOPY
ALTER TABLE t1 ADD KEY idx2(f);
Warnings:
Warning	1071	Specified key was too long; max key length is 3072 bytes
DROP TABLE t1;
CREATE TABLE t1(a blob , b blob , unique(a,b));
alter table t1 drop column b;
ERROR 42000: Key column 'b' doesn't exist in table
insert into t1 values(1,1);
insert into t1 values(1,1);
ERROR 23000: Duplicate entry '1-1' for key 'a'
alter table t1 add column c int;
drop table t1;
