select @@innodb_ft_min_token_size=8, @@innodb_ft_max_token_size=20,
@@ft_min_word_len=8, @@ft_max_word_len=20;
@@innodb_ft_min_token_size=8	@@innodb_ft_max_token_size=20	@@ft_min_word_len=8	@@ft_max_word_len=20
1	1	1	1
# A CHAR array has keys of 4 to 82 characters. Neither bound is
# within what these settings index, whichever engine holds it.
create table t1 (j json,
key idx ((CAST(j->'$.tags' AS CHAR(6) ARRAY))))engine=innodb;
ERROR HY000: A multi-valued index over this expression has keys of 4 to 82 characters, outside what InnoDB indexes (8 to 20). Adjust the fulltext token size settings
create table t1 (j json,
key idx ((CAST(j->'$.tags' AS CHAR(6) ARRAY))))engine=myisam;
ERROR HY000: A multi-valued index over this expression has keys of 4 to 82 characters, outside what MyISAM indexes (8 to 19). Adjust the fulltext token size settings
create table t1 (j json,
key idx ((CAST(j->'$.tags' AS CHAR(6) ARRAY))))engine=aria;
ERROR HY000: A multi-valued index over this expression has keys of 4 to 82 characters, outside what Aria indexes (8 to 19). Adjust the fulltext token size settings
# An INT array has keys of exactly 16 characters, which do fit
create table t1 (c int, j json,
key idx ((CAST(j->'$.n' AS INT ARRAY))))engine=innodb;
insert into t1 values (1,'{"n": [1, 42]}'),(2,'{"n": [42, 43]}'),
(3,'{"n": [7]}');
explain select * from t1 where json_contains(j->'$.n', '42');
id	select_type	table	type	possible_keys	key	key_len	ref	rows	Extra
1	SIMPLE	t1	range	idx	idx	0	NULL	#	Using where
select * from t1 where json_contains(j->'$.n', '42') order by c;
c	j
1	{"n": [1, 42]}
2	{"n": [42, 43]}
# the same rows without the index:
select * from t1 ignore index(idx)
where json_contains(j->'$.n', '42') order by c;
c	j
1	{"n": [1, 42]}
2	{"n": [42, 43]}
alter table t1 drop index idx;
# Adding one whose keys do not fit is refused, and so is an ALTER
# that would rebuild it.
alter table t1 add key idx2 ((CAST(j->'$.tags' AS CHAR(6) ARRAY)));
ERROR HY000: A multi-valued index over this expression has keys of 4 to 82 characters, outside what InnoDB indexes (8 to 20). Adjust the fulltext token size settings
alter table t1 add column x int;
alter table t1 drop column x;
alter table t1 add key idx ((CAST(j->'$.n' AS INT ARRAY)));
# The same index under limits it no longer fits is one the
# optimizer has to leave alone, or it
# could be searching for keys the engine may have dropped. The
# rows must not change.
# restart: --innodb-ft-max-token-size=10
select @@innodb_ft_max_token_size=10;
@@innodb_ft_max_token_size=10
1
explain select * from t1 where json_contains(j->'$.n', '42');
id	select_type	table	type	possible_keys	key	key_len	ref	rows	Extra
1	SIMPLE	t1	ALL	NULL	NULL	NULL	NULL	#	Using where
select c from t1 where json_contains(j->'$.n', '42') order by c;
c
1
2
# Leaving the index alone is not enough: a row written now would
# have no key in it, and the keys are dropped as they are written,
# not while they are searched for. The row would be missing from
# the index for good thus corrupting the index. Refuse the write.
insert into t1 values (4, '{"n": [55]}');
ERROR HY000: A multi-valued index over this expression has keys of 16 to 16 characters, outside what InnoDB indexes (8 to 10). Adjust the fulltext token size settings
update t1 set j= '{"n": [55]}' where c=3;
ERROR HY000: A multi-valued index over this expression has keys of 16 to 16 characters, outside what InnoDB indexes (8 to 10). Adjust the fulltext token size settings
# An update that leaves the indexed expression alone leaves the
# index alone as well, so it is allowed
update t1 set c= 4 where c=3;
update t1 set c= 3 where c=4;
# Reading and deleting stay allowed
select c from t1 where json_contains(j->'$.n', '7') order by c;
c
3
delete from t1 where c=3;
select c from t1 order by c;
c
1
2
# Back under limits the index fits. The optimizer uses it again,
# and it has an entry for every row
# restart: --innodb-ft-max-token-size=20
select @@innodb_ft_max_token_size=20;
@@innodb_ft_max_token_size=20
1
explain select c from t1 where json_contains(j->'$.n', '42');
id	select_type	table	type	possible_keys	key	key_len	ref	rows	Extra
1	SIMPLE	t1	range	idx	idx	0	NULL	#	Using where
select c from t1 where json_contains(j->'$.n', '42') order by c;
c
1
2
# the same rows without the index:
select c from t1 ignore index(idx)
where json_contains(j->'$.n', '42') order by c;
c
1
2
# and writing is allowed again
insert into t1 values (4, '{"n": [55]}');
select c from t1 where json_contains(j->'$.n', '55') order by c;
c
4
select c from t1 ignore index(idx)
where json_contains(j->'$.n', '55') order by c;
c
4
drop table t1;
# One fit and one unfit MVI
# restart: --innodb-ft-min-token-size=4 --innodb-ft-max-token-size=84
create table t1 (c int, j1 json, j2 json,
key idx_n ((CAST(j1->'$.n' AS INT ARRAY))),
key idx_t ((CAST(j2->'$.tags' AS CHAR(6) ARRAY))))engine=innodb;
insert into t1 values (1,'{"n": [1, 42]}','{"tags": ["aaa"]}');
# Raise the minimum to 8. The INT keys still fit, the CHAR ones,
# which can be 4 characters long, no longer do.
# restart: --innodb-ft-min-token-size=8
select @@innodb_ft_min_token_size=8;
@@innodb_ft_min_token_size=8
1
# The optimizer uses the index that fits and leaves the other alone
explain select c from t1 where json_contains(j1->'$.n', '42');
id	select_type	table	type	possible_keys	key	key_len	ref	rows	Extra
1	SIMPLE	t1	range	idx_n	idx_n	0	NULL	#	Using where
explain select c from t1 where json_contains(j2->'$.tags', '"aaa"');
id	select_type	table	type	possible_keys	key	key_len	ref	rows	Extra
1	SIMPLE	t1	ALL	NULL	NULL	NULL	NULL	#	Using where
# Updating the column the fitting index is over recomputes only
# its key, and that key the engine will hold
update t1 set j1= '{"n": [1, 43]}' where c=1;
# The other index would have to store a key it drops
update t1 set j2= '{"tags": ["bbb"]}' where c=1;
ERROR HY000: A multi-valued index over this expression has keys of 4 to 82 characters, outside what InnoDB indexes (8 to 20). Adjust the fulltext token size settings
# An INSERT computes both, so it is refused
insert into t1 values (2,'{"n": [7]}','{"tags": ["ccc"]}');
ERROR HY000: A multi-valued index over this expression has keys of 4 to 82 characters, outside what InnoDB indexes (8 to 20). Adjust the fulltext token size settings
# A column no index is over is free
update t1 set c= 2 where c=1;
select c, j1, j2 from t1;
c	j1	j2
2	{"n": [1, 43]}	{"tags": ["aaa"]}
drop table t1;
