DROP TABLE IF EXISTS t1, t2;
CREATE TABLE t1 (
id INTEGER NOT NULL PRIMARY KEY AUTO_INCREMENT, 
gender CHAR(1),
name VARCHAR(20)
);
SELECT SUM(DISTINCT LENGTH(name)) s1 FROM t1;
s1
NULL
INSERT INTO t1 (gender, name) VALUES (NULL, NULL);
INSERT INTO t1 (gender, name) VALUES (NULL, NULL);
INSERT INTO t1 (gender, name) VALUES (NULL, NULL);
SELECT SUM(DISTINCT LENGTH(name)) s1 FROM t1;
s1
NULL
INSERT INTO t1 (gender, name) VALUES ('F', 'Helen'), ('F', 'Anastasia'),
('F', 'Katherine'), ('F', 'Margo'), ('F', 'Magdalene'), ('F', 'Mary');
CREATE TABLE t2 SELECT name FROM t1;
SELECT (SELECT SUM(DISTINCT LENGTH(name)) FROM t1) FROM t2;
(SELECT SUM(DISTINCT LENGTH(name)) FROM t1)
18
18
18
18
18
18
18
18
18
DROP TABLE t2;
INSERT INTO t1 (gender, name) VALUES ('F', 'Eva'), ('F', 'Sofia'),
('F', 'Sara'), ('F', 'Golda'), ('F', 'Toba'), ('F', 'Victory'),
('F', 'Faina'), ('F', 'Miriam'), ('F', 'Beki'), ('F', 'America'),
('F', 'Susan'), ('F', 'Glory'), ('F', 'Priscilla'), ('F', 'Rosmary'),
('F', 'Rose'), ('F', 'Margareth'), ('F', 'Elizabeth'), ('F', 'Meredith'),
('F', 'Julie'), ('F', 'Xenia'), ('F', 'Zena'), ('F', 'Olga'),
('F', 'Brunhilda'), ('F', 'Nataly'), ('F', 'Lara'), ('F', 'Svetlana'),
('F', 'Grethem'), ('F', 'Irene');
SELECT
SUM(DISTINCT LENGTH(name)) s1,
SUM(DISTINCT SUBSTRING(NAME, 1, 3)) s2,
SUM(DISTINCT LENGTH(SUBSTRING(name, 1, 4))) s3
FROM t1;
s1	s2	s3
42	0	7
SELECT
SUM(DISTINCT LENGTH(g1.name)) s1,
SUM(DISTINCT SUBSTRING(g2.name, 1, 3)) s2,
SUM(DISTINCT LENGTH(SUBSTRING(g3.name, 1, 4))) s3
FROM t1 g1, t1 g2, t1 g3;
s1	s2	s3
42	0	7
SELECT
SUM(DISTINCT LENGTH(g1.name)) s1,
SUM(DISTINCT SUBSTRING(g2.name, 1, 3)) s2,
SUM(DISTINCT LENGTH(SUBSTRING(g3.name, 1, 4))) s3
FROM t1 g1, t1 g2, t1 g3 GROUP BY LENGTH(SUBSTRING(g3.name, 5, 10));
s1	s2	s3
42	0	NULL
42	0	7
42	0	4
42	0	4
42	0	4
42	0	4
42	0	4
SELECT SQL_BUFFER_RESULT
SUM(DISTINCT LENGTH(name)) s1,
SUM(DISTINCT SUBSTRING(NAME, 1, 3)) s2,
SUM(DISTINCT LENGTH(SUBSTRING(name, 1, 4))) s3
FROM t1;
s1	s2	s3
42	0	7
SELECT SQL_BUFFER_RESULT
SUM(DISTINCT LENGTH(g1.name)) s1,
SUM(DISTINCT SUBSTRING(g2.name, 1, 3)) s2,
SUM(DISTINCT LENGTH(SUBSTRING(g3.name, 1, 4))) s3
FROM t1 g1, t1 g2, t1 g3 GROUP BY LENGTH(SUBSTRING(g3.name, 5, 10));
s1	s2	s3
42	0	NULL
42	0	7
42	0	4
42	0	4
42	0	4
42	0	4
42	0	4
SET @l=1;
UPDATE t1 SET name=CONCAT(name, @l:=@l+1);
SELECT SUM(DISTINCT RIGHT(name, 1)) FROM t1;
SUM(DISTINCT RIGHT(name, 1))
45
SELECT SUM(DISTINCT id) FROM t1;
SUM(DISTINCT id)
703
SELECT SUM(DISTINCT id % 11) FROM t1;
SUM(DISTINCT id % 11)
55
DROP TABLE t1;
#
# Bug #777654: empty subselect in FROM clause returning  
#              SUM(DISTINCT) over non-nullable field 
#
CREATE TABLE t1 (a int NOT NULL) ;
SELECT SUM(DISTINCT a) FROM t1;
SUM(DISTINCT a)
NULL
SELECT * FROM (SELECT SUM(DISTINCT a) FROM t1) AS t;
SUM(DISTINCT a)
NULL
DROP TABLE t1;
#
# MDEV-39194: SUM DISTINCT of a bit literal
#
SELECT SUM(DISTINCT b'1100') AS r;
r
12
SELECT SUM(DISTINCT b'00000000') AS zero_value,
SUM(DISTINCT b'11111111') AS byte_value,
SUM(DISTINCT b'100000000') AS two_byte_value;
zero_value	byte_value	two_byte_value
0	255	256
SELECT SUM(DISTINCT 0xff) AS hex_value,
AVG(DISTINCT b'1100') = 12 AS bit_average_is_12;
hex_value	bit_average_is_12
255	1
SELECT SUM(DISTINCT 0xffffffffffffffff) = SUM(0xffffffffffffffff)
AS unsigned_sum_matches,
AVG(DISTINCT 0xffffffffffffffff) = AVG(0xffffffffffffffff)
AS unsigned_average_matches;
unsigned_sum_matches	unsigned_average_matches
1	1
CREATE TABLE t1 (a INT, b INT);
INSERT INTO t1 VALUES (1,1), (2,1), (3,1);
SELECT SUM(DISTINCT b'1100') AS bit_sum,
AVG(DISTINCT b'1100') = 12 AS bit_average_is_12,
COUNT(DISTINCT b'1100') AS bit_count FROM t1;
bit_sum	bit_average_is_12	bit_count
12	1	1
SELECT AVG(DISTINCT b / a) AS decimal_average FROM t1;
decimal_average
0.61110000
DROP TABLE t1;
