#
# Test memory budget fallback during MHNSW bulk insert
#
# 1. Normal bulk insert works when memory budget is large enough
create table t1 (id int auto_increment primary key, v vector(3) not null);
insert into t1 (v) values (x'000000000000000000000000'),
(x'0000803f0000000000000000'),
(x'000000000000803f00000000'),
(x'00000000000000000000803f');
alter table t1 add vector index (v);
show warnings;
Level	Code	Message
# Test search using the successfully bulk-built index
select id, vec_distance_euclidean(v, x'0000803f0000000000000000') d from t1 order by d limit 2;
id	d
2	0
1	1
drop table t1;
# 2. Bulk insert falls back to normal insert when mhnsw_max_cache_size is small
set @old_cache_size= @@global.mhnsw_max_cache_size;
set global mhnsw_max_cache_size= 1048576;
set max_recursive_iterations= 300;
create table t1 (id int auto_increment primary key, v vector(3000) not null);
insert into t1 (v)
with recursive cte as (
select 1 as n
union all
select n + 1 from cte where n < 115
)
select repeat(x'00', 12000) from cte;
insert into t1 (id, v) values (999, concat(repeat(x'00', 11996), x'0000803f'));
# Adding index with small cache size should trigger fallback and show a warning
alter table t1 add vector index (v) m=200;
Warnings:
Note	1105	MHNSW: Bulk insert disabled because estimated memory usage (estimated_mem) exceeds mhnsw_max_cache_size (1048576). Falling back to normal insert.
show warnings;
Level	Code	Message
Note	1105	MHNSW: Bulk insert disabled because estimated memory usage (estimated_mem) exceeds mhnsw_max_cache_size (1048576). Falling back to normal insert.
# Test search using the fallback-built index to ensure it is healthy and correct
select id, vec_distance_euclidean(v, concat(repeat(x'00', 11996), x'0000803f')) d from t1 order by d limit 1;
id	d
999	0
drop table t1;
set global mhnsw_max_cache_size= @old_cache_size;
#
# 3. Test OPTIMIZE TABLE uses bulk insert and rebuilds vector index
#
# 3.1 Normal OPTIMIZE TABLE with bulk insert
create table t1 (id int auto_increment primary key, v vector(3) not null);
insert into t1 (v) values (x'000000000000000000000000'),
(x'0000803f0000000000000000'),
(x'000000000000803f00000000'),
(x'00000000000000000000803f');
alter table t1 add vector index (v);
delete from t1 where id in (1, 3);
optimize table t1;
Table	Op	Msg_type	Msg_text
test.t1	optimize	note	Table does not support optimize, doing recreate + analyze instead
test.t1	optimize	status	OK
# Test search query after OPTIMIZE TABLE
select id, vec_distance_euclidean(v, x'0000803f0000000000000000') d from t1 order by d;
id	d
2	0
4	1.41421
drop table t1;
# 3.2 OPTIMIZE TABLE with small cache size triggers bulk insert fallback warning
set @old_cache_size= @@global.mhnsw_max_cache_size;
set global mhnsw_max_cache_size= 1048576;
set max_recursive_iterations= 300;
create table t1 (id int auto_increment primary key, v vector(3000) not null);
insert into t1 (v)
with recursive cte as (
select 1 as n
union all
select n + 1 from cte where n < 100
)
select repeat(x'00', 12000) from cte;
insert into t1 (id, v) values (999, concat(repeat(x'00', 11996), x'0000803f'));
set global mhnsw_max_cache_size= 104857600;
alter table t1 add vector index (v) m=16;
set global mhnsw_max_cache_size= 1048576;
optimize table t1;
Table	Op	Msg_type	Msg_text
test.t1	optimize	note	Table does not support optimize, doing recreate + analyze instead
test.t1	optimize	status	OK
show warnings;
Level	Code	Message
# Test search using the index after OPTIMIZE TABLE
select id, vec_distance_euclidean(v, concat(repeat(x'00', 11996), x'0000803f')) d from t1 order by d limit 1;
id	d
999	0
drop table t1;
set global mhnsw_max_cache_size= @old_cache_size;
