drop table if exists t0,t1;
create table t0(a int primary key);
insert into t0 values (0),(1),(2),(3),(4),(5),(6),(7),(8),(9);
create table t1(
pk int,
a int,
key(pk)
);
insert into t1
select 
A.a + B.a* 10 + C.a * 100,
1
from t0 A, t0 B, t0 C;
select 
pk,
count(a) over (order by pk rows between 2 preceding and 2 following) as exp
from t1
where pk between 1 and 30
order by pk desc
limit 4;
pk	exp
30	3
29	4
28	5
27	5
drop table t0,t1;
#
# MDEV-30052: Crash with a query containing nested WINDOW clauses
#
CREATE TABLE t1 (c INT);
insert into t1 values (1),(2);
UPDATE t1 SET c=1
WHERE c=2
ORDER BY
(1 IN ((
SELECT *
FROM (SELECT * FROM t1) AS v1
GROUP BY c
WINDOW v2 AS (ORDER BY
(SELECT *
FROM t1
GROUP BY c
WINDOW v3 AS (PARTITION BY c)
)
)
))
);
drop table t1;
#
# MDEV-29359: Server crashed with heap-use-after-free in
# Field::is_null(long long) const (Just testcase)
#
CREATE TABLE t1 (id int);
INSERT INTO t1 VALUES (-1),(0),(84);
SELECT
id IN (SELECT id
FROM t1
WINDOW w AS (ORDER BY (SELECT  1
FROM t1
WHERE
EXISTS ( SELECT id
FROM t1
GROUP BY id
WINDOW w2 AS (ORDER BY id)
)
)
)
) as exp
FROM t1;
exp
1
1
1
DROP TABLE t1;
#
# End of 10.3 tests
#
#
# MDEV-28619 Server crash and UBSAN null-pointer-use in Window_funcs_sort::setup
#
create table t (c int);
select * from t order by c=row_number() over t;
ERROR HY000: Window specification with name 't' is not defined
select * union select * from t;
ERROR HY000: No tables used
explain update t set c=1 where exists (
select * from t order by c=row_number() over t);
ERROR HY000: Window specification with name 't' is not defined
select * union select * from t order by c=row_number() over t;
ERROR HY000: No tables used
explain update t set c=1 where exists (
select * union select * from t order by c=row_number() over t);
id	select_type	table	type	possible_keys	key	key_len	ref	rows	Extra
1	PRIMARY	t	system	NULL	NULL	NULL	NULL	0	Const row not found
2	SUBQUERY	NULL	NULL	NULL	NULL	NULL	NULL	NULL	No tables used
3	UNION	NULL	NULL	NULL	NULL	NULL	NULL	NULL	no matching row in const table
NULL	UNION RESULT	<union2,3>	ALL	NULL	NULL	NULL	NULL	NULL	
drop table t;
