drop table if exists t0,t1;
create table t0(a int primary key);
insert into t0 values (0),(1),(2),(3),(4),(5),(6),(7),(8),(9);
create table t1(
pk int,
a int,
key(pk)
);
insert into t1
select 
A.a + B.a* 10 + C.a * 100,
1
from t0 A, t0 B, t0 C;
select 
pk,
count(a) over (order by pk rows between 2 preceding and 2 following) as exp
from t1
where pk between 1 and 30
order by pk desc
limit 4;
pk	exp
30	3
29	4
28	5
27	5
drop table t0,t1;
#
# MDEV-30052: Crash with a query containing nested WINDOW clauses
#
CREATE TABLE t1 (c INT);
insert into t1 values (1),(2);
UPDATE t1 SET c=1
WHERE c=2
ORDER BY
(1 IN ((
SELECT *
FROM (SELECT * FROM t1) AS v1
GROUP BY c
WINDOW v2 AS (ORDER BY
(SELECT *
FROM t1
GROUP BY c
WINDOW v3 AS (PARTITION BY c)
)
)
))
);
drop table t1;
#
# MDEV-29359: Server crashed with heap-use-after-free in
# Field::is_null(long long) const (Just testcase)
#
CREATE TABLE t1 (id int);
INSERT INTO t1 VALUES (-1),(0),(84);
SELECT
id IN (SELECT id
FROM t1
WINDOW w AS (ORDER BY (SELECT  1
FROM t1
WHERE
EXISTS ( SELECT id
FROM t1
GROUP BY id
WINDOW w2 AS (ORDER BY id)
)
)
)
) as exp
FROM t1;
exp
1
1
1
DROP TABLE t1;
# End of 10.3 tests
#
# MDEV-32317 ref_ptrs exhaust on multiple ORDER by func from winfunc
#
select row_number() over () x;
x
1
select row_number() over (order by 1) x;
x
1
select row_number() over (order by 1, 1) x;
x
1
select row_number() over (partition by 1) x;
x
1
select row_number() over (partition by 1, 1) x;
x
1
select row_number() over (partition by 1 order by 1) x;
x
1
select row_number() over (partition by 1, 2) x;
x
1
select row_number() over (partition by 1, 2 order by 1, 1) x;
x
1
select row_number() over () x order by x;
x
1
select row_number() over () order by 1;
row_number() over ()
1
select row_number() over (order by 1) order by 1;
row_number() over (order by 1)
1
select row_number() over (order by 1, 1) order by 1;
row_number() over (order by 1, 1)
1
select row_number() over (order by 1) order by 1, 1;
row_number() over (order by 1)
1
select row_number() over (order by 1, 1) order by 1, 1;
row_number() over (order by 1, 1)
1
select row_number() over (partition by 1, 2 order by 1, 1) order by 1;
row_number() over (partition by 1, 2 order by 1, 1)
1
select row_number() over (partition by 1, 2 order by 1, 1) order by 1, 1;
row_number() over (partition by 1, 2 order by 1, 1)
1
select nullif(1, 0) order by 1;
nullif(1, 0)
1
select nullif(1, 0) order by 1, 1;
nullif(1, 0)
1
select nullif(avg(1) over (), 0) order by 1;
nullif(avg(1) over (), 0)
1.0000
select nullif(avg(1) over (order by 1), 0) order by 1;
nullif(avg(1) over (order by 1), 0)
1.0000
select nullif(avg(1) over (order by 1, 1), 0) order by 1;
nullif(avg(1) over (order by 1, 1), 0)
1.0000
select nullif(avg(1) over (partition by 1), 0) order by 1;
nullif(avg(1) over (partition by 1), 0)
1.0000
select nullif(avg(1) over (partition by 1, 2), 0) order by 1;
nullif(avg(1) over (partition by 1, 2), 0)
1.0000
select nullif(avg(1) over (), 0) order by 1, 1;
nullif(avg(1) over (), 0)
1.0000
select nullif(avg(1) over (partition by 1, 2), 0) order by 1, 1;
nullif(avg(1) over (partition by 1, 2), 0)
1.0000
select nullif(avg(1) over (partition by 1, 2), 0) order by 1, 1, 1;
nullif(avg(1) over (partition by 1, 2), 0)
1.0000
select nullif(avg(1) over (partition by 1, 2), avg(1) over ()) order by 1, 1, 1;
nullif(avg(1) over (partition by 1, 2), avg(1) over ())
NULL
select avg ( '1' ) over ( ) x where ( 1 , 1 , ( 1 , null ) ) in ( ( 1 , 1 , ( 1 , 1 ) ) ) order by x between 25 and ( ( x = x ) / x ) or x = x = avg ( null ) or x = 94 ;
x
1
select row_number() over () x order by x between 1 and (( x = x ) / x) or x = x = 1  ;
x
1
select nullif(avg(1) over (order by 1), 0) order by 1, 1, 1;
nullif(avg(1) over (order by 1), 0)
1.0000
select nullif(avg(1) over (order by 1, 1, 1, 1, 1, 1, 1), avg(2) over (order by 1, 1, 1, 1, 1, 1, 1)) x order by 1, 1, 1, 1, 1, 1;
x
1.0000
select nullif(avg(1) over (partition by -1,1,0,2,3,4,5,6,7,8 order by 1, 1, 1, 1, 1, 1, 1), avg(2) over (partition by -1,1,0,2,3,4,5,6,7,8 order by 1, 1, 1, 1, 1, 1, 1)) x order by 1, 1, 1, 1, 1, 1;
x
1.0000
select nullif(avg(1) over (partition by -1,1,0,2,3,4,5,6,7,8 order by 1, 1, 1, 1, 1, 1, 1), avg(2) over (partition by -1,1,0,2,3,4,5,6,7,8 order by 1, 1, 1, 1, 1, 1, 1)) x order by 1, 1, 1, 1, 1, 1, x between 1 and (( x = x ) / x) or x = x = 1  ;
x
1.0000
# End of 10.6 tests
#
# MDEV-28619 Server crash and UBSAN null-pointer-use in Window_funcs_sort::setup
#
create table t (c int);
select * from t order by c=row_number() over t;
ERROR HY000: Window specification with name 't' is not defined
select * union select * from t;
ERROR HY000: No tables used
explain update t set c=1 where exists (
select * from t order by c=row_number() over t);
ERROR HY000: Window specification with name 't' is not defined
select * union select * from t order by c=row_number() over t;
ERROR HY000: No tables used
explain update t set c=1 where exists (
select * union select * from t order by c=row_number() over t);
id	select_type	table	type	possible_keys	key	key_len	ref	rows	Extra
1	PRIMARY	t	system	NULL	NULL	NULL	NULL	0	Const row not found
2	SUBQUERY	NULL	NULL	NULL	NULL	NULL	NULL	NULL	No tables used
3	UNION	NULL	NULL	NULL	NULL	NULL	NULL	NULL	no matching row in const table
NULL	UNION RESULT	<union2,3>	ALL	NULL	NULL	NULL	NULL	NULL	
explain update t set c=1 where exists (
select * union select nullif(avg(1) over (order by 1), avg(1) over (order by 1)) x
from t order by x=row_number() over t);
id	select_type	table	type	possible_keys	key	key_len	ref	rows	Extra
1	PRIMARY	t	system	NULL	NULL	NULL	NULL	0	Const row not found
2	SUBQUERY	NULL	NULL	NULL	NULL	NULL	NULL	NULL	No tables used
3	UNION	NULL	NULL	NULL	NULL	NULL	NULL	NULL	no matching row in const table
NULL	UNION RESULT	<union2,3>	ALL	NULL	NULL	NULL	NULL	NULL	
explain update t set c=1 where exists (
select * union select nullif(avg(1) over (order by 1), avg(1) over (order by 1)) x
from t order by x=avg(row_number() over t));
id	select_type	table	type	possible_keys	key	key_len	ref	rows	Extra
1	PRIMARY	t	system	NULL	NULL	NULL	NULL	0	Const row not found
2	SUBQUERY	NULL	NULL	NULL	NULL	NULL	NULL	NULL	No tables used
3	UNION	NULL	NULL	NULL	NULL	NULL	NULL	NULL	no matching row in const table
NULL	UNION RESULT	<union2,3>	ALL	NULL	NULL	NULL	NULL	NULL	
explain update t set c=1 where exists (
select * union select nullif(avg(1) over (order by 1), avg(1) over (order by 1)) x
from t order by x=avg(row_number() over t) over (order by 1));
id	select_type	table	type	possible_keys	key	key_len	ref	rows	Extra
1	PRIMARY	t	system	NULL	NULL	NULL	NULL	0	Const row not found
2	SUBQUERY	NULL	NULL	NULL	NULL	NULL	NULL	NULL	No tables used
3	UNION	NULL	NULL	NULL	NULL	NULL	NULL	NULL	no matching row in const table
NULL	UNION RESULT	<union2,3>	ALL	NULL	NULL	NULL	NULL	NULL	
drop table t;
#
# MDEV-36356 Server crash in Item::save_int_in_field and UBSAN null-pointer-use
#
(SELECT 1 FROM dual LIMIT 5) ORDER BY ROW_NUMBER() OVER (PARTITION BY 1);
1
1
(SELECT 1 FROM dual LIMIT 5) ORDER BY ROW_NUMBER() OVER ();
1
1
(SELECT 5 a FROM dual LIMIT 1) ORDER BY AVG(a) OVER (ORDER BY 1);
a
5
(SELECT CAST('1973' AS DATETIME) a FROM dual LIMIT 1) ORDER BY FIRST_VALUE(a) OVER (ORDER BY 1);
a
NULL
Warnings:
Warning	1292	Incorrect datetime value: '1973'
(SELECT CAST('1973' AS CHAR) a FROM dual LIMIT 1) ORDER BY FIRST_VALUE(a) OVER (ORDER BY 1);
a
1973
SET @save_sql_mode= @@sql_mode;
SET sql_mode='';
(SELECT CAST('' AS CHAR) a LIMIT 1) ORDER BY FIRST_VALUE(a) OVER (ORDER BY 1);
a

SET sql_mode= @save_sql_mode;
((SELECT 1) FOR UPDATE WAIT + 1) ORDER BY PERCENTILE_DISC(COUNT(*)) WITHIN GROUP(ORDER BY 1) OVER();
1
1
((SELECT 1) FOR UPDATE WAIT + 1) ORDER BY PERCENTILE_DISC(COUNT(*)) WITHIN GROUP(ORDER BY CURRENT_TIMESTAMP) OVER();
1
1
CREATE TABLE t1 (a INT);
INSERT INTO t1 VALUES (3),(1),(2);
CREATE TABLE t2 (a INT, b INT);
INSERT INTO t2 VALUES (3,1),(1,2),(2,1);
SELECT * FROM ((SELECT a FROM t1 UNION SELECT 9 LIMIT 5) ORDER BY ROW_NUMBER() OVER ()) x ORDER BY x.a;
a
1
2
3
9
SELECT * FROM ((SELECT a FROM t1 LIMIT 5) ORDER BY ROW_NUMBER() OVER (ORDER BY (SELECT MAX(a) FROM t1))) x ORDER BY x.a;
a
1
2
3
SELECT * FROM ((SELECT a FROM t1 LIMIT 5) ORDER BY ROW_NUMBER() OVER () + (SELECT MAX(a) FROM t1)) x ORDER BY x.a;
a
1
2
3
# This query used to crash, now it correctly fails with a bad field reference error
(SELECT a FROM t1 LIMIT 5) ORDER BY (SELECT a FROM t2 WHERE t2.a = t1.a LIMIT 1);
ERROR 42S22: Unknown column 't1.a' in 'WHERE'
SELECT * FROM ((SELECT a FROM t1 LIMIT 5) ORDER BY ROW_NUMBER() OVER ()) x, ((SELECT a FROM t1 LIMIT 5) ORDER BY ROW_NUMBER() OVER (ORDER BY a)) y ORDER BY x.a, y.a;
a	a
1	1
1	2
1	3
2	1
2	2
2	3
3	1
3	2
3	3
# The value of the window function must be the one of the derived table form
SELECT * FROM ((SELECT a FROM t1 LIMIT 5) ORDER BY ROW_NUMBER() OVER (PARTITION BY a)) x ORDER BY x.a;
a
1
2
3
SELECT * FROM (SELECT * FROM (SELECT a FROM t1 LIMIT 5) dt ORDER BY ROW_NUMBER() OVER (PARTITION BY a)) x ORDER BY x.a;
a
1
2
3
# A query expression nested in the ORDER BY must not hide the window
# function that precedes it: all of these must sort descending
(SELECT a FROM t1 LIMIT 5) ORDER BY ROW_NUMBER() OVER (ORDER BY a) + (SELECT 0 FROM t1 LIMIT 1) DESC;
a
3
2
1
(SELECT a FROM t1 LIMIT 5) ORDER BY ROW_NUMBER() OVER (ORDER BY a) + (SELECT 0 FROM t1 ORDER BY a LIMIT 1) DESC;
a
3
2
1
(SELECT a FROM t1 LIMIT 5) ORDER BY ROW_NUMBER() OVER (ORDER BY a) + (SELECT MAX(d.a)*0 FROM (SELECT a FROM t1 ORDER BY a) d) DESC;
a
3
2
1
(SELECT a FROM t1 LIMIT 5) ORDER BY ROW_NUMBER() OVER (ORDER BY a) + (SELECT 0 FROM t1 ORDER BY a LIMIT 1) + RANK() OVER (ORDER BY a) DESC;
a
3
2
1
# A window function referring to a window defined inside the parentheses
# is not visible from the ORDER BY that follows them
(SELECT a FROM t1 WINDOW w AS (ORDER BY a) LIMIT 5) ORDER BY ROW_NUMBER() OVER w;
ERROR HY000: Window specification with name 'w' is not defined
# A window function of a subquery of the ORDER BY stays in that subquery
SELECT * FROM ((SELECT a FROM t1 LIMIT 5) ORDER BY (SELECT ROW_NUMBER() OVER () FROM t1 LIMIT 1)) x ORDER BY x.a;
a
1
2
3
# Correlated subqueries of the ORDER BY are re-registered in the wrapper
SELECT * FROM ((SELECT a FROM t1 LIMIT 5) ORDER BY EXISTS (SELECT 1 FROM t2 WHERE t2.a=a AND t2.b=a)) x ORDER BY x.a;
a
1
2
3
SELECT * FROM ((SELECT a FROM t1 LIMIT 5) ORDER BY a IN (SELECT b FROM t2 WHERE t2.a=a)) x ORDER BY x.a;
a
1
2
3
DROP TABLE t1, t2;
CREATE TABLE t1 (c1 INT, c2 TEXT);
INSERT INTO t1 (c1, c2) VALUES (0, 'a');
SELECT * FROM
{
ta1 t1 AS ta2 NATURAL RIGHT OUTER JOIN
(
(
SELECT * FROM
{
ta3 t1 AS ta4 NATURAL STRAIGHT_JOIN t1 AS ta5
}
LIMIT 1234567890 ROWS EXAMINED 1234567890 LOCK IN SHARE MODE SKIP LOCKED
)
ORDER BY FALSE <=> + INTERVAL NOT FALSE=FALSE IN
(
SELECT FALSE <=> FALSE IN (SELECT 'string')
)
SECOND_MICROSECOND + TRUE <=> TRUE IN (SELECT 'string') << ROW_NUMBER () OVER
(
PARTITION BY NOT TRUE <=> FALSE IN (SELECT 'string') DESC
)
IN (SELECT 'string')
)=ta6
NATURAL JOIN t1 AS ta7
};
c1	c2
0	a
Warnings:
Warning	1292	Truncated incorrect DECIMAL value: 'string'
Warning	1292	Truncated incorrect DECIMAL value: 'string'
Warning	1292	Incorrect datetime value: '0000-00-00 00:00:00'
DROP TABLE t1;
#
# End of 10.11 tests
#
