include/rpl_init.inc [topology=1->2]
*** Test retry of transactions that fail to replicate due to deadlock or similar temporary error. ***
ALTER TABLE mysql.gtid_slave_pos ENGINE=InnoDB;
CREATE TABLE t1 (a int PRIMARY KEY, b INT) ENGINE=InnoDB;
INSERT INTO t1 VALUES (1,1);
SET sql_log_bin=0;
CREATE FUNCTION foo(x INT, d1 VARCHAR(500), d2 VARCHAR(500))
RETURNS INT DETERMINISTIC
BEGIN
RETURN x;
END
||
SET sql_log_bin=1;
SET @old_parallel_threads=@@GLOBAL.slave_parallel_threads;
include/stop_slave.inc
SET GLOBAL slave_parallel_threads=5;
include/start_slave.inc
SET sql_log_bin=0;
CREATE FUNCTION foo(x INT, d1 VARCHAR(500), d2 VARCHAR(500))
RETURNS INT DETERMINISTIC
BEGIN
IF d1 != '' THEN
SET debug_sync = d1;
END IF;
IF d2 != '' THEN
SET debug_sync = d2;
END IF;
RETURN x;
END
||
SET sql_log_bin=1;
include/stop_slave.inc
SET gtid_seq_no = 100;
BEGIN;
INSERT INTO t1 VALUES (2,1);
UPDATE t1 SET b=b+1 WHERE a=1;
INSERT INTO t1 VALUES (3,1);
COMMIT;
SELECT * FROM t1 ORDER BY a;
a	b
1	2
2	1
3	1
SET @old_dbug= @@GLOBAL.debug_dbug;
SET GLOBAL debug_dbug="+d,rpl_parallel_simulate_temp_err_gtid_0_x_100";
include/start_slave.inc
SET GLOBAL debug_dbug=@old_dbug;
retries
1
SELECT * FROM t1 ORDER BY a;
a	b
1	2
2	1
3	1
*** Test that double retry works when the first retry also fails with temp error ***
include/stop_slave.inc
SET gtid_seq_no = 100;
SET @old_server_id = @@server_id;
SET server_id = 10;
BEGIN;
INSERT INTO t1 VALUES (4,1);
UPDATE t1 SET b=b+1 WHERE a=1;
INSERT INTO t1 VALUES (5,1);
INSERT INTO t1 VALUES (6,1);
COMMIT;
SET server_id = @old_server_id;
SELECT * FROM t1 ORDER BY a;
a	b
1	3
2	1
3	1
4	1
5	1
6	1
SET @old_dbug= @@GLOBAL.debug_dbug;
SET GLOBAL debug_dbug="+d,rpl_parallel_simulate_temp_err_gtid_0_x_100,rpl_parallel_simulate_double_temp_err_gtid_0_x_100";
include/start_slave.inc
SET GLOBAL debug_dbug=@old_dbug;
retries
2
SELECT * FROM t1 ORDER BY a;
a	b
1	3
2	1
3	1
4	1
5	1
6	1
*** Test too many retries, eventually causing failure. ***
include/stop_slave.inc
SET gtid_seq_no = 100;
SET @old_server_id = @@server_id;
SET server_id = 11;
BEGIN;
INSERT INTO t1 VALUES (7,1);
UPDATE t1 SET b=b+1 WHERE a=1;
INSERT INTO t1 VALUES (8,1);
INSERT INTO t1 VALUES (9,1);
COMMIT;
SET server_id = @old_server_id;
SELECT * FROM t1 ORDER BY a;
a	b
1	4
2	1
3	1
4	1
5	1
6	1
7	1
8	1
9	1
SET sql_log_bin=0;
CALL mtr.add_suppression("Slave worker thread retried transaction 10 time\\(s\\) in vain, giving up");
CALL mtr.add_suppression("Slave: Deadlock found when trying to get lock; try restarting transaction");
SET sql_log_bin=1;
SET @old_dbug= @@GLOBAL.debug_dbug;
SET GLOBAL debug_dbug="+d,rpl_parallel_simulate_temp_err_gtid_0_x_100,rpl_parallel_simulate_infinite_temp_err_gtid_0_x_100";
START SLAVE;
include/wait_for_slave_sql_error.inc [errno=1213]
SET GLOBAL debug_dbug=@old_dbug;
retries
10
SELECT * FROM t1 ORDER BY a;
a	b
1	3
2	1
3	1
4	1
5	1
6	1
STOP SLAVE IO_THREAD;
include/start_slave.inc
SELECT * FROM t1 ORDER BY a;
a	b
1	4
2	1
3	1
4	1
5	1
6	1
7	1
8	1
9	1
*** Test retry of event group that spans multiple relay log files. ***
CREATE TABLE t2 (a int PRIMARY KEY, b BLOB) ENGINE=InnoDB;
INSERT INTO t2 VALUES (1,"Hulubullu");
include/stop_slave.inc
SET @old_max= @@GLOBAL.max_relay_log_size;
SET GLOBAL max_relay_log_size=4096;
SET gtid_seq_no = 100;
SET @old_server_id = @@server_id;
SET server_id = 12;
BEGIN;
INSERT INTO t1 VALUES (10, 4);
COMMIT;
SET server_id = @old_server_id;
SELECT * FROM t1 WHERE a >= 10 ORDER BY a;
a	b
10	4
SELECT a, LENGTH(b) FROM t2 ORDER BY a;
a	LENGTH(b)
1	9
2	5006
3	5012
SET @old_dbug= @@GLOBAL.debug_dbug;
SET GLOBAL debug_dbug="+d,rpl_parallel_simulate_temp_err_gtid_0_x_100";
include/start_slave.inc
SET GLOBAL debug_dbug=@old_dbug;
retries
1
SELECT * FROM t1 WHERE a >= 10 ORDER BY a;
a	b
10	4
SELECT a, LENGTH(b) FROM t2 ORDER BY a;
a	LENGTH(b)
1	9
2	5006
3	5012
INSERT INTO t1 VALUES (11,11);
SELECT * FROM t1 WHERE a >= 10 ORDER BY a;
a	b
10	4
11	11
SELECT a, LENGTH(b) FROM t2 ORDER BY a;
a	LENGTH(b)
1	9
2	5006
3	5012
4	5000
SET GLOBAL max_relay_log_size=@old_max;
*** MDEV-7065: Incorrect relay log position in parallel replication after retry of transaction ***
include/stop_slave.inc
BEGIN;
INSERT INTO t1 VALUES (100, 0);
INSERT INTO t1 VALUES (101, 0);
INSERT INTO t1 VALUES (102, 0);
INSERT INTO t1 VALUES (103, 0);
COMMIT;
SELECT * FROM t1 WHERE a >= 100 ORDER BY a;
a	b
100	0
101	0
102	0
103	0
SET @old_dbug= @@GLOBAL.debug_dbug;
SET GLOBAL debug_dbug="+d,rpl_parallel_simulate_temp_err_xid";
include/start_slave.inc
SET GLOBAL debug_dbug=@old_dbug;
retries
1
SELECT * FROM t1 WHERE a >= 100 ORDER BY a;
a	b
100	0
101	0
102	0
103	0
include/stop_slave_sql.inc
INSERT INTO t1 VALUES (104, 1);
INSERT INTO t1 VALUES (105, 1);
INSERT INTO t1 VALUES (106, 1);
INSERT INTO t1 VALUES (107, 1);
INSERT INTO t1 VALUES (108, 1);
INSERT INTO t1 VALUES (109, 1);
include/start_slave.inc
SELECT * FROM t1 WHERE a >= 100 ORDER BY a;
a	b
100	0
101	0
102	0
103	0
104	1
105	1
106	1
107	1
108	1
109	1
include/stop_slave.inc
SET GLOBAL slave_parallel_threads=@old_parallel_threads;
include/start_slave.inc
DROP TABLE t1, t2;
DROP function foo;
include/rpl_end.inc
