include/master-slave.inc
[connection master]
connection master;
*** 1. Prepare load ***
CREATE TABLE t1 (a int, b int, c int,
INDEX i1(a),
INDEX i2(b))
ENGINE=InnoDB;
include/save_master_gtid.inc
INSERT INTO t1 VALUES
(1,1,0), (1,2,0), (1,3,0), (1,4,0),
(2,1,0), (2,2,0);
connection slave;
include/stop_slave.inc
SET @old_timeout= @@GLOBAL.innodb_lock_wait_timeout;
SET @old_retries= @@GLOBAL.slave_transaction_retries;
SET GLOBAL innodb_lock_wait_timeout= 2;
SET GLOBAL slave_transaction_retries= 3;
include/start_slave.inc
connection master;
SET @@gtid_seq_no=100;
XA START "trx_1";
UPDATE t1 FORCE INDEX (i2) SET c=c+1 WHERE a=1 AND (b=1 OR b=2);
XA END "trx_1";
XA PREPARE "trx_1";
connection master1;
XA START "trx_2";
UPDATE t1 FORCE INDEX (i2) SET c=c+1 WHERE a=1 AND b=3;
XA END "trx_2";
XA PREPARE "trx_2";
connection master;
XA COMMIT "trx_1";
connection master1;
XA COMMIT "trx_2";
include/save_master_gtid.inc
connection master;
SELECT * FROM t1 ORDER BY a,b,c;
a	b	c
1	1	1
1	2	1
1	3	1
1	4	0
2	1	0
2	2	0
*** 2. Serial mode check ***
connection slave;
SELECT * FROM t1 ORDER BY a,b,c;
a	b	c
1	1	1
1	2	1
1	3	1
1	4	0
2	1	0
2	2	0
*** 3. Parallel mode check ***
connection slave;
include/stop_slave.inc
delete from t1;
reset master;
set @@global.gtid_slave_pos='$gtid_binlog_pos_0';
set @old_slave_parallel_threads=@@global.slave_parallel_threads;
set @old_slave_parallel_mode=@@global.slave_parallel_mode;
set @@global.slave_parallel_threads=2;
set @@global.slave_parallel_mode=optimistic;
CHANGE MASTER TO master_use_gtid=slave_pos;
SET @@global.debug_dbug="+d,hold_worker_on_schedule";
include/start_slave.inc
SET DEBUG_SYNC = 'now SIGNAL continue_worker';
include/sync_with_master_gtid.inc
SELECT * FROM t1 ORDER BY a,b,c;
a	b	c
1	1	1
1	2	1
1	3	1
1	4	0
2	1	0
2	2	0
connection master;
DROP TABLE t1;
connection slave;
SET GLOBAL innodb_lock_wait_timeout= @old_timeout;
SET GLOBAL slave_transaction_retries= @old_retries;
include/stop_slave.inc
SET debug_sync = RESET;
SET @@global.debug_dbug = "";
set @@global.slave_parallel_threads= @old_slave_parallel_threads;
set @@global.slave_parallel_mode= @old_slave_parallel_mode;
include/start_slave.inc
include/rpl_end.inc
