include/rpl_init.inc [topology=1->2]
*** Test connecting with empty GTID state to start from very beginning of binlog ***
include/stop_slave.inc
RESET MASTER;
RESET SLAVE;
RESET MASTER;
FLUSH LOGS;
CREATE TABLE t1 (a INT PRIMARY KEY) ENGINE=InnoDB;
CHANGE MASTER TO master_host = '127.0.0.1', master_port = MASTER_PORT,
MASTER_GTID_POS="";
include/start_slave.inc
SELECT * FROM t1;
a
INSERT INTO t1 VALUES (1);
SELECT * FROM t1;
a
1
include/stop_slave.inc
*** Test that master gives error when slave asks for empty gtid pos and binlog files have been purged. ***
FLUSH LOGS;
INSERT INTO t1 VALUES (2);
PURGE BINARY LOGS TO 'master-bin.000003';
show binary logs;
Log_name	File_size
master-bin.000003	#
CHANGE MASTER TO master_host = '127.0.0.1', master_port = MASTER_PORT,
MASTER_GTID_POS="";
START SLAVE;
include/wait_for_slave_io_error.inc [errno=1236]
include/stop_slave.inc
CHANGE MASTER TO master_host = '127.0.0.1', master_port = MASTER_PORT,
MASTER_LOG_FILE="master-bin.000003", MASTER_LOG_POS=4;
include/start_slave.inc
SELECT * FROM t1 ORDER BY a;
a
1
2
SET sql_log_bin=0;
call mtr.add_suppression('Could not find GTID state requested by slave in any binlog files');
SET sql_log_bin=1;
*** Test that we give error when explict MASTER_GTID_POS=xxx that conflicts with what is in our binary log ***
include/stop_slave.inc
INSERT INTO t1 VALUES(3);
CHANGE MASTER TO master_host = '127.0.0.1', master_port = MASTER_PORT,
MASTER_GTID_POS='0-1-3';
include/start_slave.inc
SELECT * FROM t1 ORDER by a;
a
1
2
3
include/stop_slave.inc
INSERT INTO t1 VALUES (4);
INSERT INTO t1 VALUES (10);
DELETE FROM t1 WHERE a=10;
CHANGE MASTER TO master_host = '127.0.0.1', master_port = MASTER_PORT,
MASTER_GTID_POS='0-1-4';
ERROR HY000: Requested MASTER_GTID_POS 0-1-4 conflicts with the binary log which contains a more recent GTID 0-2-6. To use the requested MASTER_GTID_POS, the old binlog must be removed with RESET MASTER to avoid out-of-order binlog
RESET MASTER;
CHANGE MASTER TO master_host = '127.0.0.1', master_port = MASTER_PORT,
MASTER_GTID_POS='0-1-4';
START SLAVE;
SELECT * FROM t1 ORDER by a;
a
1
2
3
4
DROP TABLE t1;
*** MDEV-4275: I/O thread restart duplicates events in relay log ***
include/stop_slave.inc
RESET SLAVE ALL;
RESET MASTER;
RESET MASTER;
CHANGE MASTER TO master_host='127.0.0.1', master_port=MASTER_PORT, master_user='root', master_gtid_pos='';
include/start_slave.inc
CREATE TABLE t1 (a INT PRIMARY KEY);
INSERT INTO t1 VALUES (1);
SELECT * FROM t1;
a
1
include/stop_slave_io.inc
START SLAVE IO_THREAD;
include/wait_for_slave_io_to_start.inc
INSERT INTO t1 VALUES (2);
SELECT * FROM t1 ORDER BY a;
a
1
2
*** MDEV-4329: MASTER_GTID_POS='' is not checked for conflicts with binlog ***
include/stop_slave.inc
DROP TABLE t1;
RESET SLAVE;
CHANGE MASTER TO master_gtid_pos='';
ERROR HY000: Requested MASTER_GTID_POS contains no value for replication domain 0. This conflicts with the binary log which contains GTID 0-2-4. To use the requested MASTER_GTID_POS, the old binlog must be removed with RESET MASTER to avoid out-of-order binlog
RESET MASTER;
CHANGE MASTER TO master_gtid_pos='';
include/start_slave.inc
SELECT * FROM t1 ORDER BY a;
a
1
2
include/stop_slave.inc
SET SQL_LOG_BIN=0;
DROP TABLE t1;
SET SQL_LOG_BIN=1;
RESET SLAVE;
CHANGE MASTER TO master_gtid_pos='';
include/start_slave.inc
SELECT * FROM t1 ORDER BY a;
a
1
2
*** Test that RESET SLAVE clears the Using_Gtid flag. ***
include/stop_slave.inc
RESET SLAVE;
Using_Gtid = '0'
START SLAVE;
include/wait_for_slave_sql_error.inc [errno=1050]
STOP SLAVE IO_THREAD;
CHANGE MASTER TO MASTER_GTID_POS=AUTO;
include/start_slave.inc
INSERT INTO t1 VALUES(3);
SELECT * FROM t1 ORDER BY a;
a
1
2
3
SET SQL_LOG_BIN=0;
call mtr.add_suppression("Slave: Table 't1' already exists Error_code: 1050");
SET SQL_LOG_BIN=1;
DROP TABLE t1;
include/rpl_end.inc
