include/master-slave.inc
[connection master]
connection master;
SET SESSION default_storage_engine=InnoDB;
SET SESSION binlog_format=ROW;
SELECT @@session.rpl_use_binlog_events_for_fk_cascade;
@@session.rpl_use_binlog_events_for_fk_cascade
0
CREATE TABLE p (
id INT PRIMARY KEY,
v INT
) ENGINE=InnoDB;
CREATE TABLE c (
id INT PRIMARY KEY,
pid INT,
v INT,
KEY(pid),
CONSTRAINT fk FOREIGN KEY (pid) REFERENCES p(id)
ON DELETE CASCADE
ON UPDATE CASCADE
) ENGINE=InnoDB;
INSERT INTO p VALUES (1, 10);
INSERT INTO c VALUES (100, 1, 20);
connection slave;
connection slave;
include/stop_slave.inc
SET GLOBAL rpl_use_binlog_events_for_fk_cascade=1;
include/start_slave.inc
connection master;
UPDATE p SET id=2 WHERE id=1;
DELETE FROM p WHERE id=2;
connection slave;
connection slave;
SELECT COUNT(*) FROM p;
COUNT(*)
0
SELECT COUNT(*) FROM c;
COUNT(*)
0
FLUSH BINARY LOGS;
FOUND 1 /### DELETE FROM `test`.`p`/ in fk_cascade_slave_option.sql
NOT FOUND /### DELETE FROM `test`.`c`/ in fk_cascade_slave_option.sql
NOT FOUND /### UPDATE `test`.`c`/ in fk_cascade_slave_option.sql
connection slave;
include/stop_slave.inc
SET GLOBAL rpl_use_binlog_events_for_fk_cascade=0;
include/start_slave.inc
connection master;
DROP TABLE c, p;
connection slave;
connection master;
include/rpl_end.inc
