for master_1
for child2
child2_1
child2_2
child2_3
for child3
child3_1
child3_2
child3_3

drop and create databases
connection master_1;
DROP DATABASE IF EXISTS auto_test_local;
CREATE DATABASE auto_test_local;
USE auto_test_local;
connection child2_1;
DROP DATABASE IF EXISTS auto_test_remote;
CREATE DATABASE auto_test_remote;
USE auto_test_remote;
connection child2_2;
DROP DATABASE IF EXISTS auto_test_remote2;
CREATE DATABASE auto_test_remote2;
USE auto_test_remote2;

test select 1
connection master_1;
SELECT 1;
1
1

create table select test
connection master_1;
DROP TABLE IF EXISTS tb_l;
CREATE TABLE tb_l (
a INT,
b CHAR(1),
c DATETIME,
PRIMARY KEY(a)
) MASTER_1_ENGINE2 MASTER_1_CHARSET2
INSERT INTO tb_l (a, b, c) VALUES
(1, 'a', '2008-08-01 10:21:39'),
(2, 'b', '2000-01-01 00:00:00'),
(3, 'e', '2007-06-04 20:03:11'),
(4, 'd', '2003-11-30 05:01:03'),
(5, 'c', '2001-12-31 23:59:59');
DROP TABLE IF EXISTS ta_l;
CREATE TABLE ta_l (
PRIMARY KEY(a)
) MASTER_1_ENGINE MASTER_1_CHARSET MASTER_1_COMMENT_2_1
SELECT a, b, c FROM tb_l
connection master_1;
SELECT a, b, date_format(c, '%Y-%m-%d %H:%i:%s') FROM ta_l ORDER BY a;
a	b	date_format(c, '%Y-%m-%d %H:%i:%s')
1	a	2008-08-01 10:21:39
2	b	2000-01-01 00:00:00
3	e	2007-06-04 20:03:11
4	d	2003-11-30 05:01:03
5	c	2001-12-31 23:59:59

create table ignore select test
connection master_1;
DROP TABLE IF EXISTS ta_l;
DROP TABLE IF EXISTS tb_l;
CREATE TABLE tb_l (
a INT,
b CHAR(1),
c DATETIME,
PRIMARY KEY(a)
) MASTER_1_ENGINE2 MASTER_1_CHARSET2
INSERT INTO tb_l (a, b, c) VALUES
(1, 'f', '2008-07-01 10:21:39'),
(2, 'g', '2000-02-01 00:00:00'),
(3, 'j', '2007-05-04 20:03:11'),
(4, 'i', '2003-10-30 05:01:03'),
(5, 'h', '2001-10-31 23:59:59');
CREATE TABLE ta_l (
PRIMARY KEY(a)
) MASTER_1_ENGINE MASTER_1_CHARSET MASTER_1_COMMENT_2_1
IGNORE SELECT a, b, c FROM tb_l
Warnings:
Warning	1062	Duplicate entry '1' for key 'PRIMARY'
Warning	1062	Duplicate entry '2' for key 'PRIMARY'
Warning	1062	Duplicate entry '3' for key 'PRIMARY'
Warning	1062	Duplicate entry '4' for key 'PRIMARY'
Warning	1062	Duplicate entry '5' for key 'PRIMARY'
connection master_1;
SELECT a, b, date_format(c, '%Y-%m-%d %H:%i:%s') FROM ta_l ORDER BY a;
a	b	date_format(c, '%Y-%m-%d %H:%i:%s')
1	a	2008-08-01 10:21:39
2	b	2000-01-01 00:00:00
3	e	2007-06-04 20:03:11
4	d	2003-11-30 05:01:03
5	c	2001-12-31 23:59:59

create table ignore select test
connection master_1;
DROP TABLE IF EXISTS ta_l;
CREATE TABLE ta_l (
PRIMARY KEY(a)
) MASTER_1_ENGINE MASTER_1_CHARSET MASTER_1_COMMENT_2_1
REPLACE SELECT a, b, c FROM tb_l
connection master_1;
SELECT a, b, date_format(c, '%Y-%m-%d %H:%i:%s') FROM ta_l ORDER BY a;
a	b	date_format(c, '%Y-%m-%d %H:%i:%s')
1	f	2008-07-01 10:21:39
2	g	2000-02-01 00:00:00
3	j	2007-05-04 20:03:11
4	i	2003-10-30 05:01:03
5	h	2001-10-31 23:59:59

create no index table
connection master_1;
DROP TABLE IF EXISTS ta_l_no_idx;
CREATE TABLE ta_l_no_idx
MASTER_1_ENGINE MASTER_1_CHARSET MASTER_1_COMMENT2_2_1
SELECT a, b, c FROM tb_l
connection master_1;
SELECT a, b, date_format(c, '%Y-%m-%d %H:%i:%s') FROM ta_l_no_idx ORDER BY a;
a	b	date_format(c, '%Y-%m-%d %H:%i:%s')
1	f	2008-07-01 10:21:39
2	g	2000-02-01 00:00:00
3	j	2007-05-04 20:03:11
4	i	2003-10-30 05:01:03
5	h	2001-10-31 23:59:59

select table
connection master_1;
SELECT a, b, date_format(c, '%Y-%m-%d %H:%i:%s') FROM ta_l ORDER BY a;
a	b	date_format(c, '%Y-%m-%d %H:%i:%s')
1	f	2008-07-01 10:21:39
2	g	2000-02-01 00:00:00
3	j	2007-05-04 20:03:11
4	i	2003-10-30 05:01:03
5	h	2001-10-31 23:59:59

select table shared mode
connection master_1;
SELECT a, b, date_format(c, '%Y-%m-%d %H:%i:%s') FROM ta_l ORDER BY a
LOCK IN SHARE MODE;
a	b	date_format(c, '%Y-%m-%d %H:%i:%s')
1	f	2008-07-01 10:21:39
2	g	2000-02-01 00:00:00
3	j	2007-05-04 20:03:11
4	i	2003-10-30 05:01:03
5	h	2001-10-31 23:59:59

select table for update
connection master_1;
SELECT a, b, date_format(c, '%Y-%m-%d %H:%i:%s') FROM ta_l ORDER BY a
FOR UPDATE;
a	b	date_format(c, '%Y-%m-%d %H:%i:%s')
1	f	2008-07-01 10:21:39
2	g	2000-02-01 00:00:00
3	j	2007-05-04 20:03:11
4	i	2003-10-30 05:01:03
5	h	2001-10-31 23:59:59

select table join
connection master_1;
SELECT a.a, a.b, date_format(b.c, '%Y-%m-%d %H:%i:%s') FROM ta_l a, tb_l b
WHERE a.a = b.a ORDER BY a.a;
a	b	date_format(b.c, '%Y-%m-%d %H:%i:%s')
1	f	2008-07-01 10:21:39
2	g	2000-02-01 00:00:00
3	j	2007-05-04 20:03:11
4	i	2003-10-30 05:01:03
5	h	2001-10-31 23:59:59

select table straight_join
connection master_1;
SELECT STRAIGHT_JOIN a.a, a.b, date_format(b.c, '%Y-%m-%d %H:%i:%s')
FROM ta_l a, tb_l b WHERE a.a = b.a ORDER BY a.a;
a	b	date_format(b.c, '%Y-%m-%d %H:%i:%s')
1	f	2008-07-01 10:21:39
2	g	2000-02-01 00:00:00
3	j	2007-05-04 20:03:11
4	i	2003-10-30 05:01:03
5	h	2001-10-31 23:59:59

select sql_small_result
connection master_1;
SELECT SQL_SMALL_RESULT a, b, date_format(c, '%Y-%m-%d %H:%i:%s') FROM ta_l
ORDER BY a;
a	b	date_format(c, '%Y-%m-%d %H:%i:%s')
1	f	2008-07-01 10:21:39
2	g	2000-02-01 00:00:00
3	j	2007-05-04 20:03:11
4	i	2003-10-30 05:01:03
5	h	2001-10-31 23:59:59

select sql_big_result
connection master_1;
SELECT SQL_BIG_RESULT a, b, date_format(c, '%Y-%m-%d %H:%i:%s') FROM ta_l
ORDER BY a;
a	b	date_format(c, '%Y-%m-%d %H:%i:%s')
1	f	2008-07-01 10:21:39
2	g	2000-02-01 00:00:00
3	j	2007-05-04 20:03:11
4	i	2003-10-30 05:01:03
5	h	2001-10-31 23:59:59

select sql_buffer_result
connection master_1;
SELECT SQL_BUFFER_RESULT a, b, date_format(c, '%Y-%m-%d %H:%i:%s') FROM ta_l
ORDER BY a;
a	b	date_format(c, '%Y-%m-%d %H:%i:%s')
1	f	2008-07-01 10:21:39
2	g	2000-02-01 00:00:00
3	j	2007-05-04 20:03:11
4	i	2003-10-30 05:01:03
5	h	2001-10-31 23:59:59

select sql_cache
connection master_1;
SELECT SQL_CACHE a, b, date_format(c, '%Y-%m-%d %H:%i:%s') FROM ta_l
ORDER BY a;
a	b	date_format(c, '%Y-%m-%d %H:%i:%s')
1	f	2008-07-01 10:21:39
2	g	2000-02-01 00:00:00
3	j	2007-05-04 20:03:11
4	i	2003-10-30 05:01:03
5	h	2001-10-31 23:59:59

select sql_no_cache
connection master_1;
SELECT SQL_NO_CACHE a, b, date_format(c, '%Y-%m-%d %H:%i:%s') FROM ta_l
ORDER BY a;
a	b	date_format(c, '%Y-%m-%d %H:%i:%s')
1	f	2008-07-01 10:21:39
2	g	2000-02-01 00:00:00
3	j	2007-05-04 20:03:11
4	i	2003-10-30 05:01:03
5	h	2001-10-31 23:59:59

select sql_calc_found_rows
connection master_1;
SELECT SQL_CALC_FOUND_ROWS a, b, date_format(c, '%Y-%m-%d %H:%i:%s') FROM ta_l
ORDER BY a LIMIT 4;
a	b	date_format(c, '%Y-%m-%d %H:%i:%s')
1	f	2008-07-01 10:21:39
2	g	2000-02-01 00:00:00
3	j	2007-05-04 20:03:11
4	i	2003-10-30 05:01:03
connection master_1;
SELECT found_rows();
found_rows()
5

select high_priority
connection master_1;
SELECT HIGH_PRIORITY a, b, date_format(c, '%Y-%m-%d %H:%i:%s') FROM ta_l
ORDER BY a;
a	b	date_format(c, '%Y-%m-%d %H:%i:%s')
1	f	2008-07-01 10:21:39
2	g	2000-02-01 00:00:00
3	j	2007-05-04 20:03:11
4	i	2003-10-30 05:01:03
5	h	2001-10-31 23:59:59

select distinct
connection master_1;
SELECT DISTINCT a, b, date_format(c, '%Y-%m-%d %H:%i:%s') FROM ta_l
ORDER BY a;
a	b	date_format(c, '%Y-%m-%d %H:%i:%s')
1	f	2008-07-01 10:21:39
2	g	2000-02-01 00:00:00
3	j	2007-05-04 20:03:11
4	i	2003-10-30 05:01:03
5	h	2001-10-31 23:59:59

select count
connection master_1;
SELECT count(*) FROM ta_l ORDER BY a;
count(*)
5

select table join not use index
connection master_1;
SELECT a.a, a.b, date_format(a.c, '%Y-%m-%d %H:%i:%s') FROM tb_l a WHERE
EXISTS (SELECT * FROM ta_l b WHERE b.b = a.b) ORDER BY a.a;
a	b	date_format(a.c, '%Y-%m-%d %H:%i:%s')
1	f	2008-07-01 10:21:39
2	g	2000-02-01 00:00:00
3	j	2007-05-04 20:03:11
4	i	2003-10-30 05:01:03
5	h	2001-10-31 23:59:59

select using pushdown
connection master_1;
SELECT a.a, a.b, date_format(a.c, '%Y-%m-%d %H:%i:%s') FROM ta_l a WHERE
a.b = 'g' ORDER BY a.a;
a	b	date_format(a.c, '%Y-%m-%d %H:%i:%s')
2	g	2000-02-01 00:00:00

select using index and pushdown
connection master_1;
SELECT a.a, a.b, date_format(a.c, '%Y-%m-%d %H:%i:%s') FROM ta_l a WHERE
a.a > 0 AND a.b = 'g' ORDER BY a.a;
a	b	date_format(a.c, '%Y-%m-%d %H:%i:%s')
2	g	2000-02-01 00:00:00

insert
connection master_1;
TRUNCATE TABLE ta_l;
connection master_1;
INSERT INTO ta_l (a, b, c) VALUES (2, 'e', '2008-01-01 23:59:59');
connection master_1;
SELECT a, b, date_format(c, '%Y-%m-%d %H:%i:%s') FROM ta_l ORDER BY a;
a	b	date_format(c, '%Y-%m-%d %H:%i:%s')
2	e	2008-01-01 23:59:59

insert select
connection master_1;
TRUNCATE TABLE ta_l;
connection master_1;
INSERT INTO ta_l (a, b, c) SELECT a, b, c FROM tb_l;
connection master_1;
SELECT a, b, date_format(c, '%Y-%m-%d %H:%i:%s') FROM ta_l ORDER BY a;
a	b	date_format(c, '%Y-%m-%d %H:%i:%s')
1	f	2008-07-01 10:21:39
2	g	2000-02-01 00:00:00
3	j	2007-05-04 20:03:11
4	i	2003-10-30 05:01:03
5	h	2001-10-31 23:59:59

insert select a
connection master_1;
TRUNCATE TABLE ta_l;
connection master_1;
INSERT INTO ta_l (a, b, c) VALUES ((SELECT a FROM tb_l ORDER BY a LIMIT 1),
'e', '2008-01-01 23:59:59');
connection master_1;
SELECT a, b, date_format(c, '%Y-%m-%d %H:%i:%s') FROM ta_l ORDER BY a;
a	b	date_format(c, '%Y-%m-%d %H:%i:%s')
1	e	2008-01-01 23:59:59

insert low_priority
connection master_1;
TRUNCATE TABLE ta_l;
connection master_1;
INSERT LOW_PRIORITY INTO ta_l (a, b, c) values (2, 'e', '2008-01-01 23:59:59');
connection master_1;
SELECT a, b, date_format(c, '%Y-%m-%d %H:%i:%s') FROM ta_l ORDER BY a;
a	b	date_format(c, '%Y-%m-%d %H:%i:%s')
2	e	2008-01-01 23:59:59

insert high_priority
connection master_1;
TRUNCATE TABLE ta_l;
connection master_1;
INSERT HIGH_PRIORITY INTO ta_l (a, b, c) VALUES (2, 'e',
'2008-01-01 23:59:59');
connection master_1;
SELECT a, b, date_format(c, '%Y-%m-%d %H:%i:%s') FROM ta_l ORDER BY a;
a	b	date_format(c, '%Y-%m-%d %H:%i:%s')
2	e	2008-01-01 23:59:59

insert ignore
connection master_1;
INSERT IGNORE INTO ta_l (a, b, c) VALUES (2, 'd', '2009-02-02 01:01:01');
Warnings:
Warning	1062	Duplicate entry '2' for key 'PRIMARY'
connection master_1;
SELECT a, b, date_format(c, '%Y-%m-%d %H:%i:%s') FROM ta_l ORDER BY a;
a	b	date_format(c, '%Y-%m-%d %H:%i:%s')
2	e	2008-01-01 23:59:59

insert update (insert)
connection master_1;
TRUNCATE TABLE ta_l;
connection master_1;
INSERT INTO ta_l (a, b, c) VALUES (2, 'e', '2008-01-01 23:59:59') ON DUPLICATE
KEY UPDATE b = 'f', c = '2005-08-08 11:11:11';
connection master_1;
SELECT a, b, date_format(c, '%Y-%m-%d %H:%i:%s') FROM ta_l ORDER BY a;
a	b	date_format(c, '%Y-%m-%d %H:%i:%s')
2	e	2008-01-01 23:59:59

insert update (update)
connection master_1;
INSERT INTO ta_l (a, b, c) VALUES (2, 'e', '2008-01-01 23:59:59') ON DUPLICATE
KEY UPDATE b = 'f', c = '2005-08-08 11:11:11';
connection master_1;
SELECT a, b, date_format(c, '%Y-%m-%d %H:%i:%s') FROM ta_l ORDER BY a;
a	b	date_format(c, '%Y-%m-%d %H:%i:%s')
2	f	2005-08-08 11:11:11

replace
connection master_1;
TRUNCATE TABLE ta_l;
INSERT INTO ta_l (a, b, c) VALUES (2, 'e', '2008-01-01 23:59:59');
connection master_1;
REPLACE INTO ta_l (a, b, c) VALUES (2, 'f', '2008-02-02 02:02:02');
connection master_1;
SELECT a, b, date_format(c, '%Y-%m-%d %H:%i:%s') FROM ta_l ORDER BY a;
a	b	date_format(c, '%Y-%m-%d %H:%i:%s')
2	f	2008-02-02 02:02:02

replace select
connection master_1;
REPLACE INTO ta_l (a, b, c) SELECT a, b, c FROM tb_l;
connection master_1;
SELECT a, b, date_format(c, '%Y-%m-%d %H:%i:%s') FROM ta_l ORDER BY a;
a	b	date_format(c, '%Y-%m-%d %H:%i:%s')
1	f	2008-07-01 10:21:39
2	g	2000-02-01 00:00:00
3	j	2007-05-04 20:03:11
4	i	2003-10-30 05:01:03
5	h	2001-10-31 23:59:59

replace select a
connection master_1;
REPLACE INTO ta_l (a, b, c) VALUES ((SELECT a FROM tb_l ORDER BY a LIMIT 1),
'e', '2008-01-01 23:59:59');
connection master_1;
SELECT a, b, date_format(c, '%Y-%m-%d %H:%i:%s') FROM ta_l ORDER BY a;
a	b	date_format(c, '%Y-%m-%d %H:%i:%s')
1	e	2008-01-01 23:59:59
2	g	2000-02-01 00:00:00
3	j	2007-05-04 20:03:11
4	i	2003-10-30 05:01:03
5	h	2001-10-31 23:59:59

replace low_priority
connection master_1;
REPLACE LOW_PRIORITY INTO ta_l (a, b, c) VALUES (3, 'g',
'2009-03-03 03:03:03');
connection master_1;
SELECT a, b, date_format(c, '%Y-%m-%d %H:%i:%s') FROM ta_l ORDER BY a;
a	b	date_format(c, '%Y-%m-%d %H:%i:%s')
1	e	2008-01-01 23:59:59
2	g	2000-02-01 00:00:00
3	g	2009-03-03 03:03:03
4	i	2003-10-30 05:01:03
5	h	2001-10-31 23:59:59

update
TRUNCATE TABLE ta_l;
INSERT INTO ta_l (a, b, c) VALUES (1, 'e', '2008-01-01 23:59:59'),
(2, 'e', '2008-01-01 23:59:59');
connection master_1;
UPDATE ta_l SET b = 'f', c = '2008-02-02 02:02:02' WHERE a = 2;
connection master_1;
SELECT a, b, date_format(c, '%Y-%m-%d %H:%i:%s') FROM ta_l ORDER BY a;
a	b	date_format(c, '%Y-%m-%d %H:%i:%s')
1	e	2008-01-01 23:59:59
2	f	2008-02-02 02:02:02

update select
connection master_1;
UPDATE ta_l SET b = 'g', c = '2009-03-03 03:03:03' WHERE a IN (SELECT a FROM
tb_l);
connection master_1;
SELECT a, b, date_format(c, '%Y-%m-%d %H:%i:%s') FROM ta_l ORDER BY a;
a	b	date_format(c, '%Y-%m-%d %H:%i:%s')
1	g	2009-03-03 03:03:03
2	g	2009-03-03 03:03:03

update select a
connection master_1;
UPDATE ta_l SET b = 'h', c = '2010-04-04 04:04:04' WHERE a = (SELECT a FROM
tb_l ORDER BY a LIMIT 1);
connection master_1;
SELECT a, b, date_format(c, '%Y-%m-%d %H:%i:%s') FROM ta_l ORDER BY a;
a	b	date_format(c, '%Y-%m-%d %H:%i:%s')
1	h	2010-04-04 04:04:04
2	g	2009-03-03 03:03:03

update join
connection master_1;
UPDATE ta_l a, tb_l b SET a.b = b.b, a.c = b.c WHERE a.a = b.a;
connection master_1;
SELECT a, b, date_format(c, '%Y-%m-%d %H:%i:%s') FROM ta_l ORDER BY a;
a	b	date_format(c, '%Y-%m-%d %H:%i:%s')
1	f	2008-07-01 10:21:39
2	g	2000-02-01 00:00:00

update join a
connection master_1;
UPDATE ta_l a, tb_l b SET a.b = 'g', a.c = '2009-03-03 03:03:03' WHERE
a.a = b.a;
connection master_1;
SELECT a, b, date_format(c, '%Y-%m-%d %H:%i:%s') FROM ta_l ORDER BY a;
a	b	date_format(c, '%Y-%m-%d %H:%i:%s')
1	g	2009-03-03 03:03:03
2	g	2009-03-03 03:03:03

update low_priority
connection master_1;
UPDATE LOW_PRIORITY ta_l SET b = 'f', c = '2008-02-02 02:02:02' WHERE a = 2;
connection master_1;
SELECT a, b, date_format(c, '%Y-%m-%d %H:%i:%s') FROM ta_l ORDER BY a;
a	b	date_format(c, '%Y-%m-%d %H:%i:%s')
1	g	2009-03-03 03:03:03
2	f	2008-02-02 02:02:02

update ignore
connection master_1;
UPDATE IGNORE ta_l SET a = 1, b = 'g', c = '2009-03-03 03:03:03' WHERE a = 2;
connection master_1;
SELECT a, b, date_format(c, '%Y-%m-%d %H:%i:%s') FROM ta_l ORDER BY a;
a	b	date_format(c, '%Y-%m-%d %H:%i:%s')
1	g	2009-03-03 03:03:03
2	f	2008-02-02 02:02:02

update pushdown
connection master_1;
update ta_l set b = 'j', c = '2009-03-03 03:03:03' where b = 'f';
connection master_1;
SELECT a, b, date_format(c, '%Y-%m-%d %H:%i:%s') FROM ta_l ORDER BY a;
a	b	date_format(c, '%Y-%m-%d %H:%i:%s')
1	g	2009-03-03 03:03:03
2	j	2009-03-03 03:03:03

update index pushdown
connection master_1;
UPDATE ta_l SET b = 'g', c = '2009-03-03 03:03:03' WHERE a > 0 AND b = 'j';
connection master_1;
SELECT a, b, date_format(c, '%Y-%m-%d %H:%i:%s') FROM ta_l ORDER BY a;
a	b	date_format(c, '%Y-%m-%d %H:%i:%s')
1	g	2009-03-03 03:03:03
2	g	2009-03-03 03:03:03

delete
TRUNCATE TABLE ta_l;
INSERT INTO ta_l (a, b, c) VALUES (1, 'e', '2008-01-01 23:59:59'),
(2, 'e', '2008-01-01 23:59:59'), (3, 'e', '2008-01-01 23:59:59'),
(4, 'e', '2008-01-01 23:59:59'), (5, 'e', '2008-01-01 23:59:59'),
(6, 'e', '2008-01-01 23:59:59'), (7, 'e', '2008-01-01 23:59:59'),
(8, 'e', '2008-01-01 23:59:59'), (9, 'e', '2008-01-01 23:59:59'),
(10, 'j', '2008-01-01 23:59:59');
connection master_1;
DELETE FROM ta_l WHERE a = 2;
connection master_1;
SELECT a, b, date_format(c, '%Y-%m-%d %H:%i:%s') FROM ta_l ORDER BY a;
a	b	date_format(c, '%Y-%m-%d %H:%i:%s')
1	e	2008-01-01 23:59:59
3	e	2008-01-01 23:59:59
4	e	2008-01-01 23:59:59
5	e	2008-01-01 23:59:59
6	e	2008-01-01 23:59:59
7	e	2008-01-01 23:59:59
8	e	2008-01-01 23:59:59
9	e	2008-01-01 23:59:59
10	j	2008-01-01 23:59:59

delete all
connection master_1;
DELETE FROM ta_l;
connection master_1;
SELECT a, b, date_format(c, '%Y-%m-%d %H:%i:%s') FROM ta_l ORDER BY a;
a	b	date_format(c, '%Y-%m-%d %H:%i:%s')

delete select
TRUNCATE TABLE ta_l;
INSERT INTO ta_l (a, b, c) VALUES (1, 'e', '2008-01-01 23:59:59'),
(2, 'e', '2008-01-01 23:59:59'), (3, 'e', '2008-01-01 23:59:59'),
(4, 'e', '2008-01-01 23:59:59'), (5, 'e', '2008-01-01 23:59:59'),
(6, 'e', '2008-01-01 23:59:59'), (7, 'e', '2008-01-01 23:59:59'),
(8, 'e', '2008-01-01 23:59:59'), (9, 'e', '2008-01-01 23:59:59'),
(10, 'j', '2008-01-01 23:59:59');
connection master_1;
DELETE FROM ta_l WHERE a IN (SELECT a FROM tb_l);
connection master_1;
SELECT a, b, date_format(c, '%Y-%m-%d %H:%i:%s') FROM ta_l ORDER BY a;
a	b	date_format(c, '%Y-%m-%d %H:%i:%s')
6	e	2008-01-01 23:59:59
7	e	2008-01-01 23:59:59
8	e	2008-01-01 23:59:59
9	e	2008-01-01 23:59:59
10	j	2008-01-01 23:59:59

delete select a
TRUNCATE TABLE ta_l;
INSERT INTO ta_l (a, b, c) VALUES (1, 'e', '2008-01-01 23:59:59'),
(2, 'e', '2008-01-01 23:59:59'), (3, 'e', '2008-01-01 23:59:59'),
(4, 'e', '2008-01-01 23:59:59'), (5, 'e', '2008-01-01 23:59:59'),
(6, 'e', '2008-01-01 23:59:59'), (7, 'e', '2008-01-01 23:59:59'),
(8, 'e', '2008-01-01 23:59:59'), (9, 'e', '2008-01-01 23:59:59'),
(10, 'j', '2008-01-01 23:59:59');
connection master_1;
DELETE FROM ta_l WHERE a = (SELECT a FROM tb_l ORDER BY a LIMIT 1);
connection master_1;
SELECT a, b, date_format(c, '%Y-%m-%d %H:%i:%s') FROM ta_l ORDER BY a;
a	b	date_format(c, '%Y-%m-%d %H:%i:%s')
2	e	2008-01-01 23:59:59
3	e	2008-01-01 23:59:59
4	e	2008-01-01 23:59:59
5	e	2008-01-01 23:59:59
6	e	2008-01-01 23:59:59
7	e	2008-01-01 23:59:59
8	e	2008-01-01 23:59:59
9	e	2008-01-01 23:59:59
10	j	2008-01-01 23:59:59

delete join
TRUNCATE TABLE ta_l;
INSERT INTO ta_l (a, b, c) VALUES (1, 'e', '2008-01-01 23:59:59'),
(2, 'e', '2008-01-01 23:59:59'), (3, 'e', '2008-01-01 23:59:59'),
(4, 'e', '2008-01-01 23:59:59'), (5, 'e', '2008-01-01 23:59:59'),
(6, 'e', '2008-01-01 23:59:59'), (7, 'e', '2008-01-01 23:59:59'),
(8, 'e', '2008-01-01 23:59:59'), (9, 'e', '2008-01-01 23:59:59'),
(10, 'j', '2008-01-01 23:59:59');
connection master_1;
DELETE a FROM ta_l a, (SELECT a FROM tb_l ORDER BY a) b WHERE a.a = b.a;
connection master_1;
SELECT a, b, date_format(c, '%Y-%m-%d %H:%i:%s') FROM ta_l ORDER BY a;
a	b	date_format(c, '%Y-%m-%d %H:%i:%s')
6	e	2008-01-01 23:59:59
7	e	2008-01-01 23:59:59
8	e	2008-01-01 23:59:59
9	e	2008-01-01 23:59:59
10	j	2008-01-01 23:59:59

delete low_priority
TRUNCATE TABLE ta_l;
INSERT INTO ta_l (a, b, c) VALUES (1, 'e', '2008-01-01 23:59:59'),
(2, 'e', '2008-01-01 23:59:59'), (3, 'e', '2008-01-01 23:59:59'),
(4, 'e', '2008-01-01 23:59:59'), (5, 'e', '2008-01-01 23:59:59'),
(6, 'e', '2008-01-01 23:59:59'), (7, 'e', '2008-01-01 23:59:59'),
(8, 'e', '2008-01-01 23:59:59'), (9, 'e', '2008-01-01 23:59:59'),
(10, 'j', '2008-01-01 23:59:59');
connection master_1;
DELETE LOW_PRIORITY FROM ta_l WHERE a = 2;
connection master_1;
SELECT a, b, date_format(c, '%Y-%m-%d %H:%i:%s') FROM ta_l ORDER BY a;
a	b	date_format(c, '%Y-%m-%d %H:%i:%s')
1	e	2008-01-01 23:59:59
3	e	2008-01-01 23:59:59
4	e	2008-01-01 23:59:59
5	e	2008-01-01 23:59:59
6	e	2008-01-01 23:59:59
7	e	2008-01-01 23:59:59
8	e	2008-01-01 23:59:59
9	e	2008-01-01 23:59:59
10	j	2008-01-01 23:59:59

delete ignore
TRUNCATE TABLE ta_l;
INSERT INTO ta_l (a, b, c) VALUES (1, 'e', '2008-01-01 23:59:59'),
(2, 'e', '2008-01-01 23:59:59'), (3, 'e', '2008-01-01 23:59:59'),
(4, 'e', '2008-01-01 23:59:59'), (5, 'e', '2008-01-01 23:59:59'),
(6, 'e', '2008-01-01 23:59:59'), (7, 'e', '2008-01-01 23:59:59'),
(8, 'e', '2008-01-01 23:59:59'), (9, 'e', '2008-01-01 23:59:59'),
(10, 'j', '2008-01-01 23:59:59');
connection master_1;
DELETE IGNORE FROM ta_l WHERE a = 2;
connection master_1;
SELECT a, b, date_format(c, '%Y-%m-%d %H:%i:%s') FROM ta_l ORDER BY a;
a	b	date_format(c, '%Y-%m-%d %H:%i:%s')
1	e	2008-01-01 23:59:59
3	e	2008-01-01 23:59:59
4	e	2008-01-01 23:59:59
5	e	2008-01-01 23:59:59
6	e	2008-01-01 23:59:59
7	e	2008-01-01 23:59:59
8	e	2008-01-01 23:59:59
9	e	2008-01-01 23:59:59
10	j	2008-01-01 23:59:59

delete quick
TRUNCATE TABLE ta_l;
INSERT INTO ta_l (a, b, c) VALUES (1, 'e', '2008-01-01 23:59:59'),
(2, 'e', '2008-01-01 23:59:59'), (3, 'e', '2008-01-01 23:59:59'),
(4, 'e', '2008-01-01 23:59:59'), (5, 'e', '2008-01-01 23:59:59'),
(6, 'e', '2008-01-01 23:59:59'), (7, 'e', '2008-01-01 23:59:59'),
(8, 'e', '2008-01-01 23:59:59'), (9, 'e', '2008-01-01 23:59:59'),
(10, 'j', '2008-01-01 23:59:59');
connection master_1;
DELETE QUICK FROM ta_l WHERE a = 2;
connection master_1;
SELECT a, b, date_format(c, '%Y-%m-%d %H:%i:%s') FROM ta_l ORDER BY a;
a	b	date_format(c, '%Y-%m-%d %H:%i:%s')
1	e	2008-01-01 23:59:59
3	e	2008-01-01 23:59:59
4	e	2008-01-01 23:59:59
5	e	2008-01-01 23:59:59
6	e	2008-01-01 23:59:59
7	e	2008-01-01 23:59:59
8	e	2008-01-01 23:59:59
9	e	2008-01-01 23:59:59
10	j	2008-01-01 23:59:59

delete pushdown
TRUNCATE TABLE ta_l;
INSERT INTO ta_l (a, b, c) VALUES (1, 'e', '2008-01-01 23:59:59'),
(2, 'e', '2008-01-01 23:59:59'), (3, 'e', '2008-01-01 23:59:59'),
(4, 'e', '2008-01-01 23:59:59'), (5, 'e', '2008-01-01 23:59:59'),
(6, 'e', '2008-01-01 23:59:59'), (7, 'e', '2008-01-01 23:59:59'),
(8, 'e', '2008-01-01 23:59:59'), (9, 'e', '2008-01-01 23:59:59'),
(10, 'j', '2008-01-01 23:59:59');
connection master_1;
DELETE FROM ta_l WHERE b = 'e';
connection master_1;
SELECT a, b, date_format(c, '%Y-%m-%d %H:%i:%s') FROM ta_l ORDER BY a;
a	b	date_format(c, '%Y-%m-%d %H:%i:%s')
10	j	2008-01-01 23:59:59

delete index pushdown
TRUNCATE TABLE ta_l;
INSERT INTO ta_l (a, b, c) VALUES (1, 'e', '2008-01-01 23:59:59'),
(2, 'e', '2008-01-01 23:59:59'), (3, 'e', '2008-01-01 23:59:59'),
(4, 'e', '2008-01-01 23:59:59'), (5, 'e', '2008-01-01 23:59:59'),
(6, 'e', '2008-01-01 23:59:59'), (7, 'e', '2008-01-01 23:59:59'),
(8, 'e', '2008-01-01 23:59:59'), (9, 'e', '2008-01-01 23:59:59'),
(10, 'j', '2008-01-01 23:59:59');
connection master_1;
DELETE FROM ta_l WHERE a > 0 AND b = 'e';
connection master_1;
SELECT a, b, date_format(c, '%Y-%m-%d %H:%i:%s') FROM ta_l ORDER BY a;
a	b	date_format(c, '%Y-%m-%d %H:%i:%s')
10	j	2008-01-01 23:59:59

truncate
connection master_1;
TRUNCATE TABLE ta_l;
connection master_1;
SELECT a, b, date_format(c, '%Y-%m-%d %H:%i:%s') FROM ta_l ORDER BY a;
a	b	date_format(c, '%Y-%m-%d %H:%i:%s')

deinit
connection master_1;
DROP DATABASE IF EXISTS auto_test_local;
connection child2_1;
DROP DATABASE IF EXISTS auto_test_remote;
connection child2_2;
DROP DATABASE IF EXISTS auto_test_remote2;
for master_1
for child2
child2_1
child2_2
child2_3
for child3
child3_1
child3_2
child3_3

end of test
