connection node_2;
connection node_1;
CREATE TABLE t1 (f1 INT PRIMARY KEY);
SET SESSION wsrep_trx_fragment_size=1;
INSERT INTO t1 VALUES (1);
connection node_2;
SELECT COUNT(*) = 1 FROM t1;
COUNT(*) = 1
1
SET SESSION wsrep_trx_fragment_size=1;
UPDATE t1 SET f1 = 2;
connection node_1;
SET SESSION wsrep_trx_fragment_size=0;
connection node_2;
SET SESSION wsrep_trx_fragment_size=0;
connection node_1;
SELECT COUNT(*) = 1 FROM t1 WHERE f1 = 2;
COUNT(*) = 1
1
include/show_binlog_events.inc
Log_name	Pos	Event_type	Server_id	End_log_pos	Info
mysqld-bin.000002	#	Binlog_checkpoint	#	#	mysqld-bin.000002
mysqld-bin.000002	#	Gtid	#	#	GTID #-#-#
mysqld-bin.000002	#	Query	#	#	use `test`; CREATE TABLE t1 (f1 INT PRIMARY KEY)
mysqld-bin.000002	#	Gtid	#	#	BEGIN GTID #-#-#
mysqld-bin.000002	#	Annotate_rows	#	#	INSERT INTO t1 VALUES (1)
mysqld-bin.000002	#	Table_map	#	#	table_id: # (test.t1)
mysqld-bin.000002	#	Write_rows_v1	#	#	table_id: # flags: STMT_END_F
mysqld-bin.000002	#	Xid	#	#	COMMIT /* XID */
mysqld-bin.000002	#	Gtid	#	#	BEGIN GTID #-#-#
mysqld-bin.000002	#	Annotate_rows	#	#	UPDATE t1 SET f1 = 2
mysqld-bin.000002	#	Table_map	#	#	table_id: # (test.t1)
mysqld-bin.000002	#	Update_rows_v1	#	#	table_id: # flags: STMT_END_F
mysqld-bin.000002	#	Xid	#	#	COMMIT /* XID */
connection node_2;
SELECT 1 FROM DUAL;
1
1
include/show_binlog_events.inc
Log_name	Pos	Event_type	Server_id	End_log_pos	Info
mysqld-bin.000003	#	Gtid	#	#	GTID #-#-#
mysqld-bin.000003	#	Query	#	#	use `test`; CREATE TABLE t1 (f1 INT PRIMARY KEY)
mysqld-bin.000003	#	Gtid	#	#	BEGIN GTID #-#-#
mysqld-bin.000003	#	Annotate_rows	#	#	INSERT INTO t1 VALUES (1)
mysqld-bin.000003	#	Table_map	#	#	table_id: # (test.t1)
mysqld-bin.000003	#	Write_rows_v1	#	#	table_id: # flags: STMT_END_F
mysqld-bin.000003	#	Xid	#	#	COMMIT /* XID */
mysqld-bin.000003	#	Gtid	#	#	BEGIN GTID #-#-#
mysqld-bin.000003	#	Annotate_rows	#	#	UPDATE t1 SET f1 = 2
mysqld-bin.000003	#	Table_map	#	#	table_id: # (test.t1)
mysqld-bin.000003	#	Update_rows_v1	#	#	table_id: # flags: STMT_END_F
mysqld-bin.000003	#	Xid	#	#	COMMIT /* XID */
DROP TABLE t1;
