include/master-slave.inc
[connection master]
create table t1(n int auto_increment primary key, s char(10));
connection slave;
insert into t1 values (2,'old');
connection master;
insert into t1 values(NULL,'new');
insert into t1 values(NULL,'new');
connection slave;
select * from t1 order by n;
n	s
1	new
2	old
delete from t1 where n = 2;
include/start_slave.inc
include/stop_slave.inc
connection master;
create table t2(n int);
drop table t2;
insert into t1 values(NULL,'new');
set sql_log_bin=0;
insert into t1 values(NULL,'new');
set sql_log_bin=1;
delete from t1 where n=4;
connection slave;
include/start_slave.inc
select * from t1 order by n;
n	s
1	new
2	new
3	new
connection master;
drop table t1;
connection slave;
include/rpl_end.inc
