include/master-slave.inc
[connection master]
connection master;
create table t1 (a int primary key);
create table t4 (a int primary key);
insert into t1 values (1),(1);
Got one of the listed errors
insert into t4 values (1),(2);
connection slave;
show tables like 't1';
Tables_in_test (t1)
show tables like 't4';
Tables_in_test (t4)
t4
SELECT * FROM test.t4 ORDER BY a;
a
1
2
connection master;
drop table t1;
connection slave;
connection master1;
select get_lock('crash_lock%20C', 10);
get_lock('crash_lock%20C', 10)
1
connection master;
create table t2 (a int primary key);
insert into t2 values(1);
create table t3 (id int);
insert into t3 values(connection_id());
update t2 set a = a + 1 + get_lock('crash_lock%20C', 10);
connection master1;
select (@id := id) - id from t3;
(@id := id) - id
0
kill @id;
drop table t2,t3;
insert into t4 values (3),(4);
connection master;
connection master1;
connection slave;
SELECT * FROM test.t4 ORDER BY a;
a
1
2
3
4
connection master1;
DROP TABLE test.t4;
connection slave;
include/rpl_end.inc
