include/master-slave.inc
Warnings:
Note	####	Sending passwords in plain text without SSL/TLS is extremely insecure.
Note	####	Storing MySQL user name or password information in the master info repository is not secure and is therefore not recommended. Please consider using the USER and PASSWORD connection options for START SLAVE; see the 'START SLAVE Syntax' in the MySQL Manual for more information.
[connection master]
call mtr.add_suppression("Error_code: 1032");
create table t1 (a int primary key, b int, c int) engine = rocksdb;
create table t2 (a int unique, b int, c int) engine = rocksdb;
create table t3 (a int, b int, c int, key(a)) engine = rocksdb;
create table t4 (a int, b int, c int) engine = rocksdb;
insert into t1 values(1, 1, 1);
insert into t2 values(1, 1, 1);
insert into t3 values(1, 1, 1);
insert into t4 values(1, 1, 1);
include/sync_slave_sql_with_master.inc
set @@sql_log_bin = 0;
update t1 set c = 2;
update t2 set c = 2;
update t3 set c = 2;
update t4 set c = 2;
set @@sql_log_bin = 1;
update t1 set b = 2;
include/wait_for_slave_sql_error.inc [errno=1032]
set @@sql_log_bin = 0;
update t1 set c = 1;
set @@sql_log_bin = 1;
include/stop_slave.inc
include/start_slave.inc
include/sync_slave_sql_with_master.inc
update t2 set b = 2;
include/wait_for_slave_sql_error.inc [errno=1032]
set @@sql_log_bin = 0;
update t2 set c = 1;
set @@sql_log_bin = 1;
include/stop_slave.inc
include/start_slave.inc
include/sync_slave_sql_with_master.inc
update t3 set b = 2;
include/wait_for_slave_sql_error.inc [errno=1032]
set @@sql_log_bin = 0;
update t3 set c = 1;
set @@sql_log_bin = 1;
include/stop_slave.inc
include/start_slave.inc
include/sync_slave_sql_with_master.inc
update t4 set b = 2;
include/wait_for_slave_sql_error.inc [errno=1032]
set @@sql_log_bin = 0;
update t4 set c = 1;
set @@sql_log_bin = 1;
include/stop_slave.inc
include/start_slave.inc
include/sync_slave_sql_with_master.inc
select * from t1;
a	b	c
1	2	1
select * from t2;
a	b	c
1	2	1
select * from t3;
a	b	c
1	2	1
select * from t4;
a	b	c
1	2	1
select * from t1;
a	b	c
1	2	1
select * from t2;
a	b	c
1	2	1
select * from t3;
a	b	c
1	2	1
select * from t4;
a	b	c
1	2	1
drop table t1;
drop table t2;
drop table t3;
drop table t4;
include/sync_slave_sql_with_master.inc
include/stop_slave.inc
set @@global.slave_rows_search_algorithms = 'INDEX_SCAN,TABLE_SCAN,HASH_SCAN';
include/start_slave.inc
create table t1 (a int primary key, b int, c int) engine = rocksdb;
create table t2 (a int unique, b int, c int) engine = rocksdb;
create table t3 (a int, b int, c int, key(a)) engine = rocksdb;
create table t4 (a int, b int, c int) engine = rocksdb;
insert into t1 values(1, 1, 1);
insert into t2 values(1, 1, 1);
insert into t3 values(1, 1, 1);
insert into t4 values(1, 1, 1);
include/sync_slave_sql_with_master.inc
set @@sql_log_bin = 0;
update t1 set c = 2;
update t2 set c = 2;
update t3 set c = 2;
update t4 set c = 2;
set @@sql_log_bin = 1;
update t1 set b = 2;
include/wait_for_slave_sql_error.inc [errno=1032]
set @@sql_log_bin = 0;
update t1 set c = 1;
set @@sql_log_bin = 1;
include/stop_slave.inc
include/start_slave.inc
include/sync_slave_sql_with_master.inc
update t2 set b = 2;
include/wait_for_slave_sql_error.inc [errno=1032]
set @@sql_log_bin = 0;
update t2 set c = 1;
set @@sql_log_bin = 1;
include/stop_slave.inc
include/start_slave.inc
include/sync_slave_sql_with_master.inc
update t3 set b = 2;
include/wait_for_slave_sql_error.inc [errno=1032]
set @@sql_log_bin = 0;
update t3 set c = 1;
set @@sql_log_bin = 1;
include/stop_slave.inc
include/start_slave.inc
include/sync_slave_sql_with_master.inc
update t4 set b = 2;
include/wait_for_slave_sql_error.inc [errno=1032]
set @@sql_log_bin = 0;
update t4 set c = 1;
set @@sql_log_bin = 1;
include/stop_slave.inc
include/start_slave.inc
include/sync_slave_sql_with_master.inc
select * from t1;
a	b	c
1	2	1
select * from t2;
a	b	c
1	2	1
select * from t3;
a	b	c
1	2	1
select * from t4;
a	b	c
1	2	1
select * from t1;
a	b	c
1	2	1
select * from t2;
a	b	c
1	2	1
select * from t3;
a	b	c
1	2	1
select * from t4;
a	b	c
1	2	1
drop table t1;
drop table t2;
drop table t3;
drop table t4;
include/sync_slave_sql_with_master.inc
include/stop_slave.inc
set @@global.slave_rows_search_algorithms = DEFAULT;
include/start_slave.inc
include/rpl_end.inc
