#
# MDEV-26693 ROW_NUMBER is wrong upon INSERT or UPDATE on Spider table
#
for master_1
for child2
child2_1
child2_2
child2_3
for child3
child3_1
child3_2
child3_3
connection child2_1;
create database auto_test_remote;
use auto_test_remote;
create table ta_r (id int primary key);
connection master_1;
create table spd (id int primary key) $MASTER_1_ENGINE $MASTER_1_CHARSET $MASTER_1_COMMENT_2_1;
insert into spd values (1),(2),(1);
ERROR 23000: Duplicate entry '1' for key 'PRIMARY'
get diagnostics condition 1 @n = row_number;
select @n;
@n
0
delete from spd;
insert into spd values (1),(2),(3),(13);
update spd set id = id + 10;
ERROR 23000: Duplicate entry '13' for key 'PRIMARY'
get diagnostics condition 1 @n = row_number;
select @n;
@n
0
drop table spd;
connection child2_1;
drop database auto_test_remote;
connection master_1;
for master_1
for child2
child2_1
child2_2
child2_3
for child3
child3_1
child3_2
child3_3
