#
# MDEV-27106 Spider: specify connection to data node by engine-defined attributes
#
for master_1
for child2
child2_1
child2_2
child2_3
for child3
connection master_1;
CREATE DATABASE auto_test_local;
USE auto_test_local;
connection child2_1;
CREATE DATABASE auto_test_remote;
USE auto_test_remote;
CREATE TABLE tbl_a (
a INT,
b VARCHAR(255),
PRIMARY KEY(a)
) ENGINE=InnoDB DEFAULT CHARSET=utf8;
connection child2_2;
CREATE DATABASE auto_test_remote2;
USE auto_test_remote2;
CREATE TABLE tbl_a (
a INT,
b VARCHAR(255),
PRIMARY KEY(a)
) ENGINE=InnoDB DEFAULT CHARSET=utf8;
# Every option all at once
connection master_1;
CREATE TABLE tbl_a (
a INT,
b VARCHAR(255),
c1 INT,
c2 INT,
PRIMARY KEY(a), UNIQUE KEY(c1), KEY(c2)
) ENGINE=Spider DEFAULT CHARSET=utf8
AUTO_INCREMENT_MODE=1
BGS_MODE=1
BULK_SIZE=41
BULK_UPDATE_SIZE=42
CONNECT_TIMEOUT="43  44"
REMOTE_DATABASE=foo63
DEFAULT_FILE=foo44
DEFAULT_GROUP=foo45
DELETE_ALL_ROWS_TYPE=0
DRIVER=foo47
DSN=foo48
FILEDSN=foo49
FORCE_BULK_DELETE=1
FORCE_BULK_UPDATE=NO
REMOTE_HOST=foo52
IDX="f c1 ig PRIMARY u c2"
MULTI_SPLIT_READ=54
NET_READ_TIMEOUT=" 55 56"
NET_WRITE_TIMEOUT=" 56 "
REMOTE_PASSWORD=foo57
REMOTE_PORT="234 837 "
PRIORITY=59
QUERY_CACHE=2
QUERY_CACHE_SYNC=3
READ_ONLY=1
REMOTE_SERVER=s_2_1
SKIP_PARALLEL_SEARCH=2
REMOTE_SOCKET=foo67
SSL_CAPATH=foo68
SSL_CA=foo69
SSL_CERT=foo70
SSL_CIPHER=foo71
SSL_KEY=foo72
SSL_VSC=1
REMOTE_TABLE=foo65
TABLE_COUNT_MODE=3
REMOTE_USERNAME=foo75
USE_PUSHDOWN_UDF=YES
WRAPPER=mysql;
Warnings:
Warning	138	The high availability feature of Spider has been deprecated and will be removed in a future release
Warning	138	The high availability feature of Spider has been deprecated and will be removed in a future release
Warning	138	The high availability feature of Spider has been deprecated and will be removed in a future release
drop table tbl_a;
# different option types
## bool
CREATE TABLE tbl_a (
a INT,
b VARCHAR(255),
PRIMARY KEY(a)
) ENGINE=Spider DEFAULT CHARSET=utf8
REMOTE_SERVER="s_2_1" REMOTE_TABLE="tbl_a" READ_ONLY=1;
show create table tbl_a;
Table	Create Table
tbl_a	CREATE TABLE `tbl_a` (
  `a` int(11) NOT NULL,
  `b` varchar(255) DEFAULT NULL,
  PRIMARY KEY (`a`)
) ENGINE=SPIDER DEFAULT CHARSET=utf8mb3 COLLATE=utf8mb3_uca1400_ai_ci `REMOTE_SERVER`='s_2_1' `REMOTE_TABLE`='tbl_a' `READ_ONLY`=1
INSERT INTO tbl_a VALUES (1, "aaa"), (2, "bbb"), (3, "ccc"), (4, "ddd");
ERROR HY000: Table 'auto_test_local.tbl_a' is read only
SELECT * FROM tbl_a;
a	b
DROP TABLE tbl_a;
CREATE TABLE tbl_a (a INT) ENGINE=Spider DEFAULT CHARSET=utf8
READ_ONLY=1k;
ERROR HY000: The table option READ_ONLY=1k is invalid
CREATE TABLE tbl_a (a INT) ENGINE=Spider DEFAULT CHARSET=utf8
READ_ONLY=k1;
ERROR HY000: The table option READ_ONLY=k1 is invalid
CREATE TABLE tbl_a (a INT) ENGINE=Spider DEFAULT CHARSET=utf8
READ_ONLY=2;
ERROR HY000: The table option READ_ONLY=2 is invalid
CREATE TABLE tbl_a (a INT) ENGINE=Spider DEFAULT CHARSET=utf8
READ_ONLY=NOPE;
ERROR HY000: The table option READ_ONLY=NOPE is invalid
## bounded_nat
CREATE TABLE tbl_a (
a INT,
b VARCHAR(255),
PRIMARY KEY(a)
) ENGINE=Spider DEFAULT CHARSET=utf8
REMOTE_SERVER=s_2_1 REMOTE_TABLE=tbl_a QUERY_CACHE=2;
INSERT INTO tbl_a VALUES (1, "aaa"), (2, "bbb"), (3, "ccc"), (4, "ddd");
connection child2_1;
SET @old_general_log = @@global.general_log;
SET @old_log_output = @@global.log_output;
SET global general_log = 1;
SET global log_output = "TABLE";
connection master_1;
SELECT * FROM tbl_a;
a	b
1	aaa
2	bbb
3	ccc
4	ddd
connection child2_1;
select argument from mysql.general_log where argument like "select sql_no_cache%" limit 1;
argument
select sql_no_cache t0.`a` `a`,t0.`b` `b` from `auto_test_remote`.`tbl_a` t0
SET global general_log = @old_general_log;
SET global log_output = @old_log_output;
truncate table mysql.general_log;
connection master_1;
DELETE FROM tbl_a;
DROP TABLE tbl_a;
CREATE TABLE tbl_a (a INT) ENGINE=Spider DEFAULT CHARSET=utf8
AUTO_INCREMENT_MODE=1k;
ERROR HY000: The table option AUTO_INCREMENT_MODE=1k is invalid
CREATE TABLE tbl_a (a INT) ENGINE=Spider DEFAULT CHARSET=utf8
AUTO_INCREMENT_MODE=k1;
ERROR HY000: The table option AUTO_INCREMENT_MODE=k1 is invalid
CREATE TABLE tbl_a (a INT) ENGINE=Spider DEFAULT CHARSET=utf8
AUTO_INCREMENT_MODE=4;
ERROR HY000: The table option AUTO_INCREMENT_MODE=4 is invalid
CREATE TABLE tbl_a (a INT) ENGINE=Spider DEFAULT CHARSET=utf8
AUTO_INCREMENT_MODE=-1;
ERROR 42000: You have an error in your SQL syntax; check the manual that corresponds to your MariaDB server version for the right syntax to use near '-1' at line 2
CREATE TABLE tbl_a (a INT) ENGINE=Spider DEFAULT CHARSET=utf8
AUTO_INCREMENT_MODE="-1";
ERROR HY000: The table option AUTO_INCREMENT_MODE=-1 is invalid
## bounded_nat_list
CREATE TABLE tbl_a (a INT) ENGINE=Spider DEFAULT CHARSET=utf8
REMOTE_PORT="123 456";
Warnings:
Warning	138	The high availability feature of Spider has been deprecated and will be removed in a future release
select db_name, table_name, port from mysql.spider_tables;
db_name	table_name	port
auto_test_local	tbl_a	123
auto_test_local	tbl_a	456
drop table tbl_a;
CREATE TABLE tbl_a (a INT) ENGINE=Spider DEFAULT CHARSET=utf8
REMOTE_PORT="123 999a";
ERROR HY000: The table option REMOTE_PORT=123 999a is invalid
CREATE TABLE tbl_a (a INT) ENGINE=Spider DEFAULT CHARSET=utf8
REMOTE_PORT="123 a999";
ERROR HY000: The table option REMOTE_PORT=123 a999 is invalid
CREATE TABLE tbl_a (a INT) ENGINE=Spider DEFAULT CHARSET=utf8
REMOTE_PORT="123 99999";
ERROR HY000: The table option REMOTE_PORT=123 99999 is invalid
## nat_longlong
CREATE TABLE tbl_a (a INT) ENGINE=Spider DEFAULT CHARSET=utf8
PRIORITY=1234567890123456789;
select db_name, table_name, priority from mysql.spider_tables;
db_name	table_name	priority
auto_test_local	tbl_a	1234567890123456789
drop table tbl_a;
## hint
CREATE TABLE tbl_a (
a INT,
b VARCHAR(255),
PRIMARY KEY(a)
) ENGINE=Spider DEFAULT CHARSET=utf8
REMOTE_SERVER=s_2_1 REMOTE_TABLE=tbl_a IDX="f PRIMARY";
INSERT INTO tbl_a VALUES (1, "aaa"), (2, "bbb"), (3, "ccc"), (4, "ddd");
connection child2_1;
SET @old_general_log = @@global.general_log;
SET @old_log_output = @@global.log_output;
SET global general_log = 1;
SET global log_output = "TABLE";
connection master_1;
SELECT max(a) FROM tbl_a;
max(a)
4
connection child2_1;
select argument from mysql.general_log
where argument like "select `a` %force index (primary)%" limit 1;
argument
select `a` from `auto_test_remote`.`tbl_a` FORCE INDEX (PRIMARY) order by `a` desc limit 1
SET global general_log = @old_general_log;
SET global log_output = @old_log_output;
truncate table mysql.general_log;
connection master_1;
DELETE FROM tbl_a;
DROP TABLE tbl_a;
CREATE TABLE tbl_a (a1 INT, a2 INT, UNIQUE KEY (a2)) ENGINE=Spider DEFAULT CHARSET=utf8
IDX="f a1 u c";
ERROR HY000: The table option IDX=f a1 u c is invalid
CREATE TABLE tbl_a (a1 INT, a2 INT, UNIQUE KEY (a2)) ENGINE=Spider DEFAULT CHARSET=utf8
IDX="f a2 u a1";
ERROR HY000: The table option IDX=f a2 u a1 is invalid
CREATE TABLE tbl_a (a INT, b INT, UNIQUE KEY (b)) ENGINE=Spider DEFAULT CHARSET=utf8
IDX="f b f";
ERROR HY000: The table option IDX=f b f is invalid
CREATE TABLE tbl_a (
a INT,
b VARCHAR(255),
c1 INT,
c2 INT,
PRIMARY KEY(a), UNIQUE KEY(c1), KEY(c2)
) ENGINE=Spider DEFAULT CHARSET=utf8
IDX="              f   c2 ig c1  u   PRIMARY   ";
drop table tbl_a;
# Misc cases
set session spider_suppress_comment_ignored_warning=1;
CREATE TABLE tbl_a (a INT) ENGINE=Spider DEFAULT CHARSET=utf8
REMOTE_TABLE=t COMMENT="My favourite spider table";
drop table tbl_a;
set session spider_suppress_comment_ignored_warning=0;
CREATE TABLE tbl_a (a INT) ENGINE=Spider DEFAULT CHARSET=utf8
REMOTE_TABLE=t CONNECTION="srv s_2_1";
Warnings:
Warning	12529	The table or partition COMMENT or CONNECTION string 'srv s_2_1' is not parsed for table params because spider_ignore_comment is 1 or at least one table option has been specified
drop table tbl_a;
CREATE TABLE tbl_a (
a INT,
b VARCHAR(255),
PRIMARY KEY(a)
) ENGINE=Spider DEFAULT CHARSET=utf8
REMOTE_SERVER="s_2_1" REMOTE_TABLE="tbl_a" READ_ONLY=0 READ_ONLY=1;
show create table tbl_a;
Table	Create Table
tbl_a	CREATE TABLE `tbl_a` (
  `a` int(11) NOT NULL,
  `b` varchar(255) DEFAULT NULL,
  PRIMARY KEY (`a`)
) ENGINE=SPIDER DEFAULT CHARSET=utf8mb3 COLLATE=utf8mb3_uca1400_ai_ci `REMOTE_SERVER`='s_2_1' `REMOTE_TABLE`='tbl_a' `READ_ONLY`=1
INSERT INTO tbl_a VALUES (1, "aaa"), (2, "bbb"), (3, "ccc"), (4, "ddd");
ERROR HY000: Table 'auto_test_local.tbl_a' is read only
SELECT * FROM tbl_a;
a	b
DROP TABLE tbl_a;
connection master_1;
CREATE TABLE tbl_a (
a INT,
b VARCHAR(255),
PRIMARY KEY(a)
) ENGINE=Spider DEFAULT CHARSET=utf8
REMOTE_SERVER="s_2_1" REMOTE_TABLE="tbl_a" READ_ONLY=1;
show create table tbl_a;
Table	Create Table
tbl_a	CREATE TABLE `tbl_a` (
  `a` int(11) NOT NULL,
  `b` varchar(255) DEFAULT NULL,
  PRIMARY KEY (`a`)
) ENGINE=SPIDER DEFAULT CHARSET=utf8mb3 COLLATE=utf8mb3_uca1400_ai_ci `REMOTE_SERVER`='s_2_1' `REMOTE_TABLE`='tbl_a' `READ_ONLY`=1
INSERT INTO tbl_a VALUES (1, "aaa"), (2, "bbb"), (3, "ccc"), (4, "ddd");
ERROR HY000: Table 'auto_test_local.tbl_a' is read only
ALTER TABLE tbl_a READ_ONLY=0;
INSERT INTO tbl_a VALUES (1, "aaa"), (2, "bbb"), (3, "ccc"), (4, "ddd");
show create table tbl_a;
Table	Create Table
tbl_a	CREATE TABLE `tbl_a` (
  `a` int(11) NOT NULL,
  `b` varchar(255) DEFAULT NULL,
  PRIMARY KEY (`a`)
) ENGINE=SPIDER DEFAULT CHARSET=utf8mb3 COLLATE=utf8mb3_uca1400_ai_ci `REMOTE_SERVER`='s_2_1' `REMOTE_TABLE`='tbl_a' `READ_ONLY`=0
SELECT * FROM tbl_a;
a	b
1	aaa
2	bbb
3	ccc
4	ddd
DELETE FROM tbl_a;
DROP TABLE tbl_a;
# Single data node
connection master_1;
CREATE TABLE tbl_a (
a INT,
b VARCHAR(255),
PRIMARY KEY(a)
) ENGINE=Spider DEFAULT CHARSET=utf8
REMOTE_SERVER="s_2_1" REMOTE_TABLE="tbl_a";
INSERT INTO tbl_a VALUES (1, "aaa"), (2, "bbb"), (3, "ccc"), (4, "ddd");
SELECT * FROM tbl_a;
a	b
1	aaa
2	bbb
3	ccc
4	ddd
DELETE FROM tbl_a;
DROP TABLE tbl_a;
# Multiple data nodes with high availability setting
connection master_1;
CREATE TABLE tbl_a (
a INT,
b VARCHAR(255),
PRIMARY KEY(a)
) ENGINE=Spider DEFAULT CHARSET=utf8
REMOTE_SERVER="s_2_1 s_2_2" REMOTE_TABLE="tbl_a";
Warnings:
Warning	138	The high availability feature of Spider has been deprecated and will be removed in a future release
INSERT INTO tbl_a VALUES (1, "aaa"), (2, "bbb"), (3, "ccc"), (4, "ddd");
SELECT * FROM tbl_a;
a	b
1	aaa
2	bbb
3	ccc
4	ddd
connection child2_1;
SELECT * FROM tbl_a;
a	b
1	aaa
2	bbb
3	ccc
4	ddd
connection child2_2;
SELECT * FROM tbl_a;
a	b
1	aaa
2	bbb
3	ccc
4	ddd
connection master_1;
DELETE FROM tbl_a;
DROP TABLE tbl_a;
# Multiple data nodes with partition options
connection master_1;
CREATE TABLE tbl_a (
a INT,
b VARCHAR(255),
PRIMARY KEY(a)
) ENGINE=Spider DEFAULT CHARSET=utf8
PARTITION BY RANGE (a) (
PARTITION p1 VALUES LESS THAN (3) REMOTE_SERVER="s_2_1" REMOTE_TABLE="tbl_a",
PARTITION p2 VALUES LESS THAN MAXVALUE REMOTE_SERVER="s_2_2" REMOTE_TABLE="tbl_a"
);
INSERT INTO tbl_a VALUES (1, "aaa"), (2, "bbb"), (3, "ccc"), (4, "ddd");
SELECT * FROM tbl_a;
a	b
1	aaa
2	bbb
3	ccc
4	ddd
DELETE FROM tbl_a;
DROP TABLE tbl_a;
connection master_1;
CREATE TABLE tbl_a (
a INT,
b VARCHAR(255),
PRIMARY KEY(a)
) ENGINE=Spider DEFAULT CHARSET=utf8
REMOTE_SERVER="s_2_1" REMOTE_TABLE="tbl_a" READ_ONLY=maybe;
ERROR HY000: The table option READ_ONLY=maybe is invalid
# Multiple data nodes with table options + partition options
connection master_1;
CREATE TABLE tbl_a (
a INT,
b VARCHAR(255),
PRIMARY KEY(a)
) ENGINE=Spider DEFAULT CHARSET=utf8
REMOTE_SERVER="s_2_1" REMOTE_TABLE="tbl_a"
PARTITION BY RANGE (a) (
PARTITION p1 VALUES LESS THAN (3),
PARTITION p2 VALUES LESS THAN MAXVALUE REMOTE_SERVER="s_2_2"
);
INSERT INTO tbl_a VALUES (1, "aaa"), (2, "bbb"), (3, "ccc"), (4, "ddd");
SELECT * FROM tbl_a;
a	b
1	aaa
2	bbb
3	ccc
4	ddd
connection child2_1;
SELECT * FROM tbl_a;
a	b
1	aaa
2	bbb
connection master_1;
DELETE FROM tbl_a;
DROP TABLE tbl_a;
# COMMENT + engine-defined option, COMMENT ignored, invalid (missing table name)
connection master_1;
CREATE TABLE tbl_a (
a INT,
b VARCHAR(255),
PRIMARY KEY(a)
) ENGINE=Spider DEFAULT CHARSET=utf8
COMMENT='tbl "tbl_a"'
PARTITION BY RANGE (a) (
PARTITION p1 VALUES LESS THAN (3) COMMENT='srv "s_2_1"',
PARTITION p2 VALUES LESS THAN MAXVALUE REMOTE_SERVER="s_2_2"
);
Warnings:
Warning	138	Spider table params in COMMENT or CONNECTION strings have been deprecated and will be removed in a future release. Please use table options instead.
Warning	138	Spider table params in COMMENT or CONNECTION strings have been deprecated and will be removed in a future release. Please use table options instead.
Warning	12529	The table or partition COMMENT or CONNECTION string 'tbl "tbl_a"' is not parsed for table params because spider_ignore_comment is 1 or at least one table option has been specified
INSERT INTO tbl_a VALUES (1, "aaa"), (2, "bbb"), (3, "ccc"), (4, "ddd");
ERROR HY000: Remote table 'auto_test_remote2.tbl_a#P#p2' is not found
DROP TABLE tbl_a;
set session spider_ignore_comments=1;
CREATE TABLE tbl_a (
a INT,
b VARCHAR(255),
PRIMARY KEY(a)
) ENGINE=Spider DEFAULT CHARSET=utf8
COMMENT='tbl "tbl_a"'
PARTITION BY RANGE (a) (
PARTITION p1 VALUES LESS THAN (3) COMMENT='srv "s_2_1"',
PARTITION p2 VALUES LESS THAN MAXVALUE REMOTE_SERVER="s_2_2"
);
Warnings:
Warning	12529	The table or partition COMMENT or CONNECTION string 'srv "s_2_1"' is not parsed for table params because spider_ignore_comment is 1 or at least one table option has been specified
Warning	12529	The table or partition COMMENT or CONNECTION string 'tbl "tbl_a"' is not parsed for table params because spider_ignore_comment is 1 or at least one table option has been specified
Warning	12529	The table or partition COMMENT or CONNECTION string 'tbl "tbl_a"' is not parsed for table params because spider_ignore_comment is 1 or at least one table option has been specified
INSERT INTO tbl_a VALUES (1, "aaa"), (2, "bbb"), (3, "ccc"), (4, "ddd");
ERROR HY000: Unable to connect to foreign data source: localhost
DROP TABLE tbl_a;
set session spider_ignore_comments=0;
# COMMENT + engine-defined option, COMMENT ignored, ok
connection master_1;
CREATE TABLE tbl_a (
a INT,
b VARCHAR(255),
PRIMARY KEY(a)
) ENGINE=Spider DEFAULT CHARSET=utf8
REMOTE_SERVER="s_2_1" REMOTE_TABLE="tbl_a"
PARTITION BY RANGE (a) (
PARTITION p1 VALUES LESS THAN (3) COMMENT='srv "s_2_2"',
PARTITION p2 VALUES LESS THAN MAXVALUE REMOTE_SERVER="s_2_2"
);
Warnings:
Warning	12529	The table or partition COMMENT or CONNECTION string 'srv "s_2_2"' is not parsed for table params because spider_ignore_comment is 1 or at least one table option has been specified
INSERT INTO tbl_a VALUES (1, "aaa"), (2, "bbb"), (3, "ccc"), (4, "ddd");
Warnings:
Warning	12529	The table or partition COMMENT or CONNECTION string 'srv "s_2_2"' is not parsed for table params because spider_ignore_comment is 1 or at least one table option has been specified
connection child2_1;
SELECT * FROM tbl_a;
a	b
1	aaa
2	bbb
connection child2_2;
SELECT * FROM tbl_a;
a	b
3	ccc
4	ddd
connection master_1;
DELETE FROM tbl_a;
DROP TABLE tbl_a;
# COMMENT + engine-defined option, COMMENT ignored, ok
connection master_1;
CREATE TABLE tbl_a (
a INT,
b VARCHAR(255),
PRIMARY KEY(a)
) ENGINE=Spider DEFAULT CHARSET=utf8
REMOTE_SERVER="s_2_1" REMOTE_TABLE="tbl_a" READ_ONLY=YES
PARTITION BY RANGE (a) (
PARTITION p1 VALUES LESS THAN (3) COMMENT='srv "s_2_2" read_only_mode "0"',
PARTITION p2 VALUES LESS THAN MAXVALUE REMOTE_SERVER="s_2_2" READ_ONLY=NO
);
Warnings:
Warning	12529	The table or partition COMMENT or CONNECTION string 'srv "s_2_2" read_only_mode "0"' is not parsed for table params because spider_ignore_comment is 1 or at least one table option has been specified
INSERT INTO tbl_a VALUES (1, "aaa"), (2, "bbb");
ERROR HY000: Table 'auto_test_local.tbl_a' is read only
INSERT INTO tbl_a VALUES (3, "ccc"), (4, "ddd");
connection child2_1;
SELECT * FROM tbl_a;
a	b
connection child2_2;
SELECT * FROM tbl_a;
a	b
3	ccc
4	ddd
DELETE FROM tbl_a;
connection master_1;
DROP TABLE tbl_a;
connection master_1;
CREATE TABLE tbl_a (
a INT,
b VARCHAR(255),
PRIMARY KEY(a)
) ENGINE=Spider DEFAULT CHARSET=utf8
REMOTE_SERVER="s_2_1" COMMENT='tbl "tbl_b"' REMOTE_TABLE="tbl_a";
Warnings:
Warning	12529	The table or partition COMMENT or CONNECTION string 'tbl "tbl_b"' is not parsed for table params because spider_ignore_comment is 1 or at least one table option has been specified
select table_name, server, tgt_table_name from mysql.spider_tables;
table_name	server	tgt_table_name
tbl_a	s_2_1	tbl_a
drop table tbl_a;
CREATE TABLE tbl_a (
a INT
) ENGINE=Spider DEFAULT CHARSET=utf8
PARTITION BY HASH (a) PARTITIONS 2;
SELECT * FROM tbl_a;
ERROR HY000: Unable to connect to foreign data source: localhost
DROP TABLE tbl_a;
# MDEV-27860 SIGSEGV in spider_parse_connect_info on CREATE TABLE
CREATE TABLE tbl_a (c INT) ENGINE=SPIDER COMMENT="TABLE 'unknown_table'"
PARTITION BY LIST COLUMNS (c) (
PARTITION p DEFAULT COMMENT="srv 'unknown_server'" ENGINE=SPIDER
);
ERROR HY000: The foreign server name you are trying to reference does not exist. Data source error:  unknown_server
connection child2_1;
DROP DATABASE auto_test_remote;
connection child2_2;
DROP DATABASE auto_test_remote2;
connection master_1;
DROP DATABASE auto_test_local;
for master_1
for child2
child2_1
child2_2
child2_3
for child3
#
# end of test engine_defined_attributes
#
