#
# MDEV-37199 UNIQUE KEY USING HASH accepting duplicate records
#
## INSERT
create table t1 (
id int, s date, e date,
period for p(s,e),
primary key(id, p without overlaps)
) engine=innodb;
start transaction;
select * from t1;
id	s	e
connect con1,localhost,root;
insert t1 values(10, date'2010-10-10', date'2010-11-11');
delete from t1;
set transaction isolation level read committed;
set debug_sync="innodb_row_ins_step_enter SIGNAL checked_duplicate WAIT_FOR do_insert";
insert t1 values(10, date'2010-09-09', date'2010-11-10');
connect con2,localhost,root;
set debug_sync="now WAIT_FOR checked_duplicate";
set session innodb_lock_wait_timeout = 1;
set transaction isolation level read committed;
insert t1 values(10, date'2010-10-10', date'2010-11-12');
set debug_sync="now SIGNAL do_insert";
connection con1;
ERROR 23000: Duplicate entry '10-2010-11-10-2010-09-09' for key 'PRIMARY'
connection default;
select * from t1;
id	s	e
commit;
select * from t1;
id	s	e
10	2010-10-10	2010-11-12
disconnect con1;
disconnect con2;
set debug_sync='RESET';
drop table t1;
## INSERT IGNORE
create table t1 (
id int, s date, e date,
period for p(s,e),
primary key(id, p without overlaps)
) engine=innodb;
start transaction;
select * from t1;
id	s	e
connect con1,localhost,root;
insert t1 values(10, date'2010-10-10', date'2010-11-11');
delete from t1;
set transaction isolation level read committed;
set debug_sync="innodb_row_ins_step_enter SIGNAL checked_duplicate WAIT_FOR do_insert";
insert ignore t1 values(10, date'2010-09-09', date'2010-11-10'),(11, date'2010-09-09', date'2010-11-10');
connect con2,localhost,root;
set debug_sync="now WAIT_FOR checked_duplicate";
set session innodb_lock_wait_timeout = 1;
set transaction isolation level read committed;
insert t1 values(10, date'2010-10-10', date'2010-11-12');
set debug_sync="now SIGNAL do_insert";
connection con1;
Warnings:
Warning	1062	Duplicate entry '10-2010-11-10-2010-09-09' for key 'PRIMARY'
connection default;
select * from t1;
id	s	e
commit;
select * from t1;
id	s	e
10	2010-10-10	2010-11-12
11	2010-09-09	2010-11-10
disconnect con1;
disconnect con2;
set debug_sync='RESET';
drop table t1;
# End of 10.6 tests
