create or replace table t(id int, s date, e date, val int,
period for p(s,e),
primary key(id, p without overlaps)) engine=myisam;
insert into t values (1, '2003-01-01', '2003-03-01', 1),
(1, '2003-05-01', '2003-07-01', 2);
# This just inserts a row; no rows matched
insert into t values (2, '2003-01-01', '2003-04-01', 3)
on duplicate key update val=4;
select * from t;
id	s	e	val
1	2003-01-01	2003-03-01	1
1	2003-05-01	2003-07-01	2
2	2003-01-01	2003-04-01	3
insert into t values (1, '2003-01-05', '2003-04-01', 5)
on duplicate key update val=6;
select row_count();
row_count()
2
select * from t;
id	s	e	val
1	2003-01-05	2003-03-01	6
1	2003-05-01	2003-07-01	2
2	2003-01-01	2003-04-01	3
insert into t values (1, '2003-01-01', '2003-06-01', 7)
on duplicate key update val=8;
select row_count();
row_count()
4
select * from t;
id	s	e	val
1	2003-01-05	2003-03-01	8
1	2003-05-01	2003-06-01	8
2	2003-01-01	2003-04-01	3
# No rows matched
insert into t values (1, '2003-07-01', '2003-08-01', 9)
on duplicate key update val=10;
select row_count();
row_count()
1
select * from t;
id	s	e	val
1	2003-01-05	2003-03-01	8
1	2003-05-01	2003-06-01	8
1	2003-07-01	2003-08-01	9
2	2003-01-01	2003-04-01	3
replace into t values (1, '2003-02-01', '2003-05-05', 11);
select row_count();
row_count()
5
select * from t;
id	s	e	val
1	2003-01-05	2003-02-01	8
1	2003-02-01	2003-05-05	11
1	2003-05-05	2003-06-01	8
1	2003-07-01	2003-08-01	9
2	2003-01-01	2003-04-01	3
# Single row insert
replace into t values(2, '2003-06-01', '2003-08-01', 12);
select row_count();
row_count()
1
select * from t;
id	s	e	val
1	2003-01-05	2003-02-01	8
1	2003-02-01	2003-05-05	11
1	2003-05-05	2003-06-01	8
1	2003-07-01	2003-08-01	9
2	2003-01-01	2003-04-01	3
2	2003-06-01	2003-08-01	12
replace into t values(2, '2003-02-01', '2003-09-01', 13);
select row_count();
row_count()
4
select * from t;
id	s	e	val
1	2003-01-05	2003-02-01	8
1	2003-02-01	2003-05-05	11
1	2003-05-05	2003-06-01	8
1	2003-07-01	2003-08-01	9
2	2003-01-01	2003-02-01	3
2	2003-02-01	2003-09-01	13
delete from t where val=13;
insert into t values(2, '2003-06-01', '2003-08-01', 14);
select * from t;
id	s	e	val
1	2003-01-05	2003-02-01	8
1	2003-02-01	2003-05-05	11
1	2003-05-05	2003-06-01	8
1	2003-07-01	2003-08-01	9
2	2003-01-01	2003-02-01	3
2	2003-06-01	2003-08-01	14
replace into t values(2, '2003-02-01', '2003-07-01', 15);
select row_count();
row_count()
3
select * from t;
id	s	e	val
1	2003-01-05	2003-02-01	8
1	2003-02-01	2003-05-05	11
1	2003-05-05	2003-06-01	8
1	2003-07-01	2003-08-01	9
2	2003-01-01	2003-02-01	3
2	2003-02-01	2003-07-01	15
2	2003-07-01	2003-08-01	14
drop table t;
