#
# Blob updates and deletes on a user TEMPORARY MEMORY table.
#
# A non-transactional TEMPORARY table is left out of the lock set
# altogether, so its handle never holds a THR_LOCK.  It is not an
# internal table, though, so it still defers its blob chain frees --
# a combination no other kind of table has, and one a debug build used
# to assert on at the end of every such statement.
#
CREATE TEMPORARY TABLE t1 (a INT, b BLOB) ENGINE=MEMORY;
INSERT INTO t1 VALUES (1,'one'), (2,REPEAT('two',500)), (3,REPEAT('three',500));
# UPDATE parks one chain per changed blob
UPDATE t1 SET b=REPEAT('x',4000) WHERE a=2;
SELECT a, LENGTH(b), LEFT(b,5) FROM t1 ORDER BY a;
a	LENGTH(b)	LEFT(b,5)
1	3	one
2	4000	xxxxx
3	2500	three
CHECK TABLE t1;
Table	Op	Msg_type	Msg_text
test.t1	check	status	OK
# DELETE parks the whole row's chain
DELETE FROM t1 WHERE a=3;
SELECT a, LENGTH(b), LEFT(b,5) FROM t1 ORDER BY a;
a	LENGTH(b)	LEFT(b,5)
1	3	one
2	4000	xxxxx
CHECK TABLE t1;
Table	Op	Msg_type	Msg_text
test.t1	check	status	OK
# Repeated cycles: every parked chain has to come back to the free list
SELECT a, LENGTH(b), LEFT(b,5) FROM t1 ORDER BY a;
a	LENGTH(b)	LEFT(b,5)
1	1500	oneon
2	8000	zzzzz
CHECK TABLE t1;
Table	Op	Msg_type	Msg_text
test.t1	check	status	OK
# Multi-table UPDATE and DELETE across two TEMPORARY tables
CREATE TEMPORARY TABLE t2 (a INT, b BLOB) ENGINE=MEMORY;
INSERT INTO t2 VALUES (1,REPEAT('u',4000)), (2,REPEAT('v',4000));
UPDATE t1, t2 SET t1.b=REPEAT('p',4000), t2.b=REPEAT('q',4000)
WHERE t1.a=t2.a;
SELECT a, LENGTH(b), LEFT(b,5) FROM t1 ORDER BY a;
a	LENGTH(b)	LEFT(b,5)
1	4000	ppppp
2	4000	ppppp
SELECT a, LENGTH(b), LEFT(b,5) FROM t2 ORDER BY a;
a	LENGTH(b)	LEFT(b,5)
1	4000	qqqqq
2	4000	qqqqq
CHECK TABLE t1, t2;
Table	Op	Msg_type	Msg_text
test.t1	check	status	OK
test.t2	check	status	OK
DELETE t1, t2 FROM t1, t2 WHERE t1.a=t2.a AND t1.a=1;
SELECT a, LENGTH(b), LEFT(b,5) FROM t1 ORDER BY a;
a	LENGTH(b)	LEFT(b,5)
2	4000	ppppp
SELECT a, LENGTH(b), LEFT(b,5) FROM t2 ORDER BY a;
a	LENGTH(b)	LEFT(b,5)
2	4000	qqqqq
CHECK TABLE t1, t2;
Table	Op	Msg_type	Msg_text
test.t1	check	status	OK
test.t2	check	status	OK
DROP TEMPORARY TABLE t1, t2;
#
# The same statements on a non-temporary MEMORY table, which does hold
# the lock while it parks and redeems at unlock time.
#
CREATE TABLE t1 (a INT, b BLOB) ENGINE=MEMORY;
INSERT INTO t1 VALUES (1,'one'), (2,REPEAT('two',500)), (3,REPEAT('three',500));
UPDATE t1 SET b=REPEAT('x',4000) WHERE a=2;
DELETE FROM t1 WHERE a=3;
SELECT a, LENGTH(b), LEFT(b,5) FROM t1 ORDER BY a;
a	LENGTH(b)	LEFT(b,5)
1	3	one
2	4000	xxxxx
CHECK TABLE t1;
Table	Op	Msg_type	Msg_text
test.t1	check	status	OK
# Under LOCK TABLES the redemption happens in ha_heap::reset() instead,
# with the lock still held
LOCK TABLES t1 WRITE;
UPDATE t1 SET b=REPEAT('w',4000) WHERE a=2;
DELETE FROM t1 WHERE a=1;
UNLOCK TABLES;
SELECT a, LENGTH(b), LEFT(b,5) FROM t1 ORDER BY a;
a	LENGTH(b)	LEFT(b,5)
2	4000	wwwww
CHECK TABLE t1;
Table	Op	Msg_type	Msg_text
test.t1	check	status	OK
DROP TABLE t1;
