#
# DELETE + TRUNCATE + INSERT: deferred blob chains must not
# survive heap_clear()
#
CREATE TABLE t (
id INT,
a TEXT,
b TEXT
) ENGINE=HEAP;
INSERT INTO t VALUES (1, REPEAT('x', 500), REPEAT('y', 500));
INSERT INTO t VALUES (2, REPEAT('a', 1000), REPEAT('b', 1000));
DELETE FROM t WHERE id = 1;
TRUNCATE TABLE t;
INSERT INTO t VALUES (3, REPEAT('z', 200), REPEAT('w', 200));
SELECT id, LENGTH(a), LENGTH(b) FROM t;
id	LENGTH(a)	LENGTH(b)
3	200	200
#
# Multiple rounds: DELETE all + TRUNCATE + refill
#
INSERT INTO t VALUES (4, REPEAT('m', 800), REPEAT('n', 800));
DELETE FROM t WHERE id = 3;
DELETE FROM t WHERE id = 4;
TRUNCATE TABLE t;
INSERT INTO t VALUES (5, REPEAT('p', 300), REPEAT('q', 300));
INSERT INTO t VALUES (6, REPEAT('r', 1500), REPEAT('s', 1500));
SELECT id, LENGTH(a), LENGTH(b) FROM t ORDER BY id;
id	LENGTH(a)	LENGTH(b)
5	300	300
6	1500	1500
DROP TABLE t;
