#
# === sysvar: default is OFF ===
#
SHOW VARIABLES LIKE 'tidesdb_single_delete_primary';
Variable_name	Value
tidesdb_single_delete_primary	OFF
SELECT @@SESSION.tidesdb_single_delete_primary;
@@SESSION.tidesdb_single_delete_primary
0
#
# === Secondary-index single-delete is always on (no flag needed). ===
# Reads must remain correct across INSERT, SELECT, UPDATE, DELETE on a
# table with multiple secondary indexes.  This exercises update_row's
# old-entry delete path and delete_row's secondary-index dispatch loop.
#
CREATE TABLE t_sec (
pk BIGINT PRIMARY KEY,
c0 INT,
c1 INT,
c2 INT,
KEY k0 (c0),
KEY k1 (c1),
KEY k2 (c2)
) ENGINE=TIDESDB;
INSERT INTO t_sec VALUES (1,10,100,1000),(2,20,200,2000),(3,30,300,3000);
SELECT * FROM t_sec ORDER BY pk;
pk	c0	c1	c2
1	10	100	1000
2	20	200	2000
3	30	300	3000
SELECT pk FROM t_sec WHERE c0 = 20;
pk
2
SELECT pk FROM t_sec WHERE c1 = 300;
pk
3
SELECT pk FROM t_sec WHERE c2 = 1000;
pk
1
UPDATE t_sec SET c0 = 11, c1 = 111 WHERE pk = 1;
SELECT * FROM t_sec ORDER BY pk;
pk	c0	c1	c2
1	11	111	1000
2	20	200	2000
3	30	300	3000
SELECT pk FROM t_sec WHERE c0 = 10;
pk
SELECT pk FROM t_sec WHERE c0 = 11;
pk
1
SELECT pk FROM t_sec WHERE c1 = 100;
pk
SELECT pk FROM t_sec WHERE c1 = 111;
pk
1
DELETE FROM t_sec WHERE pk = 2;
SELECT * FROM t_sec ORDER BY pk;
pk	c0	c1	c2
1	11	111	1000
3	30	300	3000
SELECT pk FROM t_sec WHERE c0 = 20;
pk
SELECT pk FROM t_sec WHERE c1 = 200;
pk
DELETE FROM t_sec;
SELECT COUNT(*) FROM t_sec;
COUNT(*)
0
#
# REPLACE INTO on a table with secondary indexes: the server routes
# through delete_row + write_row, so each specific (col_vals, pk) is
# still put-once-delete-once.  Secondary-index single-delete stays
# safe.
#
INSERT INTO t_sec VALUES (5,50,500,5000);
REPLACE INTO t_sec VALUES (5,55,555,5555);
SELECT * FROM t_sec WHERE pk = 5;
pk	c0	c1	c2
5	55	555	5555
SELECT pk FROM t_sec WHERE c0 = 50;
pk
SELECT pk FROM t_sec WHERE c0 = 55;
pk
5
DROP TABLE t_sec;
#
# === Primary-CF single-delete under the sysvar: insert-then-delete. ===
# The contract holds because we only INSERT and DELETE -- no UPDATE,
# no REPLACE.  Reads must agree with the non-sysvar baseline.
#
SET SESSION tidesdb_single_delete_primary = 1;
SELECT @@SESSION.tidesdb_single_delete_primary;
@@SESSION.tidesdb_single_delete_primary
1
CREATE TABLE t_pri (
pk BIGINT PRIMARY KEY,
v  VARCHAR(32)
) ENGINE=TIDESDB;
INSERT INTO t_pri VALUES (1,'a'),(2,'b'),(3,'c'),(4,'d'),(5,'e');
SELECT * FROM t_pri ORDER BY pk;
pk	v
1	a
2	b
3	c
4	d
5	e
DELETE FROM t_pri WHERE pk IN (2,4);
SELECT * FROM t_pri ORDER BY pk;
pk	v
1	a
3	c
5	e
DELETE FROM t_pri;
SELECT COUNT(*) FROM t_pri;
COUNT(*)
0
#
# Insert a fresh batch, delete every row, read nothing back.  This
# matches the iibench-shaped workload.
#
INSERT INTO t_pri VALUES (10,'x'),(20,'y'),(30,'z'),(40,'w'),(50,'v');
SELECT COUNT(*) FROM t_pri;
COUNT(*)
5
DELETE FROM t_pri;
SELECT COUNT(*) FROM t_pri;
COUNT(*)
0
DROP TABLE t_pri;
#
# === Primary-CF single-delete with secondary indexes present. ===
# Secondary-index SD is already unconditional; primary-CF SD is gated
# on the sysvar.  Together they cover all four CFs per delete on
# Mark's num_secondary_indexes=3 table shape.
#
CREATE TABLE t_mark (
transactionid BIGINT PRIMARY KEY,
c0 INT,
c1 INT,
c2 INT,
KEY (c0),
KEY (c1),
KEY (c2)
) ENGINE=TIDESDB;
INSERT INTO t_mark VALUES (1,10,100,1000),(2,20,200,2000),(3,30,300,3000),
(4,40,400,4000),(5,50,500,5000);
SELECT COUNT(*) FROM t_mark;
COUNT(*)
5
SELECT transactionid FROM t_mark WHERE c1 = 300;
transactionid
3
DELETE FROM t_mark WHERE transactionid >= 2 ORDER BY transactionid ASC LIMIT 2;
SELECT transactionid FROM t_mark ORDER BY transactionid;
transactionid
1
4
5
SELECT transactionid FROM t_mark WHERE c0 = 20;
transactionid
SELECT transactionid FROM t_mark WHERE c2 = 3000;
transactionid
DELETE FROM t_mark;
SELECT COUNT(*) FROM t_mark;
COUNT(*)
0
DROP TABLE t_mark;
SET SESSION tidesdb_single_delete_primary = 0;
#
# === Sysvar OFF across UPDATE + REPLACE paths (safety baseline). ===
# Any workload that uses UPDATE non-PK / REPLACE INTO on no-secondary
# tables must stay correct with the sysvar OFF, because primary-CF SD
# is unsafe under those patterns.  Secondary-index SD is independent
# of the sysvar.
#
CREATE TABLE t_upd (
pk BIGINT PRIMARY KEY,
c0 INT,
KEY (c0)
) ENGINE=TIDESDB;
INSERT INTO t_upd VALUES (1,100),(2,200),(3,300);
UPDATE t_upd SET c0 = 999 WHERE pk = 2;
SELECT * FROM t_upd ORDER BY pk;
pk	c0
1	100
2	999
3	300
SELECT pk FROM t_upd WHERE c0 = 200;
pk
SELECT pk FROM t_upd WHERE c0 = 999;
pk
2
DELETE FROM t_upd WHERE pk = 2;
SELECT * FROM t_upd ORDER BY pk;
pk	c0
1	100
3	300
SELECT pk FROM t_upd WHERE c0 = 999;
pk
DROP TABLE t_upd;
#
# REPLACE INTO on a no-secondary table follows the line-5143 "overwrite
# silently" fast path.  With sysvar OFF (default), subsequent DELETEs
# remain correct because the regular tombstone is used.
#
CREATE TABLE t_rep (
pk BIGINT PRIMARY KEY,
v  VARCHAR(32)
) ENGINE=TIDESDB;
INSERT INTO t_rep VALUES (1,'first');
REPLACE INTO t_rep VALUES (1,'second');
SELECT * FROM t_rep;
pk	v
1	second
DELETE FROM t_rep WHERE pk = 1;
SELECT COUNT(*) FROM t_rep;
COUNT(*)
0
SELECT * FROM t_rep;
pk	v
INSERT INTO t_rep VALUES (1,'third');
SELECT * FROM t_rep;
pk	v
1	third
DROP TABLE t_rep;
# Done.
