CREATE TABLE t1 (f1 INT PRIMARY KEY);
INSERT INTO t1 VALUES (1);
SELECT COUNT(*) = 1 FROM t1;
COUNT(*) = 1
1
UPDATE t1 SET f1 = 2;
SELECT COUNT(*) = 1 FROM t1 WHERE f1 = 2;
COUNT(*) = 1
1
gtid_binlog_state_equal
1
DROP TABLE t1;
