CREATE TABLE ten (f1 INTEGER) ENGINE=InnoDB;
INSERT INTO ten VALUES (1),(2),(3),(4),(5),(6),(7),(8),(9),(10);
connection node_1;
CREATE TABLE t1 (f1 INT PRIMARY KEY AUTO_INCREMENT, f2 VARCHAR(100), FULLTEXT (f2)) ENGINE=InnoDB;
connection node_2;
SELECT COUNT(*) = 13 FROM INFORMATION_SCHEMA.INNODB_SYS_TABLES WHERE name LIKE 'test/%';
COUNT(*) = 13
1
connection node_1;
INSERT INTO t1 (f2) SELECT 'foobarbaz' FROM ten AS a1, ten AS a2, ten AS a3;
connection node_2;
SELECT COUNT(f2) = 1000 FROM t1 WHERE MATCH(f2) AGAINST ('foobarbaz');
COUNT(f2) = 1000
1
UPDATE t1 SET f2 = 'abcdefjhk';
connection node_1;
SELECT COUNT(f2) = 1000 FROM t1 WHERE MATCH(f2) AGAINST ('abcdefjhk');
COUNT(f2) = 1000
1
connection node_2;
DROP TABLE t1;
connection node_1;
CREATE TABLE t1 (f1 VARCHAR(100), FULLTEXT (f1)) ENGINE=InnoDB;
connection node_2;
INSERT INTO t1 (f1) SELECT 'foobarbaz' FROM ten AS a1, ten AS a2, ten AS a3;
connection node_1;
SELECT COUNT(f1) = 1000 FROM t1 WHERE MATCH(f1) AGAINST ('foobarbaz');
COUNT(f1) = 1000
1
UPDATE t1 SET f1 = 'abcdefjhk';
connection node_2;
SELECT COUNT(f1) = 1000 FROM t1 WHERE MATCH(f1) AGAINST ('abcdefjhk');
COUNT(f1) = 1000
1
DROP TABLE t1;
DROP TABLE ten;
connection node_1;
SET @value=REPEAT (1,5001);
CREATE TABLE t (a VARCHAR(5000),FULLTEXT (a)) engine=innodb;
INSERT IGNORE INTO t VALUES(@value);
Warnings:
Warning	1265	Data truncated for column 'a' at row 1
SELECT COUNT(*) FROM t;
COUNT(*)
1
connection node_2;
SELECT COUNT(*) FROM t;
COUNT(*)
1
connection node_1;
DROP TABLE t;
CREATE TABLE t (a VARCHAR(5000)) engine=innodb;
INSERT IGNORE INTO t VALUES(@value);
Warnings:
Warning	1265	Data truncated for column 'a' at row 1
SELECT COUNT(*) FROM t;
COUNT(*)
1
connection node_2;
SELECT COUNT(*) FROM t;
COUNT(*)
1
connection node_1;
DROP TABLE t;
connection node_1;
SET @value=REPEAT (1,5001);
CREATE TABLE t (a VARCHAR(5000),FULLTEXT (a)) engine=innodb DEFAULT CHARSET=utf8;
INSERT IGNORE INTO t VALUES(@value);
Warnings:
Warning	1265	Data truncated for column 'a' at row 1
SELECT COUNT(*) FROM t;
COUNT(*)
1
connection node_2;
SELECT COUNT(*) FROM t;
COUNT(*)
1
connection node_1;
DROP TABLE t;
CREATE TABLE t (a VARCHAR(5000)) engine=innodb DEFAULT CHARSET=utf8;
INSERT IGNORE INTO t VALUES(@value);
Warnings:
Warning	1265	Data truncated for column 'a' at row 1
SELECT COUNT(*) FROM t;
COUNT(*)
1
connection node_2;
SELECT COUNT(*) FROM t;
COUNT(*)
1
connection node_1;
DROP TABLE t;
