CREATE TABLE t1 (f1017 VARCHAR(3) DEFAULT 'ABC') ENGINE=InnoDB;
ALTER TABLE t1 ADD COLUMN f1016 VARCHAR(3) DEFAULT 'ABC';
ALTER TABLE t1 ADD COLUMN f1015 VARCHAR(3) DEFAULT 'ABC';
ALTER TABLE t1 ADD COLUMN f1014 VARCHAR(3) DEFAULT 'ABC';
ALTER TABLE t1 ADD COLUMN f1013 VARCHAR(3) DEFAULT 'ABC';
ALTER TABLE t1 ADD COLUMN f1012 VARCHAR(3) DEFAULT 'ABC';
ALTER TABLE t1 ADD COLUMN f1011 VARCHAR(3) DEFAULT 'ABC';
ALTER TABLE t1 ADD COLUMN f1010 VARCHAR(3) DEFAULT 'ABC';
ALTER TABLE t1 ADD COLUMN f1009 VARCHAR(3) DEFAULT 'ABC';
ALTER TABLE t1 ADD COLUMN f1008 VARCHAR(3) DEFAULT 'ABC';
ALTER TABLE t1 ADD COLUMN f1007 VARCHAR(3) DEFAULT 'ABC';
ALTER TABLE t1 ADD COLUMN f1006 VARCHAR(3) DEFAULT 'ABC';
ALTER TABLE t1 ADD COLUMN f1005 VARCHAR(3) DEFAULT 'ABC';
ALTER TABLE t1 ADD COLUMN f1004 VARCHAR(3) DEFAULT 'ABC';
ALTER TABLE t1 ADD COLUMN f1003 VARCHAR(3) DEFAULT 'ABC';
ALTER TABLE t1 ADD COLUMN f1002 VARCHAR(3) DEFAULT 'ABC';
ALTER TABLE t1 ADD COLUMN f1001 VARCHAR(3) DEFAULT 'ABC';
ALTER TABLE t1 ADD COLUMN f1000 VARCHAR(3) DEFAULT 'ABC';
ALTER TABLE t1 ADD COLUMN f999 VARCHAR(3) DEFAULT 'ABC';
ALTER TABLE t1 ADD COLUMN f998 VARCHAR(3) DEFAULT 'ABC';
ALTER TABLE t1 ADD COLUMN f997 VARCHAR(3) DEFAULT 'ABC';
ALTER TABLE t1 ADD COLUMN f996 VARCHAR(3) DEFAULT 'ABC';
ALTER TABLE t1 ADD COLUMN f995 VARCHAR(3) DEFAULT 'ABC';
ALTER TABLE t1 ADD COLUMN f994 VARCHAR(3) DEFAULT 'ABC';
ALTER TABLE t1 ADD COLUMN f993 VARCHAR(3) DEFAULT 'ABC';
ALTER TABLE t1 ADD COLUMN f992 VARCHAR(3) DEFAULT 'ABC';
ALTER TABLE t1 ADD COLUMN f991 VARCHAR(3) DEFAULT 'ABC';
ALTER TABLE t1 ADD COLUMN f990 VARCHAR(3) DEFAULT 'ABC';
ALTER TABLE t1 ADD COLUMN f989 VARCHAR(3) DEFAULT 'ABC';
ALTER TABLE t1 ADD COLUMN f988 VARCHAR(3) DEFAULT 'ABC';
ALTER TABLE t1 ADD COLUMN f987 VARCHAR(3) DEFAULT 'ABC';
ALTER TABLE t1 ADD COLUMN f986 VARCHAR(3) DEFAULT 'ABC';
ALTER TABLE t1 ADD COLUMN f985 VARCHAR(3) DEFAULT 'ABC';
ALTER TABLE t1 ADD COLUMN f984 VARCHAR(3) DEFAULT 'ABC';
ALTER TABLE t1 ADD COLUMN f983 VARCHAR(3) DEFAULT 'ABC';
ALTER TABLE t1 ADD COLUMN f982 VARCHAR(3) DEFAULT 'ABC';
ALTER TABLE t1 ADD COLUMN f981 VARCHAR(3) DEFAULT 'ABC';
ALTER TABLE t1 ADD COLUMN f980 VARCHAR(3) DEFAULT 'ABC';
ALTER TABLE t1 ADD COLUMN f979 VARCHAR(3) DEFAULT 'ABC';
ALTER TABLE t1 ADD COLUMN f978 VARCHAR(3) DEFAULT 'ABC';
ALTER TABLE t1 ADD COLUMN f977 VARCHAR(3) DEFAULT 'ABC';
ALTER TABLE t1 ADD COLUMN f976 VARCHAR(3) DEFAULT 'ABC';
ALTER TABLE t1 ADD COLUMN f975 VARCHAR(3) DEFAULT 'ABC';
ALTER TABLE t1 ADD COLUMN f974 VARCHAR(3) DEFAULT 'ABC';
ALTER TABLE t1 ADD COLUMN f973 VARCHAR(3) DEFAULT 'ABC';
ALTER TABLE t1 ADD COLUMN f972 VARCHAR(3) DEFAULT 'ABC';
ALTER TABLE t1 ADD COLUMN f971 VARCHAR(3) DEFAULT 'ABC';
ALTER TABLE t1 ADD COLUMN f970 VARCHAR(3) DEFAULT 'ABC';
ALTER TABLE t1 ADD COLUMN f969 VARCHAR(3) DEFAULT 'ABC';
ALTER TABLE t1 ADD COLUMN f968 VARCHAR(3) DEFAULT 'ABC';
ALTER TABLE t1 ADD COLUMN f967 VARCHAR(3) DEFAULT 'ABC';
ALTER TABLE t1 ADD COLUMN f966 VARCHAR(3) DEFAULT 'ABC';
ALTER TABLE t1 ADD COLUMN f965 VARCHAR(3) DEFAULT 'ABC';
ALTER TABLE t1 ADD COLUMN f964 VARCHAR(3) DEFAULT 'ABC';
ALTER TABLE t1 ADD COLUMN f963 VARCHAR(3) DEFAULT 'ABC';
ALTER TABLE t1 ADD COLUMN f962 VARCHAR(3) DEFAULT 'ABC';
ALTER TABLE t1 ADD COLUMN f961 VARCHAR(3) DEFAULT 'ABC';
ALTER TABLE t1 ADD COLUMN f960 VARCHAR(3) DEFAULT 'ABC';
ALTER TABLE t1 ADD COLUMN f959 VARCHAR(3) DEFAULT 'ABC';
ALTER TABLE t1 ADD COLUMN f958 VARCHAR(3) DEFAULT 'ABC';
ALTER TABLE t1 ADD COLUMN f957 VARCHAR(3) DEFAULT 'ABC';
ALTER TABLE t1 ADD COLUMN f956 VARCHAR(3) DEFAULT 'ABC';
ALTER TABLE t1 ADD COLUMN f955 VARCHAR(3) DEFAULT 'ABC';
ALTER TABLE t1 ADD COLUMN f954 VARCHAR(3) DEFAULT 'ABC';
ALTER TABLE t1 ADD COLUMN f953 VARCHAR(3) DEFAULT 'ABC';
ALTER TABLE t1 ADD COLUMN f952 VARCHAR(3) DEFAULT 'ABC';
ALTER TABLE t1 ADD COLUMN f951 VARCHAR(3) DEFAULT 'ABC';
ALTER TABLE t1 ADD COLUMN f950 VARCHAR(3) DEFAULT 'ABC';
ALTER TABLE t1 ADD COLUMN f949 VARCHAR(3) DEFAULT 'ABC';
ALTER TABLE t1 ADD COLUMN f948 VARCHAR(3) DEFAULT 'ABC';
ALTER TABLE t1 ADD COLUMN f947 VARCHAR(3) DEFAULT 'ABC';
ALTER TABLE t1 ADD COLUMN f946 VARCHAR(3) DEFAULT 'ABC';
ALTER TABLE t1 ADD COLUMN f945 VARCHAR(3) DEFAULT 'ABC';
ALTER TABLE t1 ADD COLUMN f944 VARCHAR(3) DEFAULT 'ABC';
ALTER TABLE t1 ADD COLUMN f943 VARCHAR(3) DEFAULT 'ABC';
ALTER TABLE t1 ADD COLUMN f942 VARCHAR(3) DEFAULT 'ABC';
ALTER TABLE t1 ADD COLUMN f941 VARCHAR(3) DEFAULT 'ABC';
ALTER TABLE t1 ADD COLUMN f940 VARCHAR(3) DEFAULT 'ABC';
ALTER TABLE t1 ADD COLUMN f939 VARCHAR(3) DEFAULT 'ABC';
ALTER TABLE t1 ADD COLUMN f938 VARCHAR(3) DEFAULT 'ABC';
ALTER TABLE t1 ADD COLUMN f937 VARCHAR(3) DEFAULT 'ABC';
ALTER TABLE t1 ADD COLUMN f936 VARCHAR(3) DEFAULT 'ABC';
ALTER TABLE t1 ADD COLUMN f935 VARCHAR(3) DEFAULT 'ABC';
ALTER TABLE t1 ADD COLUMN f934 VARCHAR(3) DEFAULT 'ABC';
ALTER TABLE t1 ADD COLUMN f933 VARCHAR(3) DEFAULT 'ABC';
ALTER TABLE t1 ADD COLUMN f932 VARCHAR(3) DEFAULT 'ABC';
ALTER TABLE t1 ADD COLUMN f931 VARCHAR(3) DEFAULT 'ABC';
ALTER TABLE t1 ADD COLUMN f930 VARCHAR(3) DEFAULT 'ABC';
ALTER TABLE t1 ADD COLUMN f929 VARCHAR(3) DEFAULT 'ABC';
ALTER TABLE t1 ADD COLUMN f928 VARCHAR(3) DEFAULT 'ABC';
ALTER TABLE t1 ADD COLUMN f927 VARCHAR(3) DEFAULT 'ABC';
ALTER TABLE t1 ADD COLUMN f926 VARCHAR(3) DEFAULT 'ABC';
ALTER TABLE t1 ADD COLUMN f925 VARCHAR(3) DEFAULT 'ABC';
ALTER TABLE t1 ADD COLUMN f924 VARCHAR(3) DEFAULT 'ABC';
ALTER TABLE t1 ADD COLUMN f923 VARCHAR(3) DEFAULT 'ABC';
ALTER TABLE t1 ADD COLUMN f922 VARCHAR(3) DEFAULT 'ABC';
ALTER TABLE t1 ADD COLUMN f921 VARCHAR(3) DEFAULT 'ABC';
ALTER TABLE t1 ADD COLUMN f920 VARCHAR(3) DEFAULT 'ABC';
ALTER TABLE t1 ADD COLUMN f919 VARCHAR(3) DEFAULT 'ABC';
ALTER TABLE t1 ADD COLUMN f918 VARCHAR(3) DEFAULT 'ABC';
ALTER TABLE t1 ADD COLUMN f917 VARCHAR(3) DEFAULT 'ABC';
ALTER TABLE t1 ADD COLUMN f916 VARCHAR(3) DEFAULT 'ABC';
ALTER TABLE t1 ADD COLUMN f915 VARCHAR(3) DEFAULT 'ABC';
ALTER TABLE t1 ADD COLUMN f914 VARCHAR(3) DEFAULT 'ABC';
ALTER TABLE t1 ADD COLUMN f913 VARCHAR(3) DEFAULT 'ABC';
ALTER TABLE t1 ADD COLUMN f912 VARCHAR(3) DEFAULT 'ABC';
ALTER TABLE t1 ADD COLUMN f911 VARCHAR(3) DEFAULT 'ABC';
ALTER TABLE t1 ADD COLUMN f910 VARCHAR(3) DEFAULT 'ABC';
ALTER TABLE t1 ADD COLUMN f909 VARCHAR(3) DEFAULT 'ABC';
ALTER TABLE t1 ADD COLUMN f908 VARCHAR(3) DEFAULT 'ABC';
ALTER TABLE t1 ADD COLUMN f907 VARCHAR(3) DEFAULT 'ABC';
ALTER TABLE t1 ADD COLUMN f906 VARCHAR(3) DEFAULT 'ABC';
ALTER TABLE t1 ADD COLUMN f905 VARCHAR(3) DEFAULT 'ABC';
ALTER TABLE t1 ADD COLUMN f904 VARCHAR(3) DEFAULT 'ABC';
ALTER TABLE t1 ADD COLUMN f903 VARCHAR(3) DEFAULT 'ABC';
ALTER TABLE t1 ADD COLUMN f902 VARCHAR(3) DEFAULT 'ABC';
ALTER TABLE t1 ADD COLUMN f901 VARCHAR(3) DEFAULT 'ABC';
ALTER TABLE t1 ADD COLUMN f900 VARCHAR(3) DEFAULT 'ABC';
ALTER TABLE t1 ADD COLUMN f899 VARCHAR(3) DEFAULT 'ABC';
ALTER TABLE t1 ADD COLUMN f898 VARCHAR(3) DEFAULT 'ABC';
ALTER TABLE t1 ADD COLUMN f897 VARCHAR(3) DEFAULT 'ABC';
ALTER TABLE t1 ADD COLUMN f896 VARCHAR(3) DEFAULT 'ABC';
ALTER TABLE t1 ADD COLUMN f895 VARCHAR(3) DEFAULT 'ABC';
ALTER TABLE t1 ADD COLUMN f894 VARCHAR(3) DEFAULT 'ABC';
ALTER TABLE t1 ADD COLUMN f893 VARCHAR(3) DEFAULT 'ABC';
ALTER TABLE t1 ADD COLUMN f892 VARCHAR(3) DEFAULT 'ABC';
ALTER TABLE t1 ADD COLUMN f891 VARCHAR(3) DEFAULT 'ABC';
ALTER TABLE t1 ADD COLUMN f890 VARCHAR(3) DEFAULT 'ABC';
ALTER TABLE t1 ADD COLUMN f889 VARCHAR(3) DEFAULT 'ABC';
ALTER TABLE t1 ADD COLUMN f888 VARCHAR(3) DEFAULT 'ABC';
ALTER TABLE t1 ADD COLUMN f887 VARCHAR(3) DEFAULT 'ABC';
ALTER TABLE t1 ADD COLUMN f886 VARCHAR(3) DEFAULT 'ABC';
ALTER TABLE t1 ADD COLUMN f885 VARCHAR(3) DEFAULT 'ABC';
ALTER TABLE t1 ADD COLUMN f884 VARCHAR(3) DEFAULT 'ABC';
ALTER TABLE t1 ADD COLUMN f883 VARCHAR(3) DEFAULT 'ABC';
ALTER TABLE t1 ADD COLUMN f882 VARCHAR(3) DEFAULT 'ABC';
ALTER TABLE t1 ADD COLUMN f881 VARCHAR(3) DEFAULT 'ABC';
ALTER TABLE t1 ADD COLUMN f880 VARCHAR(3) DEFAULT 'ABC';
ALTER TABLE t1 ADD COLUMN f879 VARCHAR(3) DEFAULT 'ABC';
ALTER TABLE t1 ADD COLUMN f878 VARCHAR(3) DEFAULT 'ABC';
ALTER TABLE t1 ADD COLUMN f877 VARCHAR(3) DEFAULT 'ABC';
ALTER TABLE t1 ADD COLUMN f876 VARCHAR(3) DEFAULT 'ABC';
ALTER TABLE t1 ADD COLUMN f875 VARCHAR(3) DEFAULT 'ABC';
ALTER TABLE t1 ADD COLUMN f874 VARCHAR(3) DEFAULT 'ABC';
ALTER TABLE t1 ADD COLUMN f873 VARCHAR(3) DEFAULT 'ABC';
ALTER TABLE t1 ADD COLUMN f872 VARCHAR(3) DEFAULT 'ABC';
ALTER TABLE t1 ADD COLUMN f871 VARCHAR(3) DEFAULT 'ABC';
ALTER TABLE t1 ADD COLUMN f870 VARCHAR(3) DEFAULT 'ABC';
ALTER TABLE t1 ADD COLUMN f869 VARCHAR(3) DEFAULT 'ABC';
ALTER TABLE t1 ADD COLUMN f868 VARCHAR(3) DEFAULT 'ABC';
ALTER TABLE t1 ADD COLUMN f867 VARCHAR(3) DEFAULT 'ABC';
ALTER TABLE t1 ADD COLUMN f866 VARCHAR(3) DEFAULT 'ABC';
ALTER TABLE t1 ADD COLUMN f865 VARCHAR(3) DEFAULT 'ABC';
ALTER TABLE t1 ADD COLUMN f864 VARCHAR(3) DEFAULT 'ABC';
ALTER TABLE t1 ADD COLUMN f863 VARCHAR(3) DEFAULT 'ABC';
ALTER TABLE t1 ADD COLUMN f862 VARCHAR(3) DEFAULT 'ABC';
ALTER TABLE t1 ADD COLUMN f861 VARCHAR(3) DEFAULT 'ABC';
ALTER TABLE t1 ADD COLUMN f860 VARCHAR(3) DEFAULT 'ABC';
ALTER TABLE t1 ADD COLUMN f859 VARCHAR(3) DEFAULT 'ABC';
ALTER TABLE t1 ADD COLUMN f858 VARCHAR(3) DEFAULT 'ABC';
ALTER TABLE t1 ADD COLUMN f857 VARCHAR(3) DEFAULT 'ABC';
ALTER TABLE t1 ADD COLUMN f856 VARCHAR(3) DEFAULT 'ABC';
ALTER TABLE t1 ADD COLUMN f855 VARCHAR(3) DEFAULT 'ABC';
ALTER TABLE t1 ADD COLUMN f854 VARCHAR(3) DEFAULT 'ABC';
ALTER TABLE t1 ADD COLUMN f853 VARCHAR(3) DEFAULT 'ABC';
ALTER TABLE t1 ADD COLUMN f852 VARCHAR(3) DEFAULT 'ABC';
ALTER TABLE t1 ADD COLUMN f851 VARCHAR(3) DEFAULT 'ABC';
ALTER TABLE t1 ADD COLUMN f850 VARCHAR(3) DEFAULT 'ABC';
ALTER TABLE t1 ADD COLUMN f849 VARCHAR(3) DEFAULT 'ABC';
ALTER TABLE t1 ADD COLUMN f848 VARCHAR(3) DEFAULT 'ABC';
ALTER TABLE t1 ADD COLUMN f847 VARCHAR(3) DEFAULT 'ABC';
ALTER TABLE t1 ADD COLUMN f846 VARCHAR(3) DEFAULT 'ABC';
ALTER TABLE t1 ADD COLUMN f845 VARCHAR(3) DEFAULT 'ABC';
ALTER TABLE t1 ADD COLUMN f844 VARCHAR(3) DEFAULT 'ABC';
ALTER TABLE t1 ADD COLUMN f843 VARCHAR(3) DEFAULT 'ABC';
ALTER TABLE t1 ADD COLUMN f842 VARCHAR(3) DEFAULT 'ABC';
ALTER TABLE t1 ADD COLUMN f841 VARCHAR(3) DEFAULT 'ABC';
ALTER TABLE t1 ADD COLUMN f840 VARCHAR(3) DEFAULT 'ABC';
ALTER TABLE t1 ADD COLUMN f839 VARCHAR(3) DEFAULT 'ABC';
ALTER TABLE t1 ADD COLUMN f838 VARCHAR(3) DEFAULT 'ABC';
ALTER TABLE t1 ADD COLUMN f837 VARCHAR(3) DEFAULT 'ABC';
ALTER TABLE t1 ADD COLUMN f836 VARCHAR(3) DEFAULT 'ABC';
ALTER TABLE t1 ADD COLUMN f835 VARCHAR(3) DEFAULT 'ABC';
ALTER TABLE t1 ADD COLUMN f834 VARCHAR(3) DEFAULT 'ABC';
ALTER TABLE t1 ADD COLUMN f833 VARCHAR(3) DEFAULT 'ABC';
ALTER TABLE t1 ADD COLUMN f832 VARCHAR(3) DEFAULT 'ABC';
ALTER TABLE t1 ADD COLUMN f831 VARCHAR(3) DEFAULT 'ABC';
ALTER TABLE t1 ADD COLUMN f830 VARCHAR(3) DEFAULT 'ABC';
ALTER TABLE t1 ADD COLUMN f829 VARCHAR(3) DEFAULT 'ABC';
ALTER TABLE t1 ADD COLUMN f828 VARCHAR(3) DEFAULT 'ABC';
ALTER TABLE t1 ADD COLUMN f827 VARCHAR(3) DEFAULT 'ABC';
ALTER TABLE t1 ADD COLUMN f826 VARCHAR(3) DEFAULT 'ABC';
ALTER TABLE t1 ADD COLUMN f825 VARCHAR(3) DEFAULT 'ABC';
ALTER TABLE t1 ADD COLUMN f824 VARCHAR(3) DEFAULT 'ABC';
ALTER TABLE t1 ADD COLUMN f823 VARCHAR(3) DEFAULT 'ABC';
ALTER TABLE t1 ADD COLUMN f822 VARCHAR(3) DEFAULT 'ABC';
ALTER TABLE t1 ADD COLUMN f821 VARCHAR(3) DEFAULT 'ABC';
ALTER TABLE t1 ADD COLUMN f820 VARCHAR(3) DEFAULT 'ABC';
ALTER TABLE t1 ADD COLUMN f819 VARCHAR(3) DEFAULT 'ABC';
ALTER TABLE t1 ADD COLUMN f818 VARCHAR(3) DEFAULT 'ABC';
ALTER TABLE t1 ADD COLUMN f817 VARCHAR(3) DEFAULT 'ABC';
ALTER TABLE t1 ADD COLUMN f816 VARCHAR(3) DEFAULT 'ABC';
ALTER TABLE t1 ADD COLUMN f815 VARCHAR(3) DEFAULT 'ABC';
ALTER TABLE t1 ADD COLUMN f814 VARCHAR(3) DEFAULT 'ABC';
ALTER TABLE t1 ADD COLUMN f813 VARCHAR(3) DEFAULT 'ABC';
ALTER TABLE t1 ADD COLUMN f812 VARCHAR(3) DEFAULT 'ABC';
ALTER TABLE t1 ADD COLUMN f811 VARCHAR(3) DEFAULT 'ABC';
ALTER TABLE t1 ADD COLUMN f810 VARCHAR(3) DEFAULT 'ABC';
ALTER TABLE t1 ADD COLUMN f809 VARCHAR(3) DEFAULT 'ABC';
ALTER TABLE t1 ADD COLUMN f808 VARCHAR(3) DEFAULT 'ABC';
ALTER TABLE t1 ADD COLUMN f807 VARCHAR(3) DEFAULT 'ABC';
ALTER TABLE t1 ADD COLUMN f806 VARCHAR(3) DEFAULT 'ABC';
ALTER TABLE t1 ADD COLUMN f805 VARCHAR(3) DEFAULT 'ABC';
ALTER TABLE t1 ADD COLUMN f804 VARCHAR(3) DEFAULT 'ABC';
ALTER TABLE t1 ADD COLUMN f803 VARCHAR(3) DEFAULT 'ABC';
ALTER TABLE t1 ADD COLUMN f802 VARCHAR(3) DEFAULT 'ABC';
ALTER TABLE t1 ADD COLUMN f801 VARCHAR(3) DEFAULT 'ABC';
ALTER TABLE t1 ADD COLUMN f800 VARCHAR(3) DEFAULT 'ABC';
ALTER TABLE t1 ADD COLUMN f799 VARCHAR(3) DEFAULT 'ABC';
ALTER TABLE t1 ADD COLUMN f798 VARCHAR(3) DEFAULT 'ABC';
ALTER TABLE t1 ADD COLUMN f797 VARCHAR(3) DEFAULT 'ABC';
ALTER TABLE t1 ADD COLUMN f796 VARCHAR(3) DEFAULT 'ABC';
ALTER TABLE t1 ADD COLUMN f795 VARCHAR(3) DEFAULT 'ABC';
ALTER TABLE t1 ADD COLUMN f794 VARCHAR(3) DEFAULT 'ABC';
ALTER TABLE t1 ADD COLUMN f793 VARCHAR(3) DEFAULT 'ABC';
ALTER TABLE t1 ADD COLUMN f792 VARCHAR(3) DEFAULT 'ABC';
ALTER TABLE t1 ADD COLUMN f791 VARCHAR(3) DEFAULT 'ABC';
ALTER TABLE t1 ADD COLUMN f790 VARCHAR(3) DEFAULT 'ABC';
ALTER TABLE t1 ADD COLUMN f789 VARCHAR(3) DEFAULT 'ABC';
ALTER TABLE t1 ADD COLUMN f788 VARCHAR(3) DEFAULT 'ABC';
ALTER TABLE t1 ADD COLUMN f787 VARCHAR(3) DEFAULT 'ABC';
ALTER TABLE t1 ADD COLUMN f786 VARCHAR(3) DEFAULT 'ABC';
ALTER TABLE t1 ADD COLUMN f785 VARCHAR(3) DEFAULT 'ABC';
ALTER TABLE t1 ADD COLUMN f784 VARCHAR(3) DEFAULT 'ABC';
ALTER TABLE t1 ADD COLUMN f783 VARCHAR(3) DEFAULT 'ABC';
ALTER TABLE t1 ADD COLUMN f782 VARCHAR(3) DEFAULT 'ABC';
ALTER TABLE t1 ADD COLUMN f781 VARCHAR(3) DEFAULT 'ABC';
ALTER TABLE t1 ADD COLUMN f780 VARCHAR(3) DEFAULT 'ABC';
ALTER TABLE t1 ADD COLUMN f779 VARCHAR(3) DEFAULT 'ABC';
ALTER TABLE t1 ADD COLUMN f778 VARCHAR(3) DEFAULT 'ABC';
ALTER TABLE t1 ADD COLUMN f777 VARCHAR(3) DEFAULT 'ABC';
ALTER TABLE t1 ADD COLUMN f776 VARCHAR(3) DEFAULT 'ABC';
ALTER TABLE t1 ADD COLUMN f775 VARCHAR(3) DEFAULT 'ABC';
ALTER TABLE t1 ADD COLUMN f774 VARCHAR(3) DEFAULT 'ABC';
ALTER TABLE t1 ADD COLUMN f773 VARCHAR(3) DEFAULT 'ABC';
ALTER TABLE t1 ADD COLUMN f772 VARCHAR(3) DEFAULT 'ABC';
ALTER TABLE t1 ADD COLUMN f771 VARCHAR(3) DEFAULT 'ABC';
ALTER TABLE t1 ADD COLUMN f770 VARCHAR(3) DEFAULT 'ABC';
ALTER TABLE t1 ADD COLUMN f769 VARCHAR(3) DEFAULT 'ABC';
ALTER TABLE t1 ADD COLUMN f768 VARCHAR(3) DEFAULT 'ABC';
ALTER TABLE t1 ADD COLUMN f767 VARCHAR(3) DEFAULT 'ABC';
ALTER TABLE t1 ADD COLUMN f766 VARCHAR(3) DEFAULT 'ABC';
ALTER TABLE t1 ADD COLUMN f765 VARCHAR(3) DEFAULT 'ABC';
ALTER TABLE t1 ADD COLUMN f764 VARCHAR(3) DEFAULT 'ABC';
ALTER TABLE t1 ADD COLUMN f763 VARCHAR(3) DEFAULT 'ABC';
ALTER TABLE t1 ADD COLUMN f762 VARCHAR(3) DEFAULT 'ABC';
ALTER TABLE t1 ADD COLUMN f761 VARCHAR(3) DEFAULT 'ABC';
ALTER TABLE t1 ADD COLUMN f760 VARCHAR(3) DEFAULT 'ABC';
ALTER TABLE t1 ADD COLUMN f759 VARCHAR(3) DEFAULT 'ABC';
ALTER TABLE t1 ADD COLUMN f758 VARCHAR(3) DEFAULT 'ABC';
ALTER TABLE t1 ADD COLUMN f757 VARCHAR(3) DEFAULT 'ABC';
ALTER TABLE t1 ADD COLUMN f756 VARCHAR(3) DEFAULT 'ABC';
ALTER TABLE t1 ADD COLUMN f755 VARCHAR(3) DEFAULT 'ABC';
ALTER TABLE t1 ADD COLUMN f754 VARCHAR(3) DEFAULT 'ABC';
ALTER TABLE t1 ADD COLUMN f753 VARCHAR(3) DEFAULT 'ABC';
ALTER TABLE t1 ADD COLUMN f752 VARCHAR(3) DEFAULT 'ABC';
ALTER TABLE t1 ADD COLUMN f751 VARCHAR(3) DEFAULT 'ABC';
ALTER TABLE t1 ADD COLUMN f750 VARCHAR(3) DEFAULT 'ABC';
ALTER TABLE t1 ADD COLUMN f749 VARCHAR(3) DEFAULT 'ABC';
ALTER TABLE t1 ADD COLUMN f748 VARCHAR(3) DEFAULT 'ABC';
ALTER TABLE t1 ADD COLUMN f747 VARCHAR(3) DEFAULT 'ABC';
ALTER TABLE t1 ADD COLUMN f746 VARCHAR(3) DEFAULT 'ABC';
ALTER TABLE t1 ADD COLUMN f745 VARCHAR(3) DEFAULT 'ABC';
ALTER TABLE t1 ADD COLUMN f744 VARCHAR(3) DEFAULT 'ABC';
ALTER TABLE t1 ADD COLUMN f743 VARCHAR(3) DEFAULT 'ABC';
ALTER TABLE t1 ADD COLUMN f742 VARCHAR(3) DEFAULT 'ABC';
ALTER TABLE t1 ADD COLUMN f741 VARCHAR(3) DEFAULT 'ABC';
ALTER TABLE t1 ADD COLUMN f740 VARCHAR(3) DEFAULT 'ABC';
ALTER TABLE t1 ADD COLUMN f739 VARCHAR(3) DEFAULT 'ABC';
ALTER TABLE t1 ADD COLUMN f738 VARCHAR(3) DEFAULT 'ABC';
ALTER TABLE t1 ADD COLUMN f737 VARCHAR(3) DEFAULT 'ABC';
ALTER TABLE t1 ADD COLUMN f736 VARCHAR(3) DEFAULT 'ABC';
ALTER TABLE t1 ADD COLUMN f735 VARCHAR(3) DEFAULT 'ABC';
ALTER TABLE t1 ADD COLUMN f734 VARCHAR(3) DEFAULT 'ABC';
ALTER TABLE t1 ADD COLUMN f733 VARCHAR(3) DEFAULT 'ABC';
ALTER TABLE t1 ADD COLUMN f732 VARCHAR(3) DEFAULT 'ABC';
ALTER TABLE t1 ADD COLUMN f731 VARCHAR(3) DEFAULT 'ABC';
ALTER TABLE t1 ADD COLUMN f730 VARCHAR(3) DEFAULT 'ABC';
ALTER TABLE t1 ADD COLUMN f729 VARCHAR(3) DEFAULT 'ABC';
ALTER TABLE t1 ADD COLUMN f728 VARCHAR(3) DEFAULT 'ABC';
ALTER TABLE t1 ADD COLUMN f727 VARCHAR(3) DEFAULT 'ABC';
ALTER TABLE t1 ADD COLUMN f726 VARCHAR(3) DEFAULT 'ABC';
ALTER TABLE t1 ADD COLUMN f725 VARCHAR(3) DEFAULT 'ABC';
ALTER TABLE t1 ADD COLUMN f724 VARCHAR(3) DEFAULT 'ABC';
ALTER TABLE t1 ADD COLUMN f723 VARCHAR(3) DEFAULT 'ABC';
ALTER TABLE t1 ADD COLUMN f722 VARCHAR(3) DEFAULT 'ABC';
ALTER TABLE t1 ADD COLUMN f721 VARCHAR(3) DEFAULT 'ABC';
ALTER TABLE t1 ADD COLUMN f720 VARCHAR(3) DEFAULT 'ABC';
ALTER TABLE t1 ADD COLUMN f719 VARCHAR(3) DEFAULT 'ABC';
ALTER TABLE t1 ADD COLUMN f718 VARCHAR(3) DEFAULT 'ABC';
ALTER TABLE t1 ADD COLUMN f717 VARCHAR(3) DEFAULT 'ABC';
ALTER TABLE t1 ADD COLUMN f716 VARCHAR(3) DEFAULT 'ABC';
ALTER TABLE t1 ADD COLUMN f715 VARCHAR(3) DEFAULT 'ABC';
ALTER TABLE t1 ADD COLUMN f714 VARCHAR(3) DEFAULT 'ABC';
ALTER TABLE t1 ADD COLUMN f713 VARCHAR(3) DEFAULT 'ABC';
ALTER TABLE t1 ADD COLUMN f712 VARCHAR(3) DEFAULT 'ABC';
ALTER TABLE t1 ADD COLUMN f711 VARCHAR(3) DEFAULT 'ABC';
ALTER TABLE t1 ADD COLUMN f710 VARCHAR(3) DEFAULT 'ABC';
ALTER TABLE t1 ADD COLUMN f709 VARCHAR(3) DEFAULT 'ABC';
ALTER TABLE t1 ADD COLUMN f708 VARCHAR(3) DEFAULT 'ABC';
ALTER TABLE t1 ADD COLUMN f707 VARCHAR(3) DEFAULT 'ABC';
ALTER TABLE t1 ADD COLUMN f706 VARCHAR(3) DEFAULT 'ABC';
ALTER TABLE t1 ADD COLUMN f705 VARCHAR(3) DEFAULT 'ABC';
ALTER TABLE t1 ADD COLUMN f704 VARCHAR(3) DEFAULT 'ABC';
ALTER TABLE t1 ADD COLUMN f703 VARCHAR(3) DEFAULT 'ABC';
ALTER TABLE t1 ADD COLUMN f702 VARCHAR(3) DEFAULT 'ABC';
ALTER TABLE t1 ADD COLUMN f701 VARCHAR(3) DEFAULT 'ABC';
ALTER TABLE t1 ADD COLUMN f700 VARCHAR(3) DEFAULT 'ABC';
ALTER TABLE t1 ADD COLUMN f699 VARCHAR(3) DEFAULT 'ABC';
ALTER TABLE t1 ADD COLUMN f698 VARCHAR(3) DEFAULT 'ABC';
ALTER TABLE t1 ADD COLUMN f697 VARCHAR(3) DEFAULT 'ABC';
ALTER TABLE t1 ADD COLUMN f696 VARCHAR(3) DEFAULT 'ABC';
ALTER TABLE t1 ADD COLUMN f695 VARCHAR(3) DEFAULT 'ABC';
ALTER TABLE t1 ADD COLUMN f694 VARCHAR(3) DEFAULT 'ABC';
ALTER TABLE t1 ADD COLUMN f693 VARCHAR(3) DEFAULT 'ABC';
ALTER TABLE t1 ADD COLUMN f692 VARCHAR(3) DEFAULT 'ABC';
ALTER TABLE t1 ADD COLUMN f691 VARCHAR(3) DEFAULT 'ABC';
ALTER TABLE t1 ADD COLUMN f690 VARCHAR(3) DEFAULT 'ABC';
ALTER TABLE t1 ADD COLUMN f689 VARCHAR(3) DEFAULT 'ABC';
ALTER TABLE t1 ADD COLUMN f688 VARCHAR(3) DEFAULT 'ABC';
ALTER TABLE t1 ADD COLUMN f687 VARCHAR(3) DEFAULT 'ABC';
ALTER TABLE t1 ADD COLUMN f686 VARCHAR(3) DEFAULT 'ABC';
ALTER TABLE t1 ADD COLUMN f685 VARCHAR(3) DEFAULT 'ABC';
ALTER TABLE t1 ADD COLUMN f684 VARCHAR(3) DEFAULT 'ABC';
ALTER TABLE t1 ADD COLUMN f683 VARCHAR(3) DEFAULT 'ABC';
ALTER TABLE t1 ADD COLUMN f682 VARCHAR(3) DEFAULT 'ABC';
ALTER TABLE t1 ADD COLUMN f681 VARCHAR(3) DEFAULT 'ABC';
ALTER TABLE t1 ADD COLUMN f680 VARCHAR(3) DEFAULT 'ABC';
ALTER TABLE t1 ADD COLUMN f679 VARCHAR(3) DEFAULT 'ABC';
ALTER TABLE t1 ADD COLUMN f678 VARCHAR(3) DEFAULT 'ABC';
ALTER TABLE t1 ADD COLUMN f677 VARCHAR(3) DEFAULT 'ABC';
ALTER TABLE t1 ADD COLUMN f676 VARCHAR(3) DEFAULT 'ABC';
ALTER TABLE t1 ADD COLUMN f675 VARCHAR(3) DEFAULT 'ABC';
ALTER TABLE t1 ADD COLUMN f674 VARCHAR(3) DEFAULT 'ABC';
ALTER TABLE t1 ADD COLUMN f673 VARCHAR(3) DEFAULT 'ABC';
ALTER TABLE t1 ADD COLUMN f672 VARCHAR(3) DEFAULT 'ABC';
ALTER TABLE t1 ADD COLUMN f671 VARCHAR(3) DEFAULT 'ABC';
ALTER TABLE t1 ADD COLUMN f670 VARCHAR(3) DEFAULT 'ABC';
ALTER TABLE t1 ADD COLUMN f669 VARCHAR(3) DEFAULT 'ABC';
ALTER TABLE t1 ADD COLUMN f668 VARCHAR(3) DEFAULT 'ABC';
ALTER TABLE t1 ADD COLUMN f667 VARCHAR(3) DEFAULT 'ABC';
ALTER TABLE t1 ADD COLUMN f666 VARCHAR(3) DEFAULT 'ABC';
ALTER TABLE t1 ADD COLUMN f665 VARCHAR(3) DEFAULT 'ABC';
ALTER TABLE t1 ADD COLUMN f664 VARCHAR(3) DEFAULT 'ABC';
ALTER TABLE t1 ADD COLUMN f663 VARCHAR(3) DEFAULT 'ABC';
ALTER TABLE t1 ADD COLUMN f662 VARCHAR(3) DEFAULT 'ABC';
ALTER TABLE t1 ADD COLUMN f661 VARCHAR(3) DEFAULT 'ABC';
ALTER TABLE t1 ADD COLUMN f660 VARCHAR(3) DEFAULT 'ABC';
ALTER TABLE t1 ADD COLUMN f659 VARCHAR(3) DEFAULT 'ABC';
ALTER TABLE t1 ADD COLUMN f658 VARCHAR(3) DEFAULT 'ABC';
ALTER TABLE t1 ADD COLUMN f657 VARCHAR(3) DEFAULT 'ABC';
ALTER TABLE t1 ADD COLUMN f656 VARCHAR(3) DEFAULT 'ABC';
ALTER TABLE t1 ADD COLUMN f655 VARCHAR(3) DEFAULT 'ABC';
ALTER TABLE t1 ADD COLUMN f654 VARCHAR(3) DEFAULT 'ABC';
ALTER TABLE t1 ADD COLUMN f653 VARCHAR(3) DEFAULT 'ABC';
ALTER TABLE t1 ADD COLUMN f652 VARCHAR(3) DEFAULT 'ABC';
ALTER TABLE t1 ADD COLUMN f651 VARCHAR(3) DEFAULT 'ABC';
ALTER TABLE t1 ADD COLUMN f650 VARCHAR(3) DEFAULT 'ABC';
ALTER TABLE t1 ADD COLUMN f649 VARCHAR(3) DEFAULT 'ABC';
ALTER TABLE t1 ADD COLUMN f648 VARCHAR(3) DEFAULT 'ABC';
ALTER TABLE t1 ADD COLUMN f647 VARCHAR(3) DEFAULT 'ABC';
ALTER TABLE t1 ADD COLUMN f646 VARCHAR(3) DEFAULT 'ABC';
ALTER TABLE t1 ADD COLUMN f645 VARCHAR(3) DEFAULT 'ABC';
ALTER TABLE t1 ADD COLUMN f644 VARCHAR(3) DEFAULT 'ABC';
ALTER TABLE t1 ADD COLUMN f643 VARCHAR(3) DEFAULT 'ABC';
ALTER TABLE t1 ADD COLUMN f642 VARCHAR(3) DEFAULT 'ABC';
ALTER TABLE t1 ADD COLUMN f641 VARCHAR(3) DEFAULT 'ABC';
ALTER TABLE t1 ADD COLUMN f640 VARCHAR(3) DEFAULT 'ABC';
ALTER TABLE t1 ADD COLUMN f639 VARCHAR(3) DEFAULT 'ABC';
ALTER TABLE t1 ADD COLUMN f638 VARCHAR(3) DEFAULT 'ABC';
ALTER TABLE t1 ADD COLUMN f637 VARCHAR(3) DEFAULT 'ABC';
ALTER TABLE t1 ADD COLUMN f636 VARCHAR(3) DEFAULT 'ABC';
ALTER TABLE t1 ADD COLUMN f635 VARCHAR(3) DEFAULT 'ABC';
ALTER TABLE t1 ADD COLUMN f634 VARCHAR(3) DEFAULT 'ABC';
ALTER TABLE t1 ADD COLUMN f633 VARCHAR(3) DEFAULT 'ABC';
ALTER TABLE t1 ADD COLUMN f632 VARCHAR(3) DEFAULT 'ABC';
ALTER TABLE t1 ADD COLUMN f631 VARCHAR(3) DEFAULT 'ABC';
ALTER TABLE t1 ADD COLUMN f630 VARCHAR(3) DEFAULT 'ABC';
ALTER TABLE t1 ADD COLUMN f629 VARCHAR(3) DEFAULT 'ABC';
ALTER TABLE t1 ADD COLUMN f628 VARCHAR(3) DEFAULT 'ABC';
ALTER TABLE t1 ADD COLUMN f627 VARCHAR(3) DEFAULT 'ABC';
ALTER TABLE t1 ADD COLUMN f626 VARCHAR(3) DEFAULT 'ABC';
ALTER TABLE t1 ADD COLUMN f625 VARCHAR(3) DEFAULT 'ABC';
ALTER TABLE t1 ADD COLUMN f624 VARCHAR(3) DEFAULT 'ABC';
ALTER TABLE t1 ADD COLUMN f623 VARCHAR(3) DEFAULT 'ABC';
ALTER TABLE t1 ADD COLUMN f622 VARCHAR(3) DEFAULT 'ABC';
ALTER TABLE t1 ADD COLUMN f621 VARCHAR(3) DEFAULT 'ABC';
ALTER TABLE t1 ADD COLUMN f620 VARCHAR(3) DEFAULT 'ABC';
ALTER TABLE t1 ADD COLUMN f619 VARCHAR(3) DEFAULT 'ABC';
ALTER TABLE t1 ADD COLUMN f618 VARCHAR(3) DEFAULT 'ABC';
ALTER TABLE t1 ADD COLUMN f617 VARCHAR(3) DEFAULT 'ABC';
ALTER TABLE t1 ADD COLUMN f616 VARCHAR(3) DEFAULT 'ABC';
ALTER TABLE t1 ADD COLUMN f615 VARCHAR(3) DEFAULT 'ABC';
ALTER TABLE t1 ADD COLUMN f614 VARCHAR(3) DEFAULT 'ABC';
ALTER TABLE t1 ADD COLUMN f613 VARCHAR(3) DEFAULT 'ABC';
ALTER TABLE t1 ADD COLUMN f612 VARCHAR(3) DEFAULT 'ABC';
ALTER TABLE t1 ADD COLUMN f611 VARCHAR(3) DEFAULT 'ABC';
ALTER TABLE t1 ADD COLUMN f610 VARCHAR(3) DEFAULT 'ABC';
ALTER TABLE t1 ADD COLUMN f609 VARCHAR(3) DEFAULT 'ABC';
ALTER TABLE t1 ADD COLUMN f608 VARCHAR(3) DEFAULT 'ABC';
ALTER TABLE t1 ADD COLUMN f607 VARCHAR(3) DEFAULT 'ABC';
ALTER TABLE t1 ADD COLUMN f606 VARCHAR(3) DEFAULT 'ABC';
ALTER TABLE t1 ADD COLUMN f605 VARCHAR(3) DEFAULT 'ABC';
ALTER TABLE t1 ADD COLUMN f604 VARCHAR(3) DEFAULT 'ABC';
ALTER TABLE t1 ADD COLUMN f603 VARCHAR(3) DEFAULT 'ABC';
ALTER TABLE t1 ADD COLUMN f602 VARCHAR(3) DEFAULT 'ABC';
ALTER TABLE t1 ADD COLUMN f601 VARCHAR(3) DEFAULT 'ABC';
ALTER TABLE t1 ADD COLUMN f600 VARCHAR(3) DEFAULT 'ABC';
ALTER TABLE t1 ADD COLUMN f599 VARCHAR(3) DEFAULT 'ABC';
ALTER TABLE t1 ADD COLUMN f598 VARCHAR(3) DEFAULT 'ABC';
ALTER TABLE t1 ADD COLUMN f597 VARCHAR(3) DEFAULT 'ABC';
ALTER TABLE t1 ADD COLUMN f596 VARCHAR(3) DEFAULT 'ABC';
ALTER TABLE t1 ADD COLUMN f595 VARCHAR(3) DEFAULT 'ABC';
ALTER TABLE t1 ADD COLUMN f594 VARCHAR(3) DEFAULT 'ABC';
ALTER TABLE t1 ADD COLUMN f593 VARCHAR(3) DEFAULT 'ABC';
ALTER TABLE t1 ADD COLUMN f592 VARCHAR(3) DEFAULT 'ABC';
ALTER TABLE t1 ADD COLUMN f591 VARCHAR(3) DEFAULT 'ABC';
ALTER TABLE t1 ADD COLUMN f590 VARCHAR(3) DEFAULT 'ABC';
ALTER TABLE t1 ADD COLUMN f589 VARCHAR(3) DEFAULT 'ABC';
ALTER TABLE t1 ADD COLUMN f588 VARCHAR(3) DEFAULT 'ABC';
ALTER TABLE t1 ADD COLUMN f587 VARCHAR(3) DEFAULT 'ABC';
ALTER TABLE t1 ADD COLUMN f586 VARCHAR(3) DEFAULT 'ABC';
ALTER TABLE t1 ADD COLUMN f585 VARCHAR(3) DEFAULT 'ABC';
ALTER TABLE t1 ADD COLUMN f584 VARCHAR(3) DEFAULT 'ABC';
ALTER TABLE t1 ADD COLUMN f583 VARCHAR(3) DEFAULT 'ABC';
ALTER TABLE t1 ADD COLUMN f582 VARCHAR(3) DEFAULT 'ABC';
ALTER TABLE t1 ADD COLUMN f581 VARCHAR(3) DEFAULT 'ABC';
ALTER TABLE t1 ADD COLUMN f580 VARCHAR(3) DEFAULT 'ABC';
ALTER TABLE t1 ADD COLUMN f579 VARCHAR(3) DEFAULT 'ABC';
ALTER TABLE t1 ADD COLUMN f578 VARCHAR(3) DEFAULT 'ABC';
ALTER TABLE t1 ADD COLUMN f577 VARCHAR(3) DEFAULT 'ABC';
ALTER TABLE t1 ADD COLUMN f576 VARCHAR(3) DEFAULT 'ABC';
ALTER TABLE t1 ADD COLUMN f575 VARCHAR(3) DEFAULT 'ABC';
ALTER TABLE t1 ADD COLUMN f574 VARCHAR(3) DEFAULT 'ABC';
ALTER TABLE t1 ADD COLUMN f573 VARCHAR(3) DEFAULT 'ABC';
ALTER TABLE t1 ADD COLUMN f572 VARCHAR(3) DEFAULT 'ABC';
ALTER TABLE t1 ADD COLUMN f571 VARCHAR(3) DEFAULT 'ABC';
ALTER TABLE t1 ADD COLUMN f570 VARCHAR(3) DEFAULT 'ABC';
ALTER TABLE t1 ADD COLUMN f569 VARCHAR(3) DEFAULT 'ABC';
ALTER TABLE t1 ADD COLUMN f568 VARCHAR(3) DEFAULT 'ABC';
ALTER TABLE t1 ADD COLUMN f567 VARCHAR(3) DEFAULT 'ABC';
ALTER TABLE t1 ADD COLUMN f566 VARCHAR(3) DEFAULT 'ABC';
ALTER TABLE t1 ADD COLUMN f565 VARCHAR(3) DEFAULT 'ABC';
ALTER TABLE t1 ADD COLUMN f564 VARCHAR(3) DEFAULT 'ABC';
ALTER TABLE t1 ADD COLUMN f563 VARCHAR(3) DEFAULT 'ABC';
ALTER TABLE t1 ADD COLUMN f562 VARCHAR(3) DEFAULT 'ABC';
ALTER TABLE t1 ADD COLUMN f561 VARCHAR(3) DEFAULT 'ABC';
ALTER TABLE t1 ADD COLUMN f560 VARCHAR(3) DEFAULT 'ABC';
ALTER TABLE t1 ADD COLUMN f559 VARCHAR(3) DEFAULT 'ABC';
ALTER TABLE t1 ADD COLUMN f558 VARCHAR(3) DEFAULT 'ABC';
ALTER TABLE t1 ADD COLUMN f557 VARCHAR(3) DEFAULT 'ABC';
ALTER TABLE t1 ADD COLUMN f556 VARCHAR(3) DEFAULT 'ABC';
ALTER TABLE t1 ADD COLUMN f555 VARCHAR(3) DEFAULT 'ABC';
ALTER TABLE t1 ADD COLUMN f554 VARCHAR(3) DEFAULT 'ABC';
ALTER TABLE t1 ADD COLUMN f553 VARCHAR(3) DEFAULT 'ABC';
ALTER TABLE t1 ADD COLUMN f552 VARCHAR(3) DEFAULT 'ABC';
ALTER TABLE t1 ADD COLUMN f551 VARCHAR(3) DEFAULT 'ABC';
ALTER TABLE t1 ADD COLUMN f550 VARCHAR(3) DEFAULT 'ABC';
ALTER TABLE t1 ADD COLUMN f549 VARCHAR(3) DEFAULT 'ABC';
ALTER TABLE t1 ADD COLUMN f548 VARCHAR(3) DEFAULT 'ABC';
ALTER TABLE t1 ADD COLUMN f547 VARCHAR(3) DEFAULT 'ABC';
ALTER TABLE t1 ADD COLUMN f546 VARCHAR(3) DEFAULT 'ABC';
ALTER TABLE t1 ADD COLUMN f545 VARCHAR(3) DEFAULT 'ABC';
ALTER TABLE t1 ADD COLUMN f544 VARCHAR(3) DEFAULT 'ABC';
ALTER TABLE t1 ADD COLUMN f543 VARCHAR(3) DEFAULT 'ABC';
ALTER TABLE t1 ADD COLUMN f542 VARCHAR(3) DEFAULT 'ABC';
ALTER TABLE t1 ADD COLUMN f541 VARCHAR(3) DEFAULT 'ABC';
ALTER TABLE t1 ADD COLUMN f540 VARCHAR(3) DEFAULT 'ABC';
ALTER TABLE t1 ADD COLUMN f539 VARCHAR(3) DEFAULT 'ABC';
ALTER TABLE t1 ADD COLUMN f538 VARCHAR(3) DEFAULT 'ABC';
ALTER TABLE t1 ADD COLUMN f537 VARCHAR(3) DEFAULT 'ABC';
ALTER TABLE t1 ADD COLUMN f536 VARCHAR(3) DEFAULT 'ABC';
ALTER TABLE t1 ADD COLUMN f535 VARCHAR(3) DEFAULT 'ABC';
ALTER TABLE t1 ADD COLUMN f534 VARCHAR(3) DEFAULT 'ABC';
ALTER TABLE t1 ADD COLUMN f533 VARCHAR(3) DEFAULT 'ABC';
ALTER TABLE t1 ADD COLUMN f532 VARCHAR(3) DEFAULT 'ABC';
ALTER TABLE t1 ADD COLUMN f531 VARCHAR(3) DEFAULT 'ABC';
ALTER TABLE t1 ADD COLUMN f530 VARCHAR(3) DEFAULT 'ABC';
ALTER TABLE t1 ADD COLUMN f529 VARCHAR(3) DEFAULT 'ABC';
ALTER TABLE t1 ADD COLUMN f528 VARCHAR(3) DEFAULT 'ABC';
ALTER TABLE t1 ADD COLUMN f527 VARCHAR(3) DEFAULT 'ABC';
ALTER TABLE t1 ADD COLUMN f526 VARCHAR(3) DEFAULT 'ABC';
ALTER TABLE t1 ADD COLUMN f525 VARCHAR(3) DEFAULT 'ABC';
ALTER TABLE t1 ADD COLUMN f524 VARCHAR(3) DEFAULT 'ABC';
ALTER TABLE t1 ADD COLUMN f523 VARCHAR(3) DEFAULT 'ABC';
ALTER TABLE t1 ADD COLUMN f522 VARCHAR(3) DEFAULT 'ABC';
ALTER TABLE t1 ADD COLUMN f521 VARCHAR(3) DEFAULT 'ABC';
ALTER TABLE t1 ADD COLUMN f520 VARCHAR(3) DEFAULT 'ABC';
ALTER TABLE t1 ADD COLUMN f519 VARCHAR(3) DEFAULT 'ABC';
ALTER TABLE t1 ADD COLUMN f518 VARCHAR(3) DEFAULT 'ABC';
ALTER TABLE t1 ADD COLUMN f517 VARCHAR(3) DEFAULT 'ABC';
ALTER TABLE t1 ADD COLUMN f516 VARCHAR(3) DEFAULT 'ABC';
ALTER TABLE t1 ADD COLUMN f515 VARCHAR(3) DEFAULT 'ABC';
ALTER TABLE t1 ADD COLUMN f514 VARCHAR(3) DEFAULT 'ABC';
ALTER TABLE t1 ADD COLUMN f513 VARCHAR(3) DEFAULT 'ABC';
ALTER TABLE t1 ADD COLUMN f512 VARCHAR(3) DEFAULT 'ABC';
ALTER TABLE t1 ADD COLUMN f511 VARCHAR(3) DEFAULT 'ABC';
ALTER TABLE t1 ADD COLUMN f510 VARCHAR(3) DEFAULT 'ABC';
ALTER TABLE t1 ADD COLUMN f509 VARCHAR(3) DEFAULT 'ABC';
ALTER TABLE t1 ADD COLUMN f508 VARCHAR(3) DEFAULT 'ABC';
ALTER TABLE t1 ADD COLUMN f507 VARCHAR(3) DEFAULT 'ABC';
ALTER TABLE t1 ADD COLUMN f506 VARCHAR(3) DEFAULT 'ABC';
ALTER TABLE t1 ADD COLUMN f505 VARCHAR(3) DEFAULT 'ABC';
ALTER TABLE t1 ADD COLUMN f504 VARCHAR(3) DEFAULT 'ABC';
ALTER TABLE t1 ADD COLUMN f503 VARCHAR(3) DEFAULT 'ABC';
ALTER TABLE t1 ADD COLUMN f502 VARCHAR(3) DEFAULT 'ABC';
ALTER TABLE t1 ADD COLUMN f501 VARCHAR(3) DEFAULT 'ABC';
ALTER TABLE t1 ADD COLUMN f500 VARCHAR(3) DEFAULT 'ABC';
ALTER TABLE t1 ADD COLUMN f499 VARCHAR(3) DEFAULT 'ABC';
ALTER TABLE t1 ADD COLUMN f498 VARCHAR(3) DEFAULT 'ABC';
ALTER TABLE t1 ADD COLUMN f497 VARCHAR(3) DEFAULT 'ABC';
ALTER TABLE t1 ADD COLUMN f496 VARCHAR(3) DEFAULT 'ABC';
ALTER TABLE t1 ADD COLUMN f495 VARCHAR(3) DEFAULT 'ABC';
ALTER TABLE t1 ADD COLUMN f494 VARCHAR(3) DEFAULT 'ABC';
ALTER TABLE t1 ADD COLUMN f493 VARCHAR(3) DEFAULT 'ABC';
ALTER TABLE t1 ADD COLUMN f492 VARCHAR(3) DEFAULT 'ABC';
ALTER TABLE t1 ADD COLUMN f491 VARCHAR(3) DEFAULT 'ABC';
ALTER TABLE t1 ADD COLUMN f490 VARCHAR(3) DEFAULT 'ABC';
ALTER TABLE t1 ADD COLUMN f489 VARCHAR(3) DEFAULT 'ABC';
ALTER TABLE t1 ADD COLUMN f488 VARCHAR(3) DEFAULT 'ABC';
ALTER TABLE t1 ADD COLUMN f487 VARCHAR(3) DEFAULT 'ABC';
ALTER TABLE t1 ADD COLUMN f486 VARCHAR(3) DEFAULT 'ABC';
ALTER TABLE t1 ADD COLUMN f485 VARCHAR(3) DEFAULT 'ABC';
ALTER TABLE t1 ADD COLUMN f484 VARCHAR(3) DEFAULT 'ABC';
ALTER TABLE t1 ADD COLUMN f483 VARCHAR(3) DEFAULT 'ABC';
ALTER TABLE t1 ADD COLUMN f482 VARCHAR(3) DEFAULT 'ABC';
ALTER TABLE t1 ADD COLUMN f481 VARCHAR(3) DEFAULT 'ABC';
ALTER TABLE t1 ADD COLUMN f480 VARCHAR(3) DEFAULT 'ABC';
ALTER TABLE t1 ADD COLUMN f479 VARCHAR(3) DEFAULT 'ABC';
ALTER TABLE t1 ADD COLUMN f478 VARCHAR(3) DEFAULT 'ABC';
ALTER TABLE t1 ADD COLUMN f477 VARCHAR(3) DEFAULT 'ABC';
ALTER TABLE t1 ADD COLUMN f476 VARCHAR(3) DEFAULT 'ABC';
ALTER TABLE t1 ADD COLUMN f475 VARCHAR(3) DEFAULT 'ABC';
ALTER TABLE t1 ADD COLUMN f474 VARCHAR(3) DEFAULT 'ABC';
ALTER TABLE t1 ADD COLUMN f473 VARCHAR(3) DEFAULT 'ABC';
ALTER TABLE t1 ADD COLUMN f472 VARCHAR(3) DEFAULT 'ABC';
ALTER TABLE t1 ADD COLUMN f471 VARCHAR(3) DEFAULT 'ABC';
ALTER TABLE t1 ADD COLUMN f470 VARCHAR(3) DEFAULT 'ABC';
ALTER TABLE t1 ADD COLUMN f469 VARCHAR(3) DEFAULT 'ABC';
ALTER TABLE t1 ADD COLUMN f468 VARCHAR(3) DEFAULT 'ABC';
ALTER TABLE t1 ADD COLUMN f467 VARCHAR(3) DEFAULT 'ABC';
ALTER TABLE t1 ADD COLUMN f466 VARCHAR(3) DEFAULT 'ABC';
ALTER TABLE t1 ADD COLUMN f465 VARCHAR(3) DEFAULT 'ABC';
ALTER TABLE t1 ADD COLUMN f464 VARCHAR(3) DEFAULT 'ABC';
ALTER TABLE t1 ADD COLUMN f463 VARCHAR(3) DEFAULT 'ABC';
ALTER TABLE t1 ADD COLUMN f462 VARCHAR(3) DEFAULT 'ABC';
ALTER TABLE t1 ADD COLUMN f461 VARCHAR(3) DEFAULT 'ABC';
ALTER TABLE t1 ADD COLUMN f460 VARCHAR(3) DEFAULT 'ABC';
ALTER TABLE t1 ADD COLUMN f459 VARCHAR(3) DEFAULT 'ABC';
ALTER TABLE t1 ADD COLUMN f458 VARCHAR(3) DEFAULT 'ABC';
ALTER TABLE t1 ADD COLUMN f457 VARCHAR(3) DEFAULT 'ABC';
ALTER TABLE t1 ADD COLUMN f456 VARCHAR(3) DEFAULT 'ABC';
ALTER TABLE t1 ADD COLUMN f455 VARCHAR(3) DEFAULT 'ABC';
ALTER TABLE t1 ADD COLUMN f454 VARCHAR(3) DEFAULT 'ABC';
ALTER TABLE t1 ADD COLUMN f453 VARCHAR(3) DEFAULT 'ABC';
ALTER TABLE t1 ADD COLUMN f452 VARCHAR(3) DEFAULT 'ABC';
ALTER TABLE t1 ADD COLUMN f451 VARCHAR(3) DEFAULT 'ABC';
ALTER TABLE t1 ADD COLUMN f450 VARCHAR(3) DEFAULT 'ABC';
ALTER TABLE t1 ADD COLUMN f449 VARCHAR(3) DEFAULT 'ABC';
ALTER TABLE t1 ADD COLUMN f448 VARCHAR(3) DEFAULT 'ABC';
ALTER TABLE t1 ADD COLUMN f447 VARCHAR(3) DEFAULT 'ABC';
ALTER TABLE t1 ADD COLUMN f446 VARCHAR(3) DEFAULT 'ABC';
ALTER TABLE t1 ADD COLUMN f445 VARCHAR(3) DEFAULT 'ABC';
ALTER TABLE t1 ADD COLUMN f444 VARCHAR(3) DEFAULT 'ABC';
ALTER TABLE t1 ADD COLUMN f443 VARCHAR(3) DEFAULT 'ABC';
ALTER TABLE t1 ADD COLUMN f442 VARCHAR(3) DEFAULT 'ABC';
ALTER TABLE t1 ADD COLUMN f441 VARCHAR(3) DEFAULT 'ABC';
ALTER TABLE t1 ADD COLUMN f440 VARCHAR(3) DEFAULT 'ABC';
ALTER TABLE t1 ADD COLUMN f439 VARCHAR(3) DEFAULT 'ABC';
ALTER TABLE t1 ADD COLUMN f438 VARCHAR(3) DEFAULT 'ABC';
ALTER TABLE t1 ADD COLUMN f437 VARCHAR(3) DEFAULT 'ABC';
ALTER TABLE t1 ADD COLUMN f436 VARCHAR(3) DEFAULT 'ABC';
ALTER TABLE t1 ADD COLUMN f435 VARCHAR(3) DEFAULT 'ABC';
ALTER TABLE t1 ADD COLUMN f434 VARCHAR(3) DEFAULT 'ABC';
ALTER TABLE t1 ADD COLUMN f433 VARCHAR(3) DEFAULT 'ABC';
ALTER TABLE t1 ADD COLUMN f432 VARCHAR(3) DEFAULT 'ABC';
ALTER TABLE t1 ADD COLUMN f431 VARCHAR(3) DEFAULT 'ABC';
ALTER TABLE t1 ADD COLUMN f430 VARCHAR(3) DEFAULT 'ABC';
ALTER TABLE t1 ADD COLUMN f429 VARCHAR(3) DEFAULT 'ABC';
ALTER TABLE t1 ADD COLUMN f428 VARCHAR(3) DEFAULT 'ABC';
ALTER TABLE t1 ADD COLUMN f427 VARCHAR(3) DEFAULT 'ABC';
ALTER TABLE t1 ADD COLUMN f426 VARCHAR(3) DEFAULT 'ABC';
ALTER TABLE t1 ADD COLUMN f425 VARCHAR(3) DEFAULT 'ABC';
ALTER TABLE t1 ADD COLUMN f424 VARCHAR(3) DEFAULT 'ABC';
ALTER TABLE t1 ADD COLUMN f423 VARCHAR(3) DEFAULT 'ABC';
ALTER TABLE t1 ADD COLUMN f422 VARCHAR(3) DEFAULT 'ABC';
ALTER TABLE t1 ADD COLUMN f421 VARCHAR(3) DEFAULT 'ABC';
ALTER TABLE t1 ADD COLUMN f420 VARCHAR(3) DEFAULT 'ABC';
ALTER TABLE t1 ADD COLUMN f419 VARCHAR(3) DEFAULT 'ABC';
ALTER TABLE t1 ADD COLUMN f418 VARCHAR(3) DEFAULT 'ABC';
ALTER TABLE t1 ADD COLUMN f417 VARCHAR(3) DEFAULT 'ABC';
ALTER TABLE t1 ADD COLUMN f416 VARCHAR(3) DEFAULT 'ABC';
ALTER TABLE t1 ADD COLUMN f415 VARCHAR(3) DEFAULT 'ABC';
ALTER TABLE t1 ADD COLUMN f414 VARCHAR(3) DEFAULT 'ABC';
ALTER TABLE t1 ADD COLUMN f413 VARCHAR(3) DEFAULT 'ABC';
ALTER TABLE t1 ADD COLUMN f412 VARCHAR(3) DEFAULT 'ABC';
ALTER TABLE t1 ADD COLUMN f411 VARCHAR(3) DEFAULT 'ABC';
ALTER TABLE t1 ADD COLUMN f410 VARCHAR(3) DEFAULT 'ABC';
ALTER TABLE t1 ADD COLUMN f409 VARCHAR(3) DEFAULT 'ABC';
ALTER TABLE t1 ADD COLUMN f408 VARCHAR(3) DEFAULT 'ABC';
ALTER TABLE t1 ADD COLUMN f407 VARCHAR(3) DEFAULT 'ABC';
ALTER TABLE t1 ADD COLUMN f406 VARCHAR(3) DEFAULT 'ABC';
ALTER TABLE t1 ADD COLUMN f405 VARCHAR(3) DEFAULT 'ABC';
ALTER TABLE t1 ADD COLUMN f404 VARCHAR(3) DEFAULT 'ABC';
ALTER TABLE t1 ADD COLUMN f403 VARCHAR(3) DEFAULT 'ABC';
ALTER TABLE t1 ADD COLUMN f402 VARCHAR(3) DEFAULT 'ABC';
ALTER TABLE t1 ADD COLUMN f401 VARCHAR(3) DEFAULT 'ABC';
ALTER TABLE t1 ADD COLUMN f400 VARCHAR(3) DEFAULT 'ABC';
ALTER TABLE t1 ADD COLUMN f399 VARCHAR(3) DEFAULT 'ABC';
ALTER TABLE t1 ADD COLUMN f398 VARCHAR(3) DEFAULT 'ABC';
ALTER TABLE t1 ADD COLUMN f397 VARCHAR(3) DEFAULT 'ABC';
ALTER TABLE t1 ADD COLUMN f396 VARCHAR(3) DEFAULT 'ABC';
ALTER TABLE t1 ADD COLUMN f395 VARCHAR(3) DEFAULT 'ABC';
ALTER TABLE t1 ADD COLUMN f394 VARCHAR(3) DEFAULT 'ABC';
ALTER TABLE t1 ADD COLUMN f393 VARCHAR(3) DEFAULT 'ABC';
ALTER TABLE t1 ADD COLUMN f392 VARCHAR(3) DEFAULT 'ABC';
ALTER TABLE t1 ADD COLUMN f391 VARCHAR(3) DEFAULT 'ABC';
ALTER TABLE t1 ADD COLUMN f390 VARCHAR(3) DEFAULT 'ABC';
ALTER TABLE t1 ADD COLUMN f389 VARCHAR(3) DEFAULT 'ABC';
ALTER TABLE t1 ADD COLUMN f388 VARCHAR(3) DEFAULT 'ABC';
ALTER TABLE t1 ADD COLUMN f387 VARCHAR(3) DEFAULT 'ABC';
ALTER TABLE t1 ADD COLUMN f386 VARCHAR(3) DEFAULT 'ABC';
ALTER TABLE t1 ADD COLUMN f385 VARCHAR(3) DEFAULT 'ABC';
ALTER TABLE t1 ADD COLUMN f384 VARCHAR(3) DEFAULT 'ABC';
ALTER TABLE t1 ADD COLUMN f383 VARCHAR(3) DEFAULT 'ABC';
ALTER TABLE t1 ADD COLUMN f382 VARCHAR(3) DEFAULT 'ABC';
ALTER TABLE t1 ADD COLUMN f381 VARCHAR(3) DEFAULT 'ABC';
ALTER TABLE t1 ADD COLUMN f380 VARCHAR(3) DEFAULT 'ABC';
ALTER TABLE t1 ADD COLUMN f379 VARCHAR(3) DEFAULT 'ABC';
ALTER TABLE t1 ADD COLUMN f378 VARCHAR(3) DEFAULT 'ABC';
ALTER TABLE t1 ADD COLUMN f377 VARCHAR(3) DEFAULT 'ABC';
ALTER TABLE t1 ADD COLUMN f376 VARCHAR(3) DEFAULT 'ABC';
ALTER TABLE t1 ADD COLUMN f375 VARCHAR(3) DEFAULT 'ABC';
ALTER TABLE t1 ADD COLUMN f374 VARCHAR(3) DEFAULT 'ABC';
ALTER TABLE t1 ADD COLUMN f373 VARCHAR(3) DEFAULT 'ABC';
ALTER TABLE t1 ADD COLUMN f372 VARCHAR(3) DEFAULT 'ABC';
ALTER TABLE t1 ADD COLUMN f371 VARCHAR(3) DEFAULT 'ABC';
ALTER TABLE t1 ADD COLUMN f370 VARCHAR(3) DEFAULT 'ABC';
ALTER TABLE t1 ADD COLUMN f369 VARCHAR(3) DEFAULT 'ABC';
ALTER TABLE t1 ADD COLUMN f368 VARCHAR(3) DEFAULT 'ABC';
ALTER TABLE t1 ADD COLUMN f367 VARCHAR(3) DEFAULT 'ABC';
ALTER TABLE t1 ADD COLUMN f366 VARCHAR(3) DEFAULT 'ABC';
ALTER TABLE t1 ADD COLUMN f365 VARCHAR(3) DEFAULT 'ABC';
ALTER TABLE t1 ADD COLUMN f364 VARCHAR(3) DEFAULT 'ABC';
ALTER TABLE t1 ADD COLUMN f363 VARCHAR(3) DEFAULT 'ABC';
ALTER TABLE t1 ADD COLUMN f362 VARCHAR(3) DEFAULT 'ABC';
ALTER TABLE t1 ADD COLUMN f361 VARCHAR(3) DEFAULT 'ABC';
ALTER TABLE t1 ADD COLUMN f360 VARCHAR(3) DEFAULT 'ABC';
ALTER TABLE t1 ADD COLUMN f359 VARCHAR(3) DEFAULT 'ABC';
ALTER TABLE t1 ADD COLUMN f358 VARCHAR(3) DEFAULT 'ABC';
ALTER TABLE t1 ADD COLUMN f357 VARCHAR(3) DEFAULT 'ABC';
ALTER TABLE t1 ADD COLUMN f356 VARCHAR(3) DEFAULT 'ABC';
ALTER TABLE t1 ADD COLUMN f355 VARCHAR(3) DEFAULT 'ABC';
ALTER TABLE t1 ADD COLUMN f354 VARCHAR(3) DEFAULT 'ABC';
ALTER TABLE t1 ADD COLUMN f353 VARCHAR(3) DEFAULT 'ABC';
ALTER TABLE t1 ADD COLUMN f352 VARCHAR(3) DEFAULT 'ABC';
ALTER TABLE t1 ADD COLUMN f351 VARCHAR(3) DEFAULT 'ABC';
ALTER TABLE t1 ADD COLUMN f350 VARCHAR(3) DEFAULT 'ABC';
ALTER TABLE t1 ADD COLUMN f349 VARCHAR(3) DEFAULT 'ABC';
ALTER TABLE t1 ADD COLUMN f348 VARCHAR(3) DEFAULT 'ABC';
ALTER TABLE t1 ADD COLUMN f347 VARCHAR(3) DEFAULT 'ABC';
ALTER TABLE t1 ADD COLUMN f346 VARCHAR(3) DEFAULT 'ABC';
ALTER TABLE t1 ADD COLUMN f345 VARCHAR(3) DEFAULT 'ABC';
ALTER TABLE t1 ADD COLUMN f344 VARCHAR(3) DEFAULT 'ABC';
ALTER TABLE t1 ADD COLUMN f343 VARCHAR(3) DEFAULT 'ABC';
ALTER TABLE t1 ADD COLUMN f342 VARCHAR(3) DEFAULT 'ABC';
ALTER TABLE t1 ADD COLUMN f341 VARCHAR(3) DEFAULT 'ABC';
ALTER TABLE t1 ADD COLUMN f340 VARCHAR(3) DEFAULT 'ABC';
ALTER TABLE t1 ADD COLUMN f339 VARCHAR(3) DEFAULT 'ABC';
ALTER TABLE t1 ADD COLUMN f338 VARCHAR(3) DEFAULT 'ABC';
ALTER TABLE t1 ADD COLUMN f337 VARCHAR(3) DEFAULT 'ABC';
ALTER TABLE t1 ADD COLUMN f336 VARCHAR(3) DEFAULT 'ABC';
ALTER TABLE t1 ADD COLUMN f335 VARCHAR(3) DEFAULT 'ABC';
ALTER TABLE t1 ADD COLUMN f334 VARCHAR(3) DEFAULT 'ABC';
ALTER TABLE t1 ADD COLUMN f333 VARCHAR(3) DEFAULT 'ABC';
ALTER TABLE t1 ADD COLUMN f332 VARCHAR(3) DEFAULT 'ABC';
ALTER TABLE t1 ADD COLUMN f331 VARCHAR(3) DEFAULT 'ABC';
ALTER TABLE t1 ADD COLUMN f330 VARCHAR(3) DEFAULT 'ABC';
ALTER TABLE t1 ADD COLUMN f329 VARCHAR(3) DEFAULT 'ABC';
ALTER TABLE t1 ADD COLUMN f328 VARCHAR(3) DEFAULT 'ABC';
ALTER TABLE t1 ADD COLUMN f327 VARCHAR(3) DEFAULT 'ABC';
ALTER TABLE t1 ADD COLUMN f326 VARCHAR(3) DEFAULT 'ABC';
ALTER TABLE t1 ADD COLUMN f325 VARCHAR(3) DEFAULT 'ABC';
ALTER TABLE t1 ADD COLUMN f324 VARCHAR(3) DEFAULT 'ABC';
ALTER TABLE t1 ADD COLUMN f323 VARCHAR(3) DEFAULT 'ABC';
ALTER TABLE t1 ADD COLUMN f322 VARCHAR(3) DEFAULT 'ABC';
ALTER TABLE t1 ADD COLUMN f321 VARCHAR(3) DEFAULT 'ABC';
ALTER TABLE t1 ADD COLUMN f320 VARCHAR(3) DEFAULT 'ABC';
ALTER TABLE t1 ADD COLUMN f319 VARCHAR(3) DEFAULT 'ABC';
ALTER TABLE t1 ADD COLUMN f318 VARCHAR(3) DEFAULT 'ABC';
ALTER TABLE t1 ADD COLUMN f317 VARCHAR(3) DEFAULT 'ABC';
ALTER TABLE t1 ADD COLUMN f316 VARCHAR(3) DEFAULT 'ABC';
ALTER TABLE t1 ADD COLUMN f315 VARCHAR(3) DEFAULT 'ABC';
ALTER TABLE t1 ADD COLUMN f314 VARCHAR(3) DEFAULT 'ABC';
ALTER TABLE t1 ADD COLUMN f313 VARCHAR(3) DEFAULT 'ABC';
ALTER TABLE t1 ADD COLUMN f312 VARCHAR(3) DEFAULT 'ABC';
ALTER TABLE t1 ADD COLUMN f311 VARCHAR(3) DEFAULT 'ABC';
ALTER TABLE t1 ADD COLUMN f310 VARCHAR(3) DEFAULT 'ABC';
ALTER TABLE t1 ADD COLUMN f309 VARCHAR(3) DEFAULT 'ABC';
ALTER TABLE t1 ADD COLUMN f308 VARCHAR(3) DEFAULT 'ABC';
ALTER TABLE t1 ADD COLUMN f307 VARCHAR(3) DEFAULT 'ABC';
ALTER TABLE t1 ADD COLUMN f306 VARCHAR(3) DEFAULT 'ABC';
ALTER TABLE t1 ADD COLUMN f305 VARCHAR(3) DEFAULT 'ABC';
ALTER TABLE t1 ADD COLUMN f304 VARCHAR(3) DEFAULT 'ABC';
ALTER TABLE t1 ADD COLUMN f303 VARCHAR(3) DEFAULT 'ABC';
ALTER TABLE t1 ADD COLUMN f302 VARCHAR(3) DEFAULT 'ABC';
ALTER TABLE t1 ADD COLUMN f301 VARCHAR(3) DEFAULT 'ABC';
ALTER TABLE t1 ADD COLUMN f300 VARCHAR(3) DEFAULT 'ABC';
ALTER TABLE t1 ADD COLUMN f299 VARCHAR(3) DEFAULT 'ABC';
ALTER TABLE t1 ADD COLUMN f298 VARCHAR(3) DEFAULT 'ABC';
ALTER TABLE t1 ADD COLUMN f297 VARCHAR(3) DEFAULT 'ABC';
ALTER TABLE t1 ADD COLUMN f296 VARCHAR(3) DEFAULT 'ABC';
ALTER TABLE t1 ADD COLUMN f295 VARCHAR(3) DEFAULT 'ABC';
ALTER TABLE t1 ADD COLUMN f294 VARCHAR(3) DEFAULT 'ABC';
ALTER TABLE t1 ADD COLUMN f293 VARCHAR(3) DEFAULT 'ABC';
ALTER TABLE t1 ADD COLUMN f292 VARCHAR(3) DEFAULT 'ABC';
ALTER TABLE t1 ADD COLUMN f291 VARCHAR(3) DEFAULT 'ABC';
ALTER TABLE t1 ADD COLUMN f290 VARCHAR(3) DEFAULT 'ABC';
ALTER TABLE t1 ADD COLUMN f289 VARCHAR(3) DEFAULT 'ABC';
ALTER TABLE t1 ADD COLUMN f288 VARCHAR(3) DEFAULT 'ABC';
ALTER TABLE t1 ADD COLUMN f287 VARCHAR(3) DEFAULT 'ABC';
ALTER TABLE t1 ADD COLUMN f286 VARCHAR(3) DEFAULT 'ABC';
ALTER TABLE t1 ADD COLUMN f285 VARCHAR(3) DEFAULT 'ABC';
ALTER TABLE t1 ADD COLUMN f284 VARCHAR(3) DEFAULT 'ABC';
ALTER TABLE t1 ADD COLUMN f283 VARCHAR(3) DEFAULT 'ABC';
ALTER TABLE t1 ADD COLUMN f282 VARCHAR(3) DEFAULT 'ABC';
ALTER TABLE t1 ADD COLUMN f281 VARCHAR(3) DEFAULT 'ABC';
ALTER TABLE t1 ADD COLUMN f280 VARCHAR(3) DEFAULT 'ABC';
ALTER TABLE t1 ADD COLUMN f279 VARCHAR(3) DEFAULT 'ABC';
ALTER TABLE t1 ADD COLUMN f278 VARCHAR(3) DEFAULT 'ABC';
ALTER TABLE t1 ADD COLUMN f277 VARCHAR(3) DEFAULT 'ABC';
ALTER TABLE t1 ADD COLUMN f276 VARCHAR(3) DEFAULT 'ABC';
ALTER TABLE t1 ADD COLUMN f275 VARCHAR(3) DEFAULT 'ABC';
ALTER TABLE t1 ADD COLUMN f274 VARCHAR(3) DEFAULT 'ABC';
ALTER TABLE t1 ADD COLUMN f273 VARCHAR(3) DEFAULT 'ABC';
ALTER TABLE t1 ADD COLUMN f272 VARCHAR(3) DEFAULT 'ABC';
ALTER TABLE t1 ADD COLUMN f271 VARCHAR(3) DEFAULT 'ABC';
ALTER TABLE t1 ADD COLUMN f270 VARCHAR(3) DEFAULT 'ABC';
ALTER TABLE t1 ADD COLUMN f269 VARCHAR(3) DEFAULT 'ABC';
ALTER TABLE t1 ADD COLUMN f268 VARCHAR(3) DEFAULT 'ABC';
ALTER TABLE t1 ADD COLUMN f267 VARCHAR(3) DEFAULT 'ABC';
ALTER TABLE t1 ADD COLUMN f266 VARCHAR(3) DEFAULT 'ABC';
ALTER TABLE t1 ADD COLUMN f265 VARCHAR(3) DEFAULT 'ABC';
ALTER TABLE t1 ADD COLUMN f264 VARCHAR(3) DEFAULT 'ABC';
ALTER TABLE t1 ADD COLUMN f263 VARCHAR(3) DEFAULT 'ABC';
ALTER TABLE t1 ADD COLUMN f262 VARCHAR(3) DEFAULT 'ABC';
ALTER TABLE t1 ADD COLUMN f261 VARCHAR(3) DEFAULT 'ABC';
ALTER TABLE t1 ADD COLUMN f260 VARCHAR(3) DEFAULT 'ABC';
ALTER TABLE t1 ADD COLUMN f259 VARCHAR(3) DEFAULT 'ABC';
ALTER TABLE t1 ADD COLUMN f258 VARCHAR(3) DEFAULT 'ABC';
ALTER TABLE t1 ADD COLUMN f257 VARCHAR(3) DEFAULT 'ABC';
ALTER TABLE t1 ADD COLUMN f256 VARCHAR(3) DEFAULT 'ABC';
ALTER TABLE t1 ADD COLUMN f255 VARCHAR(3) DEFAULT 'ABC';
ALTER TABLE t1 ADD COLUMN f254 VARCHAR(3) DEFAULT 'ABC';
ALTER TABLE t1 ADD COLUMN f253 VARCHAR(3) DEFAULT 'ABC';
ALTER TABLE t1 ADD COLUMN f252 VARCHAR(3) DEFAULT 'ABC';
ALTER TABLE t1 ADD COLUMN f251 VARCHAR(3) DEFAULT 'ABC';
ALTER TABLE t1 ADD COLUMN f250 VARCHAR(3) DEFAULT 'ABC';
ALTER TABLE t1 ADD COLUMN f249 VARCHAR(3) DEFAULT 'ABC';
ALTER TABLE t1 ADD COLUMN f248 VARCHAR(3) DEFAULT 'ABC';
ALTER TABLE t1 ADD COLUMN f247 VARCHAR(3) DEFAULT 'ABC';
ALTER TABLE t1 ADD COLUMN f246 VARCHAR(3) DEFAULT 'ABC';
ALTER TABLE t1 ADD COLUMN f245 VARCHAR(3) DEFAULT 'ABC';
ALTER TABLE t1 ADD COLUMN f244 VARCHAR(3) DEFAULT 'ABC';
ALTER TABLE t1 ADD COLUMN f243 VARCHAR(3) DEFAULT 'ABC';
ALTER TABLE t1 ADD COLUMN f242 VARCHAR(3) DEFAULT 'ABC';
ALTER TABLE t1 ADD COLUMN f241 VARCHAR(3) DEFAULT 'ABC';
ALTER TABLE t1 ADD COLUMN f240 VARCHAR(3) DEFAULT 'ABC';
ALTER TABLE t1 ADD COLUMN f239 VARCHAR(3) DEFAULT 'ABC';
ALTER TABLE t1 ADD COLUMN f238 VARCHAR(3) DEFAULT 'ABC';
ALTER TABLE t1 ADD COLUMN f237 VARCHAR(3) DEFAULT 'ABC';
ALTER TABLE t1 ADD COLUMN f236 VARCHAR(3) DEFAULT 'ABC';
ALTER TABLE t1 ADD COLUMN f235 VARCHAR(3) DEFAULT 'ABC';
ALTER TABLE t1 ADD COLUMN f234 VARCHAR(3) DEFAULT 'ABC';
ALTER TABLE t1 ADD COLUMN f233 VARCHAR(3) DEFAULT 'ABC';
ALTER TABLE t1 ADD COLUMN f232 VARCHAR(3) DEFAULT 'ABC';
ALTER TABLE t1 ADD COLUMN f231 VARCHAR(3) DEFAULT 'ABC';
ALTER TABLE t1 ADD COLUMN f230 VARCHAR(3) DEFAULT 'ABC';
ALTER TABLE t1 ADD COLUMN f229 VARCHAR(3) DEFAULT 'ABC';
ALTER TABLE t1 ADD COLUMN f228 VARCHAR(3) DEFAULT 'ABC';
ALTER TABLE t1 ADD COLUMN f227 VARCHAR(3) DEFAULT 'ABC';
ALTER TABLE t1 ADD COLUMN f226 VARCHAR(3) DEFAULT 'ABC';
ALTER TABLE t1 ADD COLUMN f225 VARCHAR(3) DEFAULT 'ABC';
ALTER TABLE t1 ADD COLUMN f224 VARCHAR(3) DEFAULT 'ABC';
ALTER TABLE t1 ADD COLUMN f223 VARCHAR(3) DEFAULT 'ABC';
ALTER TABLE t1 ADD COLUMN f222 VARCHAR(3) DEFAULT 'ABC';
ALTER TABLE t1 ADD COLUMN f221 VARCHAR(3) DEFAULT 'ABC';
ALTER TABLE t1 ADD COLUMN f220 VARCHAR(3) DEFAULT 'ABC';
ALTER TABLE t1 ADD COLUMN f219 VARCHAR(3) DEFAULT 'ABC';
ALTER TABLE t1 ADD COLUMN f218 VARCHAR(3) DEFAULT 'ABC';
ALTER TABLE t1 ADD COLUMN f217 VARCHAR(3) DEFAULT 'ABC';
ALTER TABLE t1 ADD COLUMN f216 VARCHAR(3) DEFAULT 'ABC';
ALTER TABLE t1 ADD COLUMN f215 VARCHAR(3) DEFAULT 'ABC';
ALTER TABLE t1 ADD COLUMN f214 VARCHAR(3) DEFAULT 'ABC';
ALTER TABLE t1 ADD COLUMN f213 VARCHAR(3) DEFAULT 'ABC';
ALTER TABLE t1 ADD COLUMN f212 VARCHAR(3) DEFAULT 'ABC';
ALTER TABLE t1 ADD COLUMN f211 VARCHAR(3) DEFAULT 'ABC';
ALTER TABLE t1 ADD COLUMN f210 VARCHAR(3) DEFAULT 'ABC';
ALTER TABLE t1 ADD COLUMN f209 VARCHAR(3) DEFAULT 'ABC';
ALTER TABLE t1 ADD COLUMN f208 VARCHAR(3) DEFAULT 'ABC';
ALTER TABLE t1 ADD COLUMN f207 VARCHAR(3) DEFAULT 'ABC';
ALTER TABLE t1 ADD COLUMN f206 VARCHAR(3) DEFAULT 'ABC';
ALTER TABLE t1 ADD COLUMN f205 VARCHAR(3) DEFAULT 'ABC';
ALTER TABLE t1 ADD COLUMN f204 VARCHAR(3) DEFAULT 'ABC';
ALTER TABLE t1 ADD COLUMN f203 VARCHAR(3) DEFAULT 'ABC';
ALTER TABLE t1 ADD COLUMN f202 VARCHAR(3) DEFAULT 'ABC';
ALTER TABLE t1 ADD COLUMN f201 VARCHAR(3) DEFAULT 'ABC';
ALTER TABLE t1 ADD COLUMN f200 VARCHAR(3) DEFAULT 'ABC';
ALTER TABLE t1 ADD COLUMN f199 VARCHAR(3) DEFAULT 'ABC';
ALTER TABLE t1 ADD COLUMN f198 VARCHAR(3) DEFAULT 'ABC';
ALTER TABLE t1 ADD COLUMN f197 VARCHAR(3) DEFAULT 'ABC';
ALTER TABLE t1 ADD COLUMN f196 VARCHAR(3) DEFAULT 'ABC';
ALTER TABLE t1 ADD COLUMN f195 VARCHAR(3) DEFAULT 'ABC';
ALTER TABLE t1 ADD COLUMN f194 VARCHAR(3) DEFAULT 'ABC';
ALTER TABLE t1 ADD COLUMN f193 VARCHAR(3) DEFAULT 'ABC';
ALTER TABLE t1 ADD COLUMN f192 VARCHAR(3) DEFAULT 'ABC';
ALTER TABLE t1 ADD COLUMN f191 VARCHAR(3) DEFAULT 'ABC';
ALTER TABLE t1 ADD COLUMN f190 VARCHAR(3) DEFAULT 'ABC';
ALTER TABLE t1 ADD COLUMN f189 VARCHAR(3) DEFAULT 'ABC';
ALTER TABLE t1 ADD COLUMN f188 VARCHAR(3) DEFAULT 'ABC';
ALTER TABLE t1 ADD COLUMN f187 VARCHAR(3) DEFAULT 'ABC';
ALTER TABLE t1 ADD COLUMN f186 VARCHAR(3) DEFAULT 'ABC';
ALTER TABLE t1 ADD COLUMN f185 VARCHAR(3) DEFAULT 'ABC';
ALTER TABLE t1 ADD COLUMN f184 VARCHAR(3) DEFAULT 'ABC';
ALTER TABLE t1 ADD COLUMN f183 VARCHAR(3) DEFAULT 'ABC';
ALTER TABLE t1 ADD COLUMN f182 VARCHAR(3) DEFAULT 'ABC';
ALTER TABLE t1 ADD COLUMN f181 VARCHAR(3) DEFAULT 'ABC';
ALTER TABLE t1 ADD COLUMN f180 VARCHAR(3) DEFAULT 'ABC';
ALTER TABLE t1 ADD COLUMN f179 VARCHAR(3) DEFAULT 'ABC';
ALTER TABLE t1 ADD COLUMN f178 VARCHAR(3) DEFAULT 'ABC';
ALTER TABLE t1 ADD COLUMN f177 VARCHAR(3) DEFAULT 'ABC';
ALTER TABLE t1 ADD COLUMN f176 VARCHAR(3) DEFAULT 'ABC';
ALTER TABLE t1 ADD COLUMN f175 VARCHAR(3) DEFAULT 'ABC';
ALTER TABLE t1 ADD COLUMN f174 VARCHAR(3) DEFAULT 'ABC';
ALTER TABLE t1 ADD COLUMN f173 VARCHAR(3) DEFAULT 'ABC';
ALTER TABLE t1 ADD COLUMN f172 VARCHAR(3) DEFAULT 'ABC';
ALTER TABLE t1 ADD COLUMN f171 VARCHAR(3) DEFAULT 'ABC';
ALTER TABLE t1 ADD COLUMN f170 VARCHAR(3) DEFAULT 'ABC';
ALTER TABLE t1 ADD COLUMN f169 VARCHAR(3) DEFAULT 'ABC';
ALTER TABLE t1 ADD COLUMN f168 VARCHAR(3) DEFAULT 'ABC';
ALTER TABLE t1 ADD COLUMN f167 VARCHAR(3) DEFAULT 'ABC';
ALTER TABLE t1 ADD COLUMN f166 VARCHAR(3) DEFAULT 'ABC';
ALTER TABLE t1 ADD COLUMN f165 VARCHAR(3) DEFAULT 'ABC';
ALTER TABLE t1 ADD COLUMN f164 VARCHAR(3) DEFAULT 'ABC';
ALTER TABLE t1 ADD COLUMN f163 VARCHAR(3) DEFAULT 'ABC';
ALTER TABLE t1 ADD COLUMN f162 VARCHAR(3) DEFAULT 'ABC';
ALTER TABLE t1 ADD COLUMN f161 VARCHAR(3) DEFAULT 'ABC';
ALTER TABLE t1 ADD COLUMN f160 VARCHAR(3) DEFAULT 'ABC';
ALTER TABLE t1 ADD COLUMN f159 VARCHAR(3) DEFAULT 'ABC';
ALTER TABLE t1 ADD COLUMN f158 VARCHAR(3) DEFAULT 'ABC';
ALTER TABLE t1 ADD COLUMN f157 VARCHAR(3) DEFAULT 'ABC';
ALTER TABLE t1 ADD COLUMN f156 VARCHAR(3) DEFAULT 'ABC';
ALTER TABLE t1 ADD COLUMN f155 VARCHAR(3) DEFAULT 'ABC';
ALTER TABLE t1 ADD COLUMN f154 VARCHAR(3) DEFAULT 'ABC';
ALTER TABLE t1 ADD COLUMN f153 VARCHAR(3) DEFAULT 'ABC';
ALTER TABLE t1 ADD COLUMN f152 VARCHAR(3) DEFAULT 'ABC';
ALTER TABLE t1 ADD COLUMN f151 VARCHAR(3) DEFAULT 'ABC';
ALTER TABLE t1 ADD COLUMN f150 VARCHAR(3) DEFAULT 'ABC';
ALTER TABLE t1 ADD COLUMN f149 VARCHAR(3) DEFAULT 'ABC';
ALTER TABLE t1 ADD COLUMN f148 VARCHAR(3) DEFAULT 'ABC';
ALTER TABLE t1 ADD COLUMN f147 VARCHAR(3) DEFAULT 'ABC';
ALTER TABLE t1 ADD COLUMN f146 VARCHAR(3) DEFAULT 'ABC';
ALTER TABLE t1 ADD COLUMN f145 VARCHAR(3) DEFAULT 'ABC';
ALTER TABLE t1 ADD COLUMN f144 VARCHAR(3) DEFAULT 'ABC';
ALTER TABLE t1 ADD COLUMN f143 VARCHAR(3) DEFAULT 'ABC';
ALTER TABLE t1 ADD COLUMN f142 VARCHAR(3) DEFAULT 'ABC';
ALTER TABLE t1 ADD COLUMN f141 VARCHAR(3) DEFAULT 'ABC';
ALTER TABLE t1 ADD COLUMN f140 VARCHAR(3) DEFAULT 'ABC';
ALTER TABLE t1 ADD COLUMN f139 VARCHAR(3) DEFAULT 'ABC';
ALTER TABLE t1 ADD COLUMN f138 VARCHAR(3) DEFAULT 'ABC';
ALTER TABLE t1 ADD COLUMN f137 VARCHAR(3) DEFAULT 'ABC';
ALTER TABLE t1 ADD COLUMN f136 VARCHAR(3) DEFAULT 'ABC';
ALTER TABLE t1 ADD COLUMN f135 VARCHAR(3) DEFAULT 'ABC';
ALTER TABLE t1 ADD COLUMN f134 VARCHAR(3) DEFAULT 'ABC';
ALTER TABLE t1 ADD COLUMN f133 VARCHAR(3) DEFAULT 'ABC';
ALTER TABLE t1 ADD COLUMN f132 VARCHAR(3) DEFAULT 'ABC';
ALTER TABLE t1 ADD COLUMN f131 VARCHAR(3) DEFAULT 'ABC';
ALTER TABLE t1 ADD COLUMN f130 VARCHAR(3) DEFAULT 'ABC';
ALTER TABLE t1 ADD COLUMN f129 VARCHAR(3) DEFAULT 'ABC';
ALTER TABLE t1 ADD COLUMN f128 VARCHAR(3) DEFAULT 'ABC';
ALTER TABLE t1 ADD COLUMN f127 VARCHAR(3) DEFAULT 'ABC';
ALTER TABLE t1 ADD COLUMN f126 VARCHAR(3) DEFAULT 'ABC';
ALTER TABLE t1 ADD COLUMN f125 VARCHAR(3) DEFAULT 'ABC';
ALTER TABLE t1 ADD COLUMN f124 VARCHAR(3) DEFAULT 'ABC';
ALTER TABLE t1 ADD COLUMN f123 VARCHAR(3) DEFAULT 'ABC';
ALTER TABLE t1 ADD COLUMN f122 VARCHAR(3) DEFAULT 'ABC';
ALTER TABLE t1 ADD COLUMN f121 VARCHAR(3) DEFAULT 'ABC';
ALTER TABLE t1 ADD COLUMN f120 VARCHAR(3) DEFAULT 'ABC';
ALTER TABLE t1 ADD COLUMN f119 VARCHAR(3) DEFAULT 'ABC';
ALTER TABLE t1 ADD COLUMN f118 VARCHAR(3) DEFAULT 'ABC';
ALTER TABLE t1 ADD COLUMN f117 VARCHAR(3) DEFAULT 'ABC';
ALTER TABLE t1 ADD COLUMN f116 VARCHAR(3) DEFAULT 'ABC';
ALTER TABLE t1 ADD COLUMN f115 VARCHAR(3) DEFAULT 'ABC';
ALTER TABLE t1 ADD COLUMN f114 VARCHAR(3) DEFAULT 'ABC';
ALTER TABLE t1 ADD COLUMN f113 VARCHAR(3) DEFAULT 'ABC';
ALTER TABLE t1 ADD COLUMN f112 VARCHAR(3) DEFAULT 'ABC';
ALTER TABLE t1 ADD COLUMN f111 VARCHAR(3) DEFAULT 'ABC';
ALTER TABLE t1 ADD COLUMN f110 VARCHAR(3) DEFAULT 'ABC';
ALTER TABLE t1 ADD COLUMN f109 VARCHAR(3) DEFAULT 'ABC';
ALTER TABLE t1 ADD COLUMN f108 VARCHAR(3) DEFAULT 'ABC';
ALTER TABLE t1 ADD COLUMN f107 VARCHAR(3) DEFAULT 'ABC';
ALTER TABLE t1 ADD COLUMN f106 VARCHAR(3) DEFAULT 'ABC';
ALTER TABLE t1 ADD COLUMN f105 VARCHAR(3) DEFAULT 'ABC';
ALTER TABLE t1 ADD COLUMN f104 VARCHAR(3) DEFAULT 'ABC';
ALTER TABLE t1 ADD COLUMN f103 VARCHAR(3) DEFAULT 'ABC';
ALTER TABLE t1 ADD COLUMN f102 VARCHAR(3) DEFAULT 'ABC';
ALTER TABLE t1 ADD COLUMN f101 VARCHAR(3) DEFAULT 'ABC';
ALTER TABLE t1 ADD COLUMN f100 VARCHAR(3) DEFAULT 'ABC';
ALTER TABLE t1 ADD COLUMN f99 VARCHAR(3) DEFAULT 'ABC';
ALTER TABLE t1 ADD COLUMN f98 VARCHAR(3) DEFAULT 'ABC';
ALTER TABLE t1 ADD COLUMN f97 VARCHAR(3) DEFAULT 'ABC';
ALTER TABLE t1 ADD COLUMN f96 VARCHAR(3) DEFAULT 'ABC';
ALTER TABLE t1 ADD COLUMN f95 VARCHAR(3) DEFAULT 'ABC';
ALTER TABLE t1 ADD COLUMN f94 VARCHAR(3) DEFAULT 'ABC';
ALTER TABLE t1 ADD COLUMN f93 VARCHAR(3) DEFAULT 'ABC';
ALTER TABLE t1 ADD COLUMN f92 VARCHAR(3) DEFAULT 'ABC';
ALTER TABLE t1 ADD COLUMN f91 VARCHAR(3) DEFAULT 'ABC';
ALTER TABLE t1 ADD COLUMN f90 VARCHAR(3) DEFAULT 'ABC';
ALTER TABLE t1 ADD COLUMN f89 VARCHAR(3) DEFAULT 'ABC';
ALTER TABLE t1 ADD COLUMN f88 VARCHAR(3) DEFAULT 'ABC';
ALTER TABLE t1 ADD COLUMN f87 VARCHAR(3) DEFAULT 'ABC';
ALTER TABLE t1 ADD COLUMN f86 VARCHAR(3) DEFAULT 'ABC';
ALTER TABLE t1 ADD COLUMN f85 VARCHAR(3) DEFAULT 'ABC';
ALTER TABLE t1 ADD COLUMN f84 VARCHAR(3) DEFAULT 'ABC';
ALTER TABLE t1 ADD COLUMN f83 VARCHAR(3) DEFAULT 'ABC';
ALTER TABLE t1 ADD COLUMN f82 VARCHAR(3) DEFAULT 'ABC';
ALTER TABLE t1 ADD COLUMN f81 VARCHAR(3) DEFAULT 'ABC';
ALTER TABLE t1 ADD COLUMN f80 VARCHAR(3) DEFAULT 'ABC';
ALTER TABLE t1 ADD COLUMN f79 VARCHAR(3) DEFAULT 'ABC';
ALTER TABLE t1 ADD COLUMN f78 VARCHAR(3) DEFAULT 'ABC';
ALTER TABLE t1 ADD COLUMN f77 VARCHAR(3) DEFAULT 'ABC';
ALTER TABLE t1 ADD COLUMN f76 VARCHAR(3) DEFAULT 'ABC';
ALTER TABLE t1 ADD COLUMN f75 VARCHAR(3) DEFAULT 'ABC';
ALTER TABLE t1 ADD COLUMN f74 VARCHAR(3) DEFAULT 'ABC';
ALTER TABLE t1 ADD COLUMN f73 VARCHAR(3) DEFAULT 'ABC';
ALTER TABLE t1 ADD COLUMN f72 VARCHAR(3) DEFAULT 'ABC';
ALTER TABLE t1 ADD COLUMN f71 VARCHAR(3) DEFAULT 'ABC';
ALTER TABLE t1 ADD COLUMN f70 VARCHAR(3) DEFAULT 'ABC';
ALTER TABLE t1 ADD COLUMN f69 VARCHAR(3) DEFAULT 'ABC';
ALTER TABLE t1 ADD COLUMN f68 VARCHAR(3) DEFAULT 'ABC';
ALTER TABLE t1 ADD COLUMN f67 VARCHAR(3) DEFAULT 'ABC';
ALTER TABLE t1 ADD COLUMN f66 VARCHAR(3) DEFAULT 'ABC';
ALTER TABLE t1 ADD COLUMN f65 VARCHAR(3) DEFAULT 'ABC';
ALTER TABLE t1 ADD COLUMN f64 VARCHAR(3) DEFAULT 'ABC';
ALTER TABLE t1 ADD COLUMN f63 VARCHAR(3) DEFAULT 'ABC';
ALTER TABLE t1 ADD COLUMN f62 VARCHAR(3) DEFAULT 'ABC';
ALTER TABLE t1 ADD COLUMN f61 VARCHAR(3) DEFAULT 'ABC';
ALTER TABLE t1 ADD COLUMN f60 VARCHAR(3) DEFAULT 'ABC';
ALTER TABLE t1 ADD COLUMN f59 VARCHAR(3) DEFAULT 'ABC';
ALTER TABLE t1 ADD COLUMN f58 VARCHAR(3) DEFAULT 'ABC';
ALTER TABLE t1 ADD COLUMN f57 VARCHAR(3) DEFAULT 'ABC';
ALTER TABLE t1 ADD COLUMN f56 VARCHAR(3) DEFAULT 'ABC';
ALTER TABLE t1 ADD COLUMN f55 VARCHAR(3) DEFAULT 'ABC';
ALTER TABLE t1 ADD COLUMN f54 VARCHAR(3) DEFAULT 'ABC';
ALTER TABLE t1 ADD COLUMN f53 VARCHAR(3) DEFAULT 'ABC';
ALTER TABLE t1 ADD COLUMN f52 VARCHAR(3) DEFAULT 'ABC';
ALTER TABLE t1 ADD COLUMN f51 VARCHAR(3) DEFAULT 'ABC';
ALTER TABLE t1 ADD COLUMN f50 VARCHAR(3) DEFAULT 'ABC';
ALTER TABLE t1 ADD COLUMN f49 VARCHAR(3) DEFAULT 'ABC';
ALTER TABLE t1 ADD COLUMN f48 VARCHAR(3) DEFAULT 'ABC';
ALTER TABLE t1 ADD COLUMN f47 VARCHAR(3) DEFAULT 'ABC';
ALTER TABLE t1 ADD COLUMN f46 VARCHAR(3) DEFAULT 'ABC';
ALTER TABLE t1 ADD COLUMN f45 VARCHAR(3) DEFAULT 'ABC';
ALTER TABLE t1 ADD COLUMN f44 VARCHAR(3) DEFAULT 'ABC';
ALTER TABLE t1 ADD COLUMN f43 VARCHAR(3) DEFAULT 'ABC';
ALTER TABLE t1 ADD COLUMN f42 VARCHAR(3) DEFAULT 'ABC';
ALTER TABLE t1 ADD COLUMN f41 VARCHAR(3) DEFAULT 'ABC';
ALTER TABLE t1 ADD COLUMN f40 VARCHAR(3) DEFAULT 'ABC';
ALTER TABLE t1 ADD COLUMN f39 VARCHAR(3) DEFAULT 'ABC';
ALTER TABLE t1 ADD COLUMN f38 VARCHAR(3) DEFAULT 'ABC';
ALTER TABLE t1 ADD COLUMN f37 VARCHAR(3) DEFAULT 'ABC';
ALTER TABLE t1 ADD COLUMN f36 VARCHAR(3) DEFAULT 'ABC';
ALTER TABLE t1 ADD COLUMN f35 VARCHAR(3) DEFAULT 'ABC';
ALTER TABLE t1 ADD COLUMN f34 VARCHAR(3) DEFAULT 'ABC';
ALTER TABLE t1 ADD COLUMN f33 VARCHAR(3) DEFAULT 'ABC';
ALTER TABLE t1 ADD COLUMN f32 VARCHAR(3) DEFAULT 'ABC';
ALTER TABLE t1 ADD COLUMN f31 VARCHAR(3) DEFAULT 'ABC';
ALTER TABLE t1 ADD COLUMN f30 VARCHAR(3) DEFAULT 'ABC';
ALTER TABLE t1 ADD COLUMN f29 VARCHAR(3) DEFAULT 'ABC';
ALTER TABLE t1 ADD COLUMN f28 VARCHAR(3) DEFAULT 'ABC';
ALTER TABLE t1 ADD COLUMN f27 VARCHAR(3) DEFAULT 'ABC';
ALTER TABLE t1 ADD COLUMN f26 VARCHAR(3) DEFAULT 'ABC';
ALTER TABLE t1 ADD COLUMN f25 VARCHAR(3) DEFAULT 'ABC';
ALTER TABLE t1 ADD COLUMN f24 VARCHAR(3) DEFAULT 'ABC';
ALTER TABLE t1 ADD COLUMN f23 VARCHAR(3) DEFAULT 'ABC';
ALTER TABLE t1 ADD COLUMN f22 VARCHAR(3) DEFAULT 'ABC';
ALTER TABLE t1 ADD COLUMN f21 VARCHAR(3) DEFAULT 'ABC';
ALTER TABLE t1 ADD COLUMN f20 VARCHAR(3) DEFAULT 'ABC';
ALTER TABLE t1 ADD COLUMN f19 VARCHAR(3) DEFAULT 'ABC';
ALTER TABLE t1 ADD COLUMN f18 VARCHAR(3) DEFAULT 'ABC';
ALTER TABLE t1 ADD COLUMN f17 VARCHAR(3) DEFAULT 'ABC';
ALTER TABLE t1 ADD COLUMN f16 VARCHAR(3) DEFAULT 'ABC';
ALTER TABLE t1 ADD COLUMN f15 VARCHAR(3) DEFAULT 'ABC';
ALTER TABLE t1 ADD COLUMN f14 VARCHAR(3) DEFAULT 'ABC';
ALTER TABLE t1 ADD COLUMN f13 VARCHAR(3) DEFAULT 'ABC';
ALTER TABLE t1 ADD COLUMN f12 VARCHAR(3) DEFAULT 'ABC';
ALTER TABLE t1 ADD COLUMN f11 VARCHAR(3) DEFAULT 'ABC';
ALTER TABLE t1 ADD COLUMN f10 VARCHAR(3) DEFAULT 'ABC';
ALTER TABLE t1 ADD COLUMN f9 VARCHAR(3) DEFAULT 'ABC';
ALTER TABLE t1 ADD COLUMN f8 VARCHAR(3) DEFAULT 'ABC';
ALTER TABLE t1 ADD COLUMN f7 VARCHAR(3) DEFAULT 'ABC';
ALTER TABLE t1 ADD COLUMN f6 VARCHAR(3) DEFAULT 'ABC';
ALTER TABLE t1 ADD COLUMN f5 VARCHAR(3) DEFAULT 'ABC';
ALTER TABLE t1 ADD COLUMN f4 VARCHAR(3) DEFAULT 'ABC';
ALTER TABLE t1 ADD COLUMN f3 VARCHAR(3) DEFAULT 'ABC';
ALTER TABLE t1 ADD COLUMN f2 VARCHAR(3) DEFAULT 'ABC';
ALTER TABLE t1 ADD COLUMN f1 VARCHAR(3) DEFAULT 'ABC';
ALTER TABLE t1 ADD PRIMARY KEY (f1, f1017);
INSERT INTO t1 (f1) VALUES (DEFAULT);
SELECT f1 = 'ABC', f1017 = 'ABC' FROM t1;
f1 = 'ABC'	f1017 = 'ABC'
1	1
UPDATE t1 SET f1 = 'XYZ', f1017 = 'XYZ' ;
SELECT f1 = 'XYZ', f1017 = 'XYZ' FROM t1 WHERE f1 = 'XYZ' AND f1017 = 'XYZ';
f1 = 'XYZ'	f1017 = 'XYZ'
1	1
SET AUTOCOMMIT=OFF;
START TRANSACTION;
UPDATE t1 SET f2 = 'KLM' WHERE f1 = 'XYZ' AND f1017 = 'XYZ';
SET AUTOCOMMIT=OFF;
START TRANSACTION;
UPDATE t1 SET f2 = 'CDE' WHERE f1 = 'XYZ' AND f1017 = 'XYZ';
COMMIT;
COMMIT;
ERROR 40001: Deadlock found when trying to get lock; try restarting transaction
ROLLBACK;
ROLLBACK;
START TRANSACTION;
INSERT INTO t1 (f1, f1017) VALUES ('BCE','BCE');
INSERT INTO t1 (f1, f1017) VALUES ('CED','CED');
INSERT INTO t1 (f1, f1017) VALUES ('EDF','EDF');
INSERT INTO t1 (f1, f1017) VALUES ('FED','FED');
ROLLBACK;
SELECT COUNT(*) = 1 FROM t1;
COUNT(*) = 1
1
SELECT COUNT(*) = 1 FROM t1;
COUNT(*) = 1
1
DROP TABLE t1;
