connection node_1;
connection node_2;
connection node_1;
CREATE TABLE event_table(a int) engine=innodb;
CREATE EVENT event_2 ON SCHEDULE EVERY 1 SECOND
ENDS NOW() + INTERVAL 6 SECOND
ON COMPLETION NOT PRESERVE
DO
INSERT INTO event_table VALUES (1);
Warnings:
Warning	1105	Event scheduler is switched off, use SET GLOBAL event_scheduler=ON to enable it.
# node_1 event should be there
SELECT EVENT_CATALOG, EVENT_SCHEMA, EVENT_NAME, DEFINER, EVENT_BODY, EVENT_DEFINITION, EVENT_TYPE, EXECUTE_AT, INTERVAL_VALUE, INTERVAL_FIELD, STATUS,ON_COMPLETION, EVENT_COMMENT FROM INFORMATION_SCHEMA.EVENTS WHERE EVENT_NAME='event_2';
EVENT_CATALOG	EVENT_SCHEMA	EVENT_NAME	DEFINER	EVENT_BODY	EVENT_DEFINITION	EVENT_TYPE	EXECUTE_AT	INTERVAL_VALUE	INTERVAL_FIELD	STATUS	ON_COMPLETION	EVENT_COMMENT
def	test	event_2	root@localhost	SQL	INSERT INTO event_table VALUES (1)	RECURRING	NULL	1	SECOND	ENABLED	NOT PRESERVE	
connection node_2;
set global wsrep_sync_wait=15;
# node_2 event should be there
SELECT EVENT_CATALOG, EVENT_SCHEMA, EVENT_NAME, DEFINER, EVENT_BODY, EVENT_DEFINITION, EVENT_TYPE, EXECUTE_AT, INTERVAL_VALUE, INTERVAL_FIELD, STATUS,ON_COMPLETION, EVENT_COMMENT FROM INFORMATION_SCHEMA.EVENTS WHERE EVENT_NAME='event_2';
EVENT_CATALOG	EVENT_SCHEMA	EVENT_NAME	DEFINER	EVENT_BODY	EVENT_DEFINITION	EVENT_TYPE	EXECUTE_AT	INTERVAL_VALUE	INTERVAL_FIELD	STATUS	ON_COMPLETION	EVENT_COMMENT
def	test	event_2	root@localhost	SQL	INSERT INTO event_table VALUES (1)	RECURRING	NULL	1	SECOND	SLAVESIDE_DISABLED	NOT PRESERVE	
connection node_1;
SET GLOBAL event_scheduler=ON;
SHOW VARIABLES LIKE 'event_scheduler';
Variable_name	Value
event_scheduler	ON
# node_1 event should be removed
SELECT EVENT_CATALOG, EVENT_SCHEMA, EVENT_NAME, DEFINER, EVENT_BODY, EVENT_DEFINITION, EVENT_TYPE, EXECUTE_AT, INTERVAL_VALUE, INTERVAL_FIELD, STATUS,ON_COMPLETION, EVENT_COMMENT FROM INFORMATION_SCHEMA.EVENTS WHERE EVENT_NAME='event_2';
EVENT_CATALOG	EVENT_SCHEMA	EVENT_NAME	DEFINER	EVENT_BODY	EVENT_DEFINITION	EVENT_TYPE	EXECUTE_AT	INTERVAL_VALUE	INTERVAL_FIELD	STATUS	ON_COMPLETION	EVENT_COMMENT
connection node_2;
# node_2 event should be removed
SELECT EVENT_CATALOG, EVENT_SCHEMA, EVENT_NAME, DEFINER, EVENT_BODY, EVENT_DEFINITION, EVENT_TYPE, EXECUTE_AT, INTERVAL_VALUE, INTERVAL_FIELD, STATUS,ON_COMPLETION, EVENT_COMMENT FROM INFORMATION_SCHEMA.EVENTS WHERE EVENT_NAME='event_2';
EVENT_CATALOG	EVENT_SCHEMA	EVENT_NAME	DEFINER	EVENT_BODY	EVENT_DEFINITION	EVENT_TYPE	EXECUTE_AT	INTERVAL_VALUE	INTERVAL_FIELD	STATUS	ON_COMPLETION	EVENT_COMMENT
connection node_1;
SET GLOBAL event_scheduler=OFF;
DROP TABLE event_table;
connection node_1;
CREATE DATABASE IF NOT EXISTS events_test;
use events_test;
CREATE USER ev_test@localhost;
GRANT ALL ON events_test.* to ev_test@localhost;
connect  ev_con1,localhost,ev_test,,events_test;
CREATE EVENT one_event ON SCHEDULE EVERY 10 SECOND DO SELECT 123;
Warnings:
Warning	1105	Event scheduler is switched off, use SET GLOBAL event_scheduler=ON to enable it.
SHOW EVENTS;
Db	Name	Definer	Time zone	Type	Execute at	Interval value	Interval field	Starts	Ends	Status	Originator	character_set_client	collation_connection	Database Collation
events_test	one_event	ev_test@localhost	SYSTEM	RECURRING	NULL	10	#	#	NULL	ENABLED	1	latin1	latin1_swedish_ci	latin1_swedish_ci
SELECT EVENT_CATALOG, EVENT_SCHEMA, EVENT_NAME, DEFINER, EVENT_BODY, EVENT_DEFINITION, EVENT_TYPE, EXECUTE_AT, INTERVAL_VALUE, INTERVAL_FIELD, STATUS,ON_COMPLETION, EVENT_COMMENT FROM INFORMATION_SCHEMA.EVENTS ORDER BY EVENT_SCHEMA, EVENT_NAME;
EVENT_CATALOG	EVENT_SCHEMA	EVENT_NAME	DEFINER	EVENT_BODY	EVENT_DEFINITION	EVENT_TYPE	EXECUTE_AT	INTERVAL_VALUE	INTERVAL_FIELD	STATUS	ON_COMPLETION	EVENT_COMMENT
def	events_test	one_event	ev_test@localhost	SQL	SELECT 123	RECURRING	NULL	10	SECOND	ENABLED	NOT PRESERVE	
ALTER EVENT one_event ON SCHEDULE EVERY 10 SECOND;
"The definer should be ev_test@localhost"
SELECT EVENT_CATALOG, EVENT_SCHEMA, EVENT_NAME, DEFINER, EVENT_BODY, EVENT_DEFINITION, EVENT_TYPE, EXECUTE_AT, INTERVAL_VALUE, INTERVAL_FIELD, STATUS,ON_COMPLETION, EVENT_COMMENT FROM INFORMATION_SCHEMA.EVENTS WHERE EVENT_NAME='one_event';
EVENT_CATALOG	EVENT_SCHEMA	EVENT_NAME	DEFINER	EVENT_BODY	EVENT_DEFINITION	EVENT_TYPE	EXECUTE_AT	INTERVAL_VALUE	INTERVAL_FIELD	STATUS	ON_COMPLETION	EVENT_COMMENT
def	events_test	one_event	ev_test@localhost	SQL	SELECT 123	RECURRING	NULL	10	SECOND	ENABLED	NOT PRESERVE	
connection node_2;
use events_test;
"The definer should be ev_test@localhost"
SELECT EVENT_CATALOG, EVENT_SCHEMA, EVENT_NAME, DEFINER, EVENT_BODY, EVENT_DEFINITION, EVENT_TYPE, EXECUTE_AT, INTERVAL_VALUE, INTERVAL_FIELD, STATUS,ON_COMPLETION, EVENT_COMMENT FROM INFORMATION_SCHEMA.EVENTS WHERE EVENT_NAME='one_event';
EVENT_CATALOG	EVENT_SCHEMA	EVENT_NAME	DEFINER	EVENT_BODY	EVENT_DEFINITION	EVENT_TYPE	EXECUTE_AT	INTERVAL_VALUE	INTERVAL_FIELD	STATUS	ON_COMPLETION	EVENT_COMMENT
def	events_test	one_event	ev_test@localhost	SQL	SELECT 123	RECURRING	NULL	10	SECOND	SLAVESIDE_DISABLED	NOT PRESERVE	
connection node_1;
disconnect ev_con1;
use test;
DROP EVENT events_test.one_event;
DROP USER ev_test@localhost;
DROP DATABASE events_test;
connection node_1;
use test;
CREATE EVENT one_event ON SCHEDULE EVERY 10 SECOND DO SELECT 123;
Warnings:
Warning	1105	Event scheduler is switched off, use SET GLOBAL event_scheduler=ON to enable it.
# node_1 Event should be enabled
SELECT EVENT_CATALOG, EVENT_SCHEMA, EVENT_NAME, DEFINER, EVENT_BODY, EVENT_DEFINITION, EVENT_TYPE, EXECUTE_AT, INTERVAL_VALUE, INTERVAL_FIELD, STATUS,ON_COMPLETION, EVENT_COMMENT FROM INFORMATION_SCHEMA.EVENTS WHERE EVENT_NAME='one_event';
EVENT_CATALOG	EVENT_SCHEMA	EVENT_NAME	DEFINER	EVENT_BODY	EVENT_DEFINITION	EVENT_TYPE	EXECUTE_AT	INTERVAL_VALUE	INTERVAL_FIELD	STATUS	ON_COMPLETION	EVENT_COMMENT
def	test	one_event	root@localhost	SQL	SELECT 123	RECURRING	NULL	10	SECOND	ENABLED	NOT PRESERVE	
connection node_2;
use test;
# node_2 Event should be SERVERSIDE_DISABLED
SELECT EVENT_CATALOG, EVENT_SCHEMA, EVENT_NAME, DEFINER, EVENT_BODY, EVENT_DEFINITION, EVENT_TYPE, EXECUTE_AT, INTERVAL_VALUE, INTERVAL_FIELD, STATUS,ON_COMPLETION, EVENT_COMMENT FROM INFORMATION_SCHEMA.EVENTS WHERE EVENT_NAME='one_event';
EVENT_CATALOG	EVENT_SCHEMA	EVENT_NAME	DEFINER	EVENT_BODY	EVENT_DEFINITION	EVENT_TYPE	EXECUTE_AT	INTERVAL_VALUE	INTERVAL_FIELD	STATUS	ON_COMPLETION	EVENT_COMMENT
def	test	one_event	root@localhost	SQL	SELECT 123	RECURRING	NULL	10	SECOND	SLAVESIDE_DISABLED	NOT PRESERVE	
CREATE TABLE t1 (f1 INTEGER PRIMARY KEY, f2 CHAR(1)) engine=InnoDB;
INSERT INTO t1 VALUES (1, 'a'), (2, 'a'), (3, 'a');
SELECT * FROM t1;
f1	f2
1	a
2	a
3	a
Shutting down server ...
connection node_1;
UPDATE t1 SET f2 = 'b' WHERE f1 > 1;
UPDATE t1 SET f2 = 'c' WHERE f1 > 2;
SELECT * FROM t1;
f1	f2
1	a
2	b
3	c
connection node_2;
# Force SST from node_1 to node_2
Starting server ...
SELECT * FROM t1;
f1	f2
1	a
2	b
3	c
# node_2 Event should be SERVERSIDE_DISABLED
SELECT EVENT_CATALOG, EVENT_SCHEMA, EVENT_NAME, DEFINER, EVENT_BODY, EVENT_DEFINITION, EVENT_TYPE, EXECUTE_AT, INTERVAL_VALUE, INTERVAL_FIELD, STATUS,ON_COMPLETION, EVENT_COMMENT FROM INFORMATION_SCHEMA.EVENTS WHERE EVENT_NAME='one_event';
EVENT_CATALOG	EVENT_SCHEMA	EVENT_NAME	DEFINER	EVENT_BODY	EVENT_DEFINITION	EVENT_TYPE	EXECUTE_AT	INTERVAL_VALUE	INTERVAL_FIELD	STATUS	ON_COMPLETION	EVENT_COMMENT
def	test	one_event	root@localhost	SQL	SELECT 123	RECURRING	NULL	10	SECOND	SLAVESIDE_DISABLED	NOT PRESERVE	
connection node_1;
SELECT * FROM t1;
f1	f2
1	a
2	b
3	c
# node_1 Event should be ENABLED
SELECT EVENT_CATALOG, EVENT_SCHEMA, EVENT_NAME, DEFINER, EVENT_BODY, EVENT_DEFINITION, EVENT_TYPE, EXECUTE_AT, INTERVAL_VALUE, INTERVAL_FIELD, STATUS,ON_COMPLETION, EVENT_COMMENT FROM INFORMATION_SCHEMA.EVENTS WHERE EVENT_NAME='one_event';
EVENT_CATALOG	EVENT_SCHEMA	EVENT_NAME	DEFINER	EVENT_BODY	EVENT_DEFINITION	EVENT_TYPE	EXECUTE_AT	INTERVAL_VALUE	INTERVAL_FIELD	STATUS	ON_COMPLETION	EVENT_COMMENT
def	test	one_event	root@localhost	SQL	SELECT 123	RECURRING	NULL	10	SECOND	ENABLED	NOT PRESERVE	
DROP TABLE t1;
DROP EVENT one_event;
