CREATE TABLE ten (f1 INTEGER) ENGINE=InnoDB;
INSERT INTO ten VALUES (1),(2),(3),(4),(5),(6),(7),(8),(9),(10);
CREATE TABLE t1 (f1 INT PRIMARY KEY AUTO_INCREMENT, f2 VARCHAR(100), FULLTEXT (f2)) ENGINE=InnoDB;
SELECT COUNT(*) = 13 FROM INFORMATION_SCHEMA.INNODB_SYS_TABLES WHERE name LIKE 'test/%';
COUNT(*) = 13
1
INSERT INTO t1 (f2) SELECT 'foobarbaz' FROM ten AS a1, ten AS a2, ten AS a3, ten AS a4;
SELECT COUNT(f2) = 10000 FROM t1 WHERE MATCH(f2) AGAINST ('foobarbaz');
COUNT(f2) = 10000
1
UPDATE t1 SET f2 = 'abcdefjhk';
SELECT COUNT(f2) = 10000 FROM t1 WHERE MATCH(f2) AGAINST ('abcdefjhk');
COUNT(f2) = 10000
1
DROP TABLE t1;
CREATE TABLE t1 (f1 VARCHAR(100), FULLTEXT (f1)) ENGINE=InnoDB;
INSERT INTO t1 (f1) SELECT 'foobarbaz' FROM ten AS a1, ten AS a2, ten AS a3;
SELECT COUNT(f1) = 1000 FROM t1 WHERE MATCH(f1) AGAINST ('foobarbaz');
COUNT(f1) = 1000
1
UPDATE t1 SET f1 = 'abcdefjhk';
SELECT COUNT(f1) = 1000 FROM t1 WHERE MATCH(f1) AGAINST ('abcdefjhk');
COUNT(f1) = 1000
1
DROP TABLE t1;
DROP TABLE ten;
