CALL mtr.add_suppression("Aborting");
CALL mtr.add_suppression("unknown option '--galera-unknown-option'");
CREATE TABLE t1 (f1 INTEGER PRIMARY KEY, f2 CHAR(1));
INSERT INTO t1 VALUES (1, 'a'), (2, 'a'), (3, 'a');
SELECT * FROM t1;
f1	f2
1	a
2	a
3	a
Shutting down server ...
UPDATE t1 SET f2 = 'b' WHERE f1 > 1;
UPDATE t1 SET f2 = 'c' WHERE f1 > 2;
SELECT * FROM t1;
f1	f2
1	a
2	b
3	c
Starting server ...
Starting server ...
SELECT * FROM t1;
f1	f2
1	a
2	b
3	c
Shutting down server ...
UPDATE t1 SET f2 = 'd' WHERE f1 > 1;
UPDATE t1 SET f2 = 'd' WHERE f1 > 2;
SELECT * FROM t1;
f1	f2
1	a
2	d
3	d
Starting server ...
Starting server ...
SELECT * FROM t1;
f1	f2
1	a
2	d
3	d
DROP TABLE t1;
