CREATE TABLE t1 (f1 INTEGER PRIMARY KEY, f2 CHAR(1));
SET SESSION wsrep_sync_wait = 0;
CREATE PROCEDURE proc_update_insert()
BEGIN
UPDATE t1 SET f2 = 'b';
INSERT INTO t1 VALUES (4, 'd');
END|
INSERT INTO t1 VALUES (1, 'a'), (3, 'a');
SET SESSION wsrep_sync_wait = 0;
SET GLOBAL wsrep_provider_options = 'dbug=d,apply_monitor_slave_enter_sync';
INSERT INTO t1 VALUES (2, 'c');
SET SESSION wsrep_on = 0;
SET SESSION wsrep_on = 1;
SET GLOBAL wsrep_provider_options = 'dbug=';
SET GLOBAL wsrep_provider_options = 'dbug=d,after_replicate_sync';
CALL proc_update_insert;
SET SESSION wsrep_on = 0;
SET SESSION wsrep_on = 1;
SET GLOBAL wsrep_provider_options = 'dbug=';
SET GLOBAL wsrep_provider_options = 'signal=apply_monitor_slave_enter_sync';
SET GLOBAL wsrep_provider_options = 'signal=after_replicate_sync';
SET SESSION wsrep_sync_wait = default;
SELECT * FROM t1;
f1	f2
1	b
2	c
3	b
4	d
wsrep_local_replays
1
DELETE FROM t1;
CREATE PROCEDURE proc_update_insert_with_exit_handler()
BEGIN
DECLARE EXIT HANDLER FOR SQLEXCEPTION BEGIN END;
UPDATE t1 SET f2 = 'b';
INSERT INTO t1 VALUES (4, 'd');
END|
INSERT INTO t1 VALUES (1, 'a'), (3, 'a');
SET SESSION wsrep_sync_wait = 0;
SET GLOBAL wsrep_provider_options = 'dbug=d,apply_monitor_slave_enter_sync';
INSERT INTO t1 VALUES (2, 'c');
SET SESSION wsrep_on = 0;
SET SESSION wsrep_on = 1;
SET GLOBAL wsrep_provider_options = 'dbug=';
SET GLOBAL wsrep_provider_options = 'dbug=d,after_replicate_sync';
CALL proc_update_insert_with_exit_handler;
SET SESSION wsrep_on = 0;
SET SESSION wsrep_on = 1;
SET GLOBAL wsrep_provider_options = 'dbug=';
SET GLOBAL wsrep_provider_options = 'signal=apply_monitor_slave_enter_sync';
SET GLOBAL wsrep_provider_options = 'signal=after_replicate_sync';
SET SESSION wsrep_sync_wait = default;
SELECT * FROM t1;
f1	f2
1	b
2	c
3	b
4	d
wsrep_local_replays
1
DELETE FROM t1;
CREATE PROCEDURE proc_update_insert_with_continue_handler()
BEGIN
DECLARE CONTINUE HANDLER FOR SQLEXCEPTION BEGIN END;
UPDATE t1 SET f2 = 'b';
INSERT INTO t1 VALUES (4, 'd');
END|
INSERT INTO t1 VALUES (1, 'a'), (3, 'a');
SET SESSION wsrep_sync_wait = 0;
SET GLOBAL wsrep_provider_options = 'dbug=d,apply_monitor_slave_enter_sync';
INSERT INTO t1 VALUES (2, 'c');
SET SESSION wsrep_on = 0;
SET SESSION wsrep_on = 1;
SET GLOBAL wsrep_provider_options = 'dbug=';
SET GLOBAL wsrep_provider_options = 'dbug=d,after_replicate_sync';
CALL proc_update_insert_with_continue_handler;
SET SESSION wsrep_on = 0;
SET SESSION wsrep_on = 1;
SET GLOBAL wsrep_provider_options = 'dbug=';
SET GLOBAL wsrep_provider_options = 'signal=apply_monitor_slave_enter_sync';
SET GLOBAL wsrep_provider_options = 'signal=after_replicate_sync';
SET SESSION wsrep_sync_wait = default;
SELECT * FROM t1;
f1	f2
1	b
2	c
3	b
4	d
wsrep_local_replays
1
DELETE FROM t1;
CREATE PROCEDURE proc_update_insert_transaction()
BEGIN
START TRANSACTION;
UPDATE t1 SET f2 = 'b';
INSERT INTO t1 VALUES (4, 'd');
COMMIT;
END|
INSERT INTO t1 VALUES (1, 'a'), (3, 'a');
SET SESSION wsrep_sync_wait = 0;
SET GLOBAL wsrep_provider_options = 'dbug=d,apply_monitor_slave_enter_sync';
INSERT INTO t1 VALUES (2, 'c');
SET SESSION wsrep_on = 0;
SET SESSION wsrep_on = 1;
SET GLOBAL wsrep_provider_options = 'dbug=';
SET GLOBAL wsrep_provider_options = 'dbug=d,after_replicate_sync';
CALL proc_update_insert_transaction;
SET SESSION wsrep_on = 0;
SET SESSION wsrep_on = 1;
SET GLOBAL wsrep_provider_options = 'dbug=';
SET GLOBAL wsrep_provider_options = 'signal=apply_monitor_slave_enter_sync';
SET GLOBAL wsrep_provider_options = 'signal=after_replicate_sync';
Warnings:
Error	1317	Query execution was interrupted
SET SESSION wsrep_sync_wait = default;
SELECT * FROM t1;
f1	f2
1	b
2	c
3	b
4	d
wsrep_local_replays
1
DELETE FROM t1;
CREATE PROCEDURE proc_update_insert_transaction_with_continue_handler()
BEGIN
DECLARE CONTINUE HANDLER FOR SQLEXCEPTION BEGIN END;
START TRANSACTION;
UPDATE t1 SET f2 = 'b';
INSERT INTO t1 VALUES (4, 'd');
COMMIT;
END|
INSERT INTO t1 VALUES (1, 'a'), (3, 'a');
SET SESSION wsrep_sync_wait = 0;
SET GLOBAL wsrep_provider_options = 'dbug=d,apply_monitor_slave_enter_sync';
INSERT INTO t1 VALUES (2, 'c');
SET SESSION wsrep_on = 0;
SET SESSION wsrep_on = 1;
SET GLOBAL wsrep_provider_options = 'dbug=';
SET GLOBAL wsrep_provider_options = 'dbug=d,after_replicate_sync';
CALL proc_update_insert_transaction_with_continue_handler;
SET SESSION wsrep_on = 0;
SET SESSION wsrep_on = 1;
SET GLOBAL wsrep_provider_options = 'dbug=';
SET GLOBAL wsrep_provider_options = 'signal=apply_monitor_slave_enter_sync';
SET GLOBAL wsrep_provider_options = 'signal=after_replicate_sync';
Warnings:
Error	1317	Query execution was interrupted
SET SESSION wsrep_sync_wait = default;
SELECT * FROM t1;
f1	f2
1	b
2	c
3	b
4	d
wsrep_local_replays
1
DELETE FROM t1;
CREATE PROCEDURE proc_update_insert_transaction_with_exit_handler()
BEGIN
DECLARE EXIT HANDLER FOR SQLEXCEPTION BEGIN END;
START TRANSACTION;
UPDATE t1 SET f2 = 'b';
INSERT INTO t1 VALUES (4, 'd');
COMMIT;
END|
INSERT INTO t1 VALUES (1, 'a'), (3, 'a');
SET SESSION wsrep_sync_wait = 0;
SET GLOBAL wsrep_provider_options = 'dbug=d,apply_monitor_slave_enter_sync';
INSERT INTO t1 VALUES (2, 'c');
SET SESSION wsrep_on = 0;
SET SESSION wsrep_on = 1;
SET GLOBAL wsrep_provider_options = 'dbug=';
SET GLOBAL wsrep_provider_options = 'dbug=d,after_replicate_sync';
CALL proc_update_insert_transaction_with_exit_handler;
SET SESSION wsrep_on = 0;
SET SESSION wsrep_on = 1;
SET GLOBAL wsrep_provider_options = 'dbug=';
SET GLOBAL wsrep_provider_options = 'signal=apply_monitor_slave_enter_sync';
SET GLOBAL wsrep_provider_options = 'signal=after_replicate_sync';
Warnings:
Error	1317	Query execution was interrupted
SET SESSION wsrep_sync_wait = default;
SELECT * FROM t1;
f1	f2
1	b
2	c
3	b
4	d
wsrep_local_replays
1
DELETE FROM t1;
CREATE PROCEDURE proc_insert_insert_conflict()
BEGIN
INSERT INTO t1 VALUES (2, 'd');
INSERT INTO t1 VALUES (4, 'd');
END|
INSERT INTO t1 VALUES (1, 'a'), (3, 'a');
SET SESSION wsrep_sync_wait = 0;
SET GLOBAL wsrep_provider_options = 'dbug=d,apply_monitor_slave_enter_sync';
INSERT INTO t1 VALUES (2, 'c');
SET SESSION wsrep_on = 0;
SET SESSION wsrep_on = 1;
SET GLOBAL wsrep_provider_options = 'dbug=';
SET GLOBAL wsrep_provider_options = 'dbug=d,after_replicate_sync';
CALL proc_insert_insert_conflict;
SET SESSION wsrep_on = 0;
SET SESSION wsrep_on = 1;
SET GLOBAL wsrep_provider_options = 'dbug=';
SET GLOBAL wsrep_provider_options = 'signal=apply_monitor_slave_enter_sync';
SET GLOBAL wsrep_provider_options = 'signal=after_replicate_sync';
Got one of the listed errors
SET SESSION wsrep_sync_wait = default;
SELECT * FROM t1;
f1	f2
1	a
2	c
3	a
wsrep_local_replays
1
DELETE FROM t1;
CREATE PROCEDURE proc_insert_insert_conflict_with_exit_handler()
BEGIN
DECLARE EXIT HANDLER FOR SQLEXCEPTION SELECT "Conflict exit handler";
INSERT INTO t1 VALUES (2, 'd');
INSERT INTO t1 VALUES (4, 'd');
END|
INSERT INTO t1 VALUES (1, 'a'), (3, 'a');
SET SESSION wsrep_sync_wait = 0;
SET GLOBAL wsrep_provider_options = 'dbug=d,apply_monitor_slave_enter_sync';
INSERT INTO t1 VALUES (2, 'c');
SET SESSION wsrep_on = 0;
SET SESSION wsrep_on = 1;
SET GLOBAL wsrep_provider_options = 'dbug=';
SET GLOBAL wsrep_provider_options = 'dbug=d,after_replicate_sync';
CALL proc_insert_insert_conflict_with_exit_handler;
SET SESSION wsrep_on = 0;
SET SESSION wsrep_on = 1;
SET GLOBAL wsrep_provider_options = 'dbug=';
SET GLOBAL wsrep_provider_options = 'signal=apply_monitor_slave_enter_sync';
SET GLOBAL wsrep_provider_options = 'signal=after_replicate_sync';
Conflict exit handler
Conflict exit handler
SET SESSION wsrep_sync_wait = default;
SELECT * FROM t1;
f1	f2
1	a
2	c
3	a
wsrep_local_replays
1
DELETE FROM t1;
CREATE PROCEDURE proc_insert_insert_conflict_with_continue_handler()
BEGIN
DECLARE CONTINUE HANDLER FOR SQLEXCEPTION SELECT "Conflict continue handler";
INSERT INTO t1 VALUES (2, 'd');
INSERT INTO t1 VALUES (4, 'd');
END|
INSERT INTO t1 VALUES (1, 'a'), (3, 'a');
SET SESSION wsrep_sync_wait = 0;
SET GLOBAL wsrep_provider_options = 'dbug=d,apply_monitor_slave_enter_sync';
INSERT INTO t1 VALUES (2, 'c');
SET SESSION wsrep_on = 0;
SET SESSION wsrep_on = 1;
SET GLOBAL wsrep_provider_options = 'dbug=';
SET GLOBAL wsrep_provider_options = 'dbug=d,after_replicate_sync';
CALL proc_insert_insert_conflict_with_continue_handler;
SET SESSION wsrep_on = 0;
SET SESSION wsrep_on = 1;
SET GLOBAL wsrep_provider_options = 'dbug=';
SET GLOBAL wsrep_provider_options = 'signal=apply_monitor_slave_enter_sync';
SET GLOBAL wsrep_provider_options = 'signal=after_replicate_sync';
Conflict continue handler
Conflict continue handler
SET SESSION wsrep_sync_wait = default;
SELECT * FROM t1;
f1	f2
1	a
2	c
3	a
4	d
wsrep_local_replays
1
DELETE FROM t1;
DROP PROCEDURE proc_update_insert;
DROP PROCEDURE proc_update_insert_with_continue_handler;
DROP PROCEDURE proc_update_insert_with_exit_handler;
DROP PROCEDURE proc_update_insert_transaction;
DROP PROCEDURE proc_update_insert_transaction_with_continue_handler;
DROP PROCEDURE proc_update_insert_transaction_with_exit_handler;
DROP PROCEDURE proc_insert_insert_conflict;
DROP PROCEDURE proc_insert_insert_conflict_with_exit_handler;
DROP PROCEDURE proc_insert_insert_conflict_with_continue_handler;
DROP TABLE t1;
