#
# MDEV#4953 Galera: DELETE from a partitioned table is not replicated
#
USE test;
CREATE TABLE t1 (pk INT PRIMARY KEY, i INT) ENGINE=INNODB PARTITION BY HASH(pk) PARTITIONS 2;
INSERT INTO t1 VALUES (1,100), (2,200);
SELECT * FROM t1;
pk	i
2	200
1	100
DELETE FROM t1;
SELECT * FROM t1;
pk	i

# On node_1
SELECT * FROM t1;
pk	i

# On node_2
SELECT * FROM t1;
pk	i
DROP TABLE t1;
#
# MDEV-5146: Bulk loads into partitioned table not working
#
# Case 1: wsrep_load_data_splitting = ON & LOAD DATA with 20002
# entries.
SET GLOBAL wsrep_load_data_splitting = ON;
CREATE TABLE t1 (pk INT PRIMARY KEY)
ENGINE=INNODB PARTITION BY HASH(pk) PARTITIONS 2;
SELECT COUNT(*) = 20002 FROM t1;
COUNT(*) = 20002
1
wsrep_last_committed_diff
1
DROP TABLE t1;
# Case 2: wsrep_load_data_splitting = ON & LOAD DATA with 101 entries.
SET GLOBAL wsrep_load_data_splitting = ON;
CREATE TABLE t1 (pk INT PRIMARY KEY)
ENGINE=INNODB PARTITION BY HASH(pk) PARTITIONS 2;
SELECT COUNT(*) = 101 FROM t1;
COUNT(*) = 101
1
wsrep_last_committed_diff
1
DROP TABLE t1;
# Case 3: wsrep_load_data_splitting = OFF & LOAD DATA with 20002
# entries.
SET GLOBAL wsrep_load_data_splitting = OFF;
CREATE TABLE t1 (pk INT PRIMARY KEY)
ENGINE=INNODB PARTITION BY HASH(pk) PARTITIONS 2;
SELECT COUNT(*) = 20002 FROM t1;
COUNT(*) = 20002
1
wsrep_last_committed_diff
1
DROP TABLE t1;
SET GLOBAL wsrep_load_data_splitting = 1;;
# End of test
