create sequence s;
call mtr.add_suppression("ha_myisam");
call mtr.add_suppression("Checking table");
check table s;
Table	Op	Msg_type	Msg_text
test.s	check	error	Size of datafile is:         4         Should be: 58
test.s	check	error	Corrupt
drop table s;
create sequence s;
insert into s values (3,1,9223372036854775806,1,1,1000,0,0);
select * from s;
next_not_cached_value	minimum_value	maximum_value	start_value	increment	cache_size	cycle_option	cycle_count
3	1	9223372036854775806	1	1	1000	0	0
check table s;
Table	Op	Msg_type	Msg_text
test.s	check	status	OK
select nextval(s);
nextval(s)
3
drop sequence s;
create sequence s;
alter table s sequence=0;
insert into s values (3,1,9223372036854775806,1,1,1000,0,0);
select * from s;
next_not_cached_value	minimum_value	maximum_value	start_value	increment	cache_size	cycle_option	cycle_count
1	1	9223372036854775806	1	1	1000	0	0
3	1	9223372036854775806	1	1	1000	0	0
alter table s sequence=1;
check table s;
Table	Op	Msg_type	Msg_text
test.s	check	Warning	More than one row in the table
test.s	check	status	OK
select * from s;
next_not_cached_value	minimum_value	maximum_value	start_value	increment	cache_size	cycle_option	cycle_count
1	1	9223372036854775806	1	1	1000	0	0
check table s;
Table	Op	Msg_type	Msg_text
test.s	check	Warning	More than one row in the table
test.s	check	status	OK
select nextval(s);
nextval(s)
1
check table s;
Table	Op	Msg_type	Msg_text
test.s	check	Warning	More than one row in the table
test.s	check	status	OK
drop sequence s;
create sequence s;
alter table s sequence=0 engine=innodb;
delete from s;
insert into s values (2,500,200,1,1,1000,0,0);
select * from s;
next_not_cached_value	minimum_value	maximum_value	start_value	increment	cache_size	cycle_option	cycle_count
2	500	200	1	1	1000	0	0
alter table s sequence=1;
check table s;
Table	Op	Msg_type	Msg_text
test.s	check	Error	Sequence 'test.s' has out of range value for options
test.s	check	status	Operation failed
select * from s;
next_not_cached_value	minimum_value	maximum_value	start_value	increment	cache_size	cycle_option	cycle_count
2	500	200	1	1	1000	0	0
select nextval(s);
nextval(s)
2
check table s;
Table	Op	Msg_type	Msg_text
test.s	check	Error	Sequence 'test.s' has out of range value for options
test.s	check	status	Operation failed
repair table s;
Table	Op	Msg_type	Msg_text
test.s	repair	Error	Sequence 'test.s' has out of range value for options
test.s	repair	status	Table is already up to date
drop sequence s;
create sequence s minvalue 13 maxvalue 15 increment by 4;
check table s;
Table	Op	Msg_type	Msg_text
test.s	check	status	OK
select nextval(s);
nextval(s)
13
check table s;
Table	Op	Msg_type	Msg_text
test.s	check	Warning	Sequence 'test.s' has run out
test.s	check	status	OK
alter sequence s cycle;
check table s;
Table	Op	Msg_type	Msg_text
test.s	check	status	OK
alter sequence s nocycle;
check table s;
Table	Op	Msg_type	Msg_text
test.s	check	Warning	Sequence 'test.s' has run out
test.s	check	status	OK
alter sequence s increment by 1;
check table s;
Table	Op	Msg_type	Msg_text
test.s	check	Warning	Sequence 'test.s' has run out
test.s	check	status	OK
alter sequence s increment by 4;
select nextval(s);
ERROR HY000: Sequence 'test.s' has run out
alter sequence s cycle;
check table s;
Table	Op	Msg_type	Msg_text
test.s	check	status	OK
alter sequence s maxvalue 23 nocycle;
check table s;
Table	Op	Msg_type	Msg_text
test.s	check	status	OK
alter sequence s maxvalue 15;
check table s;
Table	Op	Msg_type	Msg_text
test.s	check	Warning	Sequence 'test.s' has run out
test.s	check	status	OK
drop sequence s;
create sequence s minvalue 13 maxvalue 20 increment by 1;
select nextval(s);
nextval(s)
13
check table s;
Table	Op	Msg_type	Msg_text
test.s	check	status	OK
select nextval(s);
nextval(s)
14
drop sequence s;
create sequence s minvalue 13 maxvalue 20 increment by 1;
select nextval(s);
nextval(s)
13
alter table s sequence=0;
alter table s sequence=1;
check table s;
Table	Op	Msg_type	Msg_text
test.s	check	Warning	Sequence 'test.s' has run out
test.s	check	status	OK
select nextval(s);
ERROR HY000: Sequence 'test.s' has run out
drop sequence s;
CREATE TABLE `s` (
# `next_not_cached_value` bigint(21) NOT NULL,
`minimum_value` bigint(21) NOT NULL,
`maximum_value` bigint(21) NOT NULL,
`start_value` bigint(21) NOT NULL COMMENT 'start value when sequences is created or value if RESTART is used',
`increment` bigint(21) NOT NULL COMMENT 'increment value',
`cache_size` bigint(21) unsigned NOT NULL,
`cycle_option` tinyint(1) unsigned NOT NULL COMMENT '0 if no cycles are allowed, 1 if the sequence should begin a new cycle when maximum_value is passed',
`cycle_count` bigint(21) NOT NULL COMMENT 'How many cycles have been done'
) ENGINE=innodb;
alter table s sequence=1;
ERROR HY000: Sequence 'test.s' table structure is invalid (Wrong number of columns)
drop table s;
create sequence s;
alter table s drop column next_not_cached_value;
ERROR HY000: Sequence 'test.s' table structure is invalid (Wrong number of columns)
drop sequence s;
