DROP TABLE IF EXISTS diaries;
CREATE TABLE diaries (
id INT PRIMARY KEY AUTO_INCREMENT,
title VARCHAR(40)
) DEFAULT CHARSET UTF8;
SHOW CREATE TABLE diaries;
Table	Create Table
diaries	CREATE TABLE `diaries` (
  `id` int(11) NOT NULL AUTO_INCREMENT,
  `title` varchar(40) DEFAULT NULL,
  PRIMARY KEY (`id`)
) ENGINE=Mroonga DEFAULT CHARSET=utf8mb3
INSERT INTO diaries (title) VALUES ("survey");
SELECT * FROM diaries;
id	title
1	survey
ALTER TABLE diaries ADD COLUMN body VARCHAR(140);
UPDATE diaries SET body = "will start groonga!";
SELECT * FROM diaries;
id	title	body
1	survey	will start groonga!
INSERT INTO diaries (title, body) values ("groonga (1)", "starting groonga...");
INSERT INTO diaries (title, body) values ("groonga (2)", "started groonga.");
SELECT * FROM diaries;
id	title	body
1	survey	will start groonga!
2	groonga (1)	starting groonga...
3	groonga (2)	started groonga.
SHOW CREATE TABLE diaries;
Table	Create Table
diaries	CREATE TABLE `diaries` (
  `id` int(11) NOT NULL AUTO_INCREMENT,
  `title` varchar(40) DEFAULT NULL,
  `body` varchar(140) DEFAULT NULL,
  PRIMARY KEY (`id`)
) ENGINE=Mroonga AUTO_INCREMENT=4 DEFAULT CHARSET=utf8mb3
DROP TABLE diaries;
