drop table if exists diaries;
create table diaries (
id int primary key auto_increment,
body text,
fulltext index body_index (body)
) default charset utf8;
show create table diaries;
Table	Create Table
diaries	CREATE TABLE `diaries` (
  `id` int(11) NOT NULL AUTO_INCREMENT,
  `body` text DEFAULT NULL,
  PRIMARY KEY (`id`),
  FULLTEXT KEY `body_index` (`body`)
) ENGINE=Mroonga DEFAULT CHARSET=utf8
insert into diaries (body) values ("will start groonga!");
set mroonga_dry_write=true;
update diaries set body = "starting groonga..." where id = 1;
select * from diaries;
id	body
1	will start groonga!
set mroonga_dry_write=false;
update diaries set body = "starting groonga..." where id = 1;
select * from diaries;
id	body
1	starting groonga...
drop table diaries;
