DROP TABLE IF EXISTS t2, t1;
CREATE TABLE t1 (
id INT PRIMARY KEY,
value VARCHAR(50)
) ENGINE=InnoDB;
CREATE TABLE t2 (
id INT PRIMARY KEY,
t1_id INT,
t2_value VARCHAR(50),
FOREIGN KEY (t1_id) REFERENCES t1(id) ON DELETE SET NULL
) ENGINE=InnoDB;
CREATE TRIGGER tr_t2_before_update BEFORE UPDATE ON t2
FOR EACH ROW SET NEW.t2_value = 'Updated by Trigger';
INSERT INTO t1 (id, value) VALUES (1, 'parent_row');
INSERT INTO t2 (id, t1_id, t2_value) VALUES (1, 1, 'child_row');
SELECT * FROM t1;
id	value
1	parent_row
SELECT * FROM t2;
id	t1_id	t2_value
1	1	child_row
DELETE FROM t1 WHERE id = 1;
SELECT * FROM t1;
id	value
SELECT * FROM t2;
id	t1_id	t2_value
1	NULL	Updated by Trigger
DROP TABLE t2, t1;
