SET GLOBAL innodb_log_archive=OFF;
SET GLOBAL innodb_log_file_size=4194304;
SHOW VARIABLES LIKE 'innodb_log_file_size';
Variable_name	Value
innodb_log_file_size	4194304
SELECT global_value FROM information_schema.system_variables
WHERE variable_name = 'innodb_log_file_size';
global_value
4194304
CREATE TABLE t (
a INT PRIMARY KEY AUTO_INCREMENT,
b CHAR(255) NOT NULL)
ENGINE=INNODB;
INSERT INTO t SELECT NULL, REPEAT('a', 255) FROM seq_1_to_20000;
# restart: --innodb-log-file-size=4194304 --skip-innodb-log-archive
SELECT COUNT(*) FROM t;
COUNT(*)
20000
SHOW VARIABLES LIKE 'innodb_log_file_size';
Variable_name	Value
innodb_log_file_size	4194304
FOUND 1 /InnoDB: Resized log to 4\.000MiB/ in mysqld.1.err
SET @save=@@global.innodb_log_file_buffering;
SET GLOBAL innodb_log_file_buffering=OFF;
SET GLOBAL innodb_log_file_buffering=ON;
SET GLOBAL innodb_log_file_buffering=@save;
SET GLOBAL innodb_log_file_mmap=OFF;
Got one of the listed errors
connect con1,localhost,root;
SET GLOBAL innodb_log_file_size=7340032;
connection default;
SET GLOBAL innodb_log_archive=ON;
SET GLOBAL innodb_log_archive=OFF;
KILL QUERY @id;
connection con1;
SET GLOBAL innodb_log_archive=ON, innodb_log_file_size=10485760;
SELECT @@GLOBAL.innodb_log_file_size!=10485760;
@@GLOBAL.innodb_log_file_size!=10485760
1
SET GLOBAL innodb_log_archive=OFF;
connection default;
SET GLOBAL innodb_log_file_size=5242880;
connection con1;
UPDATE t SET b='' WHERE a<10;
connection default;
SHOW VARIABLES LIKE 'innodb_log_file_size';
Variable_name	Value
innodb_log_file_size	5242880
SELECT global_value FROM information_schema.system_variables
WHERE variable_name = 'innodb_log_file_size';
global_value
5242880
connection con1;
disconnect con1;
connection default;
# restart
SET @save_archive=@@GLOBAL.innodb_log_archive;
SET GLOBAL innodb_log_archive=OFF;
SELECT * FROM t WHERE a<10;
a	b
1	
2	
3	
4	
5	
6	
7	
8	
9	
SELECT COUNT(*),LENGTH(b) FROM t GROUP BY b;
COUNT(*)	LENGTH(b)
9	0
19991	255
SHOW VARIABLES LIKE 'innodb_log_file_size';
Variable_name	Value
innodb_log_file_size	5242880
SET GLOBAL innodb_log_file_size=6291456;
SHOW VARIABLES LIKE 'innodb_log_file_size';
Variable_name	Value
innodb_log_file_size	6291456
SET GLOBAL innodb_log_file_size=5242880;
SHOW VARIABLES LIKE 'innodb_log_file_size';
Variable_name	Value
innodb_log_file_size	5242880
FOUND 1 /InnoDB: Resized log to 6\.000MiB/ in mysqld.1.err
SET GLOBAL innodb_log_archive=@save_archive;
DROP TABLE t;
