CREATE TABLE t1(a INT PRIMARY KEY) ENGINE=InnoDB;
BEGIN;
INSERT INTO t1 VALUES (42);
# Kill and restart: --innodb-log-file-size=6M
SELECT * FROM t1;
a
INSERT INTO t1 VALUES (42);
BEGIN;
DELETE FROM t1;
# Kill and restart: --innodb-log-files-in-group=3 --innodb-log-file-size=5M
SELECT * FROM t1;
a
42
INSERT INTO t1 VALUES (123);
BEGIN;
DELETE FROM t1;
# Kill the server
--innodb-force-recovery-crash=1
--innodb-force-recovery-crash=3
--innodb-force-recovery-crash=4
--innodb-force-recovery-crash=5
--innodb-force-recovery-crash=6
--innodb-force-recovery-crash=7
--innodb-force-recovery-crash=8
--innodb-force-recovery-crash=9
--innodb-force-recovery-crash=10
SELECT * FROM t1;
a
42
123
DROP TABLE t1;
