drop table if exists t3, t2, t1;
CREATE TABLE t1 (
x INT PRIMARY KEY
) ENGINE=InnoDB;
CREATE TABLE t2 (
x INT PRIMARY KEY,
y INT,
FOREIGN KEY (x) REFERENCES t1(x) ON UPDATE CASCADE
) ENGINE=InnoDB;
CREATE TABLE t3 (
old_x INT,
new_x INT
) ENGINE=InnoDB;
CREATE TRIGGER tr AFTER UPDATE ON t2
FOR EACH ROW
INSERT INTO t3 (old_x, new_x) VALUES (OLD.x, NEW.x);
INSERT INTO t1 (x) VALUES (1);
INSERT INTO t2 (x, y) VALUES (1, 20);
UPDATE t1 SET x = 2;
SELECT * FROM t3;
old_x	new_x
1	2
UPDATE t2 SET y = 50;
SELECT * FROM t3;
old_x	new_x
1	2
2	2
SELECT * FROM t1;
x
2
SELECT * FROM t2;
x	y
2	50
DROP TABLE t3, t2, t1;
create table t1(x int primary key) ENGINE=InnoDB;
create table t2(x int primary key,
foreign key(x) references t1(x) on update CASCADE) ENGINE=InnoDB;
CREATE TRIGGER tr_t2 AFTER UPDATE ON t2
FOR EACH ROW SET @counter=@counter+1;
insert into t1 VALUES (1);
insert into t2 VALUES (1);
SET @counter=0;
update t1 set x = 2;
select * from t1;
x
2
select * from t2;
x
2
select @counter;
@counter
1
DROP TABLE t2, t1;
CREATE TABLE t1 (
x INT PRIMARY KEY
) ENGINE=InnoDB;
CREATE TABLE t2 (
x INT PRIMARY KEY,
y INT,
FOREIGN KEY(x) REFERENCES t1(x) ON UPDATE CASCADE
) ENGINE=InnoDB;
CREATE TRIGGER tr BEFORE UPDATE ON t2
FOR EACH ROW SET NEW.y = 50;
INSERT INTO t1 (x) VALUES (1);
INSERT INTO t2 (x, y) VALUES (1,2);
UPDATE t1 SET x = 2;
SELECT * FROM t1;
x
2
SELECT * FROM t2;
x	y
2	50
DROP TABLE t2, t1;
CREATE TABLE t1 (
x INT PRIMARY KEY
) ENGINE=InnoDB;
CREATE TABLE t2 (
x INT PRIMARY KEY,
y INT,
FOREIGN KEY(x) REFERENCES t1(x) ON UPDATE CASCADE
) ENGINE=InnoDB;
CREATE TRIGGER tr BEFORE UPDATE ON t2
FOR EACH ROW SET NEW.y = 50;
INSERT INTO t1 (x) VALUES (1);
INSERT INTO t2 (x, y) VALUES (1,2);
UPDATE t1 SET x = 2;
SELECT * FROM t1;
x
2
SELECT * FROM t2;
x	y
2	50
DROP TABLE t2, t1;
create table t1(x int auto_increment primary key, y int, unique key(y)) ENGINE=InnoDB;
create table t2(a int primary key, x int, z varchar(20),
foreign key(x) references t1(y) on update cascade) ENGINE=InnoDB;
create table t3(id int auto_increment primary key, action_x int, action_z varchar(20), note varchar(50)) ENGINE=InnoDB;
create trigger tr_t2 before update on t2
for each row
insert into t3(action_x, action_z, note) values (OLD.x, OLD.z, 'Update t2 — OLD'),
(NEW.x, NEW.z, 'Update t2 — NEW');
insert into t1 values (1, 10);
insert into t2 values (1, 10, 'str');
update t1 set y=20 where x=1;
select * from t1;
x	y
1	20
select * from t2;
a	x	z
1	20	str
select * from t3;
id	action_x	action_z	note
1	10	str	Update t2 — OLD
2	20	str	Update t2 — NEW
drop table t3, t2, t1;
CREATE TABLE t1 (
id INT PRIMARY KEY,
value VARCHAR(50)
) ENGINE=InnoDB;
CREATE TABLE t2 (
id INT PRIMARY KEY,
t1_id INT,
t2_value VARCHAR(50),
FOREIGN KEY (t1_id) REFERENCES t1(id) ON UPDATE SET NULL
) ENGINE=InnoDB;
CREATE TRIGGER tr_t2_before_update BEFORE UPDATE ON t2
FOR EACH ROW SET NEW.t2_value = 'Updated by Trigger';
INSERT INTO t1 (id, value) VALUES (1, 'parent_row');
INSERT INTO t2 (id, t1_id, t2_value) VALUES (1, 1, 'child_row');
SELECT * FROM t1;
id	value
1	parent_row
SELECT * FROM t2;
id	t1_id	t2_value
1	1	child_row
UPDATE t1 SET id = 2 WHERE id = 1;
SELECT * FROM t1;
id	value
2	parent_row
SELECT * FROM t2;
id	t1_id	t2_value
1	NULL	Updated by Trigger
DROP TABLE t2, t1;
create table t1(x int auto_increment primary key, y int, unique key(y)) ENGINE=InnoDB;
create table t2(a int primary key, x int,
t int,
z varchar(20) as (CONCAT("test", t)),
y varchar(20) as (CONCAT("test2", t)),
y_another varchar(20) as (CONCAT("test3", x)),
unique(z),
unique(y),
unique(y_another),
foreign key(x) references t1(y) on update cascade) ENGINE=InnoDB;
create trigger tr before update ON t2
for each row set new.t = 50;
insert into t1 (x,y) values (1,1);
insert into t2 (a,x,t) values (1,1,1);
select * from t2;
a	x	t	z	y	y_another
1	1	1	test1	test21	test31
update t1 set y = 2;
SELECT * FROM t2 FORCE INDEX (z) where z = 'test50';
a	x	t	z	y	y_another
1	2	50	test50	test250	test32
SELECT * FROM t2 FORCE INDEX (y) where y = 'test250';
a	x	t	z	y	y_another
1	2	50	test50	test250	test32
SELECT * FROM t2 FORCE INDEX (y_another) where y_another = 'test32';
a	x	t	z	y	y_another
1	2	50	test50	test250	test32
select * from t2;
a	x	t	z	y	y_another
1	2	50	test50	test250	test32
drop table t2,t1;
CREATE TABLE t1 (
x INT PRIMARY KEY
) ENGINE=InnoDB;
CREATE TABLE t2 (
x INT PRIMARY KEY,
y INT,
FOREIGN KEY(x) REFERENCES t1(x) ON DELETE CASCADE
) ENGINE=InnoDB;
CREATE TRIGGER tr BEFORE DELETE ON t2
FOR EACH ROW SET @deleted_value = OLD.y;
INSERT INTO t1 (x) VALUES (1);
INSERT INTO t2 (x, y) VALUES (1, 100);
DELETE FROM t1 WHERE x = 1;
SELECT @deleted_value AS deleted_value;
deleted_value
100
SELECT * FROM t2;
x	y
DROP TABLE t2, t1;
CREATE TABLE t1 (
x INT PRIMARY KEY
) ENGINE=InnoDB;
CREATE TABLE t2 (
x INT PRIMARY KEY,
y INT,
FOREIGN KEY(x) REFERENCES t1(x) ON DELETE CASCADE
) ENGINE=InnoDB;
CREATE TABLE t3 (
id INT AUTO_INCREMENT PRIMARY KEY,
log_event VARCHAR(255)
) ENGINE=InnoDB;
CREATE TRIGGER tr_before BEFORE DELETE ON t2
FOR EACH ROW 
SET @deleted_value = OLD.y;
CREATE TRIGGER tr_after AFTER DELETE ON t2
FOR EACH ROW
INSERT INTO t3 (log_event) VALUES ('AFTER DELETE TRIGGER EXECUTED');
INSERT INTO t1 (x) VALUES (1), (2);
INSERT INTO t2 (x, y) VALUES (1, 100), (2, 200);
DELETE FROM t1 WHERE x = 1;
SELECT @deleted_value AS before_deleted_value;
before_deleted_value
100
SELECT * FROM t3;
id	log_event
1	AFTER DELETE TRIGGER EXECUTED
SELECT * FROM t2;
x	y
2	200
SELECT * FROM t1;
x
2
DROP TABLE t3, t2, t1;
CREATE TABLE t1 (
id INT PRIMARY KEY,
value VARCHAR(50)
) ENGINE=InnoDB;
CREATE TABLE t2 (
id INT PRIMARY KEY,
t1_id INT,
t2_value VARCHAR(50),
FOREIGN KEY (t1_id) REFERENCES t1(id) ON DELETE SET NULL
) ENGINE=InnoDB;
CREATE TRIGGER tr_t2_before_update BEFORE UPDATE ON t2
FOR EACH ROW SET NEW.t2_value = 'Updated by Trigger';
INSERT INTO t1 (id, value) VALUES (1, 'parent_row');
INSERT INTO t2 (id, t1_id, t2_value) VALUES (1, 1, 'child_row');
SELECT * FROM t1;
id	value
1	parent_row
SELECT * FROM t2;
id	t1_id	t2_value
1	1	child_row
DELETE FROM t1 WHERE id = 1;
SELECT * FROM t1;
id	value
SELECT * FROM t2;
id	t1_id	t2_value
1	NULL	Updated by Trigger
DROP TABLE t2, t1;
CREATE TABLE t1 (
id INT PRIMARY KEY
) ENGINE=InnoDB;
CREATE TABLE t2 (
id INT PRIMARY KEY,
FOREIGN KEY (id) REFERENCES t1(id) ON UPDATE CASCADE
) ENGINE=InnoDB;
CREATE TABLE t3 (
id INT PRIMARY KEY,
FOREIGN KEY (id) REFERENCES t2(id) ON UPDATE CASCADE
) ENGINE=InnoDB;
CREATE TABLE update_log (
log_id INT AUTO_INCREMENT PRIMARY KEY,
table_name VARCHAR(50),
old_value INT,
new_value INT
) ENGINE=InnoDB;
CREATE TRIGGER tr_t2_after_update AFTER UPDATE ON t2
FOR EACH ROW
INSERT INTO update_log(table_name, old_value, new_value)
VALUES ('t2', OLD.id, NEW.id);
CREATE TRIGGER tr_t3_after_update AFTER UPDATE ON t3
FOR EACH ROW
INSERT INTO update_log(table_name, old_value, new_value)
VALUES ('t3', OLD.id, NEW.id);
INSERT INTO t1 (id) VALUES (1);
INSERT INTO t2 (id) VALUES (1);
INSERT INTO t3 (id) VALUES (1);
UPDATE t1 SET id = 2;
SELECT * FROM t1;
id
2
SELECT * FROM t2;
id
2
SELECT * FROM t3;
id
2
SELECT * FROM update_log;
log_id	table_name	old_value	new_value
1	t3	1	2
2	t2	1	2
DROP TABLE update_log, t3, t2, t1;
CREATE TABLE t1 (
id BIT(8) PRIMARY KEY,
flag BIT(1) NOT NULL DEFAULT b'0'
) ENGINE=InnoDB;
CREATE TABLE t2 (
id BIT(8) PRIMARY KEY,
t1_id BIT(8),
value INT,
FOREIGN KEY (t1_id) REFERENCES t1(id) ON UPDATE CASCADE
) ENGINE=InnoDB;
CREATE TABLE trigger_log (
log_id INT AUTO_INCREMENT PRIMARY KEY,
log_message VARCHAR(255)
) ENGINE=InnoDB;
CREATE TRIGGER tr_t2_after_update AFTER UPDATE ON t2
FOR EACH ROW
INSERT INTO trigger_log(log_message)
VALUES (CONCAT('t2 updated: ', HEX(OLD.t1_id), ' -> ', HEX(NEW.t1_id)));
INSERT INTO t1 (id, flag) VALUES (b'00000001', b'1');
INSERT INTO t2 (id, t1_id, value) VALUES (b'00000001', b'00000001', 100);
UPDATE t1 SET id = b'00000010' WHERE id = b'00000001';
SELECT BIN(id), BIN(t1_id), value FROM t2;
BIN(id)	BIN(t1_id)	value
1	10	100
SELECT * FROM trigger_log;
log_id	log_message
1	t2 updated: 1 -> 2
DROP TABLE trigger_log, t2, t1;
CREATE TABLE t1 (
id INT PRIMARY KEY,
blob_data BLOB
) ENGINE=InnoDB;
CREATE TABLE t2 (
id INT PRIMARY KEY,
t1_id INT,
copied_blob_data BLOB,
FOREIGN KEY (t1_id) REFERENCES t1(id) ON DELETE CASCADE ON UPDATE CASCADE
) ENGINE=InnoDB;
CREATE TRIGGER tr_t2_before_update
BEFORE UPDATE ON t2
FOR EACH ROW
SET NEW.copied_blob_data = CONCAT(OLD.copied_blob_data, REPEAT('-updated', 1250));
INSERT INTO t1 (id, blob_data) VALUES (1, REPEAT('A', 1024));
INSERT INTO t2 (id, t1_id, copied_blob_data) VALUES (1, 1, REPEAT('B', 1024));
SELECT * FROM t2;
id	t1_id	copied_blob_data
1	1	BBBBBBBBBBBBBBBBBBBBBBBBBBBBBBBBBBBBBBBBBBBBBBBBBBBBBBBBBBBBBBBBBBBBBBBBBBBBBBBBBBBBBBBBBBBBBBBBBBBBBBBBBBBBBBBBBBBBBBBBBBBBBBBBBBBBBBBBBBBBBBBBBBBBBBBBBBBBBBBBBBBBBBBBBBBBBBBBBBBBBBBBBBBBBBBBBBBBBBBBBBBBBBBBBBBBBBBBBBBBBBBBBBBBBBBBBBBBBBBBBBBBBBBBBBBBBBBBBBBBBBBBBBBBBBBBBBBBBBBBBBBBBBBBBBBBBBBBBBBBBBBBBBBBBBBBBBBBBBBBBBBBBBBBBBBBBBBBBBBBBBBBBBBBBBBBBBBBBBBBBBBBBBBBBBBBBBBBBBBBBBBBBBBBBBBBBBBBBBBBBBBBBBBBBBBBBBBBBBBBBBBBBBBBBBBBBBBBBBBBBBBBBBBBBBBBBBBBBBBBBBBBBBBBBBBBBBBBBBBBBBBBBBBBBBBBBBBBBBBBBBBBBBBBBBBBBBBBBBBBBBBBBBBBBBBBBBBBBBBBBBBBBBBBBBBBBBBBBBBBBBBBBBBBBBBBBBBBBBBBBBBBBBBBBBBBBBBBBBBBBBBBBBBBBBBBBBBBBBBBBBBBBBBBBBBBBBBBBBBBBBBBBBBBBBBBBBBBBBBBBBBBBBBBBBBBBBBBBBBBBBBBBBBBBBBBBBBBBBBBBBBBBBBBBBBBBBBBBBBBBBBBBBBBBBBBBBBBBBBBBBBBBBBBBBBBBBBBBBBBBBBBBBBBBBBBBBBBBBBBBBBBBBBBBBBBBBBBBBBBBBBBBBBBBBBBBBBBBBBBBBBBBBBBBBBBBBBBBBBBBBBBBBBBBBBBBBBBBBBBBBBBBBBBBBBBBBBBBBBBBBBBBBBBBBBBBBBBBBBBBBBBBBBBBBBBBBBBBBBBBBBBBBBBBBBBBBBBBBBBBBBBBBBBBBBBBBBBBBBBBBBBBBBBBBBBBBBBBBBBBBBBBBBBBBBBBBBBBBBBBBBBBBBBBBBBBBBBBBBBBBBB
UPDATE t1 SET id = 2 WHERE id = 1;
SELECT * FROM t2;
id	t1_id	copied_blob_data
1	2	BBBBBBBBBBBBBBBBBBBBBBBBBBBBBBBBBBBBBBBBBBBBBBBBBBBBBBBBBBBBBBBBBBBBBBBBBBBBBBBBBBBBBBBBBBBBBBBBBBBBBBBBBBBBBBBBBBBBBBBBBBBBBBBBBBBBBBBBBBBBBBBBBBBBBBBBBBBBBBBBBBBBBBBBBBBBBBBBBBBBBBBBBBBBBBBBBBBBBBBBBBBBBBBBBBBBBBBBBBBBBBBBBBBBBBBBBBBBBBBBBBBBBBBBBBBBBBBBBBBBBBBBBBBBBBBBBBBBBBBBBBBBBBBBBBBBBBBBBBBBBBBBBBBBBBBBBBBBBBBBBBBBBBBBBBBBBBBBBBBBBBBBBBBBBBBBBBBBBBBBBBBBBBBBBBBBBBBBBBBBBBBBBBBBBBBBBBBBBBBBBBBBBBBBBBBBBBBBBBBBBBBBBBBBBBBBBBBBBBBBBBBBBBBBBBBBBBBBBBBBBBBBBBBBBBBBBBBBBBBBBBBBBBBBBBBBBBBBBBBBBBBBBBBBBBBBBBBBBBBBBBBBBBBBBBBBBBBBBBBBBBBBBBBBBBBBBBBBBBBBBBBBBBBBBBBBBBBBBBBBBBBBBBBBBBBBBBBBBBBBBBBBBBBBBBBBBBBBBBBBBBBBBBBBBBBBBBBBBBBBBBBBBBBBBBBBBBBBBBBBBBBBBBBBBBBBBBBBBBBBBBBBBBBBBBBBBBBBBBBBBBBBBBBBBBBBBBBBBBBBBBBBBBBBBBBBBBBBBBBBBBBBBBBBBBBBBBBBBBBBBBBBBBBBBBBBBBBBBBBBBBBBBBBBBBBBBBBBBBBBBBBBBBBBBBBBBBBBBBBBBBBBBBBBBBBBBBBBBBBBBBBBBBBBBBBBBBBBBBBBBBBBBBBBBBBBBBBBBBBBBBBBBBBBBBBBBBBBBBBBBBBBBBBBBBBBBBBBBBBBBBBBBBBBBBBBBBBBBBBBBBBBBBBBBBBBBBBBBBBBBBBBBBBBBBBBBBBBBBBBBBBBBBBBBBBBBBBBBBBBBBBBBBBBBBBBBBBBBBBBBBBB-updated-updated-updated-updated-updated-updated-updated-updated-updated-updated-updated-updated-updated-updated-updated-updated-updated-updated-updated-updated-updated-updated-updated-updated-updated-updated-updated-updated-updated-updated-updated-updated-updated-updated-updated-updated-updated-updated-updated-updated-updated-updated-updated-updated-updated-updated-updated-updated-updated-updated-updated-updated-updated-updated-updated-updated-updated-updated-updated-updated-updated-updated-updated-updated-updated-updated-updated-updated-updated-updated-updated-updated-updated-updated-updated-updated-updated-updated-updated-updated-updated-updated-updated-updated-updated-updated-updated-updated-updated-updated-updated-updated-updated-updated-updated-updated-updated-updated-updated-updated-updated-updated-updated-updated-updated-updated-updated-updated-updated-updated-updated-updated-updated-updated-updated-updated-updated-updated-updated-updated-updated-updated-updated-updated-updated-updated-updated-updated-updated-updated-updated-updated-updated-updated-updated-updated-updated-updated-updated-updated-updated-updated-updated-updated-updated-updated-updated-updated-updated-updated-updated-updated-updated-updated-updated-updated-updated-updated-updated-updated-updated-updated-updated-updated-updated-updated-updated-updated-updated-updated-updated-updated-updated-updated-updated-updated-updated-updated-updated-updated-updated-updated-updated-updated-updated-updated-updated-updated-updated-updated-updated-updated-updated-updated-updated-updated-updated-updated-updated-updated-updated-updated-updated-updated-updated-updated-updated-updated-updated-updated-updated-updated-updated-updated-updated-updated-updated-updated-updated-updated-updated-updated-updated-updated-updated-updated-updated-updated-updated-updated-updated-updated-updated-updated-updated-updated-updated-updated-updated-updated-updated-updated-updated-updated-updated-updated-updated-updated-updated-updated-updated-updated-updated-updated-updated-updated-updated-updated-updated-updated-updated-updated-updated-updated-updated-updated-updated-updated-updated-updated-updated-updated-updated-updated-updated-updated-updated-updated-updated-updated-updated-updated-updated-updated-updated-updated-updated-updated-updated-updated-updated-updated-updated-updated-updated-updated-updated-updated-updated-updated-updated-updated-updated-updated-updated-updated-updated-updated-updated-updated-updated-updated-updated-updated-updated-updated-updated-updated-updated-updated-updated-updated-updated-updated-updated-updated-updated-updated-updated-updated-updated-updated-updated-updated-updated-updated-updated-updated-updated-updated-updated-updated-updated-updated-updated-updated-updated-updated-updated-updated-updated-updated-updated-updated-updated-updated-updated-updated-updated-updated-updated-updated-updated-updated-updated-updated-updated-updated-updated-updated-updated-updated-updated-updated-updated-updated-updated-updated-updated-updated-updated-updated-updated-updated-updated-updated-updated-updated-updated-updated-updated-updated-updated-updated-updated-updated-updated-updated-updated-updated-updated-updated-updated-updated-updated-updated-updated-updated-updated-updated-updated-updated-updated-updated-updated-updated-updated-updated-updated-updated-updated-updated-updated-updated-updated-updated-updated-updated-updated-updated-updated-updated-updated-updated-updated-updated-updated-updated-updated-updated-updated-updated-updated-updated-updated-updated-updated-updated-updated-updated-updated-updated-updated-updated-updated-updated-updated-updated-updated-updated-updated-updated-updated-updated-updated-updated-updated-updated-updated-updated-updated-updated-updated-updated-updated-updated-updated-updated-updated-updated-updated-updated-updated-updated-updated-updated-updated-updated-updated-updated-updated-updated-updated-updated-updated-updated-updated-updated-updated-updated-updated-updated-updated-updated-updated-updated-updated-updated-updated-updated-updated-updated-updated-updated-updated-updated-updated-updated-updated-updated-updated-updated-updated-updated-updated-updated-updated-updated-updated-updated-updated-updated-updated-updated-updated-updated-updated-updated-updated-updated-updated-updated-updated-updated-updated-updated-updated-updated-updated-updated-updated-updated-updated-updated-updated-updated-updated-updated-updated-updated-updated-updated-updated-updated-updated-updated-updated-updated-updated-updated-updated-updated-updated-updated-updated-updated-updated-updated-updated-updated-updated-updated-updated-updated-updated-updated-updated-updated-updated-updated-updated-updated-updated-updated-updated-updated-updated-updated-updated-updated-updated-updated-updated-updated-updated-updated-updated-updated-updated-updated-updated-updated-updated-updated-updated-updated-updated-updated-updated-updated-updated-updated-updated-updated-updated-updated-updated-updated-updated-updated-updated-updated-updated-updated-updated-updated-updated-updated-updated-updated-updated-updated-updated-updated-updated-updated-updated-updated-updated-updated-updated-updated-updated-updated-updated-updated-updated-updated-updated-updated-updated-updated-updated-updated-updated-updated-updated-updated-updated-updated-updated-updated-updated-updated-updated-updated-updated-updated-updated-updated-updated-updated-updated-updated-updated-updated-updated-updated-updated-updated-updated-updated-updated-updated-updated-updated-updated-updated-updated-updated-updated-updated-updated-updated-updated-updated-updated-updated-updated-updated-updated-updated-updated-updated-updated-updated-updated-updated-updated-updated-updated-updated-updated-updated-updated-updated-updated-updated-updated-updated-updated-updated-updated-updated-updated-updated-updated-updated-updated-updated-updated-updated-updated-updated-updated-updated-updated-updated-updated-updated-updated-updated-updated-updated-updated-updated-updated-updated-updated-updated-updated-updated-updated-updated-updated-updated-updated-updated-updated-updated-updated-updated-updated-updated-updated-updated-updated-updated-updated-updated-updated-updated-updated-updated-updated-updated-updated-updated-updated-updated-updated-updated-updated-updated-updated-updated-updated-updated-updated-updated-updated-updated-updated-updated-updated-updated-updated-updated-updated-updated-updated-updated-updated-updated-updated-updated-updated-updated-updated-updated-updated-updated-updated-updated-updated-updated-updated-updated-updated-updated-updated-updated-updated-updated-updated-updated-updated-updated-updated-updated-updated-updated-updated-updated-updated-updated-updated-updated-updated-updated-updated-updated-updated-updated-updated-updated-updated-updated-updated-updated-updated-updated-updated-updated-updated-updated-updated-updated-updated-updated-updated-updated-updated-updated-updated-updated-updated-updated-updated-updated-updated-updated-updated-updated-updated-updated-updated-updated-updated-updated-updated-updated-updated-updated-updated-updated-updated-updated-updated-updated-updated-updated-updated-updated-updated-updated-updated-updated-updated-updated-updated-updated-updated-updated-updated-updated-updated-updated-updated-updated-updated-updated-updated-updated-updated-updated-updated-updated-updated-updated-updated-updated-updated-updated-updated-updated-updated-updated-updated-updated-updated-updated-updated-updated-updated-updated-updated-updated-updated-updated-updated-updated-updated-updated-updated-updated-updated-updated-updated-updated-updated-updated-updated-updated-updated-updated-updated-updated-updated-updated-updated-updated-updated-updated-updated-updated-updated-updated-updated-updated-updated-updated-updated-updated-updated-updated-updated-updated-updated-updated-updated-updated-updated-updated-updated-updated-updated-updated-updated-updated-updated-updated-updated-updated-updated-updated-updated-updated-updated-updated-updated-updated-updated-updated-updated-updated-updated-updated-updated-updated-updated-updated-updated-updated-updated-updated-updated-updated-updated-updated-updated-updated-updated-updated-updated-updated-updated-updated-updated-updated-updated-updated-updated-updated-updated-updated-updated-updated-updated-updated-updated-updated-updated-updated-updated-updated-updated-updated-updated-updated-updated-updated-updated-updated-updated-updated-updated-updated-updated-updated-updated-updated-updated-updated-updated-updated-updated-updated-updated-updated-updated-updated-updated-updated-updated-updated-updated-updated-updated-updated-updated-updated-updated-updated-updated-updated-updated-updated-updated-updated-updated-updated-updated-updated-updated-updated-updated-updated-updated-updated-updated-updated-updated-updated-updated-updated-updated-updated-updated-updated-updated-updated-updated-updated-updated-updated-updated-updated-updated-updated-updated-updated-updated-updated-updated-updated-updated-updated-updated-updated-updated-updated-updated-updated-updated-updated-updated-updated-updated-updated-updated-updated-updated-updated-updated-updated-updated-updated-updated-updated-updated-updated-updated-updated-updated-updated-updated-updated-updated-updated-updated-updated-updated-updated-updated-updated-updated-updated-updated-updated-updated-updated-updated-updated-updated-updated-updated-updated-updated-updated-updated-updated-updated-updated-updated-updated-updated-updated-updated-updated-updated-updated-updated-updated-updated-updated-updated-updated-updated-updated-updated-updated-updated-updated-updated-updated-updated-updated-updated-updated-updated-updated-updated-updated-updated-updated-updated-updated-updated-updated-updated-updated-updated-updated-updated-updated-updated-updated-updated-updated-updated-updated-updated-updated-updated-updated-updated-updated-updated-updated
DROP TABLE t2, t1;
CREATE TABLE t1 (
id INT PRIMARY KEY,
blob_data BLOB
) ENGINE=InnoDB;
CREATE TABLE t2 (
id INT PRIMARY KEY,
t1_id INT,
copied_blob_data BLOB,
FOREIGN KEY (t1_id) REFERENCES t1(id) ON DELETE CASCADE ON UPDATE CASCADE
) ENGINE=InnoDB;
CREATE TRIGGER tr_t2_before_update
BEFORE UPDATE ON t2
FOR EACH ROW
SET NEW.copied_blob_data = CONCAT(OLD.copied_blob_data, REPEAT('-updated', 12500));
INSERT INTO t1 (id, blob_data) VALUES (1, REPEAT('A', 1024));
INSERT INTO t2 (id, t1_id, copied_blob_data) VALUES (1, 1, REPEAT('B', 1024));
SELECT * FROM t2;
id	t1_id	copied_blob_data
1	1	BBBBBBBBBBBBBBBBBBBBBBBBBBBBBBBBBBBBBBBBBBBBBBBBBBBBBBBBBBBBBBBBBBBBBBBBBBBBBBBBBBBBBBBBBBBBBBBBBBBBBBBBBBBBBBBBBBBBBBBBBBBBBBBBBBBBBBBBBBBBBBBBBBBBBBBBBBBBBBBBBBBBBBBBBBBBBBBBBBBBBBBBBBBBBBBBBBBBBBBBBBBBBBBBBBBBBBBBBBBBBBBBBBBBBBBBBBBBBBBBBBBBBBBBBBBBBBBBBBBBBBBBBBBBBBBBBBBBBBBBBBBBBBBBBBBBBBBBBBBBBBBBBBBBBBBBBBBBBBBBBBBBBBBBBBBBBBBBBBBBBBBBBBBBBBBBBBBBBBBBBBBBBBBBBBBBBBBBBBBBBBBBBBBBBBBBBBBBBBBBBBBBBBBBBBBBBBBBBBBBBBBBBBBBBBBBBBBBBBBBBBBBBBBBBBBBBBBBBBBBBBBBBBBBBBBBBBBBBBBBBBBBBBBBBBBBBBBBBBBBBBBBBBBBBBBBBBBBBBBBBBBBBBBBBBBBBBBBBBBBBBBBBBBBBBBBBBBBBBBBBBBBBBBBBBBBBBBBBBBBBBBBBBBBBBBBBBBBBBBBBBBBBBBBBBBBBBBBBBBBBBBBBBBBBBBBBBBBBBBBBBBBBBBBBBBBBBBBBBBBBBBBBBBBBBBBBBBBBBBBBBBBBBBBBBBBBBBBBBBBBBBBBBBBBBBBBBBBBBBBBBBBBBBBBBBBBBBBBBBBBBBBBBBBBBBBBBBBBBBBBBBBBBBBBBBBBBBBBBBBBBBBBBBBBBBBBBBBBBBBBBBBBBBBBBBBBBBBBBBBBBBBBBBBBBBBBBBBBBBBBBBBBBBBBBBBBBBBBBBBBBBBBBBBBBBBBBBBBBBBBBBBBBBBBBBBBBBBBBBBBBBBBBBBBBBBBBBBBBBBBBBBBBBBBBBBBBBBBBBBBBBBBBBBBBBBBBBBBBBBBBBBBBBBBBBBBBBBBBBBBBBBBBBBBBBBBBBBBBBBBBBBBBBBBBBBBBBBBBBBBBBB
UPDATE t1 SET id = 2 WHERE id = 1;
ERROR 22001: Data too long for column 'copied_blob_data' at row 0
DROP TABLE t2, t1;
