include/master-slave.inc
[connection master]
#
# MDEV-34319 DECLARE TYPE .. TABLE OF .. INDEX BY in stored routines
#
SET sql_mode=oracle;
SET NAMES utf8;
connection master;
CREATE TABLE t1 (a VARCHAR(64));
DECLARE
TYPE person_t IS RECORD
(
first_name VARCHAR(64),
last_name VARCHAR(64)
);
TYPE table_of_peson_t IS TABLE OF person_t INDEX BY VARCHAR2(20);
person_by_nickname table_of_peson_t;
BEGIN
person_by_nickname('Monty') := person_t('Michael', 'Widenius');
INSERT INTO t1 VALUES (person_by_nickname.FIRST);
INSERT INTO t1 VALUES (person_by_nickname('Monty').first_name);
END;
$$
connection slave;
SELECT a FROM t1;
a
Monty
Michael
connection master;
DECLARE
TYPE person_t IS RECORD
(
first_name VARCHAR(64),
last_name VARCHAR(64)
);
TYPE table_of_peson_t IS TABLE OF person_t INDEX BY VARCHAR2(20);
person_by_nickname table_of_peson_t;
BEGIN
person_by_nickname('Monty') := person_t('Michael', 'Widenius');
DELETE FROM t1 WHERE person_by_nickname IS NOT NULL;
END;
$$
connection slave;
SELECT a FROM t1;
a
connection master;
DECLARE
TYPE first_names_t IS TABLE OF VARCHAR2(64) INDEX BY VARCHAR2(20);
first_names first_names_t;
`first names` first_names_t;
nick VARCHAR(64):= 'Monty';
BEGIN
first_names('Monty') := 'Michael';
`first names`('Alex') := 'Alexander';
INSERT INTO t1 VALUES (first_names('Monty'));
INSERT INTO t1 VALUES (first_names(nick));
INSERT INTO t1 VALUES (first_names(TRIM(nick || ' ')));
INSERT INTO t1 VALUES (first_names(TRIM(first_names.LAST)));
INSERT INTO t1 VALUES (`first names`(`first names`.LAST));
CREATE TABLE t2 AS SELECT first_names('Monty');
END;
$$
connection slave;
SELECT a FROM t1;
a
Michael
Michael
Michael
Michael
Alexander
connection master;
DROP TABLE t1;
DROP TABLE t2;
connection slave;
include/rpl_end.inc
