USE information_schema;
####################################################################################
1 Prepare test.
connection default (user=root)
####################################################################################
####################################################################################
1.1 Create two user
####################################################################################
DROP USER ddicttestuser1@'localhost';
DROP USER ddicttestuser2@'localhost';
CREATE USER ddicttestuser1@'localhost';
CREATE USER ddicttestuser2@'localhost';
SET PASSWORD FOR ddicttestuser1@'localhost' = PASSWORD('ddictpass');
SET PASSWORD FOR ddicttestuser2@'localhost' = PASSWORD('ddictpass');
####################################################################################
1.2 Establish connection con100 (user=ddicttestuser1 with no PROCESS privilege):
connect  con100,localhost,ddicttestuser1,ddictpass,information_schema;
####################################################################################
####################################################################################
2 connection default(user=root with default privileges):
SHOW/SELECT shows all processes/threads.
####################################################################################
connection default;
SHOW CREATE TABLE processlist;
Table	Create Table
PROCESSLIST	CREATE TEMPORARY TABLE `PROCESSLIST` (
  `ID` bigint(4) NOT NULL DEFAULT 0,
  `USER` varchar(128) NOT NULL DEFAULT '',
  `HOST` varchar(64) NOT NULL DEFAULT '',
  `DB` varchar(64) DEFAULT NULL,
  `COMMAND` varchar(16) NOT NULL DEFAULT '',
  `TIME` int(7) NOT NULL DEFAULT 0,
  `STATE` varchar(64) DEFAULT NULL,
  `INFO` longtext DEFAULT NULL,
  `TIME_MS` decimal(22,3) NOT NULL DEFAULT 0.000,
  `STAGE` tinyint(2) NOT NULL DEFAULT 0,
  `MAX_STAGE` tinyint(2) NOT NULL DEFAULT 0,
  `PROGRESS` decimal(7,3) NOT NULL DEFAULT 0.000,
  `MEMORY_USED` bigint(7) NOT NULL DEFAULT 0,
  `EXAMINED_ROWS` int(7) NOT NULL DEFAULT 0,
  `QUERY_ID` bigint(4) NOT NULL DEFAULT 0,
  `INFO_BINARY` blob DEFAULT NULL,
  `TID` bigint(4) NOT NULL DEFAULT 0
)  DEFAULT CHARSET=utf8
SHOW processlist;
Id	User	Host	db	Command	Time	State	Info	Progress
ID	root	HOST_NAME	information_schema	Query	TIME	init	SHOW processlist	TIME_MS
ID	ddicttestuser1	HOST_NAME	information_schema	Sleep	TIME		NULL	TIME_MS
SELECT * FROM processlist  ORDER BY id;
ID	USER	HOST	DB	COMMAND	TIME	STATE	INFO	TIME_MS	STAGE	MAX_STAGE	PROGRESS	MEMORY_USED	EXAMINED_ROWS	QUERY_ID	INFO_BINARY	TID
ID	root	HOST_NAME	information_schema	Query	TIME	Filling schema table	SELECT * FROM processlist  ORDER BY id	TIME_MS	0	0	0.000	MEMORY	ROWS	QUERY_ID	SELECT * FROM processlist  ORDER BY id	TID
ID	ddicttestuser1	HOST_NAME	information_schema	Sleep	TIME		NULL	TIME_MS	0	0	0.000	MEMORY	ROWS	QUERY_ID	NULL	TID
SELECT ID, USER, HOST, DB, COMMAND, TIME, STATE, INFO, TIME_MS, STAGE, MAX_STAGE, PROGRESS, MEMORY_USED, EXAMINED_ROWS, QUERY_ID, INFO_BINARY FROM processlist  ORDER BY id;
ID	USER	HOST	DB	COMMAND	TIME	STATE	INFO	TIME_MS	STAGE	MAX_STAGE	PROGRESS	MEMORY_USED	EXAMINED_ROWS	QUERY_ID	INFO_BINARY
ID	root	HOST_NAME	information_schema	Query	TIME	Filling schema table	SELECT ID, USER, HOST, DB, COMMAND, TIME, STATE, INFO, TIME_MS, STAGE, MAX_STAGE, PROGRESS, MEMORY_USED, EXAMINED_ROWS, QUERY_ID, INFO_BINARY FROM processlist  ORDER BY id	TIME_MS	0	0	0.000	MEMORY	ROWS	QUERY_ID	SELECT ID, USER, HOST, DB, COMMAND, TIME, STATE, INFO, TIME_MS, STAGE, MAX_STAGE, PROGRESS, MEMORY_USED, EXAMINED_ROWS, QUERY_ID, INFO_BINARY FROM processlist  ORDER BY id
ID	ddicttestuser1	HOST_NAME	information_schema	Sleep	TIME		NULL	TIME_MS	0	0	0.000	MEMORY	ROWS	QUERY_ID	NULL
CREATE TEMPORARY TABLE test.t_processlist AS SELECT * FROM processlist;
UPDATE test.t_processlist SET user='horst' WHERE id=1  ;
INSERT INTO processlist SELECT * FROM test.t_processlist;
ERROR 42000: Access denied for user 'root'@'localhost' to database 'information_schema'
DROP TABLE test.t_processlist;
CREATE VIEW test.v_processlist (ID, USER, HOST, DB, COMMAND, TIME, STATE, INFO, TIME_MS, STAGE, MAX_STAGE, PROGRESS, MEMORY_USED, EXAMINED_ROWS, QUERY_ID, INFO_BINARY) AS SELECT ID, USER, HOST, DB, COMMAND, TIME, STATE, INFO, TIME_MS, STAGE, MAX_STAGE, PROGRESS, MEMORY_USED, EXAMINED_ROWS, QUERY_ID, INFO_BINARY FROM processlist WITH CHECK OPTION;
ERROR HY000: CHECK OPTION on non-updatable view `test`.`v_processlist`
CREATE VIEW test.v_processlist (ID, USER, HOST, DB, COMMAND, TIME, STATE, INFO, TIME_MS, STAGE, MAX_STAGE, PROGRESS, MEMORY_USED, EXAMINED_ROWS, QUERY_ID, INFO_BINARY) AS SELECT ID, USER, HOST, DB, COMMAND, TIME, STATE, INFO, TIME_MS, STAGE, MAX_STAGE, PROGRESS, MEMORY_USED, EXAMINED_ROWS, QUERY_ID, INFO_BINARY FROM processlist;
DROP VIEW test.v_processlist;
UPDATE processlist SET user='any_user'  WHERE id=1 ;
ERROR 42000: Access denied for user 'root'@'localhost' to database 'information_schema'
DELETE FROM processlist WHERE id=1 ;
ERROR 42000: Access denied for user 'root'@'localhost' to database 'information_schema'
REVOKE ALL ON processlist FROM current_user;
ERROR 42000: Access denied for user 'root'@'localhost' to database 'information_schema'
GRANT INSERT,UPDATE ON processlist TO current_user;
ERROR 42000: Access denied for user 'root'@'localhost' to database 'information_schema'
SHOW GRANTS;
Grants for root@localhost
GRANT ALL PRIVILEGES ON *.* TO 'root'@'localhost' WITH GRANT OPTION
GRANT PROXY ON ''@'%' TO 'root'@'localhost' WITH GRANT OPTION
CREATE INDEX i_processlist ON processlist (user);
ERROR 42000: Access denied for user 'root'@'localhost' to database 'information_schema'
DROP TABLE processlist;
ERROR 42000: Access denied for user 'root'@'localhost' to database 'information_schema'
ALTER TABLE processlist DROP COLUMN user;
ERROR 42000: Access denied for user 'root'@'localhost' to database 'information_schema'
ALTER TABLE processlist ADD COLUMN (my_column INT);
ERROR 42000: Access denied for user 'root'@'localhost' to database 'information_schema'
RENAME TABLE processlist TO new_processlist;
ERROR 42000: Access denied for user 'root'@'localhost' to database 'information_schema'
RENAME TABLE processlist TO files;
ERROR 42000: Access denied for user 'root'@'localhost' to database 'information_schema'
CREATE TABLE new_processlist AS SELECT * FROM processlist;
ERROR 42000: Access denied for user 'root'@'localhost' to database 'information_schema'
DROP DATABASE information_schema;
ERROR 42000: Access denied for user 'root'@'localhost' to database 'information_schema'
RENAME DATABASE information_schema TO info_schema;
ERROR 42000: You have an error in your SQL syntax; check the manual that corresponds to your MariaDB server version for the right syntax to use near 'DATABASE information_schema TO info_schema' at line 1
ALTER DATABASE information_schema UPGRADE DATA DIRECTORY NAME;
ERROR 42000: Access denied for user 'root'@'localhost' to database 'information_schema'
####################################################################################
3 Switch to connection con100 (user=ddicttestuser1 with no PROCESS privilege):
connection con100;
SHOW/SELECT shows only the processes (1) of the user.
####################################################################################
SHOW CREATE TABLE processlist;
Table	Create Table
PROCESSLIST	CREATE TEMPORARY TABLE `PROCESSLIST` (
  `ID` bigint(4) NOT NULL DEFAULT 0,
  `USER` varchar(128) NOT NULL DEFAULT '',
  `HOST` varchar(64) NOT NULL DEFAULT '',
  `DB` varchar(64) DEFAULT NULL,
  `COMMAND` varchar(16) NOT NULL DEFAULT '',
  `TIME` int(7) NOT NULL DEFAULT 0,
  `STATE` varchar(64) DEFAULT NULL,
  `INFO` longtext DEFAULT NULL,
  `TIME_MS` decimal(22,3) NOT NULL DEFAULT 0.000,
  `STAGE` tinyint(2) NOT NULL DEFAULT 0,
  `MAX_STAGE` tinyint(2) NOT NULL DEFAULT 0,
  `PROGRESS` decimal(7,3) NOT NULL DEFAULT 0.000,
  `MEMORY_USED` bigint(7) NOT NULL DEFAULT 0,
  `EXAMINED_ROWS` int(7) NOT NULL DEFAULT 0,
  `QUERY_ID` bigint(4) NOT NULL DEFAULT 0,
  `INFO_BINARY` blob DEFAULT NULL,
  `TID` bigint(4) NOT NULL DEFAULT 0
)  DEFAULT CHARSET=utf8
SHOW processlist;
Id	User	Host	db	Command	Time	State	Info	Progress
ID	ddicttestuser1	HOST_NAME	information_schema	Query	TIME	init	SHOW processlist	TIME_MS
SELECT * FROM processlist  ORDER BY id;
ID	USER	HOST	DB	COMMAND	TIME	STATE	INFO	TIME_MS	STAGE	MAX_STAGE	PROGRESS	MEMORY_USED	EXAMINED_ROWS	QUERY_ID	INFO_BINARY	TID
ID	ddicttestuser1	HOST_NAME	information_schema	Query	TIME	Filling schema table	SELECT * FROM processlist  ORDER BY id	TIME_MS	0	0	0.000	MEMORY	ROWS	QUERY_ID	SELECT * FROM processlist  ORDER BY id	TID
SELECT ID, USER, HOST, DB, COMMAND, TIME, STATE, INFO, TIME_MS, STAGE, MAX_STAGE, PROGRESS, MEMORY_USED, EXAMINED_ROWS, QUERY_ID, INFO_BINARY FROM processlist  ORDER BY id;
ID	USER	HOST	DB	COMMAND	TIME	STATE	INFO	TIME_MS	STAGE	MAX_STAGE	PROGRESS	MEMORY_USED	EXAMINED_ROWS	QUERY_ID	INFO_BINARY
ID	ddicttestuser1	HOST_NAME	information_schema	Query	TIME	Filling schema table	SELECT ID, USER, HOST, DB, COMMAND, TIME, STATE, INFO, TIME_MS, STAGE, MAX_STAGE, PROGRESS, MEMORY_USED, EXAMINED_ROWS, QUERY_ID, INFO_BINARY FROM processlist  ORDER BY id	TIME_MS	0	0	0.000	MEMORY	ROWS	QUERY_ID	SELECT ID, USER, HOST, DB, COMMAND, TIME, STATE, INFO, TIME_MS, STAGE, MAX_STAGE, PROGRESS, MEMORY_USED, EXAMINED_ROWS, QUERY_ID, INFO_BINARY FROM processlist  ORDER BY id
CREATE TEMPORARY TABLE test.t_processlist AS SELECT * FROM processlist;
UPDATE test.t_processlist SET user='horst' WHERE id=1  ;
INSERT INTO processlist SELECT * FROM test.t_processlist;
ERROR 42000: Access denied for user 'ddicttestuser1'@'localhost' to database 'information_schema'
DROP TABLE test.t_processlist;
CREATE VIEW test.v_processlist (ID, USER, HOST, DB, COMMAND, TIME, STATE, INFO, TIME_MS, STAGE, MAX_STAGE, PROGRESS, MEMORY_USED, EXAMINED_ROWS, QUERY_ID, INFO_BINARY) AS SELECT ID, USER, HOST, DB, COMMAND, TIME, STATE, INFO, TIME_MS, STAGE, MAX_STAGE, PROGRESS, MEMORY_USED, EXAMINED_ROWS, QUERY_ID, INFO_BINARY FROM processlist WITH CHECK OPTION;
ERROR HY000: CHECK OPTION on non-updatable view `test`.`v_processlist`
CREATE VIEW test.v_processlist (ID, USER, HOST, DB, COMMAND, TIME, STATE, INFO, TIME_MS, STAGE, MAX_STAGE, PROGRESS, MEMORY_USED, EXAMINED_ROWS, QUERY_ID, INFO_BINARY) AS SELECT ID, USER, HOST, DB, COMMAND, TIME, STATE, INFO, TIME_MS, STAGE, MAX_STAGE, PROGRESS, MEMORY_USED, EXAMINED_ROWS, QUERY_ID, INFO_BINARY FROM processlist;
DROP VIEW test.v_processlist;
UPDATE processlist SET user='any_user'  WHERE id=1 ;
ERROR 42000: Access denied for user 'ddicttestuser1'@'localhost' to database 'information_schema'
DELETE FROM processlist WHERE id=1 ;
ERROR 42000: Access denied for user 'ddicttestuser1'@'localhost' to database 'information_schema'
REVOKE ALL ON processlist FROM current_user;
ERROR 42000: Access denied for user 'ddicttestuser1'@'localhost' to database 'information_schema'
GRANT INSERT,UPDATE ON processlist TO current_user;
ERROR 42000: Access denied for user 'ddicttestuser1'@'localhost' to database 'information_schema'
SHOW GRANTS;
Grants for ddicttestuser1@localhost
GRANT USAGE ON *.* TO 'ddicttestuser1'@'localhost' IDENTIFIED BY PASSWORD '*22DA61451703738F203CDB9DB041ACBA1F4760B1'
CREATE INDEX i_processlist ON processlist (user);
ERROR 42000: Access denied for user 'ddicttestuser1'@'localhost' to database 'information_schema'
DROP TABLE processlist;
ERROR 42000: Access denied for user 'ddicttestuser1'@'localhost' to database 'information_schema'
ALTER TABLE processlist DROP COLUMN user;
ERROR 42000: Access denied for user 'ddicttestuser1'@'localhost' to database 'information_schema'
ALTER TABLE processlist ADD COLUMN (my_column INT);
ERROR 42000: Access denied for user 'ddicttestuser1'@'localhost' to database 'information_schema'
RENAME TABLE processlist TO new_processlist;
ERROR 42000: Access denied for user 'ddicttestuser1'@'localhost' to database 'information_schema'
RENAME TABLE processlist TO files;
ERROR 42000: Access denied for user 'ddicttestuser1'@'localhost' to database 'information_schema'
CREATE TABLE new_processlist AS SELECT * FROM processlist;
ERROR 42000: Access denied for user 'ddicttestuser1'@'localhost' to database 'information_schema'
DROP DATABASE information_schema;
ERROR 42000: Access denied for user 'ddicttestuser1'@'localhost' to database 'information_schema'
RENAME DATABASE information_schema TO info_schema;
ERROR 42000: You have an error in your SQL syntax; check the manual that corresponds to your MariaDB server version for the right syntax to use near 'DATABASE information_schema TO info_schema' at line 1
ALTER DATABASE information_schema UPGRADE DATA DIRECTORY NAME;
ERROR 42000: Access denied for user 'ddicttestuser1'@'localhost' to database 'information_schema'
####################################################################################
4 Grant PROCESS privilege to ddicttestuser1
connection default (user=root)
####################################################################################
connection default;
GRANT PROCESS ON *.* TO ddicttestuser1@'localhost' IDENTIFIED BY 'ddictpass';
####################################################################################
4.1 Existing connection con100 (ddicttestuser1)
The user ddicttestuser1 has the PROCESS privilege, but the connection was
established before PROCESS was granted.
SHOW/SELECT shows only the processes (1) of the user.
####################################################################################
connection con100;
SHOW GRANTS;
Grants for ddicttestuser1@localhost
GRANT PROCESS ON *.* TO 'ddicttestuser1'@'localhost' IDENTIFIED BY PASSWORD '*22DA61451703738F203CDB9DB041ACBA1F4760B1'
SHOW processlist;
Id	User	Host	db	Command	Time	State	Info	Progress
ID	ddicttestuser1	HOST_NAME	information_schema	Query	TIME	init	SHOW processlist	TIME_MS
SELECT * FROM information_schema.processlist;
ID	USER	HOST	DB	COMMAND	TIME	STATE	INFO	TIME_MS	STAGE	MAX_STAGE	PROGRESS	MEMORY_USED	EXAMINED_ROWS	QUERY_ID	INFO_BINARY	TID
ID	ddicttestuser1	HOST_NAME	information_schema	Query	TIME	Filling schema table	SELECT * FROM information_schema.processlist	TIME_MS	0	0	0.000	MEMORY	ROWS	QUERY_ID	SELECT * FROM information_schema.processlist	TID
####################################################################################
4.2 New connection con101 (ddicttestuser1 with PROCESS privilege)
SHOW/SELECT shows all processes/threads.
####################################################################################
connect  con101,localhost,ddicttestuser1,ddictpass,information_schema;
SHOW GRANTS;
Grants for ddicttestuser1@localhost
GRANT PROCESS ON *.* TO 'ddicttestuser1'@'localhost' IDENTIFIED BY PASSWORD '*22DA61451703738F203CDB9DB041ACBA1F4760B1'
SHOW processlist;
Id	User	Host	db	Command	Time	State	Info	Progress
ID	root	HOST_NAME	information_schema	Sleep	TIME		NULL	TIME_MS
ID	ddicttestuser1	HOST_NAME	information_schema	Sleep	TIME		NULL	TIME_MS
ID	ddicttestuser1	HOST_NAME	information_schema	Query	TIME	init	SHOW processlist	TIME_MS
SELECT * FROM information_schema.processlist;
ID	USER	HOST	DB	COMMAND	TIME	STATE	INFO	TIME_MS	STAGE	MAX_STAGE	PROGRESS	MEMORY_USED	EXAMINED_ROWS	QUERY_ID	INFO_BINARY	TID
ID	ddicttestuser1	HOST_NAME	information_schema	Query	TIME	Filling schema table	SELECT * FROM information_schema.processlist	TIME_MS	0	0	0.000	MEMORY	ROWS	QUERY_ID	SELECT * FROM information_schema.processlist	TID
ID	ddicttestuser1	HOST_NAME	information_schema	Sleep	TIME		NULL	TIME_MS	0	0	0.000	MEMORY	ROWS	QUERY_ID	NULL	TID
ID	root	HOST_NAME	information_schema	Sleep	TIME		NULL	TIME_MS	0	0	0.000	MEMORY	ROWS	QUERY_ID	NULL	TID
####################################################################################
5 Grant PROCESS privilege to anonymous user.
connection default (user=root)
####################################################################################
connection default;
create user ''@'localhost';
GRANT PROCESS ON *.* TO ''@'localhost';
####################################################################################
5.1 Establish connection (anonymous1,localhost,'',,information_schema)
anonymous user with PROCESS privilege
SHOW/SELECT shows all processes/threads.
####################################################################################
connect  anonymous1,localhost,"''",,information_schema;
SHOW GRANTS;
Grants for @localhost
GRANT PROCESS ON *.* TO ''@'localhost'
SHOW processlist;
Id	User	Host	db	Command	Time	State	Info	Progress
ID	root	HOST_NAME	information_schema	Sleep	TIME		NULL	TIME_MS
ID	ddicttestuser1	HOST_NAME	information_schema	Sleep	TIME		NULL	TIME_MS
ID	ddicttestuser1	HOST_NAME	information_schema	Sleep	TIME		NULL	TIME_MS
ID		HOST_NAME	information_schema	Query	TIME	init	SHOW processlist	TIME_MS
SELECT * FROM information_schema.processlist;
ID	USER	HOST	DB	COMMAND	TIME	STATE	INFO	TIME_MS	STAGE	MAX_STAGE	PROGRESS	MEMORY_USED	EXAMINED_ROWS	QUERY_ID	INFO_BINARY	TID
ID		HOST_NAME	information_schema	Query	TIME	Filling schema table	SELECT * FROM information_schema.processlist	TIME_MS	0	0	0.000	MEMORY	ROWS	QUERY_ID	SELECT * FROM information_schema.processlist	TID
ID	ddicttestuser1	HOST_NAME	information_schema	Sleep	TIME		NULL	TIME_MS	0	0	0.000	MEMORY	ROWS	QUERY_ID	NULL	TID
ID	ddicttestuser1	HOST_NAME	information_schema	Sleep	TIME		NULL	TIME_MS	0	0	0.000	MEMORY	ROWS	QUERY_ID	NULL	TID
ID	root	HOST_NAME	information_schema	Sleep	TIME		NULL	TIME_MS	0	0	0.000	MEMORY	ROWS	QUERY_ID	NULL	TID
####################################################################################
6 Revoke PROCESS privilege from ddicttestuser1
connection default (user=root)
####################################################################################
connection default;
REVOKE PROCESS ON *.* FROM ddicttestuser1@'localhost';
####################################################################################
6.1 New connection con102 (ddicttestuser1 has no more PROCESS privilege)
connect  con102,localhost,ddicttestuser1,ddictpass,information_schema;
Again (compared to state before GRANT PROCESS) only the processes of
ddicttestuser1 are visible.
####################################################################################
SHOW GRANTS;
Grants for ddicttestuser1@localhost
GRANT USAGE ON *.* TO 'ddicttestuser1'@'localhost' IDENTIFIED BY PASSWORD '*22DA61451703738F203CDB9DB041ACBA1F4760B1'
SHOW processlist;
Id	User	Host	db	Command	Time	State	Info	Progress
ID	ddicttestuser1	HOST_NAME	information_schema	Sleep	TIME		NULL	TIME_MS
ID	ddicttestuser1	HOST_NAME	information_schema	Sleep	TIME		NULL	TIME_MS
ID	ddicttestuser1	HOST_NAME	information_schema	Query	TIME	init	SHOW processlist	TIME_MS
SELECT * FROM information_schema.processlist;
ID	USER	HOST	DB	COMMAND	TIME	STATE	INFO	TIME_MS	STAGE	MAX_STAGE	PROGRESS	MEMORY_USED	EXAMINED_ROWS	QUERY_ID	INFO_BINARY	TID
ID	ddicttestuser1	HOST_NAME	information_schema	Query	TIME	Filling schema table	SELECT * FROM information_schema.processlist	TIME_MS	0	0	0.000	MEMORY	ROWS	QUERY_ID	SELECT * FROM information_schema.processlist	TID
ID	ddicttestuser1	HOST_NAME	information_schema	Sleep	TIME		NULL	TIME_MS	0	0	0.000	MEMORY	ROWS	QUERY_ID	NULL	TID
ID	ddicttestuser1	HOST_NAME	information_schema	Sleep	TIME		NULL	TIME_MS	0	0	0.000	MEMORY	ROWS	QUERY_ID	NULL	TID
####################################################################################
7 Revoke PROCESS privilege from anonymous user
connection default (user=root)
####################################################################################
connection default;
REVOKE PROCESS ON *.* FROM ''@'localhost';
####################################################################################
7.1 New connection (anonymous2,localhost,'',,information_schema)
connect  anonymous2,localhost,"''",,information_schema;
The anonymous user has no more the PROCESS privilege
Again only the processes of the anonymous user are visible.
####################################################################################
SHOW GRANTS FOR ''@'localhost';
Grants for @localhost
GRANT USAGE ON *.* TO ''@'localhost'
SELECT * FROM information_schema.processlist;
ID	USER	HOST	DB	COMMAND	TIME	STATE	INFO	TIME_MS	STAGE	MAX_STAGE	PROGRESS	MEMORY_USED	EXAMINED_ROWS	QUERY_ID	INFO_BINARY	TID
ID		HOST_NAME	information_schema	Query	TIME	Filling schema table	SELECT * FROM information_schema.processlist	TIME_MS	0	0	0.000	MEMORY	ROWS	QUERY_ID	SELECT * FROM information_schema.processlist	TID
ID		HOST_NAME	information_schema	Sleep	TIME		NULL	TIME_MS	0	0	0.000	MEMORY	ROWS	QUERY_ID	NULL	TID
####################################################################################
8 Grant SUPER (does not imply PROCESS) privilege to ddicttestuser1
connection default (user=root)
####################################################################################
connection default;
GRANT SUPER ON *.* TO 'ddicttestuser1'@'localhost';
####################################################################################
8.1 New connection con103 (ddicttestuser1 with SUPER privilege)
connect  con103,localhost,ddicttestuser1,ddictpass,information_schema;
Only the processes of ddicttestuser1 user are visible.
####################################################################################
SHOW GRANTS FOR 'ddicttestuser1'@'localhost';
Grants for ddicttestuser1@localhost
GRANT SUPER ON *.* TO 'ddicttestuser1'@'localhost' IDENTIFIED BY PASSWORD '*22DA61451703738F203CDB9DB041ACBA1F4760B1'
SHOW processlist;
Id	User	Host	db	Command	Time	State	Info	Progress
ID	ddicttestuser1	HOST_NAME	information_schema	Sleep	TIME		NULL	TIME_MS
ID	ddicttestuser1	HOST_NAME	information_schema	Sleep	TIME		NULL	TIME_MS
ID	ddicttestuser1	HOST_NAME	information_schema	Sleep	TIME		NULL	TIME_MS
ID	ddicttestuser1	HOST_NAME	information_schema	Query	TIME	init	SHOW processlist	TIME_MS
SELECT * FROM information_schema.processlist;
ID	USER	HOST	DB	COMMAND	TIME	STATE	INFO	TIME_MS	STAGE	MAX_STAGE	PROGRESS	MEMORY_USED	EXAMINED_ROWS	QUERY_ID	INFO_BINARY	TID
ID	ddicttestuser1	HOST_NAME	information_schema	Query	TIME	Filling schema table	SELECT * FROM information_schema.processlist	TIME_MS	0	0	0.000	MEMORY	ROWS	QUERY_ID	SELECT * FROM information_schema.processlist	TID
ID	ddicttestuser1	HOST_NAME	information_schema	Sleep	TIME		NULL	TIME_MS	0	0	0.000	MEMORY	ROWS	QUERY_ID	NULL	TID
ID	ddicttestuser1	HOST_NAME	information_schema	Sleep	TIME		NULL	TIME_MS	0	0	0.000	MEMORY	ROWS	QUERY_ID	NULL	TID
ID	ddicttestuser1	HOST_NAME	information_schema	Sleep	TIME		NULL	TIME_MS	0	0	0.000	MEMORY	ROWS	QUERY_ID	NULL	TID
####################################################################################
9 Revoke SUPER privilege from user ddicttestuser1
connection default (user=root)
####################################################################################
connection default;
REVOKE SUPER ON *.* FROM 'ddicttestuser1'@'localhost';
####################################################################################
9.1 New connection con104 (ddicttestuser1 without SUPER privilege)
connect  con104,localhost,ddicttestuser1,ddictpass,information_schema;
ddicttestuser1 has no more the SUPER privilege.
Only the processes of ddicttestuser1 are visible.
####################################################################################
SHOW GRANTS FOR 'ddicttestuser1'@'localhost';
Grants for ddicttestuser1@localhost
GRANT USAGE ON *.* TO 'ddicttestuser1'@'localhost' IDENTIFIED BY PASSWORD '*22DA61451703738F203CDB9DB041ACBA1F4760B1'
SHOW processlist;
Id	User	Host	db	Command	Time	State	Info	Progress
ID	ddicttestuser1	HOST_NAME	information_schema	Sleep	TIME		NULL	TIME_MS
ID	ddicttestuser1	HOST_NAME	information_schema	Sleep	TIME		NULL	TIME_MS
ID	ddicttestuser1	HOST_NAME	information_schema	Sleep	TIME		NULL	TIME_MS
ID	ddicttestuser1	HOST_NAME	information_schema	Sleep	TIME		NULL	TIME_MS
ID	ddicttestuser1	HOST_NAME	information_schema	Query	TIME	init	SHOW processlist	TIME_MS
SELECT * FROM information_schema.processlist;
ID	USER	HOST	DB	COMMAND	TIME	STATE	INFO	TIME_MS	STAGE	MAX_STAGE	PROGRESS	MEMORY_USED	EXAMINED_ROWS	QUERY_ID	INFO_BINARY	TID
ID	ddicttestuser1	HOST_NAME	information_schema	Query	TIME	Filling schema table	SELECT * FROM information_schema.processlist	TIME_MS	0	0	0.000	MEMORY	ROWS	QUERY_ID	SELECT * FROM information_schema.processlist	TID
ID	ddicttestuser1	HOST_NAME	information_schema	Sleep	TIME		NULL	TIME_MS	0	0	0.000	MEMORY	ROWS	QUERY_ID	NULL	TID
ID	ddicttestuser1	HOST_NAME	information_schema	Sleep	TIME		NULL	TIME_MS	0	0	0.000	MEMORY	ROWS	QUERY_ID	NULL	TID
ID	ddicttestuser1	HOST_NAME	information_schema	Sleep	TIME		NULL	TIME_MS	0	0	0.000	MEMORY	ROWS	QUERY_ID	NULL	TID
ID	ddicttestuser1	HOST_NAME	information_schema	Sleep	TIME		NULL	TIME_MS	0	0	0.000	MEMORY	ROWS	QUERY_ID	NULL	TID
####################################################################################
10 Grant SUPER privilege with grant option to user ddicttestuser1.
connection default (user=root)
####################################################################################
connection default;
GRANT SUPER ON *.* TO 'ddicttestuser1'@'localhost' WITH GRANT OPTION;
####################################################################################
10.1 New connection con105 (ddicttestuser1 with SUPER privilege and GRANT OPTION)
connect  con105,localhost,ddicttestuser1,ddictpass,information_schema;
Try to grant PROCESS privilege to user ddicttestuser2 without having it.
####################################################################################
SHOW GRANTS FOR 'ddicttestuser1'@'localhost';
Grants for ddicttestuser1@localhost
GRANT SUPER ON *.* TO 'ddicttestuser1'@'localhost' IDENTIFIED BY PASSWORD '*22DA61451703738F203CDB9DB041ACBA1F4760B1' WITH GRANT OPTION
GRANT PROCESS ON *.* TO 'ddicttestuser2'@'localhost';
ERROR 28000: Access denied for user 'ddicttestuser1'@'localhost' (using password: YES)
####################################################################################
10.2 Grant SUPER and PROCESS privilege with grant option to user ddicttestuser1
connection default (user=root)
####################################################################################
connection default;
GRANT SUPER,PROCESS ON *.* TO 'ddicttestuser1'@'localhost' WITH GRANT OPTION;
####################################################################################
10.3 New connection con106 (ddicttestuser1 with SUPER,PROCESS WITH GRANT OPTION)
connect  con106,localhost,ddicttestuser1,ddictpass,information_schema;
Grant PROCESS privilege to user ddicttestuser2
####################################################################################
SHOW GRANTS FOR 'ddicttestuser1'@'localhost';
Grants for ddicttestuser1@localhost
GRANT PROCESS, SUPER ON *.* TO 'ddicttestuser1'@'localhost' IDENTIFIED BY PASSWORD '*22DA61451703738F203CDB9DB041ACBA1F4760B1' WITH GRANT OPTION
GRANT PROCESS ON *.* TO 'ddicttestuser2'@'localhost';
####################################################################################
10.4 New connection con200 (ddicttestuser2 with PROCESS privilege)
connect  con200,localhost,ddicttestuser2,ddictpass,information_schema;
ddicttestuser2 has now the PROCESS privilege and sees all connections
####################################################################################
SHOW GRANTS FOR 'ddicttestuser2'@'localhost';
Grants for ddicttestuser2@localhost
GRANT PROCESS ON *.* TO 'ddicttestuser2'@'localhost' IDENTIFIED BY PASSWORD '*22DA61451703738F203CDB9DB041ACBA1F4760B1'
SHOW processlist;
Id	User	Host	db	Command	Time	State	Info	Progress
ID	root	HOST_NAME	information_schema	Sleep	TIME		NULL	TIME_MS
ID	ddicttestuser1	HOST_NAME	information_schema	Sleep	TIME		NULL	TIME_MS
ID	ddicttestuser1	HOST_NAME	information_schema	Sleep	TIME		NULL	TIME_MS
ID		HOST_NAME	information_schema	Sleep	TIME		NULL	TIME_MS
ID	ddicttestuser1	HOST_NAME	information_schema	Sleep	TIME		NULL	TIME_MS
ID		HOST_NAME	information_schema	Sleep	TIME		NULL	TIME_MS
ID	ddicttestuser1	HOST_NAME	information_schema	Sleep	TIME		NULL	TIME_MS
ID	ddicttestuser1	HOST_NAME	information_schema	Sleep	TIME		NULL	TIME_MS
ID	ddicttestuser1	HOST_NAME	information_schema	Sleep	TIME		NULL	TIME_MS
ID	ddicttestuser1	HOST_NAME	information_schema	Sleep	TIME		NULL	TIME_MS
ID	ddicttestuser2	HOST_NAME	information_schema	Query	TIME	init	SHOW processlist	TIME_MS
SELECT * FROM information_schema.processlist;
ID	USER	HOST	DB	COMMAND	TIME	STATE	INFO	TIME_MS	STAGE	MAX_STAGE	PROGRESS	MEMORY_USED	EXAMINED_ROWS	QUERY_ID	INFO_BINARY	TID
ID	ddicttestuser2	HOST_NAME	information_schema	Query	TIME	Filling schema table	SELECT * FROM information_schema.processlist	TIME_MS	0	0	0.000	MEMORY	ROWS	QUERY_ID	SELECT * FROM information_schema.processlist	TID
ID	ddicttestuser1	HOST_NAME	information_schema	Sleep	TIME		NULL	TIME_MS	0	0	0.000	MEMORY	ROWS	QUERY_ID	NULL	TID
ID	ddicttestuser1	HOST_NAME	information_schema	Sleep	TIME		NULL	TIME_MS	0	0	0.000	MEMORY	ROWS	QUERY_ID	NULL	TID
ID	ddicttestuser1	HOST_NAME	information_schema	Sleep	TIME		NULL	TIME_MS	0	0	0.000	MEMORY	ROWS	QUERY_ID	NULL	TID
ID	ddicttestuser1	HOST_NAME	information_schema	Sleep	TIME		NULL	TIME_MS	0	0	0.000	MEMORY	ROWS	QUERY_ID	NULL	TID
ID		HOST_NAME	information_schema	Sleep	TIME		NULL	TIME_MS	0	0	0.000	MEMORY	ROWS	QUERY_ID	NULL	TID
ID	ddicttestuser1	HOST_NAME	information_schema	Sleep	TIME		NULL	TIME_MS	0	0	0.000	MEMORY	ROWS	QUERY_ID	NULL	TID
ID		HOST_NAME	information_schema	Sleep	TIME		NULL	TIME_MS	0	0	0.000	MEMORY	ROWS	QUERY_ID	NULL	TID
ID	ddicttestuser1	HOST_NAME	information_schema	Sleep	TIME		NULL	TIME_MS	0	0	0.000	MEMORY	ROWS	QUERY_ID	NULL	TID
ID	ddicttestuser1	HOST_NAME	information_schema	Sleep	TIME		NULL	TIME_MS	0	0	0.000	MEMORY	ROWS	QUERY_ID	NULL	TID
ID	root	HOST_NAME	information_schema	Sleep	TIME		NULL	TIME_MS	0	0	0.000	MEMORY	ROWS	QUERY_ID	NULL	TID
####################################################################################
11 User ddicttestuser1 revokes PROCESS privilege from user ddicttestuser2
connection ddicttestuser1;
####################################################################################
connection con106;
REVOKE PROCESS ON *.* FROM 'ddicttestuser2'@'localhost';
####################################################################################
11.1 New connection con201 (ddicttestuser2)
connect  con201,localhost,ddicttestuser2,ddictpass,information_schema;
ddicttestuser2 has no more the PROCESS privilege and can only see own connects
####################################################################################
SHOW GRANTS;
Grants for ddicttestuser2@localhost
GRANT USAGE ON *.* TO 'ddicttestuser2'@'localhost' IDENTIFIED BY PASSWORD '*22DA61451703738F203CDB9DB041ACBA1F4760B1'
SHOW processlist;
Id	User	Host	db	Command	Time	State	Info	Progress
ID	ddicttestuser2	HOST_NAME	information_schema	Sleep	TIME		NULL	TIME_MS
ID	ddicttestuser2	HOST_NAME	information_schema	Query	TIME	init	SHOW processlist	TIME_MS
SELECT * FROM information_schema.processlist;
ID	USER	HOST	DB	COMMAND	TIME	STATE	INFO	TIME_MS	STAGE	MAX_STAGE	PROGRESS	MEMORY_USED	EXAMINED_ROWS	QUERY_ID	INFO_BINARY	TID
ID	ddicttestuser2	HOST_NAME	information_schema	Query	TIME	Filling schema table	SELECT * FROM information_schema.processlist	TIME_MS	0	0	0.000	MEMORY	ROWS	QUERY_ID	SELECT * FROM information_schema.processlist	TID
ID	ddicttestuser2	HOST_NAME	information_schema	Sleep	TIME		NULL	TIME_MS	0	0	0.000	MEMORY	ROWS	QUERY_ID	NULL	TID
####################################################################################
11.2 Revoke SUPER,PROCESS,GRANT OPTION privilege from user ddicttestuser1
connection default (user=root)
####################################################################################
connection default;
REVOKE SUPER,PROCESS,GRANT OPTION ON *.* FROM 'ddicttestuser1'@'localhost';
####################################################################################
11.3 New connection con107 (ddicttestuser1)
connect  con107,localhost,ddicttestuser1,ddictpass,information_schema;
ddicttestuser1 has no more the PROCESS privilege and can only see own connects
He is also unable to GRANT the PROCESS privilege to ddicttestuser2
####################################################################################
SHOW GRANTS FOR 'ddicttestuser1'@'localhost';
Grants for ddicttestuser1@localhost
GRANT USAGE ON *.* TO 'ddicttestuser1'@'localhost' IDENTIFIED BY PASSWORD '*22DA61451703738F203CDB9DB041ACBA1F4760B1'
GRANT PROCESS ON *.* TO 'ddicttestuser2'@'localhost';
ERROR 28000: Access denied for user 'ddicttestuser1'@'localhost' (using password: YES)
SHOW processlist;
Id	User	Host	db	Command	Time	State	Info	Progress
ID	ddicttestuser1	HOST_NAME	information_schema	Sleep	TIME		NULL	TIME_MS
ID	ddicttestuser1	HOST_NAME	information_schema	Sleep	TIME		NULL	TIME_MS
ID	ddicttestuser1	HOST_NAME	information_schema	Sleep	TIME		NULL	TIME_MS
ID	ddicttestuser1	HOST_NAME	information_schema	Sleep	TIME		NULL	TIME_MS
ID	ddicttestuser1	HOST_NAME	information_schema	Sleep	TIME		NULL	TIME_MS
ID	ddicttestuser1	HOST_NAME	information_schema	Sleep	TIME		NULL	TIME_MS
ID	ddicttestuser1	HOST_NAME	information_schema	Sleep	TIME		NULL	TIME_MS
ID	ddicttestuser1	HOST_NAME	information_schema	Query	TIME	init	SHOW processlist	TIME_MS
SELECT * FROM information_schema.processlist;
ID	USER	HOST	DB	COMMAND	TIME	STATE	INFO	TIME_MS	STAGE	MAX_STAGE	PROGRESS	MEMORY_USED	EXAMINED_ROWS	QUERY_ID	INFO_BINARY	TID
ID	ddicttestuser1	HOST_NAME	information_schema	Query	TIME	Filling schema table	SELECT * FROM information_schema.processlist	TIME_MS	0	0	0.000	MEMORY	ROWS	QUERY_ID	SELECT * FROM information_schema.processlist	TID
ID	ddicttestuser1	HOST_NAME	information_schema	Sleep	TIME		NULL	TIME_MS	0	0	0.000	MEMORY	ROWS	QUERY_ID	NULL	TID
ID	ddicttestuser1	HOST_NAME	information_schema	Sleep	TIME		NULL	TIME_MS	0	0	0.000	MEMORY	ROWS	QUERY_ID	NULL	TID
ID	ddicttestuser1	HOST_NAME	information_schema	Sleep	TIME		NULL	TIME_MS	0	0	0.000	MEMORY	ROWS	QUERY_ID	NULL	TID
ID	ddicttestuser1	HOST_NAME	information_schema	Sleep	TIME		NULL	TIME_MS	0	0	0.000	MEMORY	ROWS	QUERY_ID	NULL	TID
ID	ddicttestuser1	HOST_NAME	information_schema	Sleep	TIME		NULL	TIME_MS	0	0	0.000	MEMORY	ROWS	QUERY_ID	NULL	TID
ID	ddicttestuser1	HOST_NAME	information_schema	Sleep	TIME		NULL	TIME_MS	0	0	0.000	MEMORY	ROWS	QUERY_ID	NULL	TID
ID	ddicttestuser1	HOST_NAME	information_schema	Sleep	TIME		NULL	TIME_MS	0	0	0.000	MEMORY	ROWS	QUERY_ID	NULL	TID
####################################################################################
12 Revoke the SELECT privilege from user ddicttestuser1
connection default (user=root)
####################################################################################
connection default;
REVOKE SELECT ON *.* FROM 'ddicttestuser1'@'localhost';
####################################################################################
12.1 New connection con108 (ddicttestuser1)
connect  con108,localhost,ddicttestuser1,ddictpass,information_schema;
ddicttestuser1 has neither PROCESS nor SELECT privilege
Manual says: Each MySQL user has the right to access these tables, but can see
only the rows ...
Therefore the missing SELECT privilege does not affect SELECTs on PROCESSLIST.
####################################################################################
SHOW GRANTS FOR 'ddicttestuser1'@'localhost';
Grants for ddicttestuser1@localhost
GRANT USAGE ON *.* TO 'ddicttestuser1'@'localhost' IDENTIFIED BY PASSWORD '*22DA61451703738F203CDB9DB041ACBA1F4760B1'
SHOW processlist;
Id	User	Host	db	Command	Time	State	Info	Progress
ID	ddicttestuser1	HOST_NAME	information_schema	Sleep	TIME		NULL	TIME_MS
ID	ddicttestuser1	HOST_NAME	information_schema	Sleep	TIME		NULL	TIME_MS
ID	ddicttestuser1	HOST_NAME	information_schema	Sleep	TIME		NULL	TIME_MS
ID	ddicttestuser1	HOST_NAME	information_schema	Sleep	TIME		NULL	TIME_MS
ID	ddicttestuser1	HOST_NAME	information_schema	Sleep	TIME		NULL	TIME_MS
ID	ddicttestuser1	HOST_NAME	information_schema	Sleep	TIME		NULL	TIME_MS
ID	ddicttestuser1	HOST_NAME	information_schema	Sleep	TIME		NULL	TIME_MS
ID	ddicttestuser1	HOST_NAME	information_schema	Sleep	TIME		NULL	TIME_MS
ID	ddicttestuser1	HOST_NAME	information_schema	Query	TIME	init	SHOW processlist	TIME_MS
SELECT * FROM information_schema.processlist;
ID	USER	HOST	DB	COMMAND	TIME	STATE	INFO	TIME_MS	STAGE	MAX_STAGE	PROGRESS	MEMORY_USED	EXAMINED_ROWS	QUERY_ID	INFO_BINARY	TID
ID	ddicttestuser1	HOST_NAME	information_schema	Query	TIME	Filling schema table	SELECT * FROM information_schema.processlist	TIME_MS	0	0	0.000	MEMORY	ROWS	QUERY_ID	SELECT * FROM information_schema.processlist	TID
ID	ddicttestuser1	HOST_NAME	information_schema	Sleep	TIME		NULL	TIME_MS	0	0	0.000	MEMORY	ROWS	QUERY_ID	NULL	TID
ID	ddicttestuser1	HOST_NAME	information_schema	Sleep	TIME		NULL	TIME_MS	0	0	0.000	MEMORY	ROWS	QUERY_ID	NULL	TID
ID	ddicttestuser1	HOST_NAME	information_schema	Sleep	TIME		NULL	TIME_MS	0	0	0.000	MEMORY	ROWS	QUERY_ID	NULL	TID
ID	ddicttestuser1	HOST_NAME	information_schema	Sleep	TIME		NULL	TIME_MS	0	0	0.000	MEMORY	ROWS	QUERY_ID	NULL	TID
ID	ddicttestuser1	HOST_NAME	information_schema	Sleep	TIME		NULL	TIME_MS	0	0	0.000	MEMORY	ROWS	QUERY_ID	NULL	TID
ID	ddicttestuser1	HOST_NAME	information_schema	Sleep	TIME		NULL	TIME_MS	0	0	0.000	MEMORY	ROWS	QUERY_ID	NULL	TID
ID	ddicttestuser1	HOST_NAME	information_schema	Sleep	TIME		NULL	TIME_MS	0	0	0.000	MEMORY	ROWS	QUERY_ID	NULL	TID
ID	ddicttestuser1	HOST_NAME	information_schema	Sleep	TIME		NULL	TIME_MS	0	0	0.000	MEMORY	ROWS	QUERY_ID	NULL	TID
####################################################################################
12.2 Revoke only the SELECT privilege on the information_schema from ddicttestuser1.
connection default (user=root)
####################################################################################
connection default;
REVOKE SELECT ON information_schema.* FROM 'ddicttestuser3'@'localhost';
ERROR 42000: Access denied for user 'root'@'localhost' to database 'information_schema'
####################################################################################
connection default (user=root)
Cleanup: close connections, DROP USER etc.
####################################################################################
connection default;
disconnect con100;
disconnect con101;
disconnect con102;
disconnect con103;
disconnect con104;
disconnect con105;
disconnect con106;
disconnect con107;
disconnect con108;
disconnect con200;
disconnect con201;
disconnect anonymous1;
disconnect anonymous2;
DROP USER ddicttestuser1@'localhost';
DROP USER ddicttestuser2@'localhost';
REVOKE USAGE ON *.* FROM ''@'localhost';
DROP USER ''@'localhost';
