DROP TABLE IF EXISTS t1;
CREATE TABLE t1 (a INT, b CHAR(8), KEY(a)) ENGINE=rocksdb;
SHOW CREATE TABLE t1;
Table	Create Table
t1	CREATE TABLE `t1` (
  `a` int(11) DEFAULT NULL,
  `b` char(8) DEFAULT NULL,
  KEY `a` (`a`)
) ENGINE=ROCKSDB DEFAULT CHARSET=latin1
SHOW COLUMNS IN t1;
Field	Type	Null	Key	Default	Extra
a	int(11)	YES	MUL	NULL	
b	char(8)	YES		NULL	
INSERT INTO t1 (a,b) VALUES (76,'bar');
INSERT INTO t1 (a,b) VALUES (35,'foo');
INSERT INTO t1 (a,b) VALUES (77,'baz');
SELECT * FROM t1 WHERE a = 35;
a	b
35	foo
SELECT * FROM t1 WHERE a = 35 AND b = 'foo';
a	b
35	foo
SELECT * FROM t1 WHERE a = 77 OR b = 'bar';
a	b
76	bar
77	baz
SELECT * FROM t1 WHERE a > 35;
a	b
76	bar
77	baz
SELECT * FROM t1;
a	b
35	foo
76	bar
77	baz
UPDATE t1 SET a=a+100;
SELECT * FROM t1;
a	b
135	foo
176	bar
177	baz
UPDATE t1 SET a=a-100, b='bbb' WHERE a>100;
SELECT * FROM t1;
a	b
35	bbb
76	bbb
77	bbb
UPDATE t1 SET a=300, b='ccc' WHERE a>70;
SELECT * FROM t1;
a	b
300	ccc
300	ccc
35	bbb
UPDATE t1 SET a=123 WHERE a=35;
SELECT * FROM t1;
a	b
123	bbb
300	ccc
300	ccc
UPDATE t1 SET a=321 WHERE b='ccc';
SELECT * FROM t1;
a	b
123	bbb
321	ccc
321	ccc
INSERT INTO t1 (a,b) VALUES (45,'bob');
SELECT * FROM t1;
a	b
123	bbb
321	ccc
321	ccc
45	bob
DELETE FROM t1 WHERE a=123;
SELECT * FROM t1;
a	b
321	ccc
321	ccc
45	bob
DELETE FROM t1 WHERE b > 'bbb' AND a > 100;
SELECT * FROM t1;
a	b
45	bob
TRUNCATE TABLE t1;
DROP TABLE t1;
CREATE TABLE t1 (a INT, b CHAR(8)) ENGINE=rocksdb;
ALTER TABLE t1 ADD INDEX (b);
SHOW CREATE TABLE t1;
Table	Create Table
t1	CREATE TABLE `t1` (
  `a` int(11) DEFAULT NULL,
  `b` char(8) DEFAULT NULL,
  KEY `b` (`b`)
) ENGINE=ROCKSDB DEFAULT CHARSET=latin1
SHOW COLUMNS IN t1;
Field	Type	Null	Key	Default	Extra
a	int(11)	YES		NULL	
b	char(8)	YES	MUL	NULL	
INSERT INTO t1 (a,b) VALUES (76,'bar');
INSERT INTO t1 (a,b) VALUES (35,'foo');
INSERT INTO t1 (a,b) VALUES (77,'baz');
SELECT * FROM t1 WHERE a = 35;
a	b
35	foo
SELECT * FROM t1 WHERE a = 35 AND b = 'foo';
a	b
35	foo
SELECT * FROM t1 WHERE a = 77 OR b = 'bar';
a	b
76	bar
77	baz
SELECT * FROM t1 WHERE a > 35;
a	b
76	bar
77	baz
SELECT * FROM t1;
a	b
35	foo
76	bar
77	baz
UPDATE t1 SET a=a+100;
SELECT * FROM t1;
a	b
135	foo
176	bar
177	baz
UPDATE t1 SET a=a-100, b='bbb' WHERE a>100;
SELECT * FROM t1;
a	b
35	bbb
76	bbb
77	bbb
UPDATE t1 SET a=300, b='ccc' WHERE a>70;
SELECT * FROM t1;
a	b
300	ccc
300	ccc
35	bbb
UPDATE t1 SET a=123 WHERE a=35;
SELECT * FROM t1;
a	b
123	bbb
300	ccc
300	ccc
UPDATE t1 SET a=321 WHERE b='ccc';
SELECT * FROM t1;
a	b
123	bbb
321	ccc
321	ccc
INSERT INTO t1 (a,b) VALUES (45,'bob');
SELECT * FROM t1;
a	b
123	bbb
321	ccc
321	ccc
45	bob
DELETE FROM t1 WHERE a=123;
SELECT * FROM t1;
a	b
321	ccc
321	ccc
45	bob
DELETE FROM t1 WHERE b > 'bbb' AND a > 100;
SELECT * FROM t1;
a	b
45	bob
TRUNCATE TABLE t1;
ALTER TABLE t1 DROP INDEX b;
SHOW CREATE TABLE t1;
Table	Create Table
t1	CREATE TABLE `t1` (
  `a` int(11) DEFAULT NULL,
  `b` char(8) DEFAULT NULL
) ENGINE=ROCKSDB DEFAULT CHARSET=latin1
SHOW COLUMNS IN t1;
Field	Type	Null	Key	Default	Extra
a	int(11)	YES		NULL	
b	char(8)	YES		NULL	
INSERT INTO t1 (a,b) VALUES (76,'bar');
INSERT INTO t1 (a,b) VALUES (35,'foo');
INSERT INTO t1 (a,b) VALUES (77,'baz');
SELECT * FROM t1 WHERE a = 35;
a	b
35	foo
SELECT * FROM t1 WHERE a = 35 AND b = 'foo';
a	b
35	foo
SELECT * FROM t1 WHERE a = 77 OR b = 'bar';
a	b
76	bar
77	baz
SELECT * FROM t1 WHERE a > 35;
a	b
76	bar
77	baz
SELECT * FROM t1;
a	b
35	foo
76	bar
77	baz
UPDATE t1 SET a=a+100;
SELECT * FROM t1;
a	b
135	foo
176	bar
177	baz
UPDATE t1 SET a=a-100, b='bbb' WHERE a>100;
SELECT * FROM t1;
a	b
35	bbb
76	bbb
77	bbb
UPDATE t1 SET a=300, b='ccc' WHERE a>70;
SELECT * FROM t1;
a	b
300	ccc
300	ccc
35	bbb
UPDATE t1 SET a=123 WHERE a=35;
SELECT * FROM t1;
a	b
123	bbb
300	ccc
300	ccc
UPDATE t1 SET a=321 WHERE b='ccc';
SELECT * FROM t1;
a	b
123	bbb
321	ccc
321	ccc
INSERT INTO t1 (a,b) VALUES (45,'bob');
SELECT * FROM t1;
a	b
123	bbb
321	ccc
321	ccc
45	bob
DELETE FROM t1 WHERE a=123;
SELECT * FROM t1;
a	b
321	ccc
321	ccc
45	bob
DELETE FROM t1 WHERE b > 'bbb' AND a > 100;
SELECT * FROM t1;
a	b
45	bob
TRUNCATE TABLE t1;
DROP TABLE t1;
CREATE TABLE t1 (a INT, b CHAR(8), pk INT AUTO_INCREMENT PRIMARY KEY) ENGINE=rocksdb;
ALTER TABLE t1 DROP COLUMN pk;
SHOW CREATE TABLE t1;
Table	Create Table
t1	CREATE TABLE `t1` (
  `a` int(11) DEFAULT NULL,
  `b` char(8) DEFAULT NULL
) ENGINE=ROCKSDB DEFAULT CHARSET=latin1
SHOW COLUMNS IN t1;
Field	Type	Null	Key	Default	Extra
a	int(11)	YES		NULL	
b	char(8)	YES		NULL	
INSERT INTO t1 (a,b) VALUES (76,'bar');
INSERT INTO t1 (a,b) VALUES (35,'foo');
INSERT INTO t1 (a,b) VALUES (77,'baz');
SELECT * FROM t1 WHERE a = 35;
a	b
35	foo
SELECT * FROM t1 WHERE a = 35 AND b = 'foo';
a	b
35	foo
SELECT * FROM t1 WHERE a = 77 OR b = 'bar';
a	b
76	bar
77	baz
SELECT * FROM t1 WHERE a > 35;
a	b
76	bar
77	baz
SELECT * FROM t1;
a	b
35	foo
76	bar
77	baz
UPDATE t1 SET a=a+100;
SELECT * FROM t1;
a	b
135	foo
176	bar
177	baz
UPDATE t1 SET a=a-100, b='bbb' WHERE a>100;
SELECT * FROM t1;
a	b
35	bbb
76	bbb
77	bbb
UPDATE t1 SET a=300, b='ccc' WHERE a>70;
SELECT * FROM t1;
a	b
300	ccc
300	ccc
35	bbb
UPDATE t1 SET a=123 WHERE a=35;
SELECT * FROM t1;
a	b
123	bbb
300	ccc
300	ccc
UPDATE t1 SET a=321 WHERE b='ccc';
SELECT * FROM t1;
a	b
123	bbb
321	ccc
321	ccc
INSERT INTO t1 (a,b) VALUES (45,'bob');
SELECT * FROM t1;
a	b
123	bbb
321	ccc
321	ccc
45	bob
DELETE FROM t1 WHERE a=123;
SELECT * FROM t1;
a	b
321	ccc
321	ccc
45	bob
DELETE FROM t1 WHERE b > 'bbb' AND a > 100;
SELECT * FROM t1;
a	b
45	bob
TRUNCATE TABLE t1;
DROP TABLE t1;
#
# MDEV-4313: RocksDB: Server crashes in Rdb_key_def::setup on dropping the primary key column
#
CREATE TABLE t1 (pk INT PRIMARY KEY, i INT NOT NULL, KEY(i)) ENGINE=RocksDB;
ALTER TABLE t1 DROP COLUMN `pk`;
DROP TABLE t1;
CREATE TABLE t1 (a INT, b CHAR(8), KEY(a), KEY(b)) ENGINE=rocksdb;
SHOW CREATE TABLE t1;
Table	Create Table
t1	CREATE TABLE `t1` (
  `a` int(11) DEFAULT NULL,
  `b` char(8) DEFAULT NULL,
  KEY `a` (`a`),
  KEY `b` (`b`)
) ENGINE=ROCKSDB DEFAULT CHARSET=latin1
SHOW COLUMNS IN t1;
Field	Type	Null	Key	Default	Extra
a	int(11)	YES	MUL	NULL	
b	char(8)	YES	MUL	NULL	
INSERT INTO t1 (a,b) VALUES (76,'bar');
INSERT INTO t1 (a,b) VALUES (35,'foo');
INSERT INTO t1 (a,b) VALUES (77,'baz');
SELECT * FROM t1 WHERE a = 35;
a	b
35	foo
SELECT * FROM t1 WHERE a = 35 AND b = 'foo';
a	b
35	foo
SELECT * FROM t1 WHERE a = 77 OR b = 'bar';
a	b
76	bar
77	baz
SELECT * FROM t1 WHERE a > 35;
a	b
76	bar
77	baz
SELECT * FROM t1;
a	b
35	foo
76	bar
77	baz
UPDATE t1 SET a=a+100;
SELECT * FROM t1;
a	b
135	foo
176	bar
177	baz
UPDATE t1 SET a=a-100, b='bbb' WHERE a>100;
SELECT * FROM t1;
a	b
35	bbb
76	bbb
77	bbb
UPDATE t1 SET a=300, b='ccc' WHERE a>70;
SELECT * FROM t1;
a	b
300	ccc
300	ccc
35	bbb
UPDATE t1 SET a=123 WHERE a=35;
SELECT * FROM t1;
a	b
123	bbb
300	ccc
300	ccc
UPDATE t1 SET a=321 WHERE b='ccc';
SELECT * FROM t1;
a	b
123	bbb
321	ccc
321	ccc
INSERT INTO t1 (a,b) VALUES (45,'bob');
SELECT * FROM t1;
a	b
123	bbb
321	ccc
321	ccc
45	bob
DELETE FROM t1 WHERE a=123;
SELECT * FROM t1;
a	b
321	ccc
321	ccc
45	bob
DELETE FROM t1 WHERE b > 'bbb' AND a > 100;
SELECT * FROM t1;
a	b
45	bob
TRUNCATE TABLE t1;
DROP TABLE t1;
CREATE TABLE t1 (a INT, b CHAR(8), KEY(a, b)) ENGINE=rocksdb;
SHOW CREATE TABLE t1;
Table	Create Table
t1	CREATE TABLE `t1` (
  `a` int(11) DEFAULT NULL,
  `b` char(8) DEFAULT NULL,
  KEY `a` (`a`,`b`)
) ENGINE=ROCKSDB DEFAULT CHARSET=latin1
SHOW COLUMNS IN t1;
Field	Type	Null	Key	Default	Extra
a	int(11)	YES	MUL	NULL	
b	char(8)	YES		NULL	
INSERT INTO t1 (a,b) VALUES (76,'bar');
INSERT INTO t1 (a,b) VALUES (35,'foo');
INSERT INTO t1 (a,b) VALUES (77,'baz');
SELECT * FROM t1 WHERE a = 35;
a	b
35	foo
SELECT * FROM t1 WHERE a = 35 AND b = 'foo';
a	b
35	foo
SELECT * FROM t1 WHERE a = 77 OR b = 'bar';
a	b
76	bar
77	baz
SELECT * FROM t1 WHERE a > 35;
a	b
76	bar
77	baz
SELECT * FROM t1;
a	b
35	foo
76	bar
77	baz
UPDATE t1 SET a=a+100;
SELECT * FROM t1;
a	b
135	foo
176	bar
177	baz
UPDATE t1 SET a=a-100, b='bbb' WHERE a>100;
SELECT * FROM t1;
a	b
35	bbb
76	bbb
77	bbb
UPDATE t1 SET a=300, b='ccc' WHERE a>70;
SELECT * FROM t1;
a	b
300	ccc
300	ccc
35	bbb
UPDATE t1 SET a=123 WHERE a=35;
SELECT * FROM t1;
a	b
123	bbb
300	ccc
300	ccc
UPDATE t1 SET a=321 WHERE b='ccc';
SELECT * FROM t1;
a	b
123	bbb
321	ccc
321	ccc
INSERT INTO t1 (a,b) VALUES (45,'bob');
SELECT * FROM t1;
a	b
123	bbb
321	ccc
321	ccc
45	bob
DELETE FROM t1 WHERE a=123;
SELECT * FROM t1;
a	b
321	ccc
321	ccc
45	bob
DELETE FROM t1 WHERE b > 'bbb' AND a > 100;
SELECT * FROM t1;
a	b
45	bob
TRUNCATE TABLE t1;
DROP TABLE t1;
CREATE TABLE t1 (a INT, b CHAR(8), KEY(a), KEY(b)) ENGINE=rocksdb;
SHOW CREATE TABLE t1;
Table	Create Table
t1	CREATE TABLE `t1` (
  `a` int(11) DEFAULT NULL,
  `b` char(8) DEFAULT NULL,
  KEY `a` (`a`),
  KEY `b` (`b`)
) ENGINE=ROCKSDB DEFAULT CHARSET=latin1
SHOW COLUMNS IN t1;
Field	Type	Null	Key	Default	Extra
a	int(11)	YES	MUL	NULL	
b	char(8)	YES	MUL	NULL	
INSERT INTO t1 (a,b) VALUES (76,'bar');
INSERT INTO t1 (a,b) VALUES (35,'foo');
INSERT INTO t1 (a,b) VALUES (77,'baz');
SELECT * FROM t1 WHERE a = 35;
a	b
35	foo
SELECT * FROM t1 WHERE a = 35 AND b = 'foo';
a	b
35	foo
SELECT * FROM t1 WHERE a = 77 OR b = 'bar';
a	b
76	bar
77	baz
SELECT * FROM t1 WHERE a > 35;
a	b
76	bar
77	baz
SELECT * FROM t1;
a	b
35	foo
76	bar
77	baz
UPDATE t1 SET a=a+100;
SELECT * FROM t1;
a	b
135	foo
176	bar
177	baz
UPDATE t1 SET a=a-100, b='bbb' WHERE a>100;
SELECT * FROM t1;
a	b
35	bbb
76	bbb
77	bbb
UPDATE t1 SET a=300, b='ccc' WHERE a>70;
SELECT * FROM t1;
a	b
300	ccc
300	ccc
35	bbb
UPDATE t1 SET a=123 WHERE a=35;
SELECT * FROM t1;
a	b
123	bbb
300	ccc
300	ccc
UPDATE t1 SET a=321 WHERE b='ccc';
SELECT * FROM t1;
a	b
123	bbb
321	ccc
321	ccc
INSERT INTO t1 (a,b) VALUES (45,'bob');
SELECT * FROM t1;
a	b
123	bbb
321	ccc
321	ccc
45	bob
DELETE FROM t1 WHERE a=123;
SELECT * FROM t1;
a	b
321	ccc
321	ccc
45	bob
DELETE FROM t1 WHERE b > 'bbb' AND a > 100;
SELECT * FROM t1;
a	b
45	bob
TRUNCATE TABLE t1;
DROP TABLE t1;
CREATE TABLE t1 (a INT, b CHAR(8), KEY(a)) ENGINE=rocksdb;
INSERT INTO t1 (a) VALUES (1),(2),(5);
CHECK TABLE t1;
Table	Op	Msg_type	Msg_text
test.t1	check	status	OK
INSERT INTO t1 (a) VALUES (6),(8),(12);
CHECK TABLE t1 FOR UPGRADE;
Table	Op	Msg_type	Msg_text
test.t1	check	status	OK
INSERT INTO t1 (a) VALUES (13),(15),(16);
CHECK TABLE t1 QUICK;
Table	Op	Msg_type	Msg_text
test.t1	check	status	OK
INSERT INTO t1 (a) VALUES (17),(120),(132);
CHECK TABLE t1 FAST;
Table	Op	Msg_type	Msg_text
test.t1	check	status	OK
INSERT INTO t1 (a) VALUES (801),(900),(7714);
CHECK TABLE t1 MEDIUM;
Table	Op	Msg_type	Msg_text
test.t1	check	status	OK
INSERT INTO t1 (a) VALUES (8760),(10023),(12000);
CHECK TABLE t1 EXTENDED;
Table	Op	Msg_type	Msg_text
test.t1	check	status	OK
INSERT INTO t1 (a) VALUES (13345),(24456),(78302),(143028);
CHECK TABLE t1 CHANGED;
Table	Op	Msg_type	Msg_text
test.t1	check	status	OK
DROP TABLE t1;
CREATE TABLE t1 (a INT, b INT, c INT, d INT, KEY kab(a, b), KEY kbc(b, c), KEY kabc(a,b,c)) ENGINE=rocksdb;
SHOW CREATE TABLE t1;
Table	Create Table
t1	CREATE TABLE `t1` (
  `a` int(11) DEFAULT NULL,
  `b` int(11) DEFAULT NULL,
  `c` int(11) DEFAULT NULL,
  `d` int(11) DEFAULT NULL,
  KEY `kab` (`a`,`b`),
  KEY `kbc` (`b`,`c`),
  KEY `kabc` (`a`,`b`,`c`)
) ENGINE=ROCKSDB DEFAULT CHARSET=latin1
SHOW COLUMNS IN t1;
Field	Type	Null	Key	Default	Extra
a	int(11)	YES	MUL	NULL	
b	int(11)	YES	MUL	NULL	
c	int(11)	YES		NULL	
d	int(11)	YES		NULL	
INSERT INTO t1 (a,b,c,d) VALUES (1,2,3,4);
INSERT INTO t1 (a,b,c,d) VALUES (5,6,7,8);
INSERT INTO t1 (a,b,c,d) VALUES (10,11,12,13);
INSERT INTO t1 (a,b,c,d) VALUES (14,15,16,17);
SELECT * FROM t1;
a	b	c	d
1	2	3	4
10	11	12	13
14	15	16	17
5	6	7	8
SELECT * FROM t1 WHERE a = 1 OR a = 10;
a	b	c	d
1	2	3	4
10	11	12	13
SELECT * FROM t1 WHERE c = 3 OR d = 17;
a	b	c	d
1	2	3	4
14	15	16	17
SELECT * FROM t1 WHERE a > 5 OR d > 5;
a	b	c	d
10	11	12	13
14	15	16	17
5	6	7	8
SELECT a, b, c FROM t1 FORCE INDEX (kabc) WHERE a=1 OR b=11;
a	b	c
1	2	3
10	11	12
SELECT d FROM t1 FORCE INDEX (kbc) WHERE b > 6 AND c > 12;
d
17
UPDATE t1 SET a=a+100;
UPDATE t1 SET a=a-100, b=99 WHERE a>100;
SELECT * FROM t1;
a	b	c	d
1	99	3	4
10	99	12	13
14	99	16	17
5	99	7	8
DELETE FROM t1 WHERE a>5;
DELETE FROM t1 WHERE b=99 AND d>4;
SELECT * FROM t1;
a	b	c	d
1	99	3	4
TRUNCATE TABLE t1;
DROP TABLE t1;
CREATE TABLE t1 (a INT, b CHAR(8), KEY ka(a) comment 'rev:cf1', KEY kb(b)
comment 'rev:cf1', KEY kab(a,b) comment 'rev:cf2') ENGINE=rocksdb;
SHOW CREATE TABLE t1;
Table	Create Table
t1	CREATE TABLE `t1` (
  `a` int(11) DEFAULT NULL,
  `b` char(8) DEFAULT NULL,
  KEY `ka` (`a`) COMMENT 'rev:cf1',
  KEY `kb` (`b`) COMMENT 'rev:cf1',
  KEY `kab` (`a`,`b`) COMMENT 'rev:cf2'
) ENGINE=ROCKSDB DEFAULT CHARSET=latin1
SHOW COLUMNS IN t1;
Field	Type	Null	Key	Default	Extra
a	int(11)	YES	MUL	NULL	
b	char(8)	YES	MUL	NULL	
INSERT INTO t1 (a,b) VALUES (76,'bar');
INSERT INTO t1 (a,b) VALUES (35,'foo');
INSERT INTO t1 (a,b) VALUES (77,'baz');
SELECT * FROM t1 WHERE a = 35;
a	b
35	foo
SELECT * FROM t1 WHERE a = 35 AND b = 'foo';
a	b
35	foo
SELECT * FROM t1 WHERE a = 77 OR b = 'bar';
a	b
76	bar
77	baz
SELECT * FROM t1 WHERE a > 35;
a	b
76	bar
77	baz
SELECT * FROM t1;
a	b
35	foo
76	bar
77	baz
UPDATE t1 SET a=a+100;
SELECT * FROM t1;
a	b
135	foo
176	bar
177	baz
UPDATE t1 SET a=a-100, b='bbb' WHERE a>100;
SELECT * FROM t1;
a	b
35	bbb
76	bbb
77	bbb
UPDATE t1 SET a=300, b='ccc' WHERE a>70;
SELECT * FROM t1;
a	b
300	ccc
300	ccc
35	bbb
UPDATE t1 SET a=123 WHERE a=35;
SELECT * FROM t1;
a	b
123	bbb
300	ccc
300	ccc
UPDATE t1 SET a=321 WHERE b='ccc';
SELECT * FROM t1;
a	b
123	bbb
321	ccc
321	ccc
INSERT INTO t1 (a,b) VALUES (45,'bob');
SELECT * FROM t1;
a	b
123	bbb
321	ccc
321	ccc
45	bob
DELETE FROM t1 WHERE a=123;
SELECT * FROM t1;
a	b
321	ccc
321	ccc
45	bob
DELETE FROM t1 WHERE b > 'bbb' AND a > 100;
SELECT * FROM t1;
a	b
45	bob
TRUNCATE TABLE t1;
DROP TABLE t1;
CREATE TABLE t1 (col1 int, col2 int, KEY kcol1(col1)) ENGINE=ROCKSDB;
INSERT INTO t1 (col1, col2) values (2,2);
ALTER TABLE t1 ADD COLUMN extra INT;
UPDATE t1 SET col2 = 1;
select * from t1;
col1	col2	extra
2	1	NULL
DELETE FROM t1 WHERE col1 = 2;
set global rocksdb_force_flush_memtable_now = true;
select * from t1;
col1	col2	extra
DROP TABLE t1;
create table t1 (i int auto_increment, key(i)) engine=rocksdb;
insert into t1 values();
insert into t1 values();
insert into t1 values();
show create table t1;
Table	Create Table
t1	CREATE TABLE `t1` (
  `i` int(11) NOT NULL AUTO_INCREMENT,
  KEY `i` (`i`)
) ENGINE=ROCKSDB AUTO_INCREMENT=4 DEFAULT CHARSET=latin1
show create table t1;
Table	Create Table
t1	CREATE TABLE `t1` (
  `i` int(11) NOT NULL AUTO_INCREMENT,
  KEY `i` (`i`)
) ENGINE=ROCKSDB AUTO_INCREMENT=4 DEFAULT CHARSET=latin1
drop table t1;
