include/master-slave.inc
Warnings:
Note	####	Sending passwords in plain text without SSL/TLS is extremely insecure.
Note	####	Storing MySQL user name or password information in the master info repository is not secure and is therefore not recommended. Please consider using the USER and PASSWORD connection options for START SLAVE; see the 'START SLAVE Syntax' in the MySQL Manual for more information.
[connection master]
call mtr.add_suppression("read free replication is disabled for tokudb table");
CREATE TABLE t (a int(11), b char(20)) ENGINE = TokuDB;
INSERT INTO t (a, b) VALUES (1, 'a'), (2, 'b'), (3, 'c'), (4, 'd'), (5, 'e');
SELECT * FROM t;
a	b
1	a
2	b
3	c
4	d
5	e
UPDATE t SET a = a + 10 WHERE b = 'b';
SELECT * FROM t;
a	b
1	a
12	b
3	c
4	d
5	e
SELECT * FROM t;
a	b
1	a
12	b
3	c
4	d
5	e
UPDATE t SET a = a + 10 WHERE b = 'b';
SELECT * FROM t;
a	b
1	a
22	b
3	c
4	d
5	e
SELECT * FROM t;
a	b
1	a
22	b
3	c
4	d
5	e
DROP TABLE t;
include/rpl_end.inc
